,Id,Company,Date,Title,Publisher,Link,ProviderPublishTime,Type,Related Company,Text
54,5dcebff1-2a7a-3d0c-8467-0787e172fbf4,UPS,2022-11-06,"Why You Might Be Interested In United Parcel Service, Inc. (NYSE:UPS) For Its Upcoming Dividend",Simply Wall St.,https://finance.yahoo.com/news/why-might-interested-united-parcel-120332730.html,1667736212,STORY,['UPS'],"[Some investors rely on dividends for growing their wealth, and if you're one of those dividend sleuths, you might be intrigued to know that United Parcel Service, Inc. (NYSE:UPS) is about to go ex-dividend in just 3 days. The ex-dividend date is usually set to be one business day before the record date which is the cut-off date on which you must be present on the company's books as a shareholder in order to receive the dividend. The ex-dividend date is important as the process of settlement involves two full business days. So if you miss that date, you would not show up on the company's books on the record date. In other words, investors can purchase United Parcel Service's shares before the 10th of November in order to be eligible for the dividend, which will be paid on the 1st of December.The company's next dividend payment will be US$1.52 per share, and in the last 12 months, the company paid a total of US$6.08 per share. Based on the last year's worth of payments, United Parcel Service has a trailing yield of 3.7% on the current stock price of $165.69. Dividends are a major contributor to investment returns for long term holders, but only if the dividend continues to be paid. That's why we should always check whether the dividend payments appear sustainable, and if the company is growing. View our latest analysis for United Parcel Service Dividends are typically paid from company earnings. If a company pays more in dividends than it earned in profit, then the dividend could be unsustainable. United Parcel Service paid out a comfortable 44% of its profit last year. A useful secondary check can be to evaluate whether United Parcel Service generated enough free cash flow to afford its dividend. Fortunately, it paid out only 46% of its free cash flow in the past year.It's encouraging to see that the dividend is covered by both profit and cash flow. This generally suggests the dividend is sustainable, as long as earnings don't drop precipitously.Story continuesClick here to see the company's payout ratio, plus analyst estimates of its future dividends.historic-dividendHave Earnings And Dividends Been Growing?Businesses with strong growth prospects usually make the best dividend payers, because it's easier to grow dividends when earnings per share are improving. If earnings fall far enough, the company could be forced to cut its dividend. It's encouraging to see United Parcel Service has grown its earnings rapidly, up 27% a year for the past five years. Earnings per share have been growing very quickly, and the company is paying out a relatively low percentage of its profit and cash flow. Companies with growing earnings and low payout ratios are often the best long-term dividend stocks, as the company can both grow its earnings and increase the percentage of earnings that it pays out, essentially multiplying the dividend.Many investors will assess a company's dividend performance by evaluating how much the dividend payments have changed over time. United Parcel Service has delivered 10% dividend growth per year on average over the past 10 years. Both per-share earnings and dividends have both been growing rapidly in recent times, which is great to see.Final TakeawayHas United Parcel Service got what it takes to maintain its dividend payments? We love that United Parcel Service is growing earnings per share while simultaneously paying out a low percentage of both its earnings and cash flow. These characteristics suggest the company is reinvesting in growing its business, while the conservative payout ratio also implies a reduced risk of the dividend being cut in the future. There's a lot to like about United Parcel Service, and we would prioritise taking a closer look at it.With that in mind, a critical part of thorough stock research is being aware of any risks that stock currently faces. Our analysis shows 2 warning signs for United Parcel Service that we strongly recommend you have a look at before investing in the company.A common investing mistake is buying the first interesting stock you see. Here you can find a full list of high-yield dividend stocks.Have feedback on this article? Concerned about the content? Get in touch with us directly. Alternatively, email editorial-team (at) simplywallst.com.This article by Simply Wall St is general in nature. We provide commentary based on historical data and analyst forecasts only using an unbiased methodology and our articles are not intended to be financial advice. It does not constitute a recommendation to buy or sell any stock, and does not take account of your objectives, or your financial situation. We aim to bring you long-term focused analysis driven by fundamental data. Note that our analysis may not factor in the latest price-sensitive company announcements or qualitative material. Simply Wall St has no position in any stocks mentioned.Join A Paid User Research SessionYou’ll receive a US$30 Amazon Gift card for 1 hour of your time while helping us build better investing tools for the individual investors like yourself. Sign up here]"
55,560d14ce-dfdb-3e08-adaa-69c1a8f0c773,MLM,2022-11-06,Here's Why We Think Martin Marietta Materials (NYSE:MLM) Might Deserve Your Attention Today,Simply Wall St.,https://finance.yahoo.com/news/heres-why-think-martin-marietta-144123032.html,1667659283,STORY,['MLM'],"[For beginners, it can seem like a good idea (and an exciting prospect) to buy a company that tells a good story to investors, even if it currently lacks a track record of revenue and profit. But the reality is that when a company loses money each year, for long enough, its investors will usually take their share of those losses. While a well funded company may sustain losses for years, it will need to generate a profit eventually, or else investors will move on and the company will wither away.If this kind of company isn't your style, you like companies that generate revenue, and even earn profits, then you may well be interested in Martin Marietta Materials (NYSE:MLM). While profit isn't the sole metric that should be considered when investing, it's worth recognising businesses that can consistently produce it. View our latest analysis for Martin Marietta Materials How Fast Is Martin Marietta Materials Growing?If you believe that markets are even vaguely efficient, then over the long term you'd expect a company's share price to follow its earnings per share (EPS) outcomes. Therefore, there are plenty of investors who like to buy shares in companies that are growing EPS. We can see that in the last three years Martin Marietta Materials grew its EPS by 13% per year. That's a good rate of growth, if it can be sustained.Top-line growth is a great indicator that growth is sustainable, and combined with a high earnings before interest and taxation (EBIT) margin, it's a great way for a company to maintain a competitive advantage in the market. It's noted that, last year, Martin Marietta Materials' revenue from operations was lower than its revenue, so that could distort our analysis of its margins. EBIT margins for Martin Marietta Materials remained fairly unchanged over the last year, however the company should be pleased to report its revenue growth for the period of 16% to US$5.9b. That's progress.The chart below shows how the company's bottom and top lines have progressed over time. For finer detail, click on the image.Story continuesearnings-and-revenue-historyFortunately, we've got access to analyst forecasts of Martin Marietta Materials' future profits. You can do your own forecasts without looking, or you can take a peek at what the professionals are predicting.Are Martin Marietta Materials Insiders Aligned With All Shareholders?Owing to the size of Martin Marietta Materials, we wouldn't expect insiders to hold a significant proportion of the company. But we do take comfort from the fact that they are investors in the company. We note that their impressive stake in the company is worth US$132m. We note that this amounts to 0.6% of the company, which may be small owing to the sheer size of Martin Marietta Materials but it's still worth mentioning. This still shows shareholders there is a degree of alignment between management and themselves.Is Martin Marietta Materials Worth Keeping An Eye On?One positive for Martin Marietta Materials is that it is growing EPS. That's nice to see. To add an extra spark to the fire, significant insider ownership in the company is another highlight. That combination is very appealing. So yes, we do think the stock is worth keeping an eye on. Don't forget that there may still be risks. For instance, we've identified   1 warning sign for Martin Marietta Materials  that you should be aware of.The beauty of investing is that you can invest in almost any company you want. But if you prefer to focus on stocks that have demonstrated insider buying, here is a list of companies with insider buying in the last three months.Please note the insider transactions discussed in this article refer to reportable transactions in the relevant jurisdiction.Have feedback on this article? Concerned about the content? Get in touch with us directly. Alternatively, email editorial-team (at) simplywallst.com.This article by Simply Wall St is general in nature. We provide commentary based on historical data and analyst forecasts only using an unbiased methodology and our articles are not intended to be financial advice. It does not constitute a recommendation to buy or sell any stock, and does not take account of your objectives, or your financial situation. We aim to bring you long-term focused analysis driven by fundamental data. Note that our analysis may not factor in the latest price-sensitive company announcements or qualitative material. Simply Wall St has no position in any stocks mentioned.Join A Paid User Research SessionYou’ll receive a US$30 Amazon Gift card for 1 hour of your time while helping us build better investing tools for the individual investors like yourself. Sign up here]"
56,2e34399e-2f44-3558-a52b-7cf4c81e3fb5,MDLZ,2022-11-06,"Is Mondelez International, Inc.'s (NASDAQ:MDLZ) Stock's Recent Performance Being Led By Its Attractive Financial Prospects?",Simply Wall St.,https://finance.yahoo.com/news/mondelez-international-inc-nasdaq-mdlz-120050981.html,1667736050,STORY,['MDLZ'],"[Most readers would already be aware that Mondelez International's (NASDAQ:MDLZ) stock increased significantly by 13% over the past month. Since the market usually pay for a company’s long-term fundamentals, we decided to study the company’s key performance indicators to see if they could be influencing the market. Specifically, we decided to study Mondelez International's  ROE in this article.Return on equity or ROE is an important factor to be considered by a shareholder because it tells them how effectively their capital is being reinvested. Put another way, it reveals the company's success at turning shareholder investments into profits. Check out our latest analysis for Mondelez International How To Calculate Return On Equity?The formula for return on equity is:Return on Equity = Net Profit (from continuing operations) ÷ Shareholders' EquitySo, based on the above formula, the ROE for Mondelez International is:12% = US$3.1b ÷ US$27b (Based on the trailing twelve months to September 2022).The 'return' is the income the business earned over the last year. That means that for every $1 worth of shareholders' equity, the company generated $0.12 in profit.Why Is ROE Important For Earnings Growth?Thus far, we have learned that ROE measures how efficiently a company is generating its profits. We now need to evaluate how much profit the company reinvests or ""retains"" for future growth which then gives us an idea about the growth potential of the company. Generally speaking, other things being equal, firms with a high return on equity and profit retention, have a higher growth rate than firms that don’t share these attributes.Mondelez International's Earnings Growth And 12% ROETo start with, Mondelez International's ROE looks acceptable. Even when compared to the industry average of 13% the company's ROE looks quite decent. This probably goes some way in explaining Mondelez International's moderate 6.7% growth over the past five years amongst other factors.Story continuesWe then compared Mondelez International's net income growth with the industry and we're pleased to see that the company's growth figure is higher when compared with the industry which has a growth rate of 4.9% in the same period.past-earnings-growthEarnings growth is an important metric to consider when valuing a stock. What investors need to determine next is if the expected earnings growth, or the lack of it, is already built into the share price. This then helps them determine if the stock is placed for a bright or bleak future. Has the market priced in the future outlook for MDLZ? You can find out in our latest intrinsic value infographic research report. Is Mondelez International Using Its Retained Earnings Effectively?Mondelez International has a healthy combination of a moderate three-year median payout ratio of 45% (or a retention ratio of 55%) and a respectable amount of growth in earnings as we saw above, meaning that the company has been making efficient use of its profits.Besides, Mondelez International has been paying dividends for at least ten years or more. This shows that the company is committed to sharing profits with its shareholders. Upon studying the latest analysts' consensus data, we found that the company is expected to keep paying out approximately 52% of its profits over the next three years. Still, forecasts suggest that Mondelez International's future ROE will rise to 17% even though the the company's payout ratio is not expected to change by much.SummaryOn the whole, we feel that Mondelez International's performance has been quite good. Specifically, we like that the company is reinvesting a huge chunk of its profits at a high rate of return. This of course has caused the company to see substantial growth in its earnings. With that said, the latest industry analyst forecasts reveal that the company's earnings are expected to accelerate. To know more about the latest analysts predictions for the company, check out this visualization of analyst forecasts for the company.Have feedback on this article? Concerned about the content? Get in touch with us directly. Alternatively, email editorial-team (at) simplywallst.com.This article by Simply Wall St is general in nature. We provide commentary based on historical data and analyst forecasts only using an unbiased methodology and our articles are not intended to be financial advice. It does not constitute a recommendation to buy or sell any stock, and does not take account of your objectives, or your financial situation. We aim to bring you long-term focused analysis driven by fundamental data. Note that our analysis may not factor in the latest price-sensitive company announcements or qualitative material. Simply Wall St has no position in any stocks mentioned.Join A Paid User Research SessionYou’ll receive a US$30 Amazon Gift card for 1 hour of your time while helping us build better investing tools for the individual investors like yourself. Sign up here]"
57,56e51bb5-94be-3ce1-abd9-f3961c839592,MDLZ,2022-11-06,15 Largest Food and Beverage Companies in the World in 2022,Insider Monkey,https://finance.yahoo.com/news/15-largest-food-beverage-companies-221801364.html,1667686681,STORY,"['KDP', 'KHC', 'DEO', 'MDLZ', 'TSN', 'K', 'ADM']","[In this article, we will be taking a look at the 15 largest food and beverage companies in the world in 2022. To skip our detailed analysis, you can go directly to see the 5 largest food and beverage companies in the world in 2022.The biggest food and beverage companies in the world in 2022 are mostly full of household names. The global food and beverage industry is worth trillions of dollars and grew from $5,818 billion in 2021 to jump to $6,327 billion in 2022 at a very decent compound annual growth rate (CAGR) of 8.7%. Despite facing several issues which we'll discuss in a moment, the industry is expected to grow to $7,942 billion by 2026 at a CAGR of 5.8% according to the Business Research Company.The food and beverage sector was quite badly impacted by the coronavirus pandemic which engulfed the world in 2020. Most restaurants and bars were closed immediately and were among the last to open after restrictions were ended in most countries. Furthermore, the global supply chain was significantly affected as well, affecting the operations of most major corporations and especially those with international operations. According to a report by Deloitte, food and beverage companies faced lower consumptions during the pandemic even as at-home consumption increased, which typically has lower margins. Even though out of home consumption has now increased, it is still not at levels before the pandemic as many potential customers now prefer at-home consumption mainly for comfort reasons.Largest Food and Beverage Companies in the World in 2022Copyright: stockbroker / 123RF Stock PhotoWhile recovery from the pandemic loomed in early 2021, the Russia-Ukraine war turned everything on its head. The war has resulted in a lot of sanctions imposed by mainly the West has resulted in the prices of commodities soaring which has resulted in higher costs for the food and beverage industry. The supply chain has also faced disruption because of the war which has also resulted in uneven supply and higher costs. Further, inflation has soared globally with many countries facing record levels of soaring prices, which has reduced disposable income and hence, spending on food and beverages.Story continuesTo determine the biggest food and beverage companies in the world in 2022, we referred to Forbes Global 2000 list and isolated those companies which are part of the food and beverage industry. We have only considered public companies because while there are companies such as Mars Wrigley which is a massive company, there is no information available as the company does not issue annual reports and of course, does not have a market cap. We considered three criteria namely revenue, market cap, profits and assets, with 30% weightage each assigned to the first three criteria and 10% to the last one. For market cap, we checked each company's latest market cap on Yahoo Finance and used it to base our rankings on. So, without further ado, let's take a look at the companies whose products you probably have in your home right now, starting with number 15:15. Kellogg Company (NYSE:K)Total revenue of the company (in billions of dollars): 14.2Total profits of the company (in millions of dollars): 1,490Total assets of the company (in billions of dollars): 18.2Market value as at 31 October 2022 (in billions of dollars): 26.1Kellogg Company (NYSE:K) is involved in the manufacture of cereal and convenience foods. Kellogg Company (NYSE:K) owns some of the most well-known food brands including Corn Flakes, Frosted Flakes, Rice Krispies, Eggo, Pringles and Cheez-it. Kellogg Company's (NYSE:K) has operations in more than 180 countries with its largest factory being located in the United Kingdom.14. Keurig Dr Pepper Inc. (NASDAQ:KDP)Total revenue of the company (in billions of dollars): 12.68Total profits of the company (in millions of dollars): 2,150Total assets of the company (in billions of dollars): 50.6Market value as at 31 October 2022 (in billions of dollars): 55Dr Pepper is one of the most popular drinks in the United States and the brand is owned by Keurig Dr Pepper Inc. (NASDAQ:KDP), which came into existence in 2018 after Keurig Green Mountain purchased Dr Pepper Snapple Group for $18.7 billion. Keurig Dr Pepper Inc. (NASDAQ:KDP), in addition to its beverages, is also engaged in the manufacture of coffee. Keurig Dr Pepper Inc. (NASDAQ:KDP) has more than 120 beverages and recently announced that it was building its second headquarters in Texas.13. General Mills, Inc. (NYSE:GIS)Total revenue of the company (in billions of dollars): 18.63Total profits of the company (in millions of dollars): 2,300Total assets of the company (in billions of dollars): 31.14Market value as at 31 October 2022 (in billions of dollars): 48.4Originally known for being a large flour miller, General Mills, Inc. (NYSE:GIS) both manufactures and markets branded consumer foods. General Mills, Inc.'s (NYSE:GIS) most famous brands include Annie's Homegrown, Betty Crocker, Häagen-Dazs and Cheerios among numerous others. General Mills, Inc. (NYSE:GIS) has more than 35,000 employees.12. DanoneTotal revenue of the company (in billions of dollars): 28.65Total profits of the company (in millions of dollars): 2,240Total assets of the company (in billions of dollars): 51.65Market value as at 31 October 2022 (in billions of dollars): 32.2Danone is a French food-products corporation with products sold in 120 countries.11. The Kraft Heinz Company (NASDAQ:KHC)Total revenue of the company (in billions of dollars): 26.04Total profits of the company (in millions of dollars): 1,010Total assets of the company (in billions of dollars): 93.4Market value as at 31 October 2022 (in billions of dollars): 47.1Formed through the merger of Kraft Foods and Heinz Company, The Kraft Heinz Company (NASDAQ:KHC) is one of the largest food and beverage companies in the world in 2022. Some of The Kraft Heinz Company's (NASDAQ:KHC) biggest brands include Philadelphia Cream Cheese, Boca Burgers and Gevalia in addition to of course the Kraft and Heinz brands.10. Tyson Foods, Inc. (NYSE:TSN)Total revenue of the company (in billions of dollars): 47.05Total profits of the company (in millions of dollars): 3,700Total assets of the company (in billions of dollars): 36.82Market value as at 31 October 2022 (in billions of dollars): 24.6Tyson Foods, Inc. (NYSE:TSN) is the second biggest processor of meat, pork and chicken. Tyson Foods, Inc. (NYSE:TSN) is also the biggest meat exporter in the United States. Tyson Foods, Inc. (NYSE:TSN) has faced a lot of criticism and scrutiny during the Covid-19 pandemic for not implementing best practices and resulting in the spread of the disease in its factories.9. JBSTotal revenue of the company (in billions of dollars): 64.99Total profits of the company (in millions of dollars): 3,800Total assets of the company (in billions of dollars): 37.18Market value as at 31 October 2022 (in billions of dollars): 11The largest meat processing company in the world, JBS is a Brazilian company with more than 150 industrial plants across the world.8. Diageo plc (NYSE:DEO)Total revenue of the company (in billions of dollars): 19Total profits of the company (in millions of dollars): 4,190Total assets of the company (in billions of dollars): 44.91Market value as at 31 October 2022 (in billions of dollars): 95.1Diageo plc (NYSE:DEO) is a British alcoholic beverage company. With operations through 132 sites, Diageo plc (NYSE:DEO) used to be the biggest global distiller. Some of Diageo plc's (NYSE:DEO) biggest brands include Smirnoff, Baileys, Guinness, Johnnie Walker and Tanqueray gin.7. Archer-Daniels-Midland Company (NYSE:ADM)Total revenue of the company (in billions of dollars): 85.26Total profits of the company (in millions of dollars): 2,710Total assets of the company (in billions of dollars): 56.14Market value as at 31 October 2022 (in billions of dollars): 53.3Archer-Daniels-Midland Company (NYSE:ADM) is a food processing and commodity training company. With more than 270 plants and 420 crop procurement facilities worldwide, Archer-Daniels-Midland Company (NYSE:ADM) is an extremely important raw material provider to the food and beverage industry.6. Mondelez International, Inc. (NASDAQ:MDLZ)Total revenue of the company (in billions of dollars): 28.72Total profits of the company (in millions of dollars): 4,300Total assets of the company (in billions of dollars): 67.09Market value as at 31 October 2022 (in billions of dollars): 84.3Mondelez International, Inc. (NASDAQ:MDLZ) is an American company which also maintains operations in 160 countries globally. Some of Mondelez International, Inc.'s (NASDAQ:MDLZ) biggest brands include Chips Ahoy!, Oreo, Belvita, TUC, LU, Cadbury and Toblerone among many others. Mondelez International, Inc. (NASDAQ:MDLZ) has been the subject of many controversies including wheat price-fixing allegations, deforestation, business in Russia after the Russa-Ukraine war began and child slavery. Click to continue reading and see the 5 Largest Food and Beverage Companies in the world in 2022. Suggested articles:20 Companies That Are The Biggest Polluters in the World10 Largest Fast Food Chains in the World12 Best Food Dividend Stocks To BuyDisclosure: The initial version of this article incorrectly stated that TSN's revenue was $49 billion. The correct amount is $47 billion. No positions. 15 largest food and beverage companies in the world in 2022 is originally published at Insider Monkey.]"
