,Id,Company,Date,Title,Publisher,Link,ProviderPublishTime,Type,Related Company,Text
92,2c457bf9-2665-395b-9da0-b27898177f3c,NKE,2022-11-07,"A Look At The Intrinsic Value Of NIKE, Inc. (NYSE:NKE)",Simply Wall St.,https://finance.yahoo.com/news/look-intrinsic-value-nike-inc-110047318.html,1667818847,STORY,['NKE'],"[Does the November share price for NIKE, Inc. (NYSE:NKE) reflect what it's really worth? Today, we will estimate the stock's intrinsic value by taking the expected future cash flows and discounting them to today's value. We will use the Discounted Cash Flow (DCF) model on this occasion. Models like these may appear beyond the comprehension of a lay person, but they're fairly easy to follow.We would caution that there are many ways of valuing a company and, like the DCF, each technique has advantages and disadvantages in certain scenarios. If you still have some burning questions about this type of valuation, take a look at the Simply Wall St analysis model. View our latest analysis for NIKE Crunching The NumbersWe use what is known as a 2-stage model, which simply means we have two different periods of growth rates for the company's cash flows. Generally the first stage is higher growth, and the second stage is a lower growth phase. In the first stage we need to estimate the cash flows to the business over the next ten years. Where possible we use analyst estimates, but when these aren't available we extrapolate the previous free cash flow (FCF) from the last estimate or reported value. We assume companies with shrinking free cash flow will slow their rate of shrinkage, and that companies with growing free cash flow will see their growth rate slow, over this period. We do this to reflect that growth tends to slow more in the early years than it does in later years.Generally we assume that a dollar today is more valuable than a dollar in the future, so we need to discount the sum of these future cash flows to arrive at a present value estimate:10-year free cash flow (FCF) estimate2023202420252026202720282029203020312032 Levered FCF ($, Millions) US$4.74bUS$5.63bUS$6.76bUS$7.45bUS$8.50bUS$9.27bUS$9.91bUS$10.5bUS$10.9bUS$11.3bGrowth Rate Estimate SourceAnalyst x9Analyst x10Analyst x8Analyst x2Analyst x2Est @ 9.07%Est @ 6.94%Est @ 5.45%Est @ 4.41%Est @ 3.68% Present Value ($, Millions) Discounted @ 7.6% US$4.4kUS$4.9kUS$5.4kUS$5.6kUS$5.9kUS$6.0kUS$5.9kUS$5.8kUS$5.6kUS$5.4k(""Est"" = FCF growth rate estimated by Simply Wall St)Present Value of 10-year Cash Flow (PVCF) = US$55bStory continuesWe now need to calculate the Terminal Value, which accounts for all the future cash flows after this ten year period. For a number of reasons a very conservative growth rate is used that cannot exceed that of a country's GDP growth. In this case we have used the 5-year average of the 10-year government bond yield (2.0%) to estimate future growth. In the same way as with the 10-year 'growth' period, we discount future cash flows to today's value, using a cost of equity of 7.6%.Terminal Value (TV)= FCF2032 × (1 + g) ÷ (r – g) = US$11b× (1 + 2.0%) ÷ (7.6%– 2.0%) = US$204bPresent Value of Terminal Value (PVTV)= TV / (1 + r)10= US$204b÷ ( 1 + 7.6%)10= US$98bThe total value, or equity value, is then the sum of the present value of the future cash flows, which in this case is US$153b. To get the intrinsic value per share, we divide this by the total number of shares outstanding. Relative to the current share price of US$95.8, the company appears about fair value at a 1.8% discount to where the stock price trades currently. Remember though, that this is just an approximate valuation, and like any complex formula - garbage in, garbage out.dcfThe AssumptionsNow the most important inputs to a discounted cash flow are the discount rate, and of course, the actual cash flows. If you don't agree with these result, have a go at the calculation yourself and play with the assumptions. The DCF also does not consider the possible cyclicality of an industry, or a company's future capital requirements, so it does not give a full picture of a company's potential performance. Given that we are looking at NIKE as potential shareholders, the cost of equity is used as the discount rate, rather than the cost of capital (or weighted average cost of capital, WACC) which accounts for debt. In this calculation we've used 7.6%, which is based on a levered beta of 1.103. Beta is a measure of a stock's volatility, compared to the market as a whole. We get our beta from the industry average beta of globally comparable companies, with an imposed limit between 0.8 and 2.0, which is a reasonable range for a stable business.Moving On:Although the valuation of a company is important, it ideally won't be the sole piece of analysis you scrutinize for a company. It's not possible to obtain a foolproof valuation with a DCF model. Rather it should be seen as a guide to ""what assumptions need to be true for this stock to be under/overvalued?"" For example, changes in the company's cost of equity or the risk free rate can significantly impact the valuation. For NIKE, we've compiled three additional elements you should look at:Financial Health: Does NKE have a healthy balance sheet? Take a look at our free balance sheet analysis with six simple checks on key factors like leverage and risk.Future Earnings: How does NKE's growth rate compare to its peers and the wider market? Dig deeper into the analyst consensus number for the upcoming years by interacting with our free analyst growth expectation chart.Other High Quality Alternatives: Do you like a good all-rounder? Explore our interactive list of high quality stocks to get an idea of what else is out there you may be missing!PS. Simply Wall St updates its DCF calculation for every American stock every day, so if you want to find the intrinsic value of any other stock just search here.Have feedback on this article? Concerned about the content? Get in touch with us directly. Alternatively, email editorial-team (at) simplywallst.com.This article by Simply Wall St is general in nature. We provide commentary based on historical data and analyst forecasts only using an unbiased methodology and our articles are not intended to be financial advice. It does not constitute a recommendation to buy or sell any stock, and does not take account of your objectives, or your financial situation. We aim to bring you long-term focused analysis driven by fundamental data. Note that our analysis may not factor in the latest price-sensitive company announcements or qualitative material. Simply Wall St has no position in any stocks mentioned.Join A Paid User Research SessionYou’ll receive a US$30 Amazon Gift card for 1 hour of your time while helping us build better investing tools for the individual investors like yourself. Sign up here]"
93,f7893bce-ec55-369f-af20-46934f883939,VFC,2022-11-07,VF Corporation Publishes Sustainability & Responsibility Report for Fiscal Year 2022,Business Wire,https://finance.yahoo.com/news/vf-corporation-publishes-sustainability-responsibility-115500864.html,1667822100,STORY,['VFC'],"[The report, Seizing the Momentum, details actions and progress of VF’s environmental and social commitmentsDENVER, November 07, 2022--(BUSINESS WIRE)--VF Corporation (NYSE: VFC), a global leader in branded lifestyle apparel, footwear and accessories, today released its latest Made for Change Sustainability &amp; Responsibility report entitled Seizing the Momentum. The report shares the company’s progress toward its science-based targets, product traceability goals, and other social and environmental commitments.""At VF, our performance-driven culture is grounded in purpose, which leads us to remain sharply focused on delivering consistent business results while also achieving high standards in environmental and social responsibility,"" said Steve Rendle, VF’s Chairman, President and CEO. ""Our latest Made for Change report demonstrates how we’re making meaningful progress toward our long-term sustainability commitments through the constant pursuit of responsible and profitable growth.""The company’s fifth Made for Change report details VF’s actions to advance its primary areas of focus: People, Planet and Product, which include topics covering gender parity; community investments; human rights; worker and community development; traceability; climate change; renewable energy; waste and plastic reduction; use of responsibly sourced, recycled and regenerative materials; and the reduction of unwanted chemicals.The report also highlights how VF and its brands collectively scale and accelerate meaningful progress aligned with our Purpose. Examples of brand initiatives featured in the report include the launch of the Vans® brand’s Sustainability Hub and the unveiling of its new VR3 product line and labeling; and the Timberland® brand’s TimberloopTM takeback program and resale website launched in the U.S.""VF is acting with urgency in this important moment for social and environmental progress,"" said Sean Cady, VF’s Vice President, Global Sustainability, Responsibility and Trade. ""In the face of global uncertainty, we are continuing to push forward the programs we’ve been building for years on climate action, product traceability, materials, human rights, and diversity, equity and inclusion.""Story continuesReport highlights include:People:Worker &amp; Community Development (WCD): Through its WCD programs, VF provided support to over 248,000 people in FY22 and more than 652,000 unique individuals since the program’s inception, as the company seeks to improve the lives of 1 million people by FY26 and 2 million by FY31.Inclusion, Diversity, Equity &amp; Action (IDEA): VF is making meaningful progress toward its aspiration to achieve gender parity globally in director and above positions and 25% representation of Black, Indigenous and People of Color (BIPOC) in director and above positions in the U.S. by FY30. VF reported 41.8% of global female leaders and 18.1% of U.S. BIPOC leaders at the end of FY22.Community Impact: VF associates contributed over 167,500 volunteer hours from FY19 to FY22 and VF’s brands provided more than $15.6 million in monetary and product donations in FY21.Planet:VF is making progress against its 2030 science-based greenhouse gas (GHG) emission reduction targets:Scope 1 and 2 emissions: As of FY22, VF has achieved 66% of its target of reducing Scope 1 and 2 GHG emissions by 55%.Scope 3 emissions: As of FY21, VF achieved 8% of its target of reducing Scope 3 GHG emissions by 30%.Renewable Energy: VF made progress toward the completion of the apparel and footwear industry’s largest tax equity investment in FY22 and utilized 34% renewable energy across its direct operations, up from 32% in FY21.Waste Reduction: By year-end FY22, VF achieved an average waste diversion rate of 97% in all active company owned – and operated distribution centers.Product:Traceability: VF achieved its goal of publishing traceability maps for 100 of its brands’ most iconic products in FY22. VF continues to expand its traceability program, making progress against its goal to trace five key materials through 100% of the supply chain by FY28.Materials: In FY21, 36% of polyester originated from recycled materials, achieving 72% of VF’s FY26 goal to source 50% of its polyester from recycled materials.Chemistry: VF removed more than 300 metric tons of nonpreferred chemicals from its supply chain since FY20 through the innovative CHEM-IQSM program. Since the program’s inception in 2016, VF has removed 900 metric tons of nonpreferred chemicals.VF’s FY22 Sustainability &amp; Responsibility report was prepared in accordance with Global Reporting Initiative (GRI) Standards 2018, Core option; aligned with Sustainability Accounting Standards Board (SASB) Apparel, Accessories &amp; Footwear Standard 2018; informed by the Task Force on Climate-related Financial Disclosures (TCFD); and United Nations Sustainable Development Goals (UN SDGs); and serves as our UN Global Compact (UNGC) Communication on Progress. Unless otherwise stated, all data reported is for VF’s fiscal year 2022.About VFFounded in 1899, VF Corporation is one of the world’s largest active-lifestyle companies, which connects people to the activities and experiences they cherish most through a portfolio of outdoor, active, workwear and streetwear brands including Vans®, The North Face®, Timberland® and Dickies®. Our Purpose is to power movements of sustainable and active lifestyles for the betterment of people and our planet. We connect this Purpose with a relentless drive to succeed to create value for all stakeholders and use our company as a force for good. For more information, please visit vfc.com.View source version on businesswire.com: https://www.businesswire.com/news/home/20221107005383/en/ContactsColin WheelerVF, CommunicationsVF CorporationColin_Wheeler@vfc.com]"
94,146ee91e-40ec-3d79-a374-ade2443a2850,PFE,2022-11-07,10 Most Undervalued Stocks to Buy Now,Insider Monkey,https://finance.yahoo.com/news/10-most-undervalued-stocks-buy-130910122.html,1667826550,STORY,"['MRO', 'VALE', 'F', 'INTC', 'GOLD', 'PFE', 'OXY']","[In this article, we will discuss the 10 most undervalued stocks to buy now. If you want to explore similar stocks, you can also take a look at 5 Most Undervalued Stocks to Buy Now.Evercore ISI Analyst: “Post-Midterms Tend To Be Very Good For Stocks”On November 3, senior managing director at Evercore ISI, Julian Emanuel, appeared in an interview on CNBC where he discussed the market volatility we have had in 2022 and what he sees for stocks ahead. Julian Emanuel noted that “the Fed basically came out sounding more hawkish than expected” and that rising bond yields and a strong dollar led to a major sell-off in the “yield-sensitive growth sector”. Here are some comments from Julian Emanuel about what he sees for equities moving into 2023:“When you think about a year like this year, the ups, the downs, the rollercoasters, centered around these macro relationships… You’re likely to get a new bear market low at some point in the next six to twelve months. But given the volatility that we see and the potential for a cessation in the uptrend in yields, sometime as the Fed backs away-they will eventually back away- you could actually get a good market next year because history says that post-midterms tend to be very good for stocks among other reasons.”Julian Emanuel thinks that “there’s a bit more room in terms of value outperformance” and is bullish on “financials, healthcare, and energy”. Julian Emanuel said that “growth is arguably still overvalued relative to value” and that “as a long-term investor, you need to be prepared to buy down another 10% and then another 10% after that.”As of November 4, the S&amp;P 500 has dropped 22.3% year to date, the Nasdaq has shed 35% of its value since the beginning of the year, and the Dow is down 12.38% for the year. Yields are going up and stocks are sinking to new lows. However, for the long-term investor, now might be an optimal buying opportunity to get best-in-class companies at bargain levels. This article will look at some of the most undervalued stocks to buy now, which include Intel Corporation (NASDAQ:INTC), Pfizer Inc. (NYSE:PFE), and Occidental Petroleum Corporation (NYSE:OXY).Story continues10 Most Undervalued Stocks to Buy NowImage by Sergei Tokmakov Terms.Law from PixabayOur MethodologyTo determine the most undervalued stocks to buy now, we screened for best-in-class companies whose shares have weakened significantly and are now trading at a PE multiple of less than 15x. We preferred companies with solid fundamentals and long-term growth stories and along with each stock, we included the hedge fund sentiment and analyst ratings. These stocks are ranked according to their popularity among elite hedge funds.Most Undervalued Stocks to Buy Now10. Vale S.A. (NYSE:VALE)PE Ratio as of November 4: 3.69Number of Hedge Fund Holders: 27Vale S.A. (NYSE:VALE) is a Brazilian mining and metals company that is among the largest producers of iron ore and nickel in the world. At the close of Q2 2022, 27 hedge funds held stakes in Vale S.A. (NYSE:VALE). The collective stakes of these hedge funds were valued at $1.78 billion.On October 27, Vale S.A. (NYSE:VALE) announced earnings for the third quarter of fiscal 2022. The company reported earnings per share of $1.05 and outperformed estimates by $0.05. The company generated a revenue of $9.93 billion for the quarter. As of November 4, Vale S.A. (NYSE:VALE) has a price-to-earnings ratio of 3.69 and is among the most undervalued stocks to buy now.On October 5, Deutsche Bank analyst Liam Fitzpatrick updated his price target on Vale S.A. (NYSE:VALE) to $19 from $20 and maintained a Hold rating on the shares.As of June 30, Fisher Asset Management is the largest investor in Vale S.A. (NYSE:VALE) and has stakes worth $324.5 million in the company.Some of the top names that investors can buy into weakness right now include Intel Corporation (NASDAQ:INTC), Pfizer Inc. (NYSE:PFE), and Occidental Petroleum Corporation (NYSE:OXY).9. Barrick Gold Corporation (NYSE:GOLD)PE Ratio as of November 4: 12.36Number of Hedge Fund Holders: 40Barrick Gold Corporation (NYSE:GOLD) is a leading Canadian gold mining company with operations in 18 countries. The company is among the largest gold producers in the world. As of November 4, Barrick Gold Corporation (NYSE:GOLD) has a price-to-earnings ratio of 12.36 and is awarding shareholders with a dividend yield of 5.32%. The stock is one of the most undervalued stocks to buy now.On October 19, Stifel analyst Ingrid Rico updated her price target on Barrick Gold Corporation (NYSE:GOLD) to C$33 from C$35.25 and reiterated a Buy rating on the shares.At the close of Q2 2022, 40 hedge funds were long Barrick Gold Corporation (NYSE:GOLD) and held stakes worth $1.13 billion in the company. Of those, First Eagle Investment Management was the top shareholder in the company and disclosed a stake of $471 million.8. Coterra Energy Inc. (NYSE:CTRA)PE Ratio as of November 4: 6.95Number of Hedge Fund Holders: 40Coterra Energy Inc. (NYSE:CTRA) is a leading American oil and gas company that is involved in the development, exploration and production of oil, natural gas, and natural gas liquids. As of November 4, the company has a market capitalization of $24.4 billion and is trading at a PE multiple of 7x. Coterra Energy Inc. (NYSE:CTRA) is among the best undervalued stocks to buy now.This October, Jefferies analyst Lloyd Byrne took coverage of Coterra Energy Inc. (NYSE:CTRA) with a Hold rating and a $32 price target. On October 25, Stifel analyst Derrick Whitfield started coverage of Coterra Energy Inc. (NYSE:CTRA) with a Buy rating and a $40 price target.At the end of Q2 2022, 40 hedge funds held stakes in Coterra Energy Inc (NYSE:CTRA) worth roughly $437.35 million. This is compared to 39 positions in the previous quarter with stakes worth $551.5 million.As of June 30, Diamond Hill Capital is the largest investor in Coterra Energy Inc. (NYSE:CTRA) and has a position worth $116.4 million in the company.Here is what Palm Valley Capital had to say about Coterra Energy Inc. (NYSE:CTRA) in its second-quarter 2022 investor letter:“We sold two Fund positions during the quarter which includes Coterra Energy (NYSE:CTRA). As a result of surging oil and natural gas prices, Coterra reached our valuation, and we exited the position in April.”7. Marathon Oil Corporation (NYSE:MRO)PE Ratio as of November 4: 7.67Number of Hedge Fund Holders: 41Marathon Oil Corporation (NYSE:MRO) is a leading global oil and gas exploration company. On November 2, Marathon Oil Corporation (NYSE:MRO) announced earnings for the fiscal third quarter of 2022. The company reported earnings per share of $1.24 and outperformed expectations by $0.07. The company generated a revenue of $2.25 billion, up 54.65% year over year, and beat expectations by $219.5 million.On October 18, Piper Sandler analyst Mark Lear raised his price target on Marathon Oil Corporation (NYSE:MRO) to $38 from $36 and reiterated an Overweight rating on the shares. As of November 4, the stock is trading at a PE multiple of 7x and is among the best undervalued stocks to buy now.At the close of Q2 2022, 41 hedge funds were long Marathon Oil Corporation (NYSE:MRO) and held stakes worth $1.26 billion in the company. As of June 30, Fisher Asset Management is the top investor in Marathon Oil Corporation (NYSE:MRO) and has stakes worth $194 million in the company.Shares of Intel Corporation (NASDAQ:INTC), Pfizer Inc. (NYSE:PFE), and Occidental Petroleum Corporation (NYSE:OXY) have pulled back in 2022 and are presenting an attractive entry point for long-term investors.6. Ford Motor Company (NYSE:F)PE Ratio as of November 4: 4.70Number of Hedge Fund Holders: 46Ford Motor Company (NYSE:F) has pulled back in 2022 and is presenting an optimal opportunity for long-term investors. As of November 4, the stock is trading at a PE multiple of 4x and is offering a forward dividend yield of 4.49%. Ford Motor Company (NYSE:F) is ranked among the most undervalued stocks to buy now.On October 27, Morgan Stanley analyst Adam Jonas reiterated an Overweight rating and his $14 price target on Ford Motor Company (NYSE:F).At the end of Q2 2022, 46 hedge funds held stakes in Ford Motor Company (NYSE:F). The total value of these stakes amounted to $608.7 million. As of June 30, D E Shaw has a position worth $257.6 million in the company and is the top investor.Here is what Leaven Partners had to say about Ford Motor Company (NYSE:F) in its third-quarter 2022 investor letter:“In our last quarterly letter, I briefly mentioned that the consensus estimates for corporate profits appeared to be a bit too sanguine. I referenced a Reuters article that reported, as of June 17, Wall Street expected S&amp;P 500 earnings to grow by 9.6% in 2022, which was up from 8.8% in April and from 8.4% in January. That tune began to change at the end of July and accelerated in August and September, as major players, such as Ford (NYSE:F), has recently issued profit warnings and/or have withdrawn guidance. In response, Wall Street has altered its outlook: lowering third-quarter profit growth to 4.6%[2] from 7.2% in early August and slashing full-year profit growth to 4.5%.” Click to continue reading and see 5 Most Undervalued Stocks to Buy Now. Suggested articles:12 Best Food Dividend Stocks To Buy15 Biggest Drone Companies in the World10 Best RV Stocks To Buy Disclosure: None. 10 Most Undervalued Stocks to Buy Now is originally published on Insider Monkey.]"
95,ff1267c4-fdec-3cf0-be49-84fa04f9e01d,PFE,2022-11-07,BioNTech lifts lower end of vaccine sales target range,Reuters,https://finance.yahoo.com/news/biontech-lifts-lower-end-vaccine-112254121.html,1667820174,STORY,"['BNTX', 'PFE']","[FRANKFURT (Reuters) - COVID-19 vaccine maker BioNTech on Monday raised the lower bound of its 2022 COVID-19 vaccine revenue guidance for the full year, citing demand for its adapted shots and higher prices.The German biotech firm, the vaccines partner of U.S. pharma giant Pfizer, said in a statement that it is now targeting 16 to 17 billion euros ($16-$17 billion) in vaccine sales, compared with a previous range of 13-17 billion but down from 19 billion euros reported for last year.""The updated guidance reflects the shipment of the Omicron adapted bivalent vaccine boosters, which started early in September and is expected to continue throughout the fourth quarter of 2022 as well as higher prices and a positive foreign currency effect,"" the company said.About 300 million doses of the variant-adapted vaccines have been invoiced as of mid-October 2022, it added.Partner Pfizer last week raised its forecast for its 2022 sales of the COVID-19 vaccine by $2 billion to $34 billion.BioNTech's quarterly results, however, were well below the year-earlier quarter, when primary immunisation campaigns were in full swing. Sales during the July-to-September quarter dropped 43% to 3.46 billion euros while net profit fell 44% to 1.78 billion euros.""As expected, the course of the pandemic remains dynamic and led to fluctuations in quarterly revenues,"" said BioNTech.Sales of the Pfizer/BioNTech COVID vaccine are down from pandemic highs as many countries have neared the end of their primary vaccination campaigns. There are also concerns about soft demand for newly updated booster shots.($1 = 1.0016 euros)(Reporting by Ludwig Burger, Editing by Miranda Murray)]"
96,07786f31-a2be-340a-bce8-9f35c52a75b2,FOXA,2022-11-07,"Fox Must Pay Up For FanDuel, Just as DraftKings Posts Earnings Misfire",Motley Fool,https://finance.yahoo.com/m/07786f31-a2be-340a-bce8-9f35c52a75b2/fox-must-pay-up-for-fanduel%2C.html,1667782840,STORY,"['DKNG', 'FOXA']","[Fox Sports just had their gambling hand forced -- and now they may be pot committed. On Friday, after a lengthy legal dispute, Rupert Murdoch's...Continue reading]"
