,Id,Company,Date,Title,Publisher,Link,ProviderPublishTime,Type,Related Company,Text
123,21f794fc-8b24-379e-95b4-91147b2ed131,FOX,2022-11-07,"Arbitrator affirms Fox holds 10-year option to buy stake in FanDuel, but must pay full price",Reuters,https://finance.yahoo.com/news/arbitrator-affirms-fox-holds-10-215759589.html,1667599079,STORY,['FOXA'],"[(Reuters) - An arbitrator on Friday reaffirmed Fox Corp has 10 years to exercise its option to acquire a nearly one-fifth stake in FanDuel, settling a longstanding dispute with the betting app's owner, Flutter Entertainment Plc.The New York-based Judicial Arbitration and Mediation Services tribunal ruled that Fox would pay $3.7 billion for its right to acquire an 18.6% stake of FanDuel, a sum that could rise to $4 billion when factoring in a 5% annual escalator.That's roughly twice the amount Fox sought to pay, according to a copy of the ruling seen by Reuters on Sunday.Fox received the FanDuel options in 2019 when the Irish gaming company acquired The Stars Group, a Canadian gaming company that licensed Fox's brand to launch a sports betting app in the United States.A dispute arose over the price Fox would pay for a stake in the market-leading FanDuel app, leading to arbitration that began in the spring of 2021.Fox sought to pay $2.1 billion to exercise its options in FanDuel, based on the price Flutter paid in December 2020 to acquire 37% of FanDuel Group from early investors, according to the documents.Flutter argued that Fox was not entitled to the 40% discount it received for accelerating the timetable for the buyout, and maintained Fox should pay the full market value for its stake in FanDuel as of July 2021 -- a valuation that one Wall Street analyst pegged at $35.1 billion.The arbitrator ruled Fox's options would be based on the fair market value of FanDuel in December 2020, or $20 billion, a decision Flutter heralded as a win.“Today’s ruling vindicates the confidence we had in our position on this matter and provides certaintyon what it would cost Fox to buy into this business, should they wish to do so,"" Flutter Chief Executive Peter Jackson said in a statement late Friday.Fox also issued a statement applauding the ruling, saying it gives the media company the option to acquire a ""meaningful equity stake in the market leading U.S. online sports betting operation.""Story continuesAs recently as August, Fox Chief Executive Lachlan Murdoch described sports betting as ""a huge opportunity"" for Fox Sports, telling Wall Street it would fuel viewer engagement. Sports betting is one factor in Rupert Murdoch's proposal to recombine Fox with News Corp, according to people familiar with the deal's logic.Independent directors within both media companies are evaluating the proposal, which would be subject to approval by a majority of non-family shareholders.The Murdochs' early foray into sports betting has been slow-going. The sports betting app Fox Bet is available in four states, with just 0.2% share of the U.S. market, according to researcher Vixio. A free version called Fox Bet Super 6 has attracted some 6 million users whom Fox hopes to eventually convert to betters.The growth of Fox Bet has stagnated since Flutter acquired Stars Group, the company that helped launch Fox Bet and owns and operates the app.Fox claimed that Flutter failed to provide reasonable resources behind Fox Bet, a claim Flutter said the arbitrator rejected, finding that Flutter had agreed to commit ""commercially reasonable"" resources behind the offering.However, Fox retains the right to acquire up to 50% of the Stars Group's U.S. operations, which includes Fox Bet, though it would need to obtain necessary sports betting licenses.(Reporting by Dawn Chmielewski; Editing by Leslie Adler, David Gregorio, Muralikumar Anantharaman and Diane Craft)]"
124,59a55ff5-b0a3-3871-b594-f512c004cafd,DIS,2022-11-07,The Walt Disney Company's (NYSE:DIS) Intrinsic Value Is Potentially 64% Above Its Share Price,Simply Wall St.,https://finance.yahoo.com/news/walt-disney-companys-nyse-dis-120127735.html,1667822487,STORY,['DIS'],"[Does the November share price for The Walt Disney Company (NYSE:DIS) reflect what it's really worth? Today, we will estimate the stock's intrinsic value by taking the forecast future cash flows of the company and discounting them back to today's value. We will use the Discounted Cash Flow (DCF) model on this occasion. Don't get put off by the jargon, the math behind it is actually quite straightforward.Companies can be valued in a lot of ways, so we would point out that a DCF is not perfect for every situation. For those who are keen learners of equity analysis, the Simply Wall St analysis model here may be something of interest to you. View our latest analysis for Walt Disney Crunching The NumbersWe're using the 2-stage growth model, which simply means we take in account two stages of company's growth. In the initial period the company may have a higher growth rate and the second stage is usually assumed to have a stable growth rate. In the first stage we need to estimate the cash flows to the business over the next ten years. Where possible we use analyst estimates, but when these aren't available we extrapolate the previous free cash flow (FCF) from the last estimate or reported value. We assume companies with shrinking free cash flow will slow their rate of shrinkage, and that companies with growing free cash flow will see their growth rate slow, over this period. We do this to reflect that growth tends to slow more in the early years than it does in later years.A DCF is all about the idea that a dollar in the future is less valuable than a dollar today, so we discount the value of these future cash flows to their estimated value in today's dollars:10-year free cash flow (FCF) estimate2023202420252026202720282029203020312032 Levered FCF ($, Millions) US$6.67bUS$8.98bUS$12.2bUS$14.6bUS$16.4bUS$17.9bUS$19.1bUS$20.2bUS$21.1bUS$21.9bGrowth Rate Estimate SourceAnalyst x12Analyst x8Analyst x4Analyst x1Est @ 12.2%Est @ 9.13%Est @ 6.99%Est @ 5.48%Est @ 4.43%Est @ 3.7% Present Value ($, Millions) Discounted @ 7.5% US$6.2kUS$7.8kUS$9.8kUS$10.9kUS$11.4kUS$11.6kUS$11.5kUS$11.3kUS$11.0kUS$10.6k(""Est"" = FCF growth rate estimated by Simply Wall St)Present Value of 10-year Cash Flow (PVCF) = US$102bStory continuesAfter calculating the present value of future cash flows in the initial 10-year period, we need to calculate the Terminal Value, which accounts for all future cash flows beyond the first stage. The Gordon Growth formula is used to calculate Terminal Value at a future annual growth rate equal to the 5-year average of the 10-year government bond yield of 2.0%. We discount the terminal cash flows to today's value at a cost of equity of 7.5%.Terminal Value (TV)= FCF2032 × (1 + g) ÷ (r – g) = US$22b× (1 + 2.0%) ÷ (7.5%– 2.0%) = US$404bPresent Value of Terminal Value (PVTV)= TV / (1 + r)10= US$404b÷ ( 1 + 7.5%)10= US$196bThe total value is the sum of cash flows for the next ten years plus the discounted terminal value, which results in the Total Equity Value, which in this case is US$298b. To get the intrinsic value per share, we divide this by the total number of shares outstanding. Relative to the current share price of US$99.6, the company appears quite undervalued at a 39% discount to where the stock price trades currently. Remember though, that this is just an approximate valuation, and like any complex formula - garbage in, garbage out.dcfImportant AssumptionsWe would point out that the most important inputs to a discounted cash flow are the discount rate and of course the actual cash flows. If you don't agree with these result, have a go at the calculation yourself and play with the assumptions. The DCF also does not consider the possible cyclicality of an industry, or a company's future capital requirements, so it does not give a full picture of a company's potential performance. Given that we are looking at Walt Disney as potential shareholders, the cost of equity is used as the discount rate, rather than the cost of capital (or weighted average cost of capital, WACC) which accounts for debt. In this calculation we've used 7.5%, which is based on a levered beta of 1.076. Beta is a measure of a stock's volatility, compared to the market as a whole. We get our beta from the industry average beta of globally comparable companies, with an imposed limit between 0.8 and 2.0, which is a reasonable range for a stable business.Looking Ahead:Although the valuation of a company is important, it is only one of many factors that you need to assess for a company. It's not possible to obtain a foolproof valuation with a DCF model. Rather it should be seen as a guide to ""what assumptions need to be true for this stock to be under/overvalued?"" If a company grows at a different rate, or if its cost of equity or risk free rate changes sharply, the output can look very different. What is the reason for the share price sitting below the intrinsic value? For Walt Disney, we've put together three pertinent items you should assess:Financial Health: Does DIS have a healthy balance sheet? Take a look at our free balance sheet analysis with six simple checks on key factors like leverage and risk.Future Earnings: How does DIS's growth rate compare to its peers and the wider market? Dig deeper into the analyst consensus number for the upcoming years by interacting with our free analyst growth expectation chart.Other Solid Businesses: Low debt, high returns on equity and good past performance are fundamental to a strong business. Why not explore our interactive list of stocks with solid business fundamentals to see if there are other companies you may not have considered!PS. Simply Wall St updates its DCF calculation for every American stock every day, so if you want to find the intrinsic value of any other stock just search here.Have feedback on this article? Concerned about the content? Get in touch with us directly. Alternatively, email editorial-team (at) simplywallst.com.This article by Simply Wall St is general in nature. We provide commentary based on historical data and analyst forecasts only using an unbiased methodology and our articles are not intended to be financial advice. It does not constitute a recommendation to buy or sell any stock, and does not take account of your objectives, or your financial situation. We aim to bring you long-term focused analysis driven by fundamental data. Note that our analysis may not factor in the latest price-sensitive company announcements or qualitative material. Simply Wall St has no position in any stocks mentioned.Join A Paid User Research SessionYou’ll receive a US$30 Amazon Gift card for 1 hour of your time while helping us build better investing tools for the individual investors like yourself. Sign up here]"
125,e5e951b2-7f77-34ea-b760-6b986eec0921,DIS,2022-11-07,Apple Issues iPhone Supply Warning. But the Real Issue Is Demand.,Barrons.com,https://finance.yahoo.com/m/e5e951b2-7f77-34ea-b760-6b986eec0921/apple-issues-iphone-supply.html,1667820900,STORY,['DIS'],[]
126,0657792f-d27c-3854-90bb-9491478fd734,DIS,2022-11-07,"Disney overtook Netflix as the streaming leader, and is expected to widen its lead",MarketWatch,https://finance.yahoo.com/m/0657792f-d27c-3854-90bb-9491478fd734/disney-overtook-netflix-as.html,1667774880,STORY,['DIS'],[]
127,cfedd23c-6386-3321-93e3-824d84303f11,DIS,2022-11-07,"‘Black Adam’ tops box office, but ‘Wakanda Forever’ is waiting to pounce",MarketWatch,https://finance.yahoo.com/m/cfedd23c-6386-3321-93e3-824d84303f11/%E2%80%98black-adam%E2%80%99-tops-box-office%2C.html,1667772360,STORY,['DIS'],[]
128,0fcc15f6-ae66-38a8-a157-7f3cc990addd,DIS,2022-11-07,The end of the pandemic earnings boom is in sight as holiday forecasts disappoint,MarketWatch,https://finance.yahoo.com/m/0fcc15f6-ae66-38a8-a157-7f3cc990addd/the-end-of-the-pandemic.html,1667763720,STORY,['DIS'],[]
129,282b0cad-8c67-3800-bf24-d9e5cbfa026b,DIS,2022-11-07,"Twitter delisting, Disney earnings, consumer price index top week ahead",Fox Business,https://finance.yahoo.com/news/twitter-delisting-disney-earnings-consumer-194131026.html,1667763691,STORY,['DIS'],[]
130,985bc078-c8c7-39c4-9ac1-69256e68b215,DIS,2022-11-07,Disney World Rival Adds its Own Take on a Classic Ride,TheStreet.com,https://finance.yahoo.com/m/985bc078-c8c7-39c4-9ac1-69256e68b215/disney-world-rival-adds-its.html,1667759280,STORY,['DIS'],[Disney has a lot of history and that sometimes allows its competitors to offer modern versions of the company's beloved (but dated) rides.Continue reading]
131,c6793b03-6fb8-35c7-a242-4b3e7d36071f,DIS,2022-11-07,Streaming Services Raise Prices Again. Here’s How to Avoid Overpaying.,The Wall Street Journal,https://finance.yahoo.com/m/c6793b03-6fb8-35c7-a242-4b3e7d36071f/streaming-services-raise.html,1667743200,STORY,['DIS'],[]
132,ee186735-b858-384e-93db-0f0d83c7fba8,CL,2022-11-07,Colgate-Palmolive Company (NYSE:CL) is largely controlled by institutional shareholders who own 80% of the company,Simply Wall St.,https://finance.yahoo.com/news/colgate-palmolive-company-nyse-cl-140016234.html,1667743216,STORY,['CL'],"[Every investor in Colgate-Palmolive Company (NYSE:CL) should be aware of the most powerful shareholder groups. And the group that holds the biggest piece of the pie are institutions with 80% ownership. Put another way, the group faces the maximum upside potential (or downside risk).Given the vast amount of money and research capacities at their disposal, institutional ownership tends to carry a lot of weight, especially with individual investors. Hence, having a considerable amount of institutional money invested in a company is often regarded as a desirable trait.Let's delve deeper into each type of owner of Colgate-Palmolive, beginning with the chart below. See our latest analysis for Colgate-Palmolive ownership-breakdownWhat Does The Institutional Ownership Tell Us About Colgate-Palmolive?Many institutions measure their performance against an index that approximates the local market. So they usually pay more attention to companies that are included in major indices.Colgate-Palmolive already has institutions on the share registry. Indeed, they own a respectable stake in the company. This can indicate that the company has a certain degree of credibility in the investment community. However, it is best to be wary of relying on the supposed validation that comes with institutional investors. They too, get it wrong sometimes. It is not uncommon to see a big share price drop if two large institutional investors try to sell out of a stock at the same time. So it is worth checking the past earnings trajectory of Colgate-Palmolive, (below). Of course, keep in mind that there are other factors to consider, too.earnings-and-revenue-growthInstitutional investors own over 50% of the company, so together than can probably strongly influence board decisions. We note that hedge funds don't have a meaningful investment in Colgate-Palmolive. Looking at our data, we can see that the largest shareholder is The Vanguard Group, Inc. with 9.3% of shares outstanding. Meanwhile, the second and third largest shareholders, hold 7.8% and 5.9%, of the shares outstanding, respectively.Story continuesAfter doing some more digging, we found that the top 24 have the combined ownership of 50% in the company, suggesting that no single shareholder has significant control over the company.While studying institutional ownership for a company can add value to your research, it is also a good practice to research analyst recommendations to get a deeper understand of a stock's expected performance. There are a reasonable number of analysts covering the stock, so it might be useful to find out their aggregate view on the future.Insider Ownership Of Colgate-PalmoliveThe definition of an insider can differ slightly between different countries, but members of the board of directors always count. Company management run the business, but the CEO will answer to the board, even if he or she is a member of it.Insider ownership is positive when it signals leadership are thinking like the true owners of the company. However, high insider ownership can also give immense power to a small group within the company. This can be negative in some circumstances.Our data suggests that insiders own under 1% of Colgate-Palmolive Company in their own names. Being so large, we would not expect insiders to own a large proportion of the stock. Collectively, they own US$62m of stock. In this sort of situation, it can be more interesting to  see if those insiders have been buying or selling. General Public OwnershipThe general public, who are usually individual investors, hold a 20% stake in Colgate-Palmolive. This size of ownership, while considerable, may not be enough to change company policy if the decision is not in sync with other large shareholders.Next Steps:I find it very interesting to look at who exactly owns a company. But to truly gain insight, we need to consider other information, too. To that end, you should be aware of the   1 warning sign  we've spotted with Colgate-Palmolive .Ultimately the future is most important. You can access this free report on analyst forecasts for the company.NB: Figures in this article are calculated using data from the last twelve months, which refer to the 12-month period ending on the last date of the month the financial statement is dated. This may not be consistent with full year annual report figures.Have feedback on this article? Concerned about the content? Get in touch with us directly. Alternatively, email editorial-team (at) simplywallst.com.This article by Simply Wall St is general in nature. We provide commentary based on historical data and analyst forecasts only using an unbiased methodology and our articles are not intended to be financial advice. It does not constitute a recommendation to buy or sell any stock, and does not take account of your objectives, or your financial situation. We aim to bring you long-term focused analysis driven by fundamental data. Note that our analysis may not factor in the latest price-sensitive company announcements or qualitative material. Simply Wall St has no position in any stocks mentioned.Join A Paid User Research SessionYou’ll receive a US$30 Amazon Gift card for 1 hour of your time while helping us build better investing tools for the individual investors like yourself. Sign up here]"
