,Id,Company,Date,Title,Publisher,Link,ProviderPublishTime,Type,Related Company,Text
18,7cfb290d-1b48-31a6-aee6-2e05b79f9b38,HCA,2022-12-25,"What Is HCA Healthcare, Inc.'s (NYSE:HCA) Share Price Doing?",Simply Wall St.,https://finance.yahoo.com/news/hca-healthcare-inc-nyse-hca-130101395.html,1671886861,STORY,['HCA'],"[Today we're going to take a look at the well-established HCA Healthcare, Inc. (NYSE:HCA). The company's stock led the NYSE gainers with a relatively large price hike in the past couple of weeks. With many analysts covering the large-cap stock, we may expect any price-sensitive announcements have already been factored into the stock’s share price. However, what if the stock is still a bargain? Let’s examine HCA Healthcare’s valuation and outlook in more detail to determine if there’s still a bargain opportunity. See our latest analysis for HCA Healthcare What's The Opportunity In HCA Healthcare?Good news, investors! HCA Healthcare is still a bargain right now according to my price multiple model, which compares the company's price-to-earnings ratio to the industry average. I’ve used the price-to-earnings ratio in this instance because there’s not enough visibility to forecast its cash flows. The stock’s ratio of 12.66x is currently well-below the industry average of 21.39x, meaning that it is trading at a cheaper price relative to its peers. What’s more interesting is that, HCA Healthcare’s share price is quite volatile, which gives us more chances to buy since the share price could sink lower (or rise higher) in the future. This is based on its high beta, which is a good indicator for how much the stock moves relative to the rest of the market.Can we expect growth from HCA Healthcare?earnings-and-revenue-growthFuture outlook is an important aspect when you’re looking at buying a stock, especially if you are an investor looking for growth in your portfolio. Buying a great company with a robust outlook at a cheap price is always a good investment, so let’s also take a look at the company's future expectations. HCA Healthcare's earnings growth are expected to be in the teens in the upcoming years, indicating a solid future ahead. This should lead to robust cash flows, feeding into a higher share value.What This Means For YouAre you a shareholder? Since HCA is currently below the industry PE ratio, it may be a great time to accumulate more of your holdings in the stock. With a positive outlook on the horizon, it seems like this growth has not yet been fully factored into the share price. However, there are also other factors such as financial health to consider, which could explain the current price multiple.Story continuesAre you a potential investor? If you’ve been keeping an eye on HCA for a while, now might be the time to enter the stock. Its buoyant future profit outlook isn’t fully reflected in the current share price yet, which means it’s not too late to buy HCA. But before you make any investment decisions, consider other factors such as the strength of its balance sheet, in order to make a well-informed investment decision.Keep in mind, when it comes to analysing a stock it's worth noting the risks involved. To help with this, we've discovered 3 warning signs (1 is concerning!) that you ought to be aware of before buying any shares in HCA Healthcare.If you are no longer interested in HCA Healthcare, you can use our free platform to see our list of over 50 other stocks with a high growth potential.Have feedback on this article? Concerned about the content? Get in touch with us directly. Alternatively, email editorial-team (at) simplywallst.com.This article by Simply Wall St is general in nature. We provide commentary based on historical data and analyst forecasts only using an unbiased methodology and our articles are not intended to be financial advice. It does not constitute a recommendation to buy or sell any stock, and does not take account of your objectives, or your financial situation. We aim to bring you long-term focused analysis driven by fundamental data. Note that our analysis may not factor in the latest price-sensitive company announcements or qualitative material. Simply Wall St has no position in any stocks mentioned.Join A Paid User Research SessionYou’ll receive a US$30 Amazon Gift card for 1 hour of your time while helping us build better investing tools for the individual investors like yourself. Sign up here]"
19,895a9063-1970-3fea-9a3f-e278c1e5a310,PPG,2022-12-25,Dow Jones Bear Market: The Smartest Investors Are Buying These Beaten-Down Stocks,Motley Fool,https://finance.yahoo.com/m/895a9063-1970-3fea-9a3f-e278c1e5a310/dow-jones-bear-market%3A-the.html,1671969240,STORY,"['^DJI', 'CAT', 'PPG']","[The Dow Jones Industrial Average officially fell into bear market territory at the end of September, falling just over 20% compared to where it started the year, but has steadily regained ground since. The housing market is in free fall as interest rates rise, the auto market is souring quickly with the number of repossessions higher than pre-pandemic levels, and inflation is still at 40-year highs. Bear markets tend to be measured in months, while bull markets last for years, so it's not so much when you buy stocks but rather that you buy quality companies and hold onto them.Continue reading]"
20,5418f335-cad7-3c6a-9e7e-6997a11d65f8,SLB,2022-12-25,Is Schlumberger Limited's (NYSE:SLB) Recent Stock Performance Tethered To Its Strong Fundamentals?,Simply Wall St.,https://finance.yahoo.com/news/schlumberger-limiteds-nyse-slb-recent-120055703.html,1671969655,STORY,['SLB'],"[Most readers would already be aware that Schlumberger's (NYSE:SLB) stock increased significantly by 56% over the past three months. Given the company's impressive performance, we decided to study its financial indicators more closely as a company's financial health over the long-term usually dictates market outcomes. In this article, we decided to focus on Schlumberger's  ROE.Return on Equity or ROE is a test of how effectively a company is growing its value and managing investors’ money. Simply put, it is used to assess the profitability of a company in relation to its equity capital. View our latest analysis for Schlumberger How Is ROE Calculated?Return on equity can be calculated by using the formula:Return on Equity = Net Profit (from continuing operations) ÷ Shareholders' EquitySo, based on the above formula, the ROE for Schlumberger is:17% = US$3.0b ÷ US$18b (Based on the trailing twelve months to September 2022).The 'return' is the profit over the last twelve months. One way to conceptualize this is that for each $1 of shareholders' capital it has, the company made $0.17 in profit.What Is The Relationship Between ROE And Earnings Growth?We have already established that ROE serves as an efficient profit-generating gauge for a company's future earnings. Based on how much of its profits the company chooses to reinvest or ""retain"", we are then able to evaluate a company's future ability to generate profits. Assuming all else is equal, companies that have both a higher return on equity and higher profit retention are usually the ones that have a higher growth rate when compared to companies that don't have the same features.Schlumberger's Earnings Growth And 17% ROETo start with, Schlumberger's ROE looks acceptable. On comparing with the average industry ROE of 10% the company's ROE looks pretty remarkable. Yet, Schlumberger has posted measly growth of 4.5% over the past five years. That's a bit unexpected from a company which has such a high rate of return. We reckon that a low growth, when returns are quite high could be the result of certain circumstances like low earnings retention or poor allocation of capital.Story continuesGiven that the industry shrunk its earnings at a rate of 5.0% in the same period, the net income growth of the company is quite impressive.past-earnings-growthEarnings growth is an important metric to consider when valuing a stock. The investor should try to establish if the expected growth or decline in earnings, whichever the case may be, is priced in. By doing so, they will have an idea if the stock is headed into clear blue waters or if swampy waters await. What is SLB worth today? The  intrinsic value infographic in our free research report  helps visualize whether SLB is currently mispriced by the market.Is Schlumberger Making Efficient Use Of Its Profits?Despite having a normal LTM (or last twelve month) payout ratio of 28% (or a retention ratio of 72% over the past three years, Schlumberger has seen very little growth in earnings as we saw above. Therefore, there might be some other reasons to explain the lack in that respect. For example, the business could be in decline.In addition, Schlumberger has been paying dividends over a period of at least ten years suggesting that keeping up dividend payments is way more important to the management even if it comes at the cost of business growth. Based on the latest analysts' estimates, we found that the company's future payout ratio over the next three years is expected to hold steady at 27%. Still, forecasts suggest that Schlumberger's future ROE will rise to 22% even though the the company's payout ratio is not expected to change by much.ConclusionOn the whole, we feel that Schlumberger's performance has been quite good. In particular, it's great to see that the company is investing heavily into its business and along with a high rate of return, that has resulted in a sizeable growth in its earnings. Having said that, looking at the current analyst estimates, we found that the company's earnings are expected to gain momentum. To know more about the latest analysts predictions for the company, check out this visualization of analyst forecasts for the company.Have feedback on this article? Concerned about the content? Get in touch with us directly. Alternatively, email editorial-team (at) simplywallst.com.This article by Simply Wall St is general in nature. We provide commentary based on historical data and analyst forecasts only using an unbiased methodology and our articles are not intended to be financial advice. It does not constitute a recommendation to buy or sell any stock, and does not take account of your objectives, or your financial situation. We aim to bring you long-term focused analysis driven by fundamental data. Note that our analysis may not factor in the latest price-sensitive company announcements or qualitative material. Simply Wall St has no position in any stocks mentioned.Join A Paid User Research SessionYou’ll receive a US$30 Amazon Gift card for 1 hour of your time while helping us build better investing tools for the individual investors like yourself. Sign up here]"
21,bc3ff03d-7673-3ccd-8c49-cd98926b1702,PRGO,2022-12-25,7 Perfect Presents to Gift Your 2023 Stock Portfolio,InvestorPlace,https://finance.yahoo.com/news/7-perfect-presents-gift-2023-215702678.html,1671659822,STORY,"['AMD', 'HBAN', 'PRGO', 'ARRY', 'KYMR', 'ADM', 'MRK']","[New Year 2023 will see a continued tightening of monetary policy as the Federal Reserve attempts to rein in sky-high inflation. Following the 50 basis point rate hike in Dec., there are expectations that Feb. and March will see 25 basis point rate hikes, respectively. That will bring target rates near 5% which is where investors should expect them to remain throughout 2023. In short, investors should expect 2023 to look and feel like 2022 in many ways. However, there are still a good deal of hot stocks to buy. Just prepare to invest accordingly. That isn’t meant to be gloomy. Growth still exists in several areas. ARRYArray Technologies$21.53ADMArcher-Daniels-Midland$94.27KYMRKymera Therapeutics$27.52MRKMerck$111.11AMDAdvanced Micro Devices$67.68HBANHuntington Bancshares$14.00PRGOPerrigo Co.$31.80Stocks to Buy: Array Technologies (ARRY)Solar penny stocks: a close up of a solar cell farmSource: Fit Ztudio / ShutterstockArray Technologies (NASDAQ:ARRY) stock should have a strong 2023 because of its exposure to solar. At the moment, the company manufactures ground-mounting systems used in solar arrays. InvestorPlace - Stock Market News, Stock Advice &amp; Trading TipsPlus, there are several reasons to believe 2023 will continue to be kind to the stock. For one, solar is expected to be the fastest-growing subsegment in energy in 2023 with demand spiking 20-30%. Array Technologies will also benefit from domestic content requirements in the Inflation Reduction Act. Those requirements will preference the company’s made in the U.S.A components, giving it a boost.In addition, Array Technologies’ business is booming. It reported record revenues of $515 million in its third quarter. That was a drastic improvement over the $188.6 million of revenues it posted year over year. The company is also reporting net income now after reporting losses in 2021. It’s difficult to find a serious issue that would indicate ARRY stock isn’t investment worthy. Stocks to Buy: Archer-Daniels-Midland (ADM)Tractor spraying pesticides on soybean field with sprayerSource: ShutterstockStory continuesArcher-Daniels-Midland (NYSE:ADM) stock is expected to have another exemplary year in 2023. At the moment, the consensus of the Wall Street analysts covering stock said it could trade at $101 within the next 12 to 18 months. Others suggest that it could run to $110 within a year. Investors should also note the company has paid a dividend without reduction since 1976. That dividend yields a modest 1.7% which increases overall returns.  Archer-Daniels-Midland sells oilseeds, corn, and wheat, and serves various end markets through its nutrition segment. It should continue to do well in 2023 as the war in Ukraine continues to disrupt global agriculture overall. That strong momentum is reflected in the company’s most recent earnings which include profits that increased by 55.9% during the period.Stocks to Buy: Kymera Therapeutics (KYMR)Biotechnology stocks, biomedical stocksSource: aslysun / Shutterstock.comKymera Therapeutics (NASDAQ:KYMR) is another hot stock to buy as we near 2023. The company’s pipeline of anti-inflammatory and oncology treatments continues to move toward commercialization. Better, analysts say the KYMR stock could more than double in the next 12 to 18 months, depending on the progress of its pipeline.  One of the primary reasons to remain optimistic about Kymera Therapeutics is that it sits at the forefront of the targeted protein degradation field. The company was founded around protein degradation which it believes can serve as a basis for an entire class of future drugs. The firm also believes it recently demonstrated, for the first time, a clinically significant impact of a protein degrader outside of oncology. The company also boasts a cohort of protein degraders within the oncology field. It will share relevant clinical data around those drugs in 2023 which, if positive, will serve to potentially double its price. Merck (MRK)medicine research, pharmaceutical background, LJPC stockSource: Sisacorn / Shutterstock.comMerck (NYSE:MRK) also makes our list of top stocks to buy for 2023. Most impressive, company sales increased 14% in its third quarter year over year. Further, through the first nine months of 2022, Merck’s sales jumped 29%, from $35.2 billion to $45.45 billion. MRK also carries a dividend yield of 2.63% at the moment, making it even more attractive.In addition, the MRK stock has a beta of 0.41. That means it is only 41% as volatile as the prevailing markets over the past 5 years. That should continue to be a strong point of attraction as a recession is expected beginning in late 2023. Two, it has a strong tailwind in that its immunotherapy has shown to be effective when taken in conjunction with Moderna’s (NASDAQ:MRNA) mRNA cancer vaccine. Advanced Micro Devices (AMD)Sign of AMD office in Markham, Ontario, Canada. Advanced Micro Devices, Inc. is an American multinational semiconductor company.Source: JHVEPhoto / Shutterstock.comAdvanced Micro Devices (NASDAQ:AMD) stock precipitously in 2022. It currently trades near $67 at the time of writing after being nearly halved.  Fed interest rates will probably stay around 5% throughout 2023. In addition, It is expected that AMD will see an annual 28% earnings increase over the next 3 to 5 years. Investors won’t ignore that forever. So money invested in AMD stock now is very likely to appreciate in value quickly. Analysts seem to like the AMD stock, too. UBS upgraded AMD to a buy rating, with a price target of $95 a share.  Baird analyst Tristan Gerra also just upgraded the AMD stock to outperform with a price target of $100, believing the company’s newest Genoa chips could widen the company’s competitive moat.“Genoa’s very significant performance step up should translate into an acceleration in market share gains for AMD in 2023, along with significantly higher pricing and a higher gross margin profile, reinforcing AMD’s EPYC performance leadership for years to come,” as noted by Yahoo Finance.Huntington Bancshares (HBAN)hands at desk near laptop computer, with one hand holding a pile of hundred dollar billsSource: shutterstock.com/CC7Huntington Bancshares (NASDAQ:HBAN) stock should continue to do well in New Year 2023.  The Ohio-based commercial and consumer bank increased its prime rate to 7.5% on Dec. 15. That is a very solid indication that it should continue to see rapidly growing interest income into 2023. Essentially, Huntington Bancshares will charge more interest to its customers and therefore receive a greater amount of interest income. The company had already raised its prime rate to 7% in Nov. What’s interesting is that all of the effects of those rising rates will be reflected in fourth quarter earnings. That follows an already strong third quarter earnings report in which interest income increased 11%, reaching $143 million. In short, investors can expect already strong revenues to get even stronger for the company. On top of that, Huntington Bancshares includes a dividend yielding 4.58% that can be used to increase gains through reinvestment. Perrigo (PRGO)Perrigo (NYSE:PRGO) is another one of the hot stocks to buy in 2023 . The company owns HRA Pharma which submitted an application for an over-the-counter (OTC) birth control pill back in July. That submission occurred just after the U.S. Supreme Court overturned Roe. v Wade. If its submission is successful, Perrigo will be the company with the first OTC birth control pill in the U.S. Perrigo is a French company that continues to grow. Sales reached $1.1 billion in the third quarter, up from $1.04 billion a year prior. Sales also increased 8.67% through the first nine months of 2022, reaching $3.296 billion. Yet, at the same time, Perrigo is facing increasing costs leading to higher operating expenses. That has resulted in increasing net losses through Q3 ‘22 that swelled from $78.5 million to $116.9 million. Losses should get better in 2023 as the effects of rate increases work through the economy. In any case, potential OTC approval makes Perrigo worth buying as we move into the new year.On the date of publication, Alex Sirois did not have (either directly or indirectly) any positions in the securities mentioned in this article. The opinions expressed in this article are those of the writer, subject to the InvestorPlace.com Publishing Guidelines.Alex Sirois is a freelance contributor to InvestorPlace whose personal stock investing style is focused on long-term, buy-and-hold, wealth-building stock picks.Having worked in several industries from e-commerce to translation to education and utilizing his MBA from George Washington University, he brings a diverse set of skills through which he filters his writing.More From InvestorPlaceBuy This $5 Stock BEFORE This Apple Project Goes LiveThe Best $1 Investment You Can Make TodayEarly Bitcoin Millionaire Reveals His Next Big Crypto Trade “On Air”It doesn’t matter if you have $500 or $5 million. Do this now.The post 7 Perfect Presents to Gift Your 2023 Stock PortfolioÂ  appeared first on InvestorPlace.]"
