,Id,Company,Date,Title,Publisher,Link,ProviderPublishTime,Type,Related Company,Text
44,16997692-5ea6-37e5-8c95-525fbb431f06,PM,2022-11-07,UPDATE 5-Philip Morris clinches Swedish Match after smoking out opposition,Reuters,https://finance.yahoo.com/news/5-philip-morris-clinches-swedish-064034775.html,1667803234,STORY,"['SWMAY', 'PM']","[*PMI needs 90% stake for compulsory buyout of minorities*PMI believes that target can eventually be reached*PMI says top 10 Swedish Match investors tendered shares(Adds detail, Breakingviews link)By Marie MannesNov 7 (Reuters) - Marlboro maker Philip Morris International (PMI) overcame some opposition to clinch 83% of Swedish Match, short of the 90% it wanted but enough to convince it to press on with a $16 billion deal that will cut its exposure to cigarettes.PMI had previously said it could drop its bid if it did not reach the 90% threshold at which it can start a compulsory purchase of remaining shares.The U.S. group said on Monday it believed that level could ultimately be achieved, and that Swedish Match's 10 largest shareholders had accepted its bid.That would mean activist investor Elliott Management, which had built a 10.5% stake in Swedish Match and opposed PMI's offer, had tendered its shares. Elliott declined to comment.""Our intention is still to take the company entirely private, so it is better for the (Swedish Match) shareholders if they tender their shares,"" PMI Chief Executive Jacek Olczak told Reuters.PMI said it had extended its offer, now unconditional, until Nov. 25 in the hope of further raising its stake, and Olczak said that could lead some index funds that have not already tendered their shares to do so, in addition to other holdoutsPMI made a 106 crowns per share offer to buy Swedish Match in May, and then raised it to 116 crowns per share in October after some investors said the initial price was too low.Buying Swedish Match, with its popular wet snuff ""snus"" products and tobacco-free nicotine ""ZYN"" pouches, will aid PMI in its stated ambition to move away from health-harming cigarettes and eventually become a smoke-free company.The deal will also help pave the way for PMI into the U.S. market, where Swedish Match has grown its business rapidly and where PMI is currently absent.Story continues""I see strong industrial logic in the combination and see Swedish Match being able to do things with PMI in both scenarios,"" Swedish Match CEO Lars Dahlgren said, referring to whether the company is delisted or remains listed with PMI as its majority shareholder.Asked about his future with the company, Dahlgren, who has been its CEO since 2008, said it remained to be seen since there was no formal agreement in place, but added he ""enjoyed working at Swedish Match"".Jefferies analysts said in a note to clients that to secure Elliott's approval, PMI could have potentially promised a special dividend or a seat on its board to the investor.According to Reuters calculations, Elliott stands to make a profit of over $100 million, or more than a 6.4% return, on its investment.PMI and Elliott declined to comment.John Hempton, co-founder of Sydney-based Bronte Capital, has also been against the deal, but said on Sunday he would tender his shares if Elliott had done the same.(Reporting by Marie Mannes Editing by Terje Solsvik and Mark Potter)]"
45,e8845032-cbe7-3b45-988c-c00953be7e54,PM,2022-11-07,Philip Morris clinches Swedish Match after smoking out opposition,Reuters,https://finance.yahoo.com/news/philip-morris-clinches-swedish-match-063556954.html,1667802956,STORY,"['PM', 'SWMAY']","[By Marie Mannes(Reuters) - Marlboro maker Philip Morris International (PMI) overcame some opposition to clinch 83% of Swedish Match, short of the 90% it wanted but enough to convince it to press on with a $16 billion deal that will cut its exposure to cigarettes.PMI had previously said it could drop its bid if it did not reach the 90% threshold at which it can start a compulsory purchase of remaining shares.The U.S. group said on Monday it believed that level could ultimately be achieved, and that Swedish Match's 10 largest shareholders had accepted its bid.That would mean activist investor Elliott Management, which had built a 10.5% stake in Swedish Match and opposed PMI's offer, had tendered its shares. Elliott declined to comment.""Our intention is still to take the company entirely private, so it is better for the (Swedish Match) shareholders if they tender their shares,"" PMI Chief Executive Jacek Olczak told Reuters.PMI said it had extended its offer, now unconditional, until Nov. 25 in the hope of further raising its stake, and Olczak said that could lead some index funds that have not already tendered their shares to do so, in addition to other holdoutsPMI made a 106 crowns per share offer to buy Swedish Match in May, and then raised it to 116 crowns per share in October after some investors said the initial price was too low.Buying Swedish Match, with its popular wet snuff ""snus"" products and tobacco-free nicotine ""ZYN"" pouches, will aid PMI in its stated ambition to move away from health-harming cigarettes and eventually become a smoke-free company.The deal will also help pave the way for PMI into the U.S. market, where Swedish Match has grown its business rapidly and where PMI is currently absent.""I see strong industrial logic in the combination and see Swedish Match being able to do things with PMI in both scenarios,"" Swedish Match CEO Lars Dahlgren said, referring to whether the company is delisted or remains listed with PMI as its majority shareholder.Story continuesAsked about his future with the company, Dahlgren, who has been its CEO since 2008, said it remained to be seen since there was no formal agreement in place, but added he ""enjoyed working at Swedish Match"".Jefferies analysts said in a note to clients that to secure Elliott's approval, PMI could have potentially promised a special dividend or a seat on its board to the investor.According to Reuters calculations, Elliott stands to make a profit of over $100 million, or more than a 6.4% return, on its investment.PMI and Elliott declined to comment.John Hempton, co-founder of Sydney-based Bronte Capital, has also been against the deal, but said on Sunday he would tender his shares if Elliott had done the same.GRAPHIC: Philip Morris takeover bid lights up Swedish Match shares (https://fingfx.thomsonreuters.com/gfx/mkt/zdpxdyemxpx/swedish.PNG)(Reporting by Marie Mannes Editing by Terje Solsvik and Mark Potter)]"
46,351c3e9b-d2b2-38ae-83bc-dc7763dee213,PM,2022-11-07,Elliott Said to Tender Shares to PMI’s Swedish Match Bid,Bloomberg,https://finance.yahoo.com/news/elliott-said-tender-shares-pmi-180814325.html,1667758094,STORY,['PM'],[]
47,5b770630-e40b-38bc-b6ce-08176ac1fb05,PM,2022-11-07,Investment expert Anthony Saglimbene says value stocks in these shockproof sectors could help protect your portfolio,TipRanks,https://finance.yahoo.com/news/investment-expert-anthony-saglimbene-says-161121222.html,1667751081,STORY,"['AMP', 'PM', 'CVS']","[Markets were volatile again last week, rocked by the Fed’s latest rate hike and the intention to keep rates high as it battles to curb inflation.For investors, the immediate result means trying to cope with an uncertain economic climate and an unpredictable market. Anthony Saglimbene, chief market strategist of the trillion-dollar asset manager Ameriprise, has cast his eye on the situation, and is ready with advice on how investors can succeed.First, Saglimbene believes that stocks have already priced in the strong chance of a recession next year, noting that the market is normally a leading indicator, by about five months. At the same time, he also believes that the near-term will offer solid opportunities for investors.“Typically, October, November, and December is the best three-month period for the market for the year. This is a typically strong period and after such a big drop in the market this year, it wouldn't surprise me if markets just rally through the rest of the year,” Saglimbene explained.Heading into 2023, however, Saglimbene sees valuations declining. In his view, a combination of high inflation and rising interest rates will put headwinds in the way of growth and profits. The proper course for investors, he says, is to move into value stocks in defensive sectors, such as healthcare and consumer staples sectors.We’ve followed that lead and found two stocks in the TipRanks database – one healthcare and one consumer staples – that could support Saglimbene’s thesis. So, let’s get into the details and see why they could make good additions to a portfolio right now.CVS Health Corporation (CVS)We’ll start in the healthcare sector, which Saglimbene has described as, “a better kind of tweener — it has some growth and has some defense,” and take a look at American healthcare giant CVS Health.The company provides pharmacy services, telehealth treatment, prescription coverage for chronic diseases, and health insurance products and related services. These are offered via several segments: Pharmacy Services, Retail or Long-Term Care, Health Care Benefits, and Corporate/Other. As of the end of last year, the company handled roughly 9,900 retail locations and 1,200 MinuteClinic spots, as well as LTC pharmacies, onsite pharmacies and online retail pharmacy websites. The fact this is an industry giant is evident from the employee count which numbers ~216,000.Story continuesIn a year in which stocks have been put through the wringer, CVS has mostly avoided the carnage. While the shares are down by 2% year-to-date, that is a far better look than the S&amp;P 500’s 21% decline.Strong earnings have helped support the stock and the company beat expectations when it reported Q3 results last week. Revenue rose by 10% year-over-year to of $81.2 billion, coming in $4.42 billion above the consensus estimate. On the bottom-line, adj. EPS of $2.09 beat the analysts’ $1.99 forecast. Even better, for the third time this year, the company raised its adj. EPS guidance for the full year from the range between $8.40 to $8.60 to between $8.55 to $8.65. Consensus had $8.55.Assessing the company’s prospects, J.P. Morgan’s Lisa Gill expects CVS to keep on delivering. The 5-star analyst writes, “We are positive on the company’s integrated healthcare model (retail pharmacy, PBM, health plan, specialty, retail clinics) and believe the company’s broad suite of services, strong clinical capabilities, and continuity of care across care settings position it well to benefit from changing market dynamics over the longer term, including new reimbursement models (the shift to value-based care) and the ‘retailization’ of healthcare. We view CVS as a partner of choice, which should lead to a greater share of spend across its various channels over time and positively contribute to overall enterprise profitability.”To this end, Gill has an Overweight (i.e., Buy) rating on the shares, backed by a $125 price target, suggesting 12-month upside of 25%. (To watch Gill’s track record, click here)None of Gill’s colleagues have an issue with her prognosis; the stock claims a unanimous 12 positive reviews which naturally all coalesce to a Strong Buy consensus rating. The forecast calls for one-year returns of 21%, considering the average price target stands at $120.08. (See CVS stock forecast on TipRanks)Philip Morris (PM)For the next stock on our list, we’ll look at Philip Morris, a leader in the tobacco industry. Its products are consumer staples – but it’s also the classic ‘sin stock,’ a defensive niche. This fits with Saglimbene’s comments on the sector: “Staples are really expensive, but I think tactically — which when we look at our window of time is six to 12 months — you want to be a little bit more defensive... Staples traditionally move higher when markets are coming down…” So let’s look under the hood of Philip Morris, and see just what defensive attributes it brings.To start with, the company has recognized the increasing social pressures against smoking, and how that will impact its chief product lines. Philip Morris is moving to adapt by shifting toward alternative products, especially those that are smokeless. These include vapes, heated tobacco lines, and even oral nicotine pouches. They are all marketed as safer, less smelly, and less intrusive than smoking – addressing many of the social issues against cigarettes – while at the same time helping customers to quit smoking – without losing them as customers.We can look at PM’s recent 3Q22 report to gauge how well the company is performing at these goals. For the third quarter, the adjusted EPS came in at $1.53, some distance ahead of the Street’s call for $1.36.Total revenue in Q3 was reported at $8.03 billion, higher than both Q1 and Q2 of this year – but slipping 1.1% y/y, although still coming in $730 million higher than the analysts’ prediction. The company finished the quarter with over $5.3 billion in cash, up from $4.5 billion in the year-ago period.Along with earnings, Philip Morris also announced that it had raised its quarterly dividend payment by 1.6%, or 2 cents, to $1.27 per share. This marked the third dividend increase in the last three years. At the new rate, the payment annualizes to $5.08 per common share and gives a yield of 5.7%. That yield is more than 2.5x higher than the market average, and about 2/3 the current rate of inflation. These attributes, combined with a 14-year history of reliable payments, make the dividend an attractive defensive feature for investors seeking to protect their portfolios.Philip Morris is part of Morgan Stanley analyst Pamela Kaufman’s coverage universe, and she takes a bullish stand on the stock. Kaufman is especially impressed by the company’s move into smokeless heated tobacco products, such as the upcoming new iQOS line. She writes, “[We] expect PM to launch IQOS in the US in spring 2024. PM's impending entry into the US offers an attractive growth opportunity as the US is one of the world's largest tobacco profit pools (~$20 billion in 2021), with ~31 million smokers. IQOS will benefit from PM's early mover advantage in the heat-not-burn (HNB) category in the US, its reduced risk tobacco product designation (MRTP) from the FDA, and PM's extensive marketing learnings from other markets. IQOS has a demonstrated track record of success across markets, generating $9 billion in revenue in 2021.”In-line with her outlook, Kaufman rates PM shares as Overweight (Buy), backed by a $109 price target to indicate the stock has room for 21% growth in the coming year. (To watch Kaufman’s track record, click here.)With 4 Buy ratings set recently, against 2 Holds, Philip Morris gets a Moderate Buy rating from the analyst consensus. The $105 average price target suggests a 17% one-year gain from the current trading price of $89.98. (See Philip Morris’ stock forecast at TipRanks.)To find good ideas for stocks trading at attractive valuations, visit TipRanks’ Best Stocks to Buy, a newly launched tool that unites all of TipRanks’ equity insights.Disclaimer: The opinions expressed in this article are solely those of the featured analysts. The content is intended to be used for informational purposes only. It is very important to do your own analysis before making any investment.]"
48,05966c43-9687-331f-a102-589d8c4e274c,PM,2022-11-07,PMI Wins Elliott’s Backing for Swedish Match Deal: FT,Bloomberg,https://finance.yahoo.com/news/pmi-wins-elliott-backing-swedish-123456986.html,1667738096,STORY,['PM'],[]
49,5c14815e-7e7c-382a-bea6-e1845e4081b4,PM,2022-11-07,Elliott backs Philip Morris's $16 billion Swedish Match takeover -FT,Reuters,https://finance.yahoo.com/news/elliott-backs-philip-morriss-16-115024827.html,1667735424,STORY,"['SWMAY', 'PM']","[(Reuters) -Activist investor Elliott Management Corp has decided to back Marlboro-maker Philip Morris International's (PMI) $16 billion offer for Swedish Match AB, the Financial Times reported on Sunday.Elliott has tendered its shares in the Swedish target, the FT said, bringing PMI closer to the 90% threshold required for forced redemption of remaining minority stakeholders.PMI's offer had received more than 80% shareholder acceptance at the latest count on Friday and more could be processed on Monday, the FT reported, citing sources familiar with the matter.The deadline for shareholders to tender shares expired on Friday at 1600 GMT.U.S. investor Elliott, PMI and Swedish Match declined to comment.Elliott has been building its stake in Swedish Match for months, reaching more than 10% in October. Bloomberg News reported in July, that Elliott was building a stake but was opposed to a PMI deal at the original offer of 106 Swedish crowns ($9.73) per share.PMI launched its bid for the maker of tobacco and oral nicotine products in May before raising the offer to 116 crowns last month after Swedish Match shares consistently traded above the original bid price.United States-based PMI does not currently trade in its home market, but Swedish Match has been expanding fast in America.Swedish Match controls about half the world's market for snus - a moist, smoke-free snuff - but one of its fastest-growing products is its tobacco-free “ZYN” nicotine pouches.($1 = 10.8952 Swedish crowns)(Reporting by Maria Ponnezhath in Bengaluru and Marie Mannes in GdanskEditing by David Goodman)]"
50,30ec1690-1d6b-34cd-bf3c-33f9396b5489,ROP,2022-11-07,Crystal Ball Dividend Hikes: Companies That Look Poised to Raise This Week,Investing.com,https://finance.yahoo.com/news/crystal-ball-dividend-hikes-companies-175047665.html,1667757047,STORY,"['DHI', 'ALV', 'ROP', 'TNL', 'AIZ', 'ADP']","[By Sarina IsaacsInvesting.com - Companies will often establish a pattern of hiking their dividends at the same time each year, giving their investors a reliable cash influx and enticing them to stay in the shares for the long term. With the help from StreetInsider data, we've put together a list of companies that look poised to raise their payouts in the next week, based on what they did this time last year. For up-to-the-minute dividend announcements, check out InvestingPro+.Patrick Industries (NASDAQ:PATK): Raised by 17.9% last year and currently has an annualized payout of $1.32, a yield of 2.9%, and a 8.75% payout ratio.Autoliv (NYSE:ALV): Raised by 3.2% last year and currently has an annualized payout of $2.56, a yield of 3.%, and a 58.38% payout ratio.DR Horton Inc (NYSE:DHI): Raised by 12.5% last year and currently has an annualized payout of $0.90, a yield of 1.2%, and a 5.6% payout ratio.GCM Grosvenor Inc (NASDAQ:GCMG): Raised by 11.1% last year and currently has an annualized payout of $0.40, a yield of 5%, and a 56.7% payout ratio.Assurant (NYSE:AIZ): Raised by 3% last year and currently has an annualized payout of $2.72, a yield of 2.2%, and a 44.7% payout ratio.Travel + Leisure Co (NYSE:TNL): Raised by 16.7% last year and currently has an annualized payout of $1.60, a yield of 4.4%, and a 35.7% payout ratio.Lancaster Colony (NASDAQ:LANC) Corp.: Raised by 6.7% last year and currently has an annualized payout of $3.20, a yield of 1.6%, and a 91.3% payout ratio.Automatic Data Processing Inc (NASDAQ:ADP): Raised by 11.8% last year and currently has an annualized payout of $4.16, a yield of 1.8%, and a 56.1% payout ratio.MDU Resources Group Inc (NYSE:MDU): Raised by 2.4% last year and currently has am annualized payout of $0.87, a yield of 3%, and a 52.2% payout ratio.Roper Technologies (NYSE:ROP): Raised by 10.2% last year and currently has an annualized payout of $2.48, a yield of 0.6%, and an 8.8% payout ratio.Story continuesRelated ArticlesCrystal Ball Dividend Hikes: Companies That Look Poised to Raise This WeekTwitter impersonators will be suspended permanently, Musk saysSapporo Holdings investor 3D writes to external directors seeking overhaul -Nikkei]"
51,9caff79f-cc83-3f3c-92e8-e3d6fed40663,GS,2022-11-07,"Here’s how much China stocks still could rally from zero-COVID, say Goldman Sachs strategists",MarketWatch,https://finance.yahoo.com/m/9caff79f-cc83-3f3c-92e8-e3d6fed40663/here%E2%80%99s-how-much-china-stocks.html,1667822340,STORY,['GS'],[]
52,a3a33b7e-d376-3584-a6c8-4d0ac01dd496,GS,2022-11-07,JPMorgan and Goldman Sachs in battle for British customer deposits,Financial Times,https://finance.yahoo.com/m/a3a33b7e-d376-3584-a6c8-4d0ac01dd496/jpmorgan-and-goldman-sachs-in.html,1667797217,STORY,['GS'],[]
53,7b628334-2309-3711-a64f-c13c5bbd3160,SLB,2022-11-07,Schlumberger-Backed Arabian Drilling Surges in Riyadh Debut,Bloomberg,https://finance.yahoo.com/news/schlumberger-backed-arabian-drilling-surges-070803190.html,1667804883,STORY,['SLB'],[]
