,Id,Company,Date,Title,Publisher,Link,ProviderPublishTime,Type,Related Company,Text
0,79848ab4-a07e-330f-8ca0-d7eb20060a20,SCHW,2022-11-07,Charles Schwab's (NYSE:SCHW) investors will be pleased with their notable 88% return over the last three years,Simply Wall St.,https://finance.yahoo.com/news/charles-schwabs-nyse-schw-investors-130043450.html,1667826043,STORY,['SCHW'],"[By buying an index fund, investors can approximate the average market return. But if you choose individual stocks with prowess, you can make superior returns. For example, the The Charles Schwab Corporation (NYSE:SCHW) share price is up 82% in the last three years, clearly besting the market return of around 20% (not including dividends).So let's assess the underlying fundamentals over the last 3 years and see if they've moved in lock-step with shareholder returns. See our latest analysis for Charles Schwab In his essay The Superinvestors of Graham-and-Doddsville Warren Buffett described how share prices do not always rationally reflect the value of a business. One way to examine how market sentiment has changed over time is to look at the interaction between a company's share price and its earnings per share (EPS).During three years of share price growth, Charles Schwab achieved compound earnings per share growth of 5.6% per year. This EPS growth is lower than the 22% average annual increase in the share price. So it's fair to assume the market has a higher opinion of the business than it did three years ago. That's not necessarily surprising considering the three-year track record of earnings growth.The image below shows how EPS has tracked over time (if you click on the image you can see greater detail).earnings-per-share-growthWe like that insiders have been buying shares in the last twelve months. Even so, future earnings will be far more important to whether current shareholders make money. Dive deeper into the earnings by checking this interactive graph of Charles Schwab's earnings, revenue and cash flow.What About Dividends?As well as measuring the share price return, investors should also consider the total shareholder return (TSR). Whereas the share price return only reflects the change in the share price, the TSR includes the value of dividends (assuming they were reinvested) and the benefit of any discounted capital raising or spin-off. It's fair to say that the TSR gives a more complete picture for stocks that pay a dividend. We note that for Charles Schwab the TSR over the last 3 years was 88%, which is better than the share price return mentioned above. And there's no prize for guessing that the dividend payments largely explain the divergence!Story continuesA Different PerspectiveWhile it's never nice to take a loss, Charles Schwab shareholders can take comfort that , including dividends,their trailing twelve month loss of 1.6% wasn't as bad as the market loss of around 25%. Of course, the long term returns are far more important and the good news is that over five years, the stock has returned 14% for each year. It could be that the business is just facing some short term problems, but shareholders should keep a close eye on the fundamentals. It's always interesting to track share price performance over the longer term. But to understand Charles Schwab better, we need to consider many other factors. Case in point: We've spotted   2 warning signs for Charles Schwab  you should be aware of.There are plenty of other companies that have insiders buying up shares. You probably do not want to miss this free list of growing companies that insiders are buying.Please note, the market returns quoted in this article reflect the market weighted average returns of stocks that currently trade on US exchanges.Have feedback on this article? Concerned about the content? Get in touch with us directly. Alternatively, email editorial-team (at) simplywallst.com.This article by Simply Wall St is general in nature. We provide commentary based on historical data and analyst forecasts only using an unbiased methodology and our articles are not intended to be financial advice. It does not constitute a recommendation to buy or sell any stock, and does not take account of your objectives, or your financial situation. We aim to bring you long-term focused analysis driven by fundamental data. Note that our analysis may not factor in the latest price-sensitive company announcements or qualitative material. Simply Wall St has no position in any stocks mentioned.Join A Paid User Research SessionYou’ll receive a US$30 Amazon Gift card for 1 hour of your time while helping us build better investing tools for the individual investors like yourself. Sign up here]"
1,484b7b83-c521-314d-a6e7-5305f1153c70,TXN,2022-11-07,15 Biggest IT Companies in the World,Insider Monkey,https://finance.yahoo.com/news/15-biggest-companies-world-212847409.html,1667770127,STORY,"['NVDA', 'TMUS', '^GSPC', 'TXN', 'ORCL', 'AVGO', 'VZ', 'ACN', 'CSCO']","[In this article, we will take a look at 15 of the biggest IT companies in the world. If you want to see more of the biggest IT companies in the world, go directly to 5 Biggest IT Companies in the World.According to market research firm Gartner, Information Technology or IT, ""is the common term for the entire spectrum of technologies for information processing, including software, hardware, communications technologies and related services.""Given the growth in the computer, smartphone, and internet industry over the past three decades, the IT sector is the biggest sector in the market today. In terms of one of the most popular ETFs that track the S&amp;P 500, the Vanguard S&amp;P 500 ETF (VOO), the IT sector is largest sector by ETF weight with the sector accounting for 26.4% of the ETF as of 9/30/22. That compares to 15.1% in the healthcare sector and 11.7% in the consumer discretionary for the ETF, which are the second and third heaviest weight sectors.Many of the world's largest companies are also IT companies. Microsoft, for example makes software for computers to process information while Apple make smartphone hardware and software.IT Sector GrowthIn the last three decades, the IT sector has benefited from Moore's Law and the emergence of the internet. With Moore's law, semiconductors have become cheaper and smaller over time, allowing more people to afford computers and smartphones. With the emergence of the internet, more websites/apps have reached the scale needed to produce useful services for people with computers and smartphones. With more services, the internet, computers, and smartphones become more useful.Given the cycle, computer hardware companies have benefited from more demand and computer software companies have benefited from more potential customers. Similarly, smartphone companies have sold a lot more smartphones and internet/app companies have benefited from having more potential users.Although Moore's law was just a rule of thumb and is no longer possible due to physics, computers and smartphones are now cheap enough that most of the world can afford them. With future economic growth, potential subsidies, and satellite internet, it may be possible for anyone in the world to afford a computing device and connect to the internet if they choose to a decade or two from now.Story continuesIn addition to more users that could fuel more growth in the IT sector, the sector could also benefit from the emergence of new technologies.McKinsey writes, ""The emergence of cloud and 5G, for example, exponentially increases compute power and network speeds that can enable greater innovation. Developments in the metaverse of augmented and virtual reality open the doors to virtual R&amp;D via digital twins, for example, and immersive learning. Advances in AI, machine learning, and software 2.0 (machine-written code) bring a range of new services and products, from autonomous vehicles to connected homes, well within reach.""2022Given high inflation, the Federal Reserve has increased interest rates six times in 2022 alone. As a result, the federal funds rate is now 3.75% to 4%, which is considered by many economists as 'restrictive' that could slow economic growth.Given that many analysts think the U.S central bank will raise rates further, the potential for a recession has increased substantially.Given the uncertainty, tech stocks have declined substantially and it could be a good idea for long term investors to own a well diversified portfolio of stocks across many different sectors.Trump International Hotel &amp; Tower, New York Citybenjamin-suter-Issa_lRkr0o-unsplashMethodologyFor our list of 15 Biggest IT Companies in the World, we took the 15 largest companies by market capitalization in the IT sector from the S&amp;P 500 as of 11/5.15 Biggest IT Companies in the World15. salesforce.com, inc. (NYSE:CRM)Market Capitalization as of 11/5: $136.97 billionNumber of Hedge Fund Holders: 116Salesforce.com, inc. (NYSE:CRM) is a leading cloud company that offers an enterprise platform for IT. With salesforce.com, inc. (NYSE:CRM)'s software, companies could potentially grow relationships with customers, and teams could work better with better team communication and productivity. Given the growth in the cloud in the last decade, salesforce.com, inc. (NYSE:CRM) has grown into one of the largest IT companies in the world given its market capitalization of almost $137 billion as of 11/5.14. Texas Instruments Incorporated (NASDAQ:TXN)Market Capitalization as of 11/5: $143.41 billionNumber of Hedge Fund Holders: 55Texas Instruments Incorporated (NASDAQ:TXN) is one of the leading semiconductor companies in the world. Throughout its history, the company has helped the world transition from vacuum tubes to transistors to integrated circuits. For the future, Texas Instruments Incorporated (NASDAQ:TXN) has been focused on producing semiconductors for sectors such as the industrial and automotive markets that could help make electronics even more useful. Given its growth, Texas Instruments Incorporated (NASDAQ:TXN) ranks #14 on our list of 15 Biggest IT Companies in the World with a market capitalization of $143.41 billion.13. Verizon Communications Inc. (NYSE:VZ)Market Capitalization as of 11/5: $150.21 billionNumber of Hedge Fund Holders: 58Verizon Communications Inc. (NYSE:VZ) is a leading telecom in the United States. With Verizon Communications Inc. (NYSE:VZ)'s cellphone and 5G service, tens of millions of people every day access the internet through the company's network. In addition to wireless networks, Verizon Communications Inc. (NYSE:VZ) also offers broadband and fiber that also help individuals and businesses connect and potentially be more productive. As of 11/5, Verizon Communications Inc. (NYSE:VZ) has a market capitalization of slightly over $150 billion.12. Accenture Plc (NYSE:ACN)Market Capitalization as of 11/5: $168.22 billionNumber of Hedge Fund Holders: 61Accenture Plc (NYSE:ACN) is a professional service company that offers strategy and consulting to the IT industry. Given its past growth, Accenture Plc (NYSE:ACN) is one of the largest consulting firms in the world with a market capitalization of over $168 billion as of 11/5 and 721,000 employees serving clients in over 120 countries. For FY22, Accenture Plc (NYSE:ACN) also generated $61.6 billion in revenue and $10.71 in EPS.11. T-Mobile US, Inc. (NYSE:TMUS)Market Capitalization as of 11/5: $173.82 billionNumber of Hedge Fund Holders: 96T-Mobile US, Inc. (NYSE:TMUS) is a leading telecom in the United States that provides cell phone and internet services to tens of millions of Americans. For the third quarter of 2022, T-Mobile US, Inc. (NYSE:TMUS) had service revenues of $15.4 billion, up 4% year over year and free cash flow of $2.1 billion, up 32% year over year. Given its businesses, T-Mobile US, Inc. (NYSE:TMUS) has a market capitalization of $173.82 billion as of 11/5.10. Cisco Systems, Inc. (NASDAQ:CSCO)Market Capitalization as of 11/5: $177.91 billionNumber of Hedge Fund Holders: 63Cisco Systems, Inc. (NASDAQ:CSCO) is a leading manufacturer of computer networking products with a market capitalization of $177.91 billion as of 11/5. Given the large market size for computer networking equipment, Cisco Systems, Inc. (NASDAQ:CSCO) is a huge company. For fiscal 2022, Cisco Systems, Inc. (NASDAQ:CSCO) reported revenue of $51.6 billion and adjusted EPS of $3.36, up 3% year over year and up 4% year over year, respectively.9. Broadcom Inc. (NASDAQ:AVGO)Market Capitalization as of 11/5: $190.2 billionNumber of Hedge Fund Holders: 66Broadcom Inc. (NASDAQ:AVGO) is a leading semiconductor maker whose products are used for the data center, networking, and other IT sectors. Having expanded substantially in the past due to M&amp;A, Broadcom Inc. (NASDAQ:AVGO) is one of the most valuable semiconductor companies in the world with a market capitalization of $190.2 billion as of 11/5. Broadcom Inc. (NASDAQ:AVGO) is currently in the process of buying cloud computing company Vmware, pending regulatory approval, to help diversify its business.8. Oracle Corporation (NASDAQ:ORCL)Market Capitalization as of 11/5: $199.05 billionNumber of Hedge Fund Holders: 69Oracle Corporation (NASDAQ:ORCL) is a leading database and enterprise software company with a market capitalization of $199.05 billion as of 11/5. In the past decade, Oracle Corporation (NASDAQ:ORCL) has tried to expand in the cloud market with M&amp;A and the strategy has worked out so far given that the company's stock has more than doubled from 10 years ago. With more valuable stock, Oracle Corporation (NASDAQ:ORCL) could potentially do more acquisitions in the future that could expand its sales.7. Meta Platforms, Inc. (NASDAQ:META)Market Capitalization as of 11/5: $240.9 billionNumber of Hedge Fund Holders: 184Meta Platforms, Inc. (NASDAQ:META) is a leading social media giant with around 3.71 billion monthly users across its portfolio of apps such as Facebook, Instagram, and WhatsApp. In 2022, shares of Meta Platforms, Inc. (NASDAQ:META) have fallen 73% year to date given the company's substantial spending on the metaverse. Nevertheless, Meta Platforms, Inc. (NASDAQ:META) is still one of the largest companies in the world with a market capitalization of $240.9 billion as of 11/5.6. NVIDIA Corporation (NASDAQ:NVDA)Market Capitalization as of 11/5: $335.72 billionNumber of Hedge Fund Holders: 84NVIDIA Corporation (NASDAQ:NVDA) is a leading semiconductor maker of GPUs which are in some ways better than CPUs for some AI and machine learning processing. Given its growth potential, NVIDIA Corporation (NASDAQ:NVDA) has a market capitalization of $335.72 billion as of 11/5. Baron Funds commented on NVIDIA Corporation (NASDAQ:NVDA) in a Q3 2022 investor letter, NVIDIA Corporation (NASDAQ:NVDA) is a fabless semiconductor company and a leader in gaming and accelerated computing. NVIDIA is powering the growth of AI from the data center to the edge. Shares detracted due to inventory right sizing in NVIDIA’s gaming segment coupled with the broader market sell-off in growth stocks. Given NVIDIA’s end-to-end AI platform and its leading market share in gaming, data centers, and autonomous machines, along with the size of these markets, we believe the company can sustain its growth trajectory. Click to continue reading and see 5 Biggest IT Companies in the World.Suggested articles:22 Biggest Economies in the World in 202215 Largest IPOs of All Time Worldwide15 Biggest Global Tech Companies by Market CapDisclosure: None. 15 Biggest IT Companies in the World is originally published on Insider Monkey.]"
