,Id,Company,Date,Title,Publisher,Link,ProviderPublishTime,Type,Related Company,Text
20,52da053c-1097-34ec-9f39-a51cb3280a04,QCOM,2022-11-06,7 Nasdaq Stocks Set to Soar From 52-Week Lows,InvestorPlace,https://finance.yahoo.com/news/7-nasdaq-stocks-set-soar-170228885.html,1667581348,STORY,"['COMP', 'CME', 'DIS', 'RILYP', 'POOL', 'QCOM', 'SSRM', 'SBGI']","[Nasdaq stocks have been some of the hardest hit during the market downturn. In fact, over the last 12 months, the Nasdaq Composite Index has dropped more than 35%. This isn’t surprising, given the more growth-oriented nature of stocks listed on this exchange. Growth stocks are far more sensitive to interest rate increases, hence these types of stocks have been more greatly affected by the steep rise in interest rates this year.In addition, as the Federal Reserve continues to hike rates, in its efforts to bring inflation under control, Nasdaq-listed equities may be in for further volatility. However, while that suggests holding off on popular tech and other growth names listed on the exchange, there are some Nasdaq Composite components you may want to consider.For example, these seven Nasdaq stocks, all of which currently trade within 10% of their respective 52-week lows. Already pushed to favorable valuations, each one could be in for a rebound, even if an overall Nasdaq rebound takes time to happen.InvestorPlace - Stock Market News, Stock Advice &amp; Trading TipsCMECME Group$170.44FOXFox. Corp.$27.58POOLPool Corp.$287.84QCOMQualcomm$105.97RILYB. Riley Financial$43.28SBGISinclair Broadcast Group$16.88SSRMSSR Mining$13.80CME Group (CME)Nasdaq 100 stocks: the Nasdaq building lit up at nightSource: ShutterstockCME Group (NASDAQ:CME) is the world’s largest commodities futures exchange operators.Despite strengths like high margins and a deep economic moat, CME stock has been knocked lower during the market downturn. The stock is down over 21% since last Nov. So, as one of the Nasdaq stocks hitting a new 52-week low, what makes it a buy today? It’s possible that the market is overreacting to the prospect of a slowdown in trading volume on CME’s exchange, after the big run-up in commodities following Russia’s invasion of Ukraine.The CME continues to exceed expectations in terms of trading volume, revenue, and earnings. This may mean shares, trading for a reasonable 20.96 times forward earnings, are oversold. CME stock also sports a 2.31% forward dividend yield, with an 11-year track record of dividend growth.Story continuesFox Corporation (FOX)Businessman is drawing a growing virtual hologram stock bar chart on dark blue background representing value stocksSource: Costello77 / ShutterstockConsisting of the media properties not included in 21st Century Fox’s sale to Disney (NYSE:DIS), Fox Corporation (NASDAQ:FOX) delivered middling returns since it debuted as a separate, publicly-traded company in 2019.FOX stock has been under even more pressure recently, due to another possible merger move. That is, the Murdoch family is looking to re-merge Fox with News Corp (NASDAQ:NWS). News Corp, spun off of Fox’s former parent company in 2013, consists of print media properties such as The Wall Street Journal.But while the market today isn’t too keen on the proposed deal, this deal could ultimately pay off for FOX stock investors. Mostly, through cost synergies stemming from consolidating the news operations of both entities. These cost savings, plus continued growth of Fox’s video streaming business (Tubi TV), could help this cheap stock (trading for only 8.14 times earnings) make a comeback.Pool Corp. (POOL)Yellow pool float, ring floating in a refreshing blue swimming poolSource: ShutterstockPool Corp. (NASDAQ:POOL) is a distributor of swimming pool chemicals, equipment, and supplies. Although operating results continue to exceed expectations, it is Pool’s future that’s weighing on the minds of investors. For example, concerns about the impact of a recession has pushed the POOL stock to a new 52-week low. Yet while the sell-side expects Pool Corporation’s earnings to decline in 2023, you may want to “buy the dip,” as it were.That’s because the POOL stock could continue to be a long-term winner. As InvestorPlace’s Will Ashworth argued last month, Pool’s business may be more resilient than the market currently believes. This may enable the stock to remain a top-performing S&amp;P 500 component. Pool shares are also a great dividend growth play. Although the current dividend yield (1.31%) is low, payouts have grown by an average of 21.5% over the past five years.Qualcomm (QCOM)a big pile of smartphonesSource: ShutterstockUnderwhelming guidance pushed Qualcomm (NASDAQ:QCOM) to a new multi year low. Shares in the mobile chip maker now trade at their lowest prices in more than two years. There’s now high uncertainty regarding results in the coming quarters, as the global economic slowdown affects mobile chip demand.At first glance, this news, and the subsequent reaction, may signal that it’s best to steer clear of QCOM stock. However, based on the latest sell-side analyst ratings, the prospect of what Qualcomm CEO Cristiano Amon is calling a “temporary cyclical inventory drawdown” isn’t a reason to stay away.Analysts from Canaccord Genuity, Piper Sandler, and KeyBanc have all maintained “buy” or equivalent ratings on QCOM. Although they’ve each slashed their respective price targets,  each of these targets are well above QCOM’s current highly-discounted (10 times earnings) valuation.B. Riley Financial (RILY)A person holds a phone with a stock chart visible on it with another chart visible on a computer nearby.Source: Bro Crock / Shutterstock.comThe market downturn pushed investment bank B. Riley Financial’s (NASDAQ:RILY) shares down nearly 50% in the past year. A bear market could continue to affect the firm’s operating performance. However, while the market bails out of the stock, B. Riley’s management is seizing the opportunity.As InvestorPlace’s Thomas Yeung pointed out last month, insiders such as founder Bryant Riley are making big purchases of RILY stock. The firm itself has announced plans to buy back up to $50 million in shares over the next year. In hindsight, this snapping up of shares could prove to be a shrewd move.After getting through today’s rough patch, RILY could make a big recovery. Better yet, one can buy this stock today, and get paid to wait for said comeback. RILY currently pays out $4 per share in dividends, making this one of the high-yield (10%) Nasdaq stocks.Sinclair Broadcast Group (SBGI)graphs and stock charts are superimposed on a stock image of a businessmanSource: ShutterstockSinclair Broadcast Group (NASDAQ:SBGI) is one of largest owners of broadcast television stations in the U.S., owning and/or operating 185 TV stations in 86 media markets. The company also owns several “diginets,” or digital broadcast subchannels, as well as a 50% interest in a joint venture that operates regional sports channels under the Bally Sports brand.Negative sentiment, made worse by a recent downgrade from Wells Fargo analyst Steven Cahall, has pushed SBGI stock to a new 52-week low. Cahall’s bearishness is based largely on an expected drop in net retransmission revenue from cable operators.Yet based on Sinclair’s Oct. 2022 investor presentation, factors such as increased political advertising on its stations could make up for this. Also, like peer Nexstar Media Group (NASDAQ:NXST), the launch of NEXTGEN TV, aka ATSC 3.0, could open new opportunities for Sinclair to further monetize its broadcast spectrum assets.SSR Mining (SSRM)Mining cart in a silver, copper, and gold mine representing VOXR Stock.Source: TTstudio / ShutterstockSSR Mining (NASDAQ:SSRM) mines for gold, silver, copper, lead, and zinc at projects located in the U.S., Canada, Argentina, and Turkey.Trading at a reasonable 13.4 times forward earnings, the SSRM stock may be a great way to add precious metals exposure to your portfolio. Even as precious metal prices remain in a slump, silver and gold prices could start to bounce back, once the Fed ends its current tightening cycle. If the Fed pivots, and cuts rates down the road, precious metals could zoom higher.Also, as a Seeking Alpha contributor argued last month, the resumption of operations at its Çöpler gold mine in Turkey points to stronger results going forward. With all this in mind, consider snapping up SSRM, while it remains one of the Nasdaq stocks near its 52-week low.On the date of publication, Thomas Niel did not hold (either directly or indirectly) any positions in the securities mentioned in this article. The opinions expressed in this article are those of the writer, subject to the InvestorPlace.com Publishing Guidelines.More From InvestorPlaceBuy This $5 Stock BEFORE This Apple Project Goes LiveThe Best $1 Investment You Can Make TodayEarly Bitcoin Millionaire Reveals His Next Big Crypto Trade “On Air”It doesn’t matter if you have $500 or $5 million. Do this now.The post 7 Nasdaq Stocks Set to Soar From 52-Week Lows appeared first on InvestorPlace.]"
21,24b3e7c8-1411-31c3-a308-bb825947ef7d,JNJ,2022-11-06,"Johnson & Johnson's Big Purchase, Amazon's New Moves, and More",Motley Fool,https://finance.yahoo.com/m/24b3e7c8-1411-31c3-a308-bb825947ef7d/johnson-%26-johnson%27s-big.html,1667659500,STORY,"['JNJ', 'AMZN', 'ABMD', 'DIS']","[Why he believes Abiomed is worth a ""shock and awe"" price. How Abiomed will strengthen Johnson &amp; Johnson's medical device portfolio. Also, Motley Fool host Alison Southwick and Motley Fool personal finance expert Robert Brokamp discuss how shortcuts can make you a smarter saver.Continue reading]"
22,eb92a8a7-f451-3f39-97f0-811ef032a40f,JNJ,2022-11-06,3 No-Brainer Dividend Stocks to Buy in November,Motley Fool,https://finance.yahoo.com/m/eb92a8a7-f451-3f39-97f0-811ef032a40f/3-no-brainer-dividend-stocks.html,1667655060,STORY,"['GILD', 'ABBV', 'JNJ']","[Here's why they chose AbbVie (NYSE: ABBV), Gilead Sciences (NASDAQ: GILD), and Johnson &amp; Johnson (NYSE: JNJ). This FUD relates to concerns about how the impending loss of exclusivity (LOE) in the U.S. for Humira will impact AbbVie. The blockbuster drug generated more than 37% of the company's total sales in the third quarter.Continue reading]"
23,10a515e3-4e5a-3503-8feb-96bb9456aed2,MDT,2022-11-06,Investors in Medtronic (NYSE:MDT) have unfortunately lost 29% over the last year,Simply Wall St.,https://finance.yahoo.com/news/investors-medtronic-nyse-mdt-unfortunately-110037379.html,1667732437,STORY,['MDT'],"[Investors can earn very close to the average market return by buying an index fund. In contrast individual stocks will provide a wide range of possible returns, and may fall short. That's what happened in the case of Medtronic plc (NYSE:MDT): its share price dropped 31% while the market declined 25%. Longer term shareholders haven't suffered as badly, since the stock is down a comparatively less painful 21% in three years.So let's have a look and see if the longer term performance of the company has been in line with the underlying business' progress. Check out our latest analysis for Medtronic In his essay The Superinvestors of Graham-and-Doddsville Warren Buffett described how share prices do not always rationally reflect the value of a business. By comparing earnings per share (EPS) and share price changes over time, we can get a feel for how investor attitudes to a company have morphed over time.During the unfortunate twelve months during which the Medtronic share price fell, it actually saw its earnings per share (EPS) improve by 35%. It could be that the share price was previously over-hyped.It's surprising to see the share price fall so much, despite the improved EPS. So it's easy to justify a look at some other metrics.Revenue was pretty flat on last year, which isn't too bad. However, it is certainly possible the market was expecting an uptick in revenue, and that the share price fall reflects that disappointment.The graphic below depicts how earnings and revenue have changed over time (unveil the exact values by clicking on the image).earnings-and-revenue-growthWe like that insiders have been buying shares in the last twelve months. Even so, future earnings will be far more important to whether current shareholders make money. So we recommend checking out this free report showing consensus forecastsA Different PerspectiveWhile the broader market lost about 25% in the twelve months, Medtronic shareholders did even worse, losing 29% (even including dividends). However, it could simply be that the share price has been impacted by broader market jitters. It might be worth keeping an eye on the fundamentals, in case there's a good opportunity. Longer term investors wouldn't be so upset, since they would have made 4%, each year, over five years. If the fundamental data continues to indicate long term sustainable growth, the current sell-off could be an opportunity worth considering. Investors who like to make money usually check up on insider purchases, such as the price paid, and total amount bought. You can find out about the insider purchases of Medtronic by clicking this link.Story continuesMedtronic is not the only stock that insiders are buying. For those who like to find winning investments this free list of growing companies with recent insider purchasing, could be just the ticket.Please note, the market returns quoted in this article reflect the market weighted average returns of stocks that currently trade on US exchanges.Have feedback on this article? Concerned about the content? Get in touch with us directly. Alternatively, email editorial-team (at) simplywallst.com.This article by Simply Wall St is general in nature. We provide commentary based on historical data and analyst forecasts only using an unbiased methodology and our articles are not intended to be financial advice. It does not constitute a recommendation to buy or sell any stock, and does not take account of your objectives, or your financial situation. We aim to bring you long-term focused analysis driven by fundamental data. Note that our analysis may not factor in the latest price-sensitive company announcements or qualitative material. Simply Wall St has no position in any stocks mentioned.Join A Paid User Research SessionYou’ll receive a US$30 Amazon Gift card for 1 hour of your time while helping us build better investing tools for the individual investors like yourself. Sign up here]"
24,a863777e-a13f-395f-a04e-590c187d1687,ROK,2022-11-06,"Income Investors Should Know That Rockwell Automation, Inc. (NYSE:ROK) Goes Ex-Dividend Soon",Simply Wall St.,https://finance.yahoo.com/news/income-investors-know-rockwell-automation-120207471.html,1667736127,STORY,['ROK'],"[Rockwell Automation, Inc. (NYSE:ROK) stock is about to trade ex-dividend in three days. Typically, the ex-dividend date is one business day before the record date which is the date on which a company determines the shareholders eligible to receive a dividend. It is important to be aware of the ex-dividend date because any trade on the stock needs to have been settled on or before the record date. Meaning, you will need to purchase Rockwell Automation's shares before the 10th of November to receive the dividend, which will be paid on the 12th of December.The company's next dividend payment will be US$1.18 per share, and in the last 12 months, the company paid a total of US$4.72 per share. Looking at the last 12 months of distributions, Rockwell Automation has a trailing yield of approximately 1.9% on its current stock price of $247.43. Dividends are an important source of income to many shareholders, but the health of the business is crucial to maintaining those dividends. We need to see whether the dividend is covered by earnings and if it's growing. See our latest analysis for Rockwell Automation Dividends are typically paid from company earnings. If a company pays more in dividends than it earned in profit, then the dividend could be unsustainable. Rockwell Automation paid out 56% of its earnings to investors last year, a normal payout level for most businesses. That said, even highly profitable companies sometimes might not generate enough cash to pay the dividend, which is why we should always check if the dividend is covered by cash flow. It paid out 76% of its free cash flow as dividends, which is within usual limits but will limit the company's ability to lift the dividend if there's no growth.It's encouraging to see that the dividend is covered by both profit and cash flow. This generally suggests the dividend is sustainable, as long as earnings don't drop precipitously.Click here to see the company's payout ratio, plus analyst estimates of its future dividends.Story continueshistoric-dividendHave Earnings And Dividends Been Growing?Businesses with strong growth prospects usually make the best dividend payers, because it's easier to grow dividends when earnings per share are improving. If earnings fall far enough, the company could be forced to cut its dividend. This is why it's a relief to see Rockwell Automation earnings per share are up 4.7% per annum over the last five years. A payout ratio of 56% looks like a tacit signal from management that reinvestment opportunities in the business are low. In line with limited earnings growth in recent years, this is not the most appealing combination.The main way most investors will assess a company's dividend prospects is by checking the historical rate of dividend growth. Since the start of our data, 10 years ago, Rockwell Automation has lifted its dividend by approximately 11% a year on average. We're glad to see dividends rising alongside earnings over a number of years, which may be a sign the company intends to share the growth with shareholders.Final TakeawayIs Rockwell Automation worth buying for its dividend? Earnings per share have been growing modestly and Rockwell Automation paid out a bit over half of its earnings and free cash flow last year. Overall, it's hard to get excited about Rockwell Automation from a dividend perspective.So if you want to do more digging on Rockwell Automation, you'll find it worthwhile knowing the risks that this stock faces. In terms of investment risks, we've identified 2 warning signs with Rockwell Automation and understanding them should be part of your investment process.If you're in the market for strong dividend payers, we recommend checking our selection of top dividend stocks.Have feedback on this article? Concerned about the content? Get in touch with us directly. Alternatively, email editorial-team (at) simplywallst.com.This article by Simply Wall St is general in nature. We provide commentary based on historical data and analyst forecasts only using an unbiased methodology and our articles are not intended to be financial advice. It does not constitute a recommendation to buy or sell any stock, and does not take account of your objectives, or your financial situation. We aim to bring you long-term focused analysis driven by fundamental data. Note that our analysis may not factor in the latest price-sensitive company announcements or qualitative material. Simply Wall St has no position in any stocks mentioned.Join A Paid User Research SessionYou’ll receive a US$30 Amazon Gift card for 1 hour of your time while helping us build better investing tools for the individual investors like yourself. Sign up here]"
25,86d60f84-e8bc-3575-88e5-e0566bd417e3,BA,2022-11-06,UPDATE 2-China 'reheats' $17 bln Airbus deals during Scholz visit,Reuters,https://finance.yahoo.com/news/2-china-reheats-17-bln-102519119.html,1667557519,STORY,"['AIR.PA', 'EADSY', 'BA']","[(Recasts, adds details, quotes)By Albee Zhang, Tim Hepher and Eduardo BaptistaBEIJING/PARIS, Nov 4 (Reuters) - China on Friday formally announced existing deals for Airbus jets worth $17 billion, in what experts described as an effort to showcase a visit by German Chancellor Olaf Scholz that caught the European planemaker and China-watchers off guard.China's state buying agency CASC said it had signed a bulk agreement for 140 Airbus aircraft including 132 A320-family jets and eight A350 wide-body aircraft during Scholz's one-day visit.However, the timing triggered speculation as an Airbus spokesperson said it covered deals already on its books including part of a 292-jet deal in July, and an industry source familiar with the matter said the A350 deal went back to 2019.""China's modus operandi is to announce business deals commensurate with the importance of the guest,"" said Noah Barkin, managing editor with research firm Rhodium Group's China practice and an expert in German-Chinese relations.""Germany was not keen to make this about deals. So the Chinese side appears to have reheated an old deal and announced it on their own.""CASC did not immediately respond to a request for comment.The announcement comes as Beijing is widely seen as keen to show concrete achievements from the visit, which has stirred concerns in Germany that Berlin will prioritise economic ties with Beijing over security and strategic matters.China is Germany's biggest trading partner and Scholz decided to take a large business delegation with him to the dismay of China hawks in the West.In the face of growing criticism, a German official said ahead of the visit no deals would be signed during it.Scholz told journalists in Beijing late on Friday he had campaigned for a level playing field for European and Chinese companies during his trip, but did not mention an Airbus deal.'DIPLOMATIC SIGNALS'Experts said the discrepancy between the narrative from Beijing and the reaction in Europe highlighted the importance of the Scholz visit in the eyes of the Chinese leadership.Story continuesThe German Chancellor's in-person meeting with Xi marked the end of a three-year period where Xi did not interact face-to-face with any leader of a G7 nation.The aircraft announcement also marked an apparent signal to the United States where Boeing remains largely frozen out of the Chinese market after several years of trade tensions.China's ""Big Three"" state airlines in July pledged to buy a total of 292 Airbus jets, making it the biggest order at the time by Chinese carriers for several years and a breakthrough for Europe.Airbus officially booked the deal in August.Boeing acknowledged on Wednesday it may have to do without the world's largest import market as it strives to raise output and reach delivery targets in the wake of a safety crisis.""China has long used jet deals to send diplomatic signals, rewards friendships and punish critics,"" said a veteran Western watcher of China's aviation industry, asking not to be named.Friday's announcement covered 132 out of the 292 single-aisle jets purchased from Airbus earlier this year.Industry sources said that amounted to a carrot for remaining orders to receive the same fanfare during any future trip by French President Emmanuel Macron. Airbus is part-owned by France and Germany and a symbol of European economic ties.A visit by Macron to Beijing around the time of the G20 in Bali in November has been under consideration, sources have told Reuters, but no official plan has been announced yet.French and German government sources told Reuters Macron had suggested to Scholz they go to Beijing together to send a signal of EU unity to Xi and counter what they see as Chinese attempts to play one country against another, but Scholz declined. (Additional reporting by Brenda Goh, Andreas Rinke, Sarah Marsh and Michel Rose; Writing by Tim Hepher; editing by David Evans)]"
