,Id,Company,Date,Title,Publisher,Link,ProviderPublishTime,Type,Related Company,Text
30,a91e8521-64fd-3f0e-abe4-9e2fe9a2044e,MNST,2023-07-03,3 High-Flying Stocks Set to Soar Even Higher,InvestorPlace,https://finance.yahoo.com/news/3-high-flying-stocks-set-190826213.html,1687806506,STORY,"['MNST', 'LIN', 'DRI']","[According to Finviz.com yesterday, 119 S&amp;P 500 stocks were trading within 5% of their 52-week high. While I won’t go through all 119 to list stocks reaching record highs, I will deliver three possibilities. On Jan. 4, 2022, the index hit an all-time high of 4,818.62. It’s currently trading at 4,367.36, or 9.3% below its all-time high. With the index up 14.3% year-to-date, the odds aren’t good for it to reach a new high before the end of the year. Why’s that, you ask? InvestorPlace - Stock Market News, Stock Advice &amp; Trading TipsWell, if it hit 4,818.63 on Dec. 31 and stayed there to the close, it would finish the year up 25.5%. The index has beaten that return on four occasions since 2000, a success rate of 17%. Two of those occurred in the past five years. If you believe in regression to the mean, it seems unlikely. However, not wanting to be a party pooper, I will assume that the good times will continue through the remainder of 2023. With that in mind, I’m looking to invest in high-performing stocks to keep the ball rolling higher over the next six months and into 2024.Here are my three possibilities. Linde (LIN)Logo of Linde AG (LIN) in Hanover, Germany - The Linde Group is a multinational chemical companySource: nitpicker / Shutterstock.comLinde (NYSE:LIN) plays an important part in global business, manufacturing and distributing industrial gases such as oxygen, nitrogen, nitrogen helium, hydrogen, and many others. It’s hard to think of an industry that isn’t aided in some fashion by its work. Its stock has been on a run the past five years, up 136%, more than double the S&amp;P’s Top 50. Year-to-date, it’s once again outpacing the index. When you’re a $182 billion market-capitalization stock, you can afford to meet your customers where they work. As a result, Linde will build a gas plant on your property if the need for its industrial gases is significant, say for 10 or 20 years. The best part: the contracts come with price escalators to ensure inflation doesn’t take a bite out of profits.  The Americas account for 46% of its revenue, with the rest of the world accounting for 54%. Its top three markets by sales are manufacturing (22%), chemicals and energy (22%), and metals and mining (14%).  Story continuesGreen hydrogen has become a big deal with the world transitioning from fossil fuels to renewable energy sources. Linde expects this market for the company will grow to $50 billion worldwide over the next decade, with a whopping 60% generated in the U.S.Based on a trailing, 12-month free cash flow of $5.42 billion and a market cap of $182.4 billion, it has a free cash flow yield of 3.0%. While it’s not cheap (I consider anything below 4% to be relatively expensive), there’s no question it has delivered for shareholders over the long haul because the need for its products will continue to persist.  Darden Restaurants (DRI)Source: ShutterstockDarden Restaurants (NYSE:DRI) is up 41% over the past year. It’s trading within 4.1% of its 52-week and all-time high of $168.98. The stock fell on June 22 after the restaurant operator reported a few weak spots in its lineup, especially in fine dining. However, as iCapital Chief Strategist Anastasia Amoroso told Yahoo Finance, the consumer is in fine shape. “But when I look, Julie [Yahoo Finance host Julie Hyman], to a point to the big macro picture, what I see is the consumer that has a job and is getting paid more for that job. 3.5% unemployment rate, 4.4% year-over-year wage growth. And, by the way, when you take inflation into account, that means that actually in real terms wages ever so slightly are going up,” Amoroso said on June 22. Despite the same-store sales miss for Olive Garden — they were 4.4% compared to a 5% estimate — they were still very positive. Add in the same-store sales growth of 7.1% for LongHorn Steakhouse, and the recent purchase of Ruth’s Chris Steak House, and you’ve got the ingredients for a long run-up of its share price.  Of the 29 analysts covering its stock, 19 rate it overweight or an outright buy, with a target price of $173.Monster Beverage (MNST)Grocery store shelf with 16 ounce cans of Monster brand energy drinks.Source: Sheila Fitzgerald / Shutterstock.comYou often hear stories of people who’ve become wealthy investing with Warren Buffett. The same isn’t true for Monster Beverage (NASDAQ:MNST), but it should be. The energy drink company consistently shows up on lists of the top-performing stocks of the past “x” number of years. U.S. News &amp; World Report listed the 10 best-performing stocks of the past 30 years in May. Monster Beverage was number one, with a cumulative return of 213,088%. A $10,000 bet in 1992 was worth $21.3 million as of August 2022. It’s up another 31% in the past year, adding to its lead. On May 5, Monster hit a 52-week high of $60.47. That also happens to be its all-time high. It’s currently trading at $59.69, 1.3% below its all-time high. Monster Beverage generates a lot of free cash. In January 2022, it acquired CANarchy Craft Brewery Collective LLC. Its beer brands include Cigar City, Oskar Blues, Deep Ellum, and others. It paid $330 million, about one-third of its annual free cash flow.   “This transaction provides us with a springboard from which to enter the alcoholic beverage sector,” said Monster’s Vice Chairman and Co-Chief Executive Officer Hilton Schlosberg at the time. In Q1 2023, its Alcohol Brands segment, which holds the CANarchy assets, had revenue of $46.3 million, up from $15.2 million a year earlier. It’s currently not generating positive operating income. Give it time. Monster is a profit machine. On the date of publication, Will Ashworth did not have (either directly or indirectly) any positions in the securities mentioned in this article. The opinions expressed in this article are those of the writer, subject to the InvestorPlace.com PublishingGuidelines. Will Ashworth has written about investments full-time since 2008. Publications where he’s appeared include InvestorPlace, The Motley Fool Canada, Investopedia, Kiplinger, and several others in both the U.S. and Canada. He particularly enjoys creating model portfolios that stand the test of time. He lives in Halifax, Nova Scotia.More From InvestorPlaceBuy This $5 Stock BEFORE This Apple Project Goes LiveWall Street Titan: Here’s My #1 Stock for 2023The $1 Investment You MUST Take Advantage of Right NowIt doesn’t matter if you have $500 or $5 million. Do this now.The post 3 High-Flying Stocks Set to Soar Even Higher appeared first on InvestorPlace.]"
31,aca8b8e4-d8b4-33a7-ae86-b11bbef2212a,LUV,2023-07-03,Southwest Airlines Makes a Major Passenger-Friendly Change,TheStreet.com,https://finance.yahoo.com/m/aca8b8e4-d8b4-33a7-ae86-b11bbef2212a/southwest-airlines-makes-a.html,1688387400,STORY,['LUV'],"[The airline has a long way to go to win back consumer trust, but it's putting its best wing forward.Continue reading]"
32,6af4c522-9a09-318b-acaf-36a1d26b3674,LUV,2023-07-03,United Airlines Meltdown: 1 More Reason to Avoid the Stock,Motley Fool,https://finance.yahoo.com/m/6af4c522-9a09-318b-acaf-36a1d26b3674/united-airlines-meltdown%3A-1.html,1688303820,STORY,"['UAL', 'LUV']","[The airline giant canceled thousands of flights last week, despite management's previous claims that it had made major investments to avoid operational meltdowns.Continue reading]"
33,6b822af4-3be6-3fc4-9760-e8592372cfd3,PM,2023-07-03,Are Investors Undervaluing Philip Morris International Inc. (NYSE:PM) By 36%?,Simply Wall St.,https://finance.yahoo.com/news/investors-undervaluing-philip-morris-international-130111654.html,1688302871,STORY,['PM'],"[Key InsightsThe projected fair value for Philip Morris International is US$152 based on 2 Stage Free Cash Flow to EquityPhilip Morris International's US$97.62 share price signals that it might be 36% undervalued The US$113 analyst price target for PM is 26% less than our estimate of fair valueToday we will run through one way of estimating the intrinsic value of Philip Morris International Inc. (NYSE:PM) by taking the expected future cash flows and discounting them to their present value. We will use the Discounted Cash Flow (DCF) model on this occasion. Models like these may appear beyond the comprehension of a lay person, but they're fairly easy to follow.Companies can be valued in a lot of ways, so we would point out that a DCF is not perfect for every situation. If you want to learn more about discounted cash flow, the rationale behind this calculation can be read in detail in the Simply Wall St analysis model. View our latest analysis for Philip Morris International Crunching The NumbersWe are going to use a two-stage DCF model, which, as the name states, takes into account two stages of growth. The first stage is generally a higher growth period which levels off heading towards the terminal value, captured in the second 'steady growth' period. To begin with, we have to get estimates of the next ten years of cash flows. Where possible we use analyst estimates, but when these aren't available we extrapolate the previous free cash flow (FCF) from the last estimate or reported value. We assume companies with shrinking free cash flow will slow their rate of shrinkage, and that companies with growing free cash flow will see their growth rate slow, over this period. We do this to reflect that growth tends to slow more in the early years than it does in later years.Generally we assume that a dollar today is more valuable than a dollar in the future, and so the sum of these future cash flows is then discounted to today's value:Story continues10-year free cash flow (FCF) forecast2024202520262027202820292030203120322033 Levered FCF ($, Millions) US$10.7bUS$11.5bUS$12.2bUS$12.7bUS$13.2bUS$13.6bUS$14.0bUS$14.4bUS$14.8bUS$15.1bGrowth Rate Estimate SourceAnalyst x6Analyst x5Est @ 5.53%Est @ 4.50%Est @ 3.79%Est @ 3.28%Est @ 2.93%Est @ 2.68%Est @ 2.51%Est @ 2.39% Present Value ($, Millions) Discounted @ 7.3% US$10.0kUS$10.0kUS$9.9kUS$9.6kUS$9.3kUS$8.9kUS$8.6kUS$8.2kUS$7.8kUS$7.5k(""Est"" = FCF growth rate estimated by Simply Wall St)Present Value of 10-year Cash Flow (PVCF) = US$90bThe second stage is also known as Terminal Value, this is the business's cash flow after the first stage. The Gordon Growth formula is used to calculate Terminal Value at a future annual growth rate equal to the 5-year average of the 10-year government bond yield of 2.1%. We discount the terminal cash flows to today's value at a cost of equity of 7.3%.Terminal Value (TV)= FCF2033 × (1 + g) ÷ (r – g) = US$15b× (1 + 2.1%) ÷ (7.3%– 2.1%) = US$296bPresent Value of Terminal Value (PVTV)= TV / (1 + r)10= US$296b÷ ( 1 + 7.3%)10= US$146bThe total value is the sum of cash flows for the next ten years plus the discounted terminal value, which results in the Total Equity Value, which in this case is US$236b. In the final step we divide the equity value by the number of shares outstanding. Compared to the current share price of US$97.6, the company appears quite undervalued at a 36% discount to where the stock price trades currently. Valuations are imprecise instruments though, rather like a telescope - move a few degrees and end up in a different galaxy. Do keep this in mind.dcfImportant AssumptionsThe calculation above is very dependent on two assumptions. The first is the discount rate and the other is the cash flows. Part of investing is coming up with your own evaluation of a company's future performance, so try the calculation yourself and check your own assumptions. The DCF also does not consider the possible cyclicality of an industry, or a company's future capital requirements, so it does not give a full picture of a company's potential performance. Given that we are looking at Philip Morris International as potential shareholders, the cost of equity is used as the discount rate, rather than the cost of capital (or weighted average cost of capital, WACC) which accounts for debt. In this calculation we've used 7.3%, which is based on a levered beta of 0.879. Beta is a measure of a stock's volatility, compared to the market as a whole. We get our beta from the industry average beta of globally comparable companies, with an imposed limit between 0.8 and 2.0, which is a reasonable range for a stable business.SWOT Analysis for Philip Morris InternationalStrengthDebt is well covered by earnings.Dividend is in the top 25% of dividend payers in the market.WeaknessEarnings declined over the past year.OpportunityAnnual revenue is forecast to grow faster than the American market.Good value based on P/E ratio and estimated fair value.ThreatDebt is not well covered by operating cash flow.Total liabilities exceed total assets, which raises the risk of financial distress.Dividends are not covered by earnings and cashflows.Annual earnings are forecast to grow slower than the American market.Moving On:Valuation is only one side of the coin in terms of building your investment thesis, and it is only one of many factors that you need to assess for a company. DCF models are not the be-all and end-all of investment valuation. Preferably you'd apply different cases and assumptions and see how they would impact the company's valuation. For instance, if the terminal value growth rate is adjusted slightly, it can dramatically alter the overall result. What is the reason for the share price sitting below the intrinsic value? For Philip Morris International, there are three additional factors you should further research:Risks: For instance, we've identified   2 warning signs for Philip Morris International  that you should be aware of.Future Earnings: How does PM's growth rate compare to its peers and the wider market? Dig deeper into the analyst consensus number for the upcoming years by interacting with our free analyst growth expectation chart.Other Solid Businesses: Low debt, high returns on equity and good past performance are fundamental to a strong business. Why not explore our interactive list of stocks with solid business fundamentals to see if there are other companies you may not have considered!PS. Simply Wall St updates its DCF calculation for every American stock every day, so if you want to find the intrinsic value of any other stock just search here.Have feedback on this article? Concerned about the content? Get in touch with us directly. Alternatively, email editorial-team (at) simplywallst.com.This article by Simply Wall St is general in nature. We provide commentary based on historical data and analyst forecasts only using an unbiased methodology and our articles are not intended to be financial advice. It does not constitute a recommendation to buy or sell any stock, and does not take account of your objectives, or your financial situation. We aim to bring you long-term focused analysis driven by fundamental data. Note that our analysis may not factor in the latest price-sensitive company announcements or qualitative material. Simply Wall St has no position in any stocks mentioned.Join A Paid User Research SessionYou’ll receive a US$30 Amazon Gift card for 1 hour of your time while helping us build better investing tools for the individual investors like yourself. Sign up here]"
34,1365f024-ee40-3f2d-a32f-ce707a6f1878,TDG,2023-07-03,Should You Be Adding TransDigm Group (NYSE:TDG) To Your Watchlist Today?,Simply Wall St.,https://finance.yahoo.com/news/adding-transdigm-group-nyse-tdg-110042587.html,1688382042,STORY,['TDG'],"[It's common for many investors, especially those who are inexperienced, to buy shares in companies with a good story even if these companies are loss-making. But as Peter Lynch said in One Up On Wall Street, 'Long shots almost never pay off.' While a well funded company may sustain losses for years, it will need to generate a profit eventually, or else investors will move on and the company will wither away.In contrast to all that, many investors prefer to focus on companies like TransDigm Group (NYSE:TDG), which has not only revenues, but also profits. Even if this company is fairly valued by the market, investors would agree that generating consistent profits will continue to provide TransDigm Group with the means to add long-term value to shareholders. See our latest analysis for TransDigm Group How Quickly Is TransDigm Group Increasing Earnings Per Share?If a company can keep growing earnings per share (EPS) long enough, its share price should eventually follow. That means EPS growth is considered a real positive by most successful long-term investors. Over the last three years, TransDigm Group has grown EPS by 11% per year. That's a pretty good rate, if the company can sustain it.Top-line growth is a great indicator that growth is sustainable, and combined with a high earnings before interest and taxation (EBIT) margin, it's a great way for a company to maintain a competitive advantage in the market. TransDigm Group shareholders can take confidence from the fact that EBIT margins are up from 40% to 43%, and revenue is growing. Both of which are great metrics to check off for potential growth.The chart below shows how the company's bottom and top lines have progressed over time. To see the actual numbers, click on the chart.earnings-and-revenue-historyThe trick, as an investor, is to find companies that are going to perform well in the future, not just in the past. While crystal balls don't exist, you can check our visualization of consensus analyst forecasts for TransDigm Group's future EPS 100% free.Story continuesAre TransDigm Group Insiders Aligned With All Shareholders?We would not expect to see insiders owning a large percentage of a US$49b company like TransDigm Group. But we do take comfort from the fact that they are investors in the company. Notably, they have an enviable stake in the company, worth US$221m. While that is a lot of skin in the game, we note this holding only totals to 0.4% of the business, which is a result of the company being so large. This still shows shareholders there is a degree of alignment between management and themselves.Does TransDigm Group Deserve A Spot On Your Watchlist?As previously touched on, TransDigm Group is a growing business, which is encouraging. For those who are looking for a little more than this, the high level of insider ownership enhances our enthusiasm for this growth. The combination definitely favoured by investors so consider keeping the company on a watchlist. You should always think about risks though. Case in point, we've spotted   2 warning signs for TransDigm Group  you should be aware of.The beauty of investing is that you can invest in almost any company you want. But if you prefer to focus on stocks that have demonstrated insider buying, here is a list of companies with insider buying in the last three months.Please note the insider transactions discussed in this article refer to reportable transactions in the relevant jurisdiction.Have feedback on this article? Concerned about the content? Get in touch with us directly. Alternatively, email editorial-team (at) simplywallst.com.This article by Simply Wall St is general in nature. We provide commentary based on historical data and analyst forecasts only using an unbiased methodology and our articles are not intended to be financial advice. It does not constitute a recommendation to buy or sell any stock, and does not take account of your objectives, or your financial situation. We aim to bring you long-term focused analysis driven by fundamental data. Note that our analysis may not factor in the latest price-sensitive company announcements or qualitative material. Simply Wall St has no position in any stocks mentioned.Join A Paid User Research SessionYou’ll receive a US$30 Amazon Gift card for 1 hour of your time while helping us build better investing tools for the individual investors like yourself. Sign up here]"
35,54bc5091-fc7d-3e7d-9a11-945a16d54dfb,NFLX,2023-07-03,Netflix to revamp advertising strategy to lure brands and boost revenues,Financial Times,https://finance.yahoo.com/m/54bc5091-fc7d-3e7d-9a11-945a16d54dfb/netflix-to-revamp-advertising.html,1688356810,STORY,['NFLX'],[]
36,a389819e-57e2-3cc0-a4cb-7a6e9cbe8550,NFLX,2023-07-03,A Bull Market Is Coming: 1 Reason to Buy Comcast Stock,Motley Fool,https://finance.yahoo.com/m/a389819e-57e2-3cc0-a4cb-7a6e9cbe8550/a-bull-market-is-coming%3A-1.html,1688308200,STORY,"['CMCSA', 'NFLX', 'DIS']","[Despite these challenges, Comcast (NASDAQ: CMCSA) is one entertainment company that might just have unlocked a unique area of growth. When Comcast launched its Peacock streaming platform in 2020, the company offered Peacock Premium free to its 32 million Xfinity Internet customers. Comcast has recently made changes to the offering, and it could lead many of those Xfinity users to start paying for Peacock content.Continue reading]"
37,53069dcb-9072-37ef-a1ee-b8d2a80b3df7,AMGN,2023-07-03,"Insiders At Amgen Sold US$1.9m In Stock, Alluding To Potential Weakness",Simply Wall St.,https://finance.yahoo.com/news/insiders-amgen-sold-us-1-140012228.html,1688306412,STORY,['AMGN'],"[Many Amgen Inc. (NASDAQ:AMGN) insiders ditched their stock over the past year, which may be of interest to the company's shareholders. When evaluating insider transactions, knowing whether insiders are buying versus if they selling is usually more beneficial, as the latter can be open to many interpretations. However, if numerous insiders are selling, shareholders should investigate more.While we would never suggest that investors should base their decisions solely on what the directors of a company have been doing, we would consider it foolish to ignore insider transactions altogether. See our latest analysis for Amgen The Last 12 Months Of Insider Transactions At AmgenOver the last year, we can see that the biggest insider sale was by the Lead Independent Director, Robert Eckert, for US$1.6m worth of shares, at about US$249 per share. While we don't usually like to see insider selling, it's more concerning if the sales take place at a lower price. It's of some comfort that this sale was conducted at a price well above the current share price, which is US$222. So it may not tell us anything about how insiders feel about the current share price.Insiders in Amgen didn't buy any shares in the last year. You can see a visual depiction of insider transactions (by companies and individuals) over the last 12 months, below. If you click on the chart, you can see all the individual transactions, including the share price, individual, and the date!insider-trading-volumeI will like Amgen better if I see some big insider buys. While we wait, check out this free list of growing companies with considerable, recent, insider buying.Insider Ownership Of AmgenAnother way to test the alignment between the leaders of a company and other shareholders is to look at how many shares they own. I reckon it's a good sign if insiders own a significant number of shares in the company. Amgen insiders own 0.2% of the company, currently worth about US$192m based on the recent share price. This kind of significant ownership by insiders does generally increase the chance that the company is run in the interest of all shareholders.Story continuesSo What Does This Data Suggest About Amgen Insiders?There haven't been any insider transactions in the last three months -- that doesn't mean much. It's heartening that insiders own plenty of stock, but we'd like to see more insider buying, since the last year of Amgen insider transactions don't fill us with confidence. In addition to knowing about insider transactions going on, it's beneficial to identify the risks facing Amgen. To assist with this, we've discovered 1 warning sign that you should run your eye over to get a better picture of Amgen.Of course, you might find a fantastic investment by looking elsewhere. So take a peek at this free list of interesting companies.For the purposes of this article, insiders are those individuals who report their transactions to the relevant regulatory body. We currently account for open market transactions and private dispositions, but not derivative transactions.Have feedback on this article? Concerned about the content? Get in touch with us directly. Alternatively, email editorial-team (at) simplywallst.com.This article by Simply Wall St is general in nature. We provide commentary based on historical data and analyst forecasts only using an unbiased methodology and our articles are not intended to be financial advice. It does not constitute a recommendation to buy or sell any stock, and does not take account of your objectives, or your financial situation. We aim to bring you long-term focused analysis driven by fundamental data. Note that our analysis may not factor in the latest price-sensitive company announcements or qualitative material. Simply Wall St has no position in any stocks mentioned.Join A Paid User Research SessionYou’ll receive a US$30 Amazon Gift card for 1 hour of your time while helping us build better investing tools for the individual investors like yourself. Sign up here]"
