,Id,Company,Date,Title,Publisher,Link,ProviderPublishTime,Type,Related Company,Text
54,c45a437c-7aca-3895-9855-e32f02a69fc6,OKE,2023-09-03,7 Top-Rated Utilities Stocks to Buy Before Winter,InvestorPlace,https://finance.yahoo.com/news/7-top-rated-utilities-stocks-111548632.html,1693221348,STORY,"['OKE', 'EPD', 'LNG', 'ET', 'WMB', 'CEQP']","[Except for people living off the grid, everyone uses utilities. Electricity to light their homes, gas for heat, and everyone needs running water. That’s why utilities stocks are usually a pretty safe bet, particularly as winter comes and people nudge their thermostats a little higher.I suggest utilities stocks for investors who don’t have a great risk tolerance because you can count on them for dependable returns. Although you won’t see the world-beating returns you’ll get from the best growth stocks.In addition, many utility companies are regulated monopolies, so you’re assured of a decent return, but government regulators won’t let the companies set super-high rates to inflate profits.InvestorPlace - Stock Market News, Stock Advice &amp; Trading TipsInstead, utilities stocks are more of a defensive play. When the market gets volatile, or the economy begins to wobble, investors can usually find safety in the utilities sector.But even when the market is humming along, there are some reasons to appreciate utilities. These stocks typically provide a decent dividend. And there’s always something satisfying about investing in a company that pays you back.Here are several from which to choose.Oneok (OKE)Oneok company logo icon on websiteSource: Postmodern Studio / Shutterstock.comOneok (NYSE:OKE) is a natural gas supplier in Tulsa, Oklahoma. It connects the natural gas liquid supply in the Rocky Mountain, mid-continent and Permian regions with customers.Its assets, which stretch as far north as North Dakota and to the Gulf of Mexico, use a network of 40,000 miles of pipelines.Oneok is also working on a deal announced in May to acquire Magellan Midstream Partners (NYSE:MMP) in an $18.8 billion transaction.The calls for Magellan shareholders to receive $25 and 0.667 shares of OKE stock for each share of MMP stock. The deal should close later this year, giving Oneok another revenue stream and an opportunity to reduce redundancies.Investors are on board. Oneok stock is up 13% since the merger announcement. As a bonus, Oneok is one of the better dividend stocks on the New York Stock Exchange, providing a yield of nearly 6%.Story continuesOKE stock has a “B” rating in the Portfolio Grader.Energy Transfer (ET)A magnifying glass zooms in on the website for Energy Transfer (ET).Source: Casimiro PT / Shutterstock.comEnergy Transfer (NYSE:ET) is also in the business of transporting natural gas and propane.The Dallas-based company has nearly 125,000 miles of pipelines and energy infrastructure across 41 U.S. states.The company is a major player responsible for transporting about 30% of the nation’s oil and natural gas.It’s also in acquisition mode. Energy Transfer announced a deal to buy Crestwood Equity Partners (NYSE:CEQP), a master limited partnership with midstream assets in the Powder River Basin, Williston Basin and Delaware Basin, for $7.1 billion.Crestwood has 143 wells, including 73 connected in the last quarter, so its assets will be an excellent addition to ET.Energy Transfer had revenue of $18.32 billion in the second quarter and topped EPS estimates by posting 26 cents per share. But its revenue was down nearly 30% from a year ago as commodity prices fell.However, ET should bring home consistent, if not overwhelming, profits. And that’s what you want from utilities stocks. ET has a “B” rating in the Portfolio Grader.Williams Companies (WMB)The Williams Companies (WMB) logo displayed on a smartphone.Source: rafapress / Shutterstock.comAlso based in Tulsa, Williams Companies (NYSE:WMB) is involved in natural gas processing and transportation.Its footprint goes from coast to coast, with pipelines and operations connecting Washington state to New York state.It claims to handle 30% of natural gas production in the U.S. and has a network of 30,000 miles of pipeline covering 25 states.For Williams, stability and security are the name of the game. The company has paid a quarterly dividend for nearly 50 years, with a yield currently that’s better than 5%. It also has a streak of 26 consecutive quarters, beating analysts’ EBITDA estimates.WMB stock is up 5% this year and has a “B” rating in the Portfolio Grader.Enterprise Products Partners (EPD)A magnifying glass zooms in on the website of Enterprise Product Partners (EPD)Source: Casimiro PT / Shutterstock.comEnterprise Products Partners (NYSE:EPD) is a master limited partnership based in Houston. As a master limited partnership, ownership shares of EPD trade publicly like a stock.Investors realize increased dividend payouts and reduced taxes because of the MLP’s unique tax structure; the corporation pays taxes on earnings before sharing the windfall with investors.That makes MLPs a reliable choice for income investors and a safe investment. Enterprise Products Partners is diversified, operating in natural gas liquids, crude oil, natural gas and petrochemicals. It has more than 50,000 miles of pipeline.Earnings in the second quarter included $1.3 billion, or 57 cents per share. Enterprise increased its dividend by 5.3% to 50 cents per share, giving it a dividend yield of 7.6%.EPD earned a “B” rating in the Portfolio Grader.Fluence Energy (FLNC)FLNC stock. Concept of renewable energy battery storage system in nature. 3d renderingSource: petrmalinak / Shutterstock.comFluence Energy (NASDAQ:FLNC) is in the clean energy business. The Virginia company operates in the energy storage products and services space and provides cloud-based software for renewables and storage.AI powers the company’s Fluence IQ Platform, which provides software-as-a-service products that allow its customers to manage and optimize renewables and storage.This utilities stock is an interesting play on wind power and green energy, which provides a good alternative in your portfolio to companies focused on crude oil, petrochemicals and natural gas liquids.Goldman Sachs analyst Brian Lee said the recent pullback in solar and energy stocks is a good buying opportunity for FLNC stock, which he says has a 78% upside potential.Third-quarter earnings of $536 million were 13% better than analysts expected, although the company still lost 20 cents per share.FLNC stock has a “B” rating in the Portfolio Grader.Cheniere Energy (LNG)LNG stock: the Cheniere logo displayed on a phoneSource: IgorGolovniov / Shutterstock.comCheniere Energy (NYSEAMERICAN:LNG) doesn’t trade on the main New York Stock Exchange, but don’t that dissuade you. Cheniere is one of the best utilities stocks you can buy.The company is the largest exporter of liquified natural gas in the U.S. and profits handsomely from its shipments to Europe. European customers badly needed natural gas because Russia cut off their supply in retaliation for the West’s sanctions against Moscow over its war with Ukraine.As long as that conflict continues and Russia remains on the outs with Europe, Cheniere Energy will have a willing trading partner.The company reported second-quarter revenue of $4.1 billion and net income of $1.4 billion. It also revised its full-year guidance from a range between $8.2 billion and $8.7 billion to a range of $8.3 billion and $8.8 billion.LNG stock is up 7.5% in 2023 and has a “B” rating in the Portfolio Grader.Antero Midstream (AM)Large tanker ship carrying natural gas at dusk in harborSource: shutterstock.com/Wojciech WrzesienAntero Midstream (NYSE:AM) is a midstream energy company with operations in the Appalachian Basin and the Marcellus and Utica shales. It’s one of the nation’s leading producers of natural gas liquids and natural gas, with enough inventory to last a few decades.Earnings for the second quarter included revenue of $258.29 million, just beating expectations of $257.13 million.The company also reported free cash flow after dividends of $31 million, a massive improvement from a year ago when it posted a $2 million deficit. The quarter was the fourth consecutive quarter of posting positive FCF after dividends.The stock has rebounded nicely since April and shows a 10% gain in 2023. And then, when you add that to the company’s generous 7.5% dividend yield, you have a stock that gets a “B” rating in the Portfolio Grader.On the date of publication, Louis Navellier had a long position in LNG. Louis Navellier did not have (either directly or indirectly) any other positions in the securities mentioned in this article.The InvestorPlace Research Staff member primarily responsible for this article did not hold (either directly or indirectly) any positions in the securities mentioned in this article.Louis Navellier, who has been called “one of the most important money managers of our time,” has broken the silence in this shocking “tell all” video… exposing one of the most shocking events in our country’s history… and the one move every American needs to make today.More From InvestorPlaceMusk’s “Project Omega” May Be Set to Mint New Millionaires. Here’s How to Get In.ChatGPT IPO Could Shock the World, Make This Move Before the AnnouncementIt doesn’t matter if you have $500 or $5 million. Do this now.The post 7 Top-Rated Utilities Stocks to Buy Before Winter appeared first on InvestorPlace.]"
55,440f2de1-e937-3b58-83ab-dd45802f9753,HP,2023-09-03,Helmerich & Payne Inc's Meteoric Rise: Unpacking the 32% Surge in Just 3 Months,GuruFocus.com,https://finance.yahoo.com/news/helmerich-payne-incs-meteoric-rise-162045776.html,1693585245,STORY,"['HP', 'SDRLO.OL']","[Helmerich &amp; Payne Inc (NYSE:HP), a leading player in the Oil &amp; Gas industry, has seen a significant surge in its stock price over the past three months. The company's stock price has risen by 32.34% over the past quarter, marking a notable increase from its previous performance. Over the past week, the stock price has seen a gain of 2.84%, indicating a continued upward trend. The current market capitalization of the company stands at $4.14 billion, with a stock price of $41.64.Warning! GuruFocus has detected 1 Warning Sign with HP. Click here to check it out. HP 30-Year Financial DataThe intrinsic value of HPAccording to GuruFocus.com, the current GF Value of Helmerich &amp; Payne Inc is $67.15, which is higher than its GF Value three months ago, which stood at $63.2. The GF Value, defined by GuruFocus.com, calculates a stock's intrinsic value using historical multiples, past performance adjustments, and future business estimates. Despite the increase in the stock price, the company remains significantly undervalued according to the GF Valuation, both currently and three months ago.Helmerich &amp; Payne Inc's Meteoric Rise: Unpacking the 32% Surge in Just 3 MonthsHelmerich &amp; Payne Inc: A Brief OverviewHelmerich &amp; Payne Inc operates in the Oil &amp; Gas industry and boasts the largest fleet of U.S. land drilling rigs. The company's FlexRig line is the leading choice for drilling horizontal wells for the production of U.S. tight oil and gas. With a presence in nearly every major U.S. shale play, H&amp;P also has a small but growing international presence.Profitability Analysis of Helmerich &amp; Payne IncHelmerich &amp; Payne Inc has a Profitability Rank of 5/10, indicating a moderate level of profitability. The company's operating margin stands at 17.87%, better than 64.74% of 967 companies in the same industry. The ROE and ROA are 14.66% and 9.22% respectively, both better than the majority of companies in the industry. The ROIC of 10.13% is also higher than 68.28% of 1075 companies. Over the past decade, the company has had 5 years of profitability, better than 51.58% of 948 companies.Story continuesHelmerich &amp; Payne Inc's Meteoric Rise: Unpacking the 32% Surge in Just 3 MonthsGrowth Analysis of Helmerich &amp; Payne IncThe company's Growth Rank is 1/10, indicating a low growth rate. The 3-year and 5-year revenue growth rate per share are -9.00% and -5.00% respectively. However, the company's total revenue growth rate for the next 3 to 5 years is estimated at 12.81%, better than 82.51% of 263 companies. The EPS without NRI growth rate for the same period is projected at a whopping 165.28%, better than 98.48% of 66 companies.Helmerich &amp; Payne Inc's Meteoric Rise: Unpacking the 32% Surge in Just 3 MonthsMajor Holders of Helmerich &amp; Payne Inc's StockKen Fisher (Trades, Portfolio), Prem Watsa (Trades, Portfolio), and First Eagle Investment (Trades, Portfolio) are the top three holders of Helmerich &amp; Payne Inc's stock. Ken Fisher (Trades, Portfolio) holds 809965 shares, representing 0.81% of the total shares. Prem Watsa (Trades, Portfolio) holds 555105 shares, accounting for 0.56% of the total shares. First Eagle Investment (Trades, Portfolio) holds a smaller stake of 61012 shares, representing 0.06% of the total shares.Competitors of Helmerich &amp; Payne IncHelmerich &amp; Payne Inc faces competition from Seadrill Ltd(NYSE:SDRL), Patterson-UTI Energy Inc(NASDAQ:PTEN), and Transocean Ltd(NYSE:RIG). Seadrill Ltd has a market capitalization of $4 billion, Patterson-UTI Energy Inc has a market capitalization of $3.64 billion, and Transocean Ltd has a market capitalization of $6.58 billion.ConclusionIn conclusion, Helmerich &amp; Payne Inc has shown a significant surge in its stock price over the past three months. Despite this, the company remains significantly undervalued according to the GF Valuation. The company has a moderate level of profitability and a low growth rate. However, the projected total revenue growth rate and EPS without NRI growth rate for the next 3 to 5 years are promising. The company faces competition from Seadrill Ltd, Patterson-UTI Energy Inc, and Transocean Ltd. Based on this analysis, Helmerich &amp; Payne Inc presents an interesting investment opportunity for value investors.This article first appeared on GuruFocus.]"
56,f7b73c09-79f3-3608-af81-4b49a03e23fb,DVN,2023-09-03,2 Oil Stocks to Buy Hand Over Fist in September,Motley Fool,https://finance.yahoo.com/m/f7b73c09-79f3-3608-af81-4b49a03e23fb/2-oil-stocks-to-buy-hand-over.html,1693740180,STORY,"['NG=F', 'CL=F', 'PXD', 'DVN']",[Higher oil prices could give these companies the fuel to generate a lot more cash flow in the coming quarters.Continue reading]
57,a96de1f3-3ea9-3baa-a072-32cee4c9b732,MU,2023-09-03,"Institutional investors have a lot riding on Micron Technology, Inc. (NASDAQ:MU) with 82% ownership",Simply Wall St.,https://finance.yahoo.com/news/institutional-investors-lot-riding-micron-110032656.html,1693738832,STORY,['MU'],"[Key InsightsGiven the large stake in the stock by institutions, Micron Technology's stock price might be vulnerable to their trading decisions50% of the business is held by the top 22 shareholders Insiders have sold recently Every investor in Micron Technology, Inc. (NASDAQ:MU) should be aware of the most powerful shareholder groups. The group holding the most number of shares in the company, around 82% to be precise, is institutions. In other words, the group stands to gain the most (or lose the most) from their investment into the company.And as as result, institutional investors reaped the most rewards after the company's stock price gained 10% last week. The gains from last week would have further boosted the one-year return to shareholders which currently stand at 26%.Let's delve deeper into each type of owner of Micron Technology, beginning with the chart below. View our latest analysis for Micron Technology ownership-breakdownWhat Does The Institutional Ownership Tell Us About Micron Technology?Institutional investors commonly compare their own returns to the returns of a commonly followed index. So they generally do consider buying larger companies that are included in the relevant benchmark index.As you can see, institutional investors have a fair amount of stake in Micron Technology. This suggests some credibility amongst professional investors. But we can't rely on that fact alone since institutions make bad investments sometimes, just like everyone does. When multiple institutions own a stock, there's always a risk that they are in a 'crowded trade'. When such a trade goes wrong, multiple parties may compete to sell stock fast. This risk is higher in a company without a history of growth. You can see Micron Technology's historic earnings and revenue below, but keep in mind there's always more to the story.earnings-and-revenue-growthSince institutional investors own more than half the issued stock, the board will likely have to pay attention to their preferences. We note that hedge funds don't have a meaningful investment in Micron Technology. The Vanguard Group, Inc. is currently the company's largest shareholder with 8.6% of shares outstanding. Meanwhile, the second and third largest shareholders, hold 8.2% and 7.9%, of the shares outstanding, respectively.Story continuesAfter doing some more digging, we found that the top 22 have the combined ownership of 50% in the company, suggesting that no single shareholder has significant control over the company.Researching institutional ownership is a good way to gauge and filter a stock's expected performance. The same can be achieved by studying analyst sentiments. There are a reasonable number of analysts covering the stock, so it might be useful to find out their aggregate view on the future.Insider Ownership Of Micron TechnologyWhile the precise definition of an insider can be subjective, almost everyone considers board members to be insiders. The company management answer to the board and the latter should represent the interests of shareholders. Notably, sometimes top-level managers are on the board themselves.Most consider insider ownership a positive because it can indicate the board is well aligned with other shareholders. However, on some occasions too much power is concentrated within this group.Our data suggests that insiders own under 1% of Micron Technology, Inc. in their own names. Being so large, we would not expect insiders to own a large proportion of the stock. Collectively, they own US$188m of stock. Arguably recent buying and selling is just as important to consider. You can  click here to see if insiders have been buying or selling. General Public OwnershipThe general public-- including retail investors -- own 17% stake in the company, and hence can't easily be ignored. While this size of ownership may not be enough to sway a policy decision in their favour, they can still make a collective impact on company policies.Next Steps:It's always worth thinking about the different groups who own shares in a company. But to understand Micron Technology better, we need to consider many other factors. To that end, you should be aware of the   1 warning sign  we've spotted with Micron Technology .Ultimately the future is most important. You can access this free report on analyst forecasts for the company.NB: Figures in this article are calculated using data from the last twelve months, which refer to the 12-month period ending on the last date of the month the financial statement is dated. This may not be consistent with full year annual report figures.Have feedback on this article? Concerned about the content? Get in touch with us directly. Alternatively, email editorial-team (at) simplywallst.com.This article by Simply Wall St is general in nature. We provide commentary based on historical data and analyst forecasts only using an unbiased methodology and our articles are not intended to be financial advice. It does not constitute a recommendation to buy or sell any stock, and does not take account of your objectives, or your financial situation. We aim to bring you long-term focused analysis driven by fundamental data. Note that our analysis may not factor in the latest price-sensitive company announcements or qualitative material. Simply Wall St has no position in any stocks mentioned.]"
58,d4d91566-fa62-3f8d-9667-4f1620e1e746,HAS,2023-09-03,Is Mattel a Buy Now?,Motley Fool,https://finance.yahoo.com/m/d4d91566-fa62-3f8d-9667-4f1620e1e746/is-mattel-a-buy-now%3F.html,1693657800,STORY,"['MAT', 'HAS']","[Mattel (NASDAQ: MAT) has been a topic of investing conversations a little more than usual lately because of the success of its blockbuster film, ""Barbie."" Despite all the attention Mattel is getting and the nostalgia ""Barbie"" has ignited for many of its brands, it's important to approach investing in the company with an unbiased eye. Let's take a look and see if Mattel is worth buying right now.Continue reading]"
59,493616cc-746e-3db5-b60f-2cd2958c007e,MCD,2023-09-03,"The Best Stocks to Invest $5,000 in Right Now",Motley Fool,https://finance.yahoo.com/m/493616cc-746e-3db5-b60f-2cd2958c007e/the-best-stocks-to-invest.html,1693737300,STORY,"['COST', 'MCD']","[Quality merchandise and low prices have been the keys to Costco Wholesale's (NASDAQ: COST) success for decades. Costco further entices people to shop at its well-stocked warehouses by altering its selection of items for sale. Once someone pays to become a member, they're motivated to maximize their savings by shopping at Costco as often as they can.Continue reading]"
