,Id,Company,Date,Title,Publisher,Link,ProviderPublishTime,Type,Related Company,Text
0,1010d339-5d9b-3057-8c77-e0128933d623,VRSK,2023-07-03,"When Should You Buy Verisk Analytics, Inc. (NASDAQ:VRSK)?",Simply Wall St.,https://finance.yahoo.com/news/buy-verisk-analytics-inc-nasdaq-110035316.html,1688382035,STORY,['VRSK'],"[Verisk Analytics, Inc. (NASDAQ:VRSK) received a lot of attention from a substantial price increase on the NASDAQGS over the last few months. With many analysts covering the large-cap stock, we may expect any price-sensitive announcements have already been factored into the stock’s share price. However, could the stock still be trading at a relatively cheap price? Let’s examine Verisk Analytics’s valuation and outlook in more detail to determine if there’s still a bargain opportunity. See our latest analysis for Verisk Analytics What's The Opportunity In Verisk Analytics?According to my price multiple model, where I compare the company's price-to-earnings ratio to the industry average, the stock currently looks expensive. I’ve used the price-to-earnings ratio in this instance because there’s not enough visibility to forecast its cash flows. The stock’s ratio of 43.69x is currently well-above the industry average of 22.27x, meaning that it is trading at a more expensive price relative to its peers. Another thing to keep in mind is that Verisk Analytics’s share price is quite stable relative to the rest of the market, as indicated by its low beta. This means that if you believe the current share price should move towards the levels of its industry peers over time, a low beta could suggest it is not likely to reach that level anytime soon, and once it’s there, it may be hard for it to fall back down into an attractive buying range again.What does the future of Verisk Analytics look like?earnings-and-revenue-growthInvestors looking for growth in their portfolio may want to consider the prospects of a company before buying its shares. Although value investors would argue that it’s the intrinsic value relative to the price that matter the most, a more compelling investment thesis would be high growth potential at a cheap price. With profit expected to grow by 20% over the next couple of years, the future seems bright for Verisk Analytics. It looks like higher cash flow is on the cards for the stock, which should feed into a higher share valuation.Story continuesWhat This Means For YouAre you a shareholder? It seems like the market has well and truly priced in VRSK’s positive outlook, with shares trading above industry price multiples. At this current price, shareholders may be asking a different question – should I sell? If you believe VRSK should trade below its current price, selling high and buying it back up again when its price falls towards the industry PE ratio can be profitable. But before you make this decision, take a look at whether its fundamentals have changed.Are you a potential investor? If you’ve been keeping tabs on VRSK for some time, now may not be the best time to enter into the stock. The price has surpassed its industry peers, which means it is likely that there is no more upside from mispricing. However, the positive outlook is encouraging for VRSK, which means it’s worth diving deeper into other factors in order to take advantage of the next price drop.So if you'd like to dive deeper into this stock, it's crucial to consider any risks it's facing. In terms of investment risks, we've identified 1 warning sign with Verisk Analytics, and understanding this should be part of your investment process.If you are no longer interested in Verisk Analytics, you can use our free platform to see our list of over 50 other stocks with a high growth potential.Have feedback on this article? Concerned about the content? Get in touch with us directly. Alternatively, email editorial-team (at) simplywallst.com.This article by Simply Wall St is general in nature. We provide commentary based on historical data and analyst forecasts only using an unbiased methodology and our articles are not intended to be financial advice. It does not constitute a recommendation to buy or sell any stock, and does not take account of your objectives, or your financial situation. We aim to bring you long-term focused analysis driven by fundamental data. Note that our analysis may not factor in the latest price-sensitive company announcements or qualitative material. Simply Wall St has no position in any stocks mentioned.Join A Paid User Research SessionYou’ll receive a US$30 Amazon Gift card for 1 hour of your time while helping us build better investing tools for the individual investors like yourself. Sign up here]"
1,cb9c15fa-4e44-3d47-8616-b5275d47334f,SCHW,2023-07-03,20 Cities with Highest Elderly Population,Insider Monkey,https://finance.yahoo.com/news/20-cities-highest-elderly-population-121605547.html,1688386565,STORY,"['SCHW', 'OHI', 'BLK']","[In this article, we will take a look at 20 cities with highest elderly population. If you wish to skip our detailed analysis on the graying US population, and investor benefits, you may skip to 5 Cities with Highest Elderly Population.The Graying US PopulationMore than 55 million people across the USA are aged 65 or older, reports the US Census Bureau. With an increasing number of Baby Boomers reaching retirement age and older generations living longer, the US is graying drastically.This senior population is said to be burgeoning at 5 times the pace it had during the 100 years from 1920 to 2020. In 1920, the senior population was a mere 4.7% of the total population. In 2020, the population has reached 16.8% of the total count.To compare further, the US Census Bureau report highlights that no state had reached the threshold of 20% in 2010. However, 2020 has seen four states crossing this threshold. Maine is the state with the highest elderly population at 21.8%. Following Maine, the highest elderly population by state is in Florida, Vermont, and West Virginia, with 21.2%, 20.6%, and 20.5% seniors, respectively.With states graying rapidly in the US, so are many counties. Speaking of the highest elderly population by county, Sumter County in Florida has the highest senior population, with 58.9% comprising individuals aged 65 or older. Catron County, in New Mexico, ranks second in counties wit the highest elderly population, comprising 43.3% seniors. Charlotte County in Florida has 40.4% seniors, while Jefferson County in Washington has 39%. Whether its overall elderly population in the state or different counties, Florida takes the lead. It has many seniors, native and migrated, as it is one of the many states that don’t tax social security or pensions.Even though America may be graying at a rapid pace, statistics show that it is still younger than many developed countries. For instance, Japan has the largest share of older residents, at 28.5% of its population. Tokyo Kanto Metropolitan Area in Japan is the city with the oldest population in the world. Home to 8.7 million people aged 65 or older, seniors make up 23% of the city's total population. On the other hand, the USA only has 16.8% of older residents. When it comes to cities with the highest elderly population, Scottsdale, in Arizona, has the highest population of seniors, representing 24.6% of the total.Story continuesInvestor Benefits from an Aging PopulationA graying population, however, isn’t all bad news. In fact, a burgeoning older population can be fruitful for investors, notes CNBC. For instance, as more and more people are aging and retiring, the need for age-accessible housing is increasing too. As of 2011, only 11 million homes were age-ready for seniors. As a result, many seniors have had trouble accessing parts of their homes. Corporations such as Omega Healthcare Investors, Inc. (NYSE:OHI) and Welltower Inc. (NYSE:WELL) can help play a role in this matter. While Welltower Inc. (NYSE:WELL) is largely a diversified healthcare portfolio, it is also heavily focused on senior housing. Moreover, Omega Healthcare Investors, Inc. (NYSE:OHI) is one of the leading nursing home REITs.Yahoo notes that the senior housing industry will experience many years of demand growth exceeding supply growth, leading to occupancy of over 90% for the industry. As the senior population continues to age, increasing occupancy levels will push profit levels for the senior housing industry. As such, Omega Healthcare Investors, Inc. (NYSE:OHI), Welltower Inc. (NYSE:WELL), and similar others will likely experience double-digit funds from operations growth in the next decade.With the wealthiest generation in history beginning to draw their assets for funding retirement, other public companies to watch out for include Morgan Stanley (NYSE:MS), The Charles Schwab Corporation (NYSE:SCHW), and BlackRock, Inc. (NYSE:BLK).Morgan Stanley (NYSE:MS), a global leader in financial services, helps people, institutions, and governments in raising, managing, and distributing the capital they need to achieve their goals. Similar to Morgan Stanley (NYSE:MS), The Charles Schwab Corporation (NYSE:SCHW) provides a full range of brokerage, securities, money management, banking, and financial advisory services to people.Moreover, BlackRock, Inc. (NYSE:BLK) is a preeminent asset management firm as well as a premier provider of investment management. Potential retirees can use services from The Charles Schwab Corporation (NYSE:SCHW) and BlackRock, Inc. (NYSE:BLK) to raise their retirement funds. Similarly, these corporations are good stocks to invest in, too.An aging population is increasing the need for healthcare services as well. Healthcare stocks, on average, demonstrate 23% less volatility as compared to other stocks. As such, the best healthcare stocks to buy include UnitedHealth Group Incorporated (NYSE:UNH), Johnson &amp; Johnson (NYSE:JNJ), and Horizon Therapeutics Public Limited Company (NASDAQ:HZNP).Regardless of the benefits of an aging population, it is a fact that such populations need to be adequately supported in an economy. Multiple strategies must be designed that can help sustain these populations and prepare them for their care better. The first step in this direction is to ascertain the places where population-graying is being felt the hardest. Highlighting cities, states, and counties with the highest elderly population is a right step in this direction.20 Cities with Highest Elderly PopulationMethodologyIn order to compile the list of cities with the highest elderly populations, we have used data from the US Census Bureau report “The Older Population: 2020”, amongst others. Cities having more than 100,000 population were selected for the rankings, with elderly population defined as seniors aged 65 or older. After compiling the cities with the highest elderly populations, we ranked them by percentage. Percentages have been sourced from the recent July 2022 population from the US Census Bureau. Places are ranked in ascending order from the lowest to the highest percentages of elderly population.Here are the top 20 cities with the highest elderly populations: 20. New Orleans City, LouisianaPercentage of senior population:  15.2%The estimated population of New Orleans City, Louisiana, is 369,749. 15.2% of its population comprises seniors. The city is famous amongst retirees due to its unique charm, warm climate, and abundance of recreational opportunities.19. Albuquerque, New MexicoPercentage of senior population: 15.9%Albuquerque is a city in New Mexico. It is home to a population of 561,008, 15.9% of whom are seniors. 33.4% of the senior population has disabilities. Seniors love to retire here because of the warm and sunny climate, as well as variety of outdoor activities such as biking, hiking, and golf.18. San Francisco City, CaliforniaPercentage of senior population: 15.9%San Francisco is one of the cities in California with highest elderly population. The estimated total population in the city is 808,437, 15.9% of whom are seniors. The city “by the bay” attracts retirees due to its cool weather, beaches, and picturesque scenery. However, most of the retirees relocating to San Francisco are wealthy due to the city's high cost of living.17. Miami, FloridaPercentage of senior population:  16.4%The estimated total population in Miami, Florida, is 449,514. 16.4% of this population comprises seniors. Residents enjoy the city for its outdoors, with numerous activities available to them; such as biking, hiking, yoga, golf, and tennis. The city is also attractive thanks to the state’s tax-friendliness as well ideal climate for seniors.16. Mesa, ArizonaPercentage of senior population: 16.5%Mesa is one of the most populated cities in Arizona. According to population estimates, the total population of the city is 561,008. 16.5% of this population comprises seniors. Overall, the city gives retirees a chance to enjoy warm weather within a quieter suburban setting.15. Yonkers, New YorkPercentage of senior population: 16.8%The oldest major city in New York is Yonkers. The city has a population of more than 200,000, and almost 17% of the residents are seniors aged 65 or older. The growth in senior citizens is largely driven by ages 65-84, while those 85 and above are steadily declining. 10% of these older adults are reported to be living in poverty.14. Pembroke Pines, FloridaPercentage of senior population: 17.8%Located 22 miles north of Miami, Pembroke Pines is a city in Florida with one of the highest elderly populations. The total estimated population in the city is 169,876, 17.8% of whom are seniors. The vibrant city is famous for its sunny climate, stunning beaches, and plentiful recreational activities.13. Palm Bay, FloridaPercentage of senior population: 18.1%Palm Bay city has an estimated population of 129,234. 18.1% of this population is aged 65 or older. Seniors love Palm Bay City for its moderate climate, plentiful parks, and abundant beaches. The city has a suburban feel to it, and seniors usually lead an active lifestyle in the city.12. Daly City, CaliforniaPercentage of senior population: 18.6%Daly City is one of the cities with the highest elderly population. Having a population of 100,007, 18.6% of the population in the city comprises seniors. There are plenty of senior living communities and assisted living options in Daly City attracting the senior population, such as St. Andrew community, Villa Fontana, and Peninsula Del Ray, to name a few.11. Pompano Beach, FloridaPercentage of senior population: 18.6%In Pompano Beach city, the total population is 112,302. 18.6% of the population in Pompano Beach city are seniors. This warm and inviting city has an exceptional quality of life, contributing to the rapidly rising senior population.10. St. Petersburg, FloridaPercentage of senior population: 19.3%St. Petersburg is the second largest city in the Tampa Bay area and the fifth most populous city in Florida. The estimated population of the city is 261,256. Out of this population, 19.3% comprises of seniors aged 65 or older. The city has a large senior population thanks to its affordable living, pleasant weather, and plentiful outdoor activities.9. Thousand Oaks, CaliforniaPercentage of senior population: 19.4%This second-largest city in Ventura County is one of the cities with the highest elderly population. Out of a total population of 124,265, 19.4% are aged 65 or older. The city has an aging demographic with many advantages for seniors, such as good healthcare and cheap utility costs. Caring 2023 has declared the city as one of the most desirable places for seniors to live in.8. Hialeah, FloridaPercentage of senior population: 20.1%Hialeah is situated in Miami-Dade County, Florida. The city has an estimated population of 220,292, 20.1% of whom are seniors. 96.4% of the population is Hispanic or Latino, which is why Spanish-speaking seniors love to retire here. The Hialeah transit system runs through the week to every major hospital, and seniors get to ride free.7. Port St. Lucie, FloridaPercentage of senior population:  20.4%Another city with the highest elderly population is Port St. Lucie city in Florida. The estimated population in the city is 231,790, 20.4% of which comprises seniors. Moreover, 24% of the seniors are veterans in the city. The temperate climate, accommodating neighborhoods, and plentiful senior services attract retirees to the city.6. Urban Honolulu CDP, HawaiiPercentage of senior population: 20.5%The estimated population of Urban Honolulu CDP, Hawaii, is 343,421. 20.5% of this population comprises of seniors. While the city is far too expensive for retirees, it is great to for outdoors and enjoyment of an active retirement. Moreover, the state doesn’t tax social security or pensions either.Click to continue reading and see the 5 Cities with Highest Elderly Population. Suggested Articles:15 Best Places to Retire in South Carolina15 Best Beach Towns for Retirement20 Worst States to Retire in for Taxes and Cost of LivingDisclosure: none. 20 Cities with Highest Elderly Population is originally published on Insider Monkey.]"
2,ae83b75a-81d3-3efe-a642-42cafbe36ec2,TMO,2023-07-03,Estimating The Intrinsic Value Of Thermo Fisher Scientific Inc. (NYSE:TMO),Simply Wall St.,https://finance.yahoo.com/news/estimating-intrinsic-value-thermo-fisher-120209957.html,1688385729,STORY,['TMO'],"[Key InsightsThe projected fair value for Thermo Fisher Scientific is US$628 based on 2 Stage Free Cash Flow to EquityCurrent share price of US$522 suggests Thermo Fisher Scientific is potentially trading close to its fair valueOur fair value estimate is similar to Thermo Fisher Scientific's analyst price target of US$628How far off is Thermo Fisher Scientific Inc. (NYSE:TMO) from its intrinsic value? Using the most recent financial data, we'll take a look at whether the stock is fairly priced by estimating the company's future cash flows and discounting them to their present value. One way to achieve this is by employing the Discounted Cash Flow (DCF) model. Models like these may appear beyond the comprehension of a lay person, but they're fairly easy to follow.We generally believe that a company's value is the present value of all of the cash it will generate in the future. However, a DCF is just one valuation metric among many, and it is not without flaws. If you still have some burning questions about this type of valuation, take a look at the Simply Wall St analysis model. Check out our latest analysis for Thermo Fisher Scientific The CalculationWe use what is known as a 2-stage model, which simply means we have two different periods of growth rates for the company's cash flows. Generally the first stage is higher growth, and the second stage is a lower growth phase. To start off with, we need to estimate the next ten years of cash flows. Where possible we use analyst estimates, but when these aren't available we extrapolate the previous free cash flow (FCF) from the last estimate or reported value. We assume companies with shrinking free cash flow will slow their rate of shrinkage, and that companies with growing free cash flow will see their growth rate slow, over this period. We do this to reflect that growth tends to slow more in the early years than it does in later years.Generally we assume that a dollar today is more valuable than a dollar in the future, so we discount the value of these future cash flows to their estimated value in today's dollars:Story continues10-year free cash flow (FCF) forecast2024202520262027202820292030203120322033 Levered FCF ($, Millions) US$8.68bUS$9.58bUS$10.9bUS$13.1bUS$14.4bUS$15.6bUS$16.5bUS$17.3bUS$18.0bUS$18.7bGrowth Rate Estimate SourceAnalyst x10Analyst x9Analyst x3Analyst x1Est @ 10.30%Est @ 7.84%Est @ 6.12%Est @ 4.92%Est @ 4.08%Est @ 3.49% Present Value ($, Millions) Discounted @ 8.0% US$8.0kUS$8.2kUS$8.7kUS$9.6kUS$9.8kUS$9.8kUS$9.7kUS$9.4kUS$9.1kUS$8.7k(""Est"" = FCF growth rate estimated by Simply Wall St)Present Value of 10-year Cash Flow (PVCF) = US$91bAfter calculating the present value of future cash flows in the initial 10-year period, we need to calculate the Terminal Value, which accounts for all future cash flows beyond the first stage. For a number of reasons a very conservative growth rate is used that cannot exceed that of a country's GDP growth. In this case we have used the 5-year average of the 10-year government bond yield (2.1%) to estimate future growth. In the same way as with the 10-year 'growth' period, we discount future cash flows to today's value, using a cost of equity of 8.0%.Terminal Value (TV)= FCF2033 × (1 + g) ÷ (r – g) = US$19b× (1 + 2.1%) ÷ (8.0%– 2.1%) = US$325bPresent Value of Terminal Value (PVTV)= TV / (1 + r)10= US$325b÷ ( 1 + 8.0%)10= US$151bThe total value, or equity value, is then the sum of the present value of the future cash flows, which in this case is US$242b. The last step is to then divide the equity value by the number of shares outstanding. Relative to the current share price of US$522, the company appears about fair value at a 17% discount to where the stock price trades currently. Remember though, that this is just an approximate valuation, and like any complex formula - garbage in, garbage out.dcfImportant AssumptionsNow the most important inputs to a discounted cash flow are the discount rate, and of course, the actual cash flows. You don't have to agree with these inputs, I recommend redoing the calculations yourself and playing with them. The DCF also does not consider the possible cyclicality of an industry, or a company's future capital requirements, so it does not give a full picture of a company's potential performance. Given that we are looking at Thermo Fisher Scientific as potential shareholders, the cost of equity is used as the discount rate, rather than the cost of capital (or weighted average cost of capital, WACC) which accounts for debt. In this calculation we've used 8.0%, which is based on a levered beta of 0.987. Beta is a measure of a stock's volatility, compared to the market as a whole. We get our beta from the industry average beta of globally comparable companies, with an imposed limit between 0.8 and 2.0, which is a reasonable range for a stable business.SWOT Analysis for Thermo Fisher ScientificStrengthDebt is well covered by earnings and cashflows.WeaknessEarnings declined over the past year.Dividend is low compared to the top 25% of dividend payers in the Life Sciences market.OpportunityAnnual earnings are forecast to grow for the next 3 years.Current share price is below our estimate of fair value.ThreatAnnual earnings are forecast to grow slower than the American market.Next Steps:Whilst important, the DCF calculation shouldn't be the only metric you look at when researching a company. It's not possible to obtain a foolproof valuation with a DCF model. Preferably you'd apply different cases and assumptions and see how they would impact the company's valuation. For instance, if the terminal value growth rate is adjusted slightly, it can dramatically alter the overall result. For Thermo Fisher Scientific, we've compiled three further factors you should look at:Risks: As an example, we've found 1 warning sign for Thermo Fisher Scientific that you need to consider before investing here.Future Earnings: How does TMO's growth rate compare to its peers and the wider market? Dig deeper into the analyst consensus number for the upcoming years by interacting with our free analyst growth expectation chart.Other High Quality Alternatives: Do you like a good all-rounder? Explore our interactive list of high quality stocks to get an idea of what else is out there you may be missing!PS. Simply Wall St updates its DCF calculation for every American stock every day, so if you want to find the intrinsic value of any other stock just search here.Have feedback on this article? Concerned about the content? Get in touch with us directly. Alternatively, email editorial-team (at) simplywallst.com.This article by Simply Wall St is general in nature. We provide commentary based on historical data and analyst forecasts only using an unbiased methodology and our articles are not intended to be financial advice. It does not constitute a recommendation to buy or sell any stock, and does not take account of your objectives, or your financial situation. We aim to bring you long-term focused analysis driven by fundamental data. Note that our analysis may not factor in the latest price-sensitive company announcements or qualitative material. Simply Wall St has no position in any stocks mentioned.Join A Paid User Research SessionYou’ll receive a US$30 Amazon Gift card for 1 hour of your time while helping us build better investing tools for the individual investors like yourself. Sign up here]"
