,Id,Company,Date,Title,Publisher,Link,ProviderPublishTime,Type,Related Company,Text
188,955770f1-388a-3ef9-90ef-fd2003213dd3,OKE,2023-03-25,"Oneok (OKE) Loses -13.74% in 4 Weeks, Here's Why a Trend Reversal May be Around the Corner",Zacks,https://finance.yahoo.com/news/oneok-oke-loses-13-74-133501013.html,1679664901,STORY,['OKE'],"[A downtrend has been apparent in Oneok Inc. (OKE) lately with too much selling pressure. The stock has declined 13.7% over the past four weeks. However, given the fact that it is now in oversold territory and Wall Street analysts are majorly in agreement about the company's ability to report better earnings than they predicted earlier, the stock could be due for a turnaround.Here is How to Spot Oversold StocksWe use Relative Strength Index (RSI), one of the most commonly used technical indicators, for spotting whether a stock is oversold. This is a momentum oscillator that measures the speed and change of price movements.RSI oscillates between zero and 100. Usually, a stock is considered oversold when its RSI reading falls below 30.Technically, every stock oscillates between being overbought and oversold irrespective of the quality of their fundamentals. And the beauty of RSI is that it helps you quickly and easily check if a stock's price is reaching a point of reversal.So, by this measure, if a stock has gotten too far below its fair value just because of unwarranted selling pressure, investors may start looking for entry opportunities in the stock for benefitting from the inevitable rebound.However, like every investing tool, RSI has its limitations, and should not be used alone for making an investment decision.Here's Why OKE Could Experience a TurnaroundThe RSI reading of 28.35 for OKE is an indication that the heavy selling could be in the process of exhausting itself, so the stock could bounce back in a quest for reaching the old equilibrium of supply and demand.3-month RSI Chart for OKEThe RSI value is not the only factor that indicates a potential turnaround for the stock in the near term. On the fundamental side, there has been strong agreement among the sell-side analysts covering the stock in raising earnings estimates for the current year. Over the last 30 days, the consensus EPS estimate for OKE has increased 13.1%. And an upward trend in earnings estimate revisions usually translates into price appreciation in the near term.Story continuesMoreover, OKE currently has a Zacks Rank #2 (Buy), which means it is in the top 20% of more than the 4,000 stocks that we rank based on trends in earnings estimate revisions and EPS surprises. This is a more conclusive indication of the stock's potential turnaround in the near term. You can see the complete list of today's Zacks Rank #1 (Strong Buy) stocks here &gt;&gt;&gt;&gt;Want the latest recommendations from Zacks Investment Research? Today, you can download 7 Best Stocks for the Next 30 Days. Click to get this free reportONEOK, Inc. (OKE) : Free Stock Analysis ReportTo read this article on Zacks.com click here.Zacks Investment Research]"
189,2bd44356-e494-3923-bf73-3a5b5d8b8b43,HP,2023-03-25,Helmerich & Payne (HP) Gains But Lags Market: What You Should Know,Zacks,https://finance.yahoo.com/news/helmerich-payne-hp-gains-lags-215009119.html,1679694609,STORY,['HP'],"[In the latest trading session, Helmerich &amp; Payne (HP) closed at $33.79, marking a +0.42% move from the previous day. The stock lagged the S&amp;P 500's daily gain of 0.56%. At the same time, the Dow added 0.41%, and the tech-heavy Nasdaq gained 1.35%.Heading into today, shares of the oil and gas well-drilling contractor had lost 17.26% over the past month, lagging the Oils-Energy sector's loss of 8% and the S&amp;P 500's loss of 1.48% in that time.Wall Street will be looking for positivity from Helmerich &amp; Payne as it approaches its next earnings report date. The company is expected to report EPS of $1.06, up 723.53% from the prior-year quarter. Meanwhile, the Zacks Consensus Estimate for revenue is projecting net sales of $744.3 million, up 59.17% from the year-ago period.HP's full-year Zacks Consensus Estimates are calling for earnings of $4.68 per share and revenue of $3.04 billion. These results would represent year-over-year changes of +4580% and +47.85%, respectively.Any recent changes to analyst estimates for Helmerich &amp; Payne should also be noted by investors. These revisions help to show the ever-changing nature of near-term business trends. As such, positive estimate revisions reflect analyst optimism about the company's business and profitability.Based on our research, we believe these estimate revisions are directly related to near-team stock moves. Investors can capitalize on this by using the Zacks Rank. This model considers these estimate changes and provides a simple, actionable rating system.The Zacks Rank system ranges from #1 (Strong Buy) to #5 (Strong Sell). It has a remarkable, outside-audited track record of success, with #1 stocks delivering an average annual return of +25% since 1988. Over the past month, the Zacks Consensus EPS estimate remained stagnant. Helmerich &amp; Payne is currently a Zacks Rank #3 (Hold).Digging into valuation, Helmerich &amp; Payne currently has a Forward P/E ratio of 7.19. For comparison, its industry has an average Forward P/E of 7.61, which means Helmerich &amp; Payne is trading at a discount to the group.Story continuesThe Oil and Gas - Drilling industry is part of the Oils-Energy sector. This group has a Zacks Industry Rank of 95, putting it in the top 38% of all 250+ industries.The Zacks Industry Rank gauges the strength of our individual industry groups by measuring the average Zacks Rank of the individual stocks within the groups. Our research shows that the top 50% rated industries outperform the bottom half by a factor of 2 to 1.Be sure to follow all of these stock-moving metrics, and many more, on Zacks.com.Want the latest recommendations from Zacks Investment Research? Today, you can download 7 Best Stocks for the Next 30 Days. Click to get this free reportHelmerich &amp; Payne, Inc. (HP) : Free Stock Analysis ReportTo read this article on Zacks.com click here.Zacks Investment Research]"
190,e043e536-9b3c-3503-bbf3-50cb2755857e,NDAQ,2023-03-25,"Nasdaq Announces Mid-Month Open Short Interest Positions in Nasdaq Stocks as of Settlement Date March 15, 2023",GlobeNewswire,https://finance.yahoo.com/news/nasdaq-announces-mid-month-open-200500485.html,1679688300,STORY,['NDAQ'],"[Nasdaq, Inc.Nasdaq Short Interest DaysNasdaq Short Interest DaysNEW YORK, March 24, 2023 (GLOBE NEWSWIRE) -- At the end of the settlement date of March 15, 2023, short interest in 3,418 Nasdaq Global MarketSM securities totaled 10,373,177,802 shares compared with 10,071,117,158 shares in 3,441 Global Market issues reported for the prior settlement date of February 28, 2023. The mid-March short interest represents 2.72 days compared with 2.78 days for the prior reporting period.Short interest in 1,782 securities on The Nasdaq Capital MarketSM  totaled 1,972,054,324 shares at the end of the settlement date of March 15, 2023, compared with 1,961,935,389 shares in 1,819 securities for the previous reporting period. This represents a 1.29 day average daily volume; the previous reporting period’s figure was 1.55.In summary, short interest in all 5,200 Nasdaq® securities totaled 12,345,232,126 shares at the March 15, 2023 settlement date, compared with 5,260 issues and 12,033,052,547 shares at the end of the previous reporting period. This is 2.31 days average daily volume, compared with an average of 2.46 days for the prior reporting period.The open short interest positions reported for each Nasdaq security reflect the total number of shares sold short by all broker/dealers regardless of their exchange affiliations. A short sale is generally understood to mean the sale of a security that the seller does not own or any sale that is consummated by the delivery of a security borrowed by or for the account of the seller.For more information on Nasdaq Short interest positions, including publication dates, visit http://www.nasdaq.com/quotes/short-interest.aspx or http://www.nasdaqtrader.com/asp/short_interest.asp.Nasdaq Short Interest DaysAbout Nasdaq:Nasdaq (Nasdaq: NDAQ) is a global technology company serving the capital markets and other industries. Our diverse offering of data, analytics, software and services enables clients to optimize and execute their business vision with confidence. To learn more about the company, technology solutions and career opportunities, visit us on LinkedIn, on Twitter @Nasdaq, or at www.nasdaq.com.Story continuesNDAQOMedia Contact: Camille Staffordcamille.stafford@nasdaq.comA photo accompanying this announcement is available at https://www.globenewswire.com/NewsRoom/AttachmentNg/2eeda3ae-35c1-4822-8097-7a67e179e18c]"
191,89457de4-749f-3a33-bed3-fc4888474e06,NDAQ,2023-03-25,Nasdaq Readies To Launch Crypto Custody,Investopedia,https://finance.yahoo.com/m/89457de4-749f-3a33-bed3-fc4888474e06/nasdaq-readies-to-launch.html,1679686335,STORY,['NDAQ'],"[Nasdaq is getting close to launching custody for cryptocurrencies, after announcing its digital assets business last year.Continue reading]"
192,519f1b6b-c54e-3a64-ac8a-972b7a998fb2,NDAQ,2023-03-25,Nasdaq planning to launch custody services for crypto by end of Q2,Fortune,https://finance.yahoo.com/news/nasdaq-planning-launch-custody-services-183402756.html,1679682842,STORY,['NDAQ'],"[Global exchange Nasdaq Inc. plans to launch custody services for Bitcoin and Ether in the next three months, according to Ira Auerbach, senior vice president and head of Nasdaq Digital Assets.In an interview with Bloomberg on Friday, Auerbach said the company is working to finalize the technical infrastructure as well as secure final regulatory approvals so the new business can launch before the end of the second quarter.A Nasdaq spokesperson declined to comment further.The company said in September it was looking to establish custody services and appointed Auerbach to oversee Nasdaq Digital Assets, a new division.“Nasdaq Digital Assets builds upon the successful solutions we have introduced in recent years to serve the digital assets ecosystem, including marketplace technology for digital asset exchanges, crypto-native anti-financial crime offerings, and crypto-related index solutions for tradable products,” CEO Adena Friedman said in a statement at the time.Nasdaq applied to the New York Department of Financial Services for a limited-purpose trust company charter for the new services. Eventually, the company aims to offer a full suite of services for the group’s digital assets division, which would eventually include execution for financial institutions, Auerbach told Bloomberg.The exchange’s move into crypto would mark a change from its traditional business of dealing in stocks and bonds. It would also help fill the gap in crypto custody services that was left after the collapse of FTX last year.Other companies, such as BNY Mellon and Fidelity have also jumped into crypto to offer custody services.Despite a spate of crypto company bankruptcies and a sharp decline in the value of digital assets last year, the crypto market has been on an upswing in recent weeks. After failing to maintain momentum beyond the $25,000 mark, Bitcoin has stayed consistently above it for more than a week.This story was originally featured on Fortune.comStory continuesMore from Fortune: 5 side hustles where you may earn over $20,000 per year—all while working from homeExpert advice to keep your money safe during bank failuresUFB Direct savings account is offering an APY above 5%—and with no feesThis is how much money you need to earn annually to comfortably buy a $600,000 home ]"
193,b2007a33-11bb-3bc7-ae60-ac0787799525,JNPR,2023-03-25,ADTRAN (ADTN) Solution to Aid Truespeed's Network Expansion,Zacks,https://finance.yahoo.com/news/adtran-adtn-solution-aid-truespeeds-165204527.html,1679676724,STORY,"['ADTN', 'JNPR', 'ANET']","[ADTRAN, Inc. ADTN recently announced that Truespeed selected its fiber network solution to enhance broadband connectivity and expand coverage in South West England. The U.K.-based broadband provider has already connected more than 60,000 properties under its fiber network platform. Implementing ADTRAN’s technology will accelerate Truespeed’s aim to increase its reach to half a million by 2025. This agreement accentuates the strength of ADTRAN’s fiber broadband portfolio and its ability and usefulness in providing efficient, fast and reliable connectivity across cities, towns and rural areas.The company’s multi-gigabyte technology paves the way for high-speed, cost-efficient network connectivity. Truespeed is looking to leverage ADTRAN’s XGS-PON technology that allows the service provider to boost speed up to 900 Mbp/s to households and up to 10Gbp/s to organizations. It significantly reduces the requirement for additional equipment installation, allowing rapid deployment of the technology and connecting new users faster.Integration of XGS-PON greatly enhances the efficiency and sustainability of fiber broadband infrastructure. In the modern world, Internet connectivity has become an integral part of life and data demands are rising daily. The XGS-PON optical line terminals allow greater scalability, enabling operators to match the changing data requirements of the consumers.ADTRAN continues to benefit from solid demand trends of its network solutions driven by the accelerated expansion of fiber-to-the-home networks, upgrades to in-home Wi-Fi connectivity and the adoption of cloud-based automation tools. The company’s end-to-end solutions simplify the deployment of fiber-based broadband services and provide a better customer experience.It is focused on being a top global supplier of access infrastructure and related value-added solutions from the Cloud Edge to the Subscriber Edge through a broad portfolio of flexible hardware and software network solutions. These products enable customers to transition to the fully converged, scalable, highly automated, cloud-controlled voice, data, Internet and video network of the future.The company has enabled service providers to leverage the ADTRAN Mosaic Software-Defined Access architecture that combines modern Web-scale technologies with open-source platforms to facilitate rapid innovation in multi-technology, multi-vendor environments. The Mosaic cloud platform and Mosaic OS, combined with programmable network elements, provide operators with a highly agile, open-services architecture. This allows operators to better compete with Web-scale competition by reducing the time and cost to launch new services, technologies and best-of-breed suppliers as they strive to reduce operational costs while creating and deploying differentiated product offerings.The stock has declined 17.4% in the past year compared with the industry’s decline of 31.4%.Story continuesZacks Investment ResearchImage Source: Zacks Investment ResearchADTRAN currently carries a Zacks Rank #5 (Strong Sell).You can see the complete list of today’s Zacks #1 Rank (Strong Buy) stocks here.Ubiquiti, Inc. UI, carrying a Zacks Rank #2(Buy), delivered an earnings surprise of 6.90% in the last reported quarter. Earnings estimates for UI for the current year stand at $7.31 per share. Ubiquiti and its subsidiaries offer a comprehensive portfolio of networking products and solutions for service providers and enterprises. Its service-provider product platforms offer carrier-class network infrastructure for fixed wireless broadband, wireless backhaul systems and routing, while enterprise product platforms provide wireless local area network (WLAN) infrastructure, video surveillance products and machine-to-machine communication components.The company’s excellent global business model, which is flexible and adaptable to evolving changes in markets, helps it to beat challenges and maximize growth. Its operating model is backed by a rapidly growing and highly engaged community of service providers, distributors, value-added resellers, systems integrators and corporate IT professionals (referred to as the Ubiquiti Community).Arista Networks, Inc. ANET, sporting a Zacks Rank #1, delivered an earnings surprise of 14.17%, on average, in the trailing four quarters. Earnings estimates for ANET for the current year stand at $5.79 per share. Arista provides cloud networking solutions for data centers and cloud computing environments. The company offers 10/25/40/50/100 Gigabit Ethernet switches and routers optimized for next-generation data center networks.It continues to benefit from strong momentum and diversification across its top verticals and product lines. The company has a software-driven, data-centric approach to help customers build their cloud architecture and enhance their cloud experience. It is well-poised for growth in data-driven cloud networking business with proactive platforms and predictive operations. Arista has introduced network observability software, DANZ Monitoring Fabric (DMF), on its switching platforms for enterprise-wide traffic visibility and contextual insights.Juniper Networks, Inc. JNPR, carrying a Zacks Rank #2, delivered an earnings surprise of 1.55%, on average, in the trailing four quarters. It is witnessing strong momentum across its core industry verticals and is confident of its long-term prospects. Investments in customer solutions and sales organizations have enabled the company to capitalize on the solid demand across end markets.Juniper is a leading provider of networking solutions and communication devices. The company develops, designs and sells products that help build a network infrastructure for services and applications based on a single Internet protocol network worldwide. The company caters to the networking needs of enterprises, public sector organizations and service providers across the globe.Want the latest recommendations from Zacks Investment Research? Today, you can download 7 Best Stocks for the Next 30 Days. Click to get this free reportADTRAN Holdings, Inc. (ADTN) : Free Stock Analysis ReportJuniper Networks, Inc. (JNPR) : Free Stock Analysis ReportArista Networks, Inc. (ANET) : Free Stock Analysis ReportUbiquiti Inc. (UI) : Free Stock Analysis ReportTo read this article on Zacks.com click here.Zacks Investment Research]"
194,5e191266-2684-3ba3-b832-5815570515ef,JNPR,2023-03-25,Keysight (KEYS) Boosts Footprint With Portfolio Expansion,Zacks,https://finance.yahoo.com/news/keysight-keys-boosts-footprint-portfolio-131201524.html,1679663521,STORY,"['KEYS', 'ANET', 'JNPR']","[Keysight Technologies, Inc. KEYS recently announced that it has expanded its e-mobility charging test portfolio to help accelerate the development of electric charging infrastructure and improve interoperability among e-mobility products. In addition to complementing its existing electric vehicle (EV) and electric vehicle supply equipment (EVSE) charging products, the portfolio expansion is likely to strengthen its leading position in the market.The EV industry is witnessing exponential growth with government impetus and funding and is likely to reach more than 300 million globally, per the International Energy Agency. This has led to the proliferation of various electric charging infrastructures, often leading to several issues relating to the interoperability of such devices.This is where Keysight e-mobility charging test portfolio comes into play, addressing the complexities of the products with simple, accessible solutions. The company’s new charging test kits improve interoperability between EVs and EVSE products through conformance testing and type approvals leveraging the end-to-end communications protocols employed by the Combined Charging System (CCS) standards.The company is witnessing solid adoption of its electronic design and test solutions. Strong demand for its solutions has been a key catalyst behind robust top-line growth.Electronic devices form the very fulcrum of Internet of Things (IoT) services, wireless devices, data centers and 5G technologies. The rapid adoption of these devices is increasing the demand for electronic testing equipment. Further, technological advancements in mobile communications, semiconductors and automotive markets are likely to drive growth. Moreover, the rising demand for power management applications is a key catalyst for Keysight. Sturdy efforts toward modifying the Internet infrastructure and the evolution of smart cars &amp; autonomous-driving vehicles bode well for its growth.Keysight’s efforts in emerging growth markets like IoT and high-speed data centers bode well for the top line. Particularly, management’s focus on Automotive and Energy, and Aerospace and Defense domains augurs well in the long haul. The company is expected to benefit from the growing proliferation of electronic content in vehicles, momentum in space and satellite applications and rising adoption of driver-assistance systems globally.It has lost 2.3% over the past year compared with the industry’s decline of 1.1%.Story continuesZacks Investment ResearchImage Source: Zacks Investment ResearchKeysight currently carries a Zacks Rank #3 (Hold).You can see the complete list of today’s Zacks #1 Rank (Strong Buy) stocks here.Key PicksArista Networks, Inc. ANET, sporting a Zacks Rank #1, is likely to benefit from strong momentum and diversification across its top verticals and product lines. The company has a software-driven, data-centric approach to help customers build their cloud architecture and enhance their cloud experience. Arista has a long-term earnings growth expectation of 14.2% and delivered an earnings surprise of 14.2%, on average, in the trailing four quarters.It holds a leadership position in 100-gigabit Ethernet switching share in port for the high-speed datacenter segment. Arista is increasingly gaining market traction in 200- and 400-gig high-performance switching products and remains well-positioned for healthy growth in data-driven cloud networking business with proactive platforms and predictive operations.Juniper Networks, Inc. JNPR carries a Zacks Rank #2 (Buy). It has a long-term earnings growth expectation of 7% and delivered an earnings surprise of 1.6%, on average, in the trailing four quarters.Juniper is leveraging the 400-gig cycle to capture hyperscale switching opportunities inside the data center. The company is set to capitalize on the increasing demand for data center virtualization, cloud computing and mobile traffic packet/optical convergence.Ubiquiti Inc. UI, carrying a Zacks Rank #2, offers a comprehensive portfolio of networking products and solutions for service providers and enterprises. Ubiquiti’s excellent global business model, which is flexible and adaptable to evolving changes in markets, helps it to beat challenges and maximize growth.Ubiquiti boasts a proprietary network communication platform that is well-equipped to meet end-market customer needs. In addition, the company is committed toward reducing its operational costs by using a self-sustaining mechanism for rapid product support and dissemination of information by leveraging the strength of the Ubiquiti Community.Want the latest recommendations from Zacks Investment Research? Today, you can download 7 Best Stocks for the Next 30 Days. Click to get this free reportJuniper Networks, Inc. (JNPR) : Free Stock Analysis ReportArista Networks, Inc. (ANET) : Free Stock Analysis ReportKeysight Technologies Inc. (KEYS) : Free Stock Analysis ReportUbiquiti Inc. (UI) : Free Stock Analysis ReportTo read this article on Zacks.com click here.Zacks Investment Research]"
