,Id,Company,Date,Title,Publisher,Link,ProviderPublishTime,Type,Related Company,Text
56,7be5083e-f38e-3888-9cfc-4c50868224ae,AES,2023-07-03,Is There Now An Opportunity In The AES Corporation (NYSE:AES)?,Simply Wall St.,https://finance.yahoo.com/news/now-opportunity-aes-corporation-nyse-103524504.html,1688380524,STORY,"['AES', 'AESC']","[Today we're going to take a look at the well-established The AES Corporation (NYSE:AES). The company's stock received a lot of attention from a substantial price movement on the NYSE over the last few months, increasing to US$25.54 at one point, and dropping to the lows of US$19.74. Some share price movements can give investors a better opportunity to enter into the stock, and potentially buy at a lower price. A question to answer is whether AES' current trading price of US$20.73 reflective of the actual value of the large-cap? Or is it currently undervalued, providing us with the opportunity to buy? Let’s take a look at AES’s outlook and value based on the most recent financial data to see if there are any catalysts for a price change. See our latest analysis for AES Is AES Still Cheap?Good news, investors! AES is still a bargain right now. According to my valuation, the intrinsic value for the stock is $30.07, but it is currently trading at US$20.73 on the share market, meaning that there is still an opportunity to buy now. AES’s share price also seems relatively stable compared to the rest of the market, as indicated by its low beta. If you believe the share price should eventually reach its true value, a low beta could suggest it is unlikely to rapidly do so anytime soon, and once it’s there, it may be hard to fall back down into an attractive buying range.Can we expect growth from AES?earnings-and-revenue-growthInvestors looking for growth in their portfolio may want to consider the prospects of a company before buying its shares. Although value investors would argue that it’s the intrinsic value relative to the price that matter the most, a more compelling investment thesis would be high growth potential at a cheap price. Though in the case of AES, it is expected to deliver a relatively unexciting top-line growth of 7.0% in the next few years, which doesn’t help build up its investment thesis. Growth doesn’t appear to be a main reason for a buy decision for the company, at least in the near term.Story continuesWhat This Means For YouAre you a shareholder? Even though growth is relatively muted, since AES is currently undervalued, it may be a great time to increase your holdings in the stock. However, there are also other factors such as capital structure to consider, which could explain the current undervaluation.Are you a potential investor? If you’ve been keeping an eye on AES for a while, now might be the time to enter the stock. Its future outlook isn’t fully reflected in the current share price yet, which means it’s not too late to buy AES. But before you make any investment decisions, consider other factors such as the strength of its balance sheet, in order to make a well-informed buy.With this in mind, we wouldn't consider investing in a stock unless we had a thorough understanding of the risks. At Simply Wall St, we found 2 warning signs for AES and we think they deserve your attention.If you are no longer interested in AES, you can use our free platform to see our list of over 50 other stocks with a high growth potential.Have feedback on this article? Concerned about the content? Get in touch with us directly. Alternatively, email editorial-team (at) simplywallst.com.This article by Simply Wall St is general in nature. We provide commentary based on historical data and analyst forecasts only using an unbiased methodology and our articles are not intended to be financial advice. It does not constitute a recommendation to buy or sell any stock, and does not take account of your objectives, or your financial situation. We aim to bring you long-term focused analysis driven by fundamental data. Note that our analysis may not factor in the latest price-sensitive company announcements or qualitative material. Simply Wall St has no position in any stocks mentioned.Join A Paid User Research SessionYou’ll receive a US$30 Amazon Gift card for 1 hour of your time while helping us build better investing tools for the individual investors like yourself. Sign up here]"
57,a7d21fbb-0560-38c6-8f31-c4542582f86e,GM,2023-07-03,2 Warren Buffett Stocks That Are Screaming Buys in July and 1 to Avoid Like the Plague,Motley Fool,https://finance.yahoo.com/m/a7d21fbb-0560-38c6-8f31-c4542582f86e/2-warren-buffett-stocks-that.html,1688375160,STORY,"['BRK-A', 'GM', '^GSPC', 'AAPL', 'SDA']","[Two Berkshire Hathaway holdings stand out as exceptional values in July, while another top Buffett stock is the priciest it's been in more than a decade.Continue reading]"
58,7935c4bf-1ef5-3e7f-a341-2de291d3c5be,UAL,2023-07-03,Flight Delays Mar Record Holiday Air Travel. Why Airline Stocks Are Alright.,Barrons.com,https://finance.yahoo.com/m/7935c4bf-1ef5-3e7f-a341-2de291d3c5be/flight-delays-mar-record.html,1688387640,STORY,['UAL'],[]
59,591e6a31-e501-3ccb-8042-6152d706a90d,UAL,2023-07-03,Tesla and Apple Thrive Through Resilience. Yellen’s China Trip Could Deliver More Optimism.,Barrons.com,https://finance.yahoo.com/m/591e6a31-e501-3ccb-8042-6152d706a90d/tesla-and-apple-thrive.html,1688380260,STORY,['UAL'],[]
60,363cfabc-0f59-38c6-8d1d-ffef8ca0f7d4,UAL,2023-07-03,Top United Airlines Shareholders,Investopedia,https://finance.yahoo.com/m/363cfabc-0f59-38c6-8d1d-ffef8ca0f7d4/top-united-airlines.html,1688308539,STORY,['UAL'],"[The top United Airlines shareholders are Oscar Munoz, J. Scott Kirby, Brett J. Hart, Vanguard Group Inc., Primecap Management Co., and Capital International Investors.Continue reading]"
61,6af4c522-9a09-318b-acaf-36a1d26b3674,UAL,2023-07-03,United Airlines Meltdown: 1 More Reason to Avoid the Stock,Motley Fool,https://finance.yahoo.com/m/6af4c522-9a09-318b-acaf-36a1d26b3674/united-airlines-meltdown%3A-1.html,1688303820,STORY,"['UAL', 'LUV']","[The airline giant canceled thousands of flights last week, despite management's previous claims that it had made major investments to avoid operational meltdowns.Continue reading]"
62,39724a19-e1a0-3d90-8681-16a1b1221947,TGT,2023-07-03,15 Easy Party Snacks to Buy for Adults,Insider Monkey,https://finance.yahoo.com/news/15-easy-party-snacks-buy-112834315.html,1688383714,STORY,"['WMT', 'AMZN', 'TGT', 'COST', 'JJSF', 'HRL']","[In this article, we are going to discuss 15 easy party snacks to buy for adults. You can skip our detailed analysis of the history of the food service industry, good party foods to buy, innovations in the supermarket shopping experience, challenges faced by the grocery industry, rise of online grocery shopping, and go directly to 5 Easy Party Snacks to Buy for Adults. Food service has developed and evolved over the centuries, with many new ways of preparing and serving food emerging in recent years. The first evidence of the food service industry can be traced back to the Sumerian period, in 3000 BC. In ancient Mohenjo-Daro, a recent excavation in Pakistan shows evidence that people ate in restaurant-type facilities that were equipped with stone ovens and stoves for quantity food preparation. In the following centuries, the food service industry grew rapidly and became an important part of the economy. Global caloric consumption has also grown as we have been able to drastically increase food production due to agricultural mechanization. As we mentioned in our article – 20 Most Profitable Food Businesses in the World – global caloric consumption will grow from 2,789 kilocalories in 2000 per person, to 3,139 kilocalories by 2050, an increase of 12%. Good Party Foods to Buy:Everyone enjoys a good party but party planning, on the other hand, may be quite a hassle. One of the easiest ways to glamorize your food is to plate it aesthetically. A beautiful garnishing will make even the most ordinary food look mouth-watering. Providing your guests with proteins by serving meat or seafood meals is always a good idea. You can find a lot of frozen food options that are easily prepared in a few minutes. Your guests would also need some flavorful crunchies to munch on, so make sure to have snacks like nuts, crackers, chips, or other salty finger foods. It’s also important to complement items from different snack categories with sauces, and other party dips and spreads. Story continuesIf you’re worried about what food to serve your guests, we have mentioned some great ideas in this list of Easy Store-Bought Party Snacks for Adults. Innovations in the Supermarket Shopping Experience: Despite the wave of digital transformation spreading throughout the retail sector, the supermarket shopping experience has largely remained the same. In the wake of the pandemic, online grocery shopping has certainly become more popular, but the majority of the people still prefer buying groceries at physical stores. Shopping carts are an essential part of the grocery shopping experience. Amazon.com, Inc. (NASDAQ:AMZN) announced in 2022 that it was launching its smart grocery carts at a Whole Foods store in Massachusetts. The Dash Cart, introduced in 2020, tracks and tallies up items as shoppers place them in the cart, enabling them to skip the checkout line. Voice-based ordering is another trend that the supermarkets are catching up on, by offering consumers the ability to order goods through their voice-assistants and pick them up in-store. For example, Walmart Inc. (NYSE:WMT) partnered with Google before the pandemic to offer customers the ability to order groceries through Google’s voice assistant. The Just Walk Out technology by Amazon.com, Inc. (NASDAQ:AMZN) was perhaps the biggest leap in the supermarket shopping experience in recent years. The technology allows shoppers to identify themselves upon entering a store by scanning a QR code or their palms on a scanner. After that, they shop as usual and instead of checking out at a counter, they can simply walk out of the store. Their Amazon.com, Inc. (NASDAQ:AMZN) accounts are billed automatically and they receive a digital receipt onlineChallenges Faced by the Grocery Industry:The grocery industry continues to face a number of challenges, such as rising supply chain costs, labor and raw material shortages, geopolitical conflicts, changes in consumer behavior and expectations, and the ongoing cost-of-living crisis. Food prices are at an all-time high due to global inflation, with consumers reducing their overall spending. Grocery retailers today need to transform in order to navigate these challenges and meet consumer demands. Two of the largest supermarket chains in the U.S. hope to join forces as inflation pushes food prices higher. Grocery giant The Kroger Co. (NYSE:KR) announced plans last year to acquire Idaho-based Albertsons Companies, Inc. (NYSE:ACI) in a $24.6 billion deal. If it is approved by officials, the deal could reshape the U.S. supermarket landscape and create a corporate behemoth that collectively generates $209 billion in yearly revenue and operates nearly 5,000 stores. The acquisition, aimed, in part, to take on Walmart Inc. (NYSE:WMT), will allow the grocers to save millions in operating costs and have stronger bargaining power with suppliers. The complex deal would pay all shareholders of Albertsons Companies, Inc. (NYSE:ACI) $34.1 a share.Rise of Online Grocery Shopping: Over the past few years, e-commerce in the American grocery industry has continued to mature and scale, mainly accelerated because of the restrictions placed during the Covid-19 pandemic. According to a study by Verified Market Research, the U.S. online grocery market size was valued at $29.4 billion in 2022 and is projected to reach $59.94 billion by 2030, with a solid CAGR of 9.31% from 2024 to 2030. The main drivers of e-commerce growth during the pandemic were convenience and safety, but research indicates that consumers also value the channel’s unique features, such as product comparisons, assortment, personalized promotions, and a growing preference for comfort.  Walmart Inc. (NYSE:WMT) was the big winner in 2022 as more and more people shifted to online grocery shopping, looking for ways to save a buck. Consumers were driven by what the researchers term ‘flight to value’, where they buy products via an ‘everyday low price’ pricing model employed at Walmart Inc. (NYSE:WMT).With that said, let's head over to the list of the Easiest Party Snacks to Buy for Adults.   15 Easy Party Snacks to Buy for AdultsPixabay/Public DomainMethodology:To collect data for this article, we have referred to several sources, such as Dwell &amp; Dine, Real Simple, Greatist etc., looking for easy party snack ideas for adults. In the end, we picked Easy Party Snacks to Buy that were mentioned recurrently in these sources, and are easily available at supermarkets like Walmart, Costco, Whole Foods and Target.  If you’re also seeking to invest in the food industry, please refer to our article 10 Cheap Food Stocks to Buy. 15. Whole Foods Potato and Pea SamosasAvailable at Whole Foods for: $2.69A pack of 8 flavorful, frozen samosas that are filled with a savory combination of potatoes and peas that have been slow-roasted in fragrant herbs and spices, like cumin, garam masala, coriander, and turmeric, can be a delicious snack choice. Like any good samosas, these are a tad spicy and are deliciously paired with a cooling green chutney, like one made from coriander or mint. These vegan-friendly Indian delights can be prepared in only 12-14 minutes in an oven or a deep-fryer, and are a tasty treat for your guests to relish.14. Taste of the South Triple Cheddar Pimento CheeseAvailable at Walmart for: $4.32Having some delicious dips and sauces is an essential in any list of easy party snacks to buy for adults. Great on sandwiches, burgers or as a scoop on a blue plate special, this dip comes in a 10 oz container and blends together three types of cheddar, pimento peppers and Taste of the South’s signature southern seasoning blend. You’ll also love this classic southern dip recipe with some crackers, pita chips, crunchy carrots, and celery sticks, to make an easy no-cook finger food for parties. Taste of the South Dips provides a variety of great-tasting, premium, ready-to-eat dips, that are now available at over 3,000 locations of Walmart Inc. (NYSE:WMT). According to Fortune Business Insights, the global dips and spreads market size was valued at $85.6 billion in 2021, and is projected to grow to $132.2 billion by 2029, with a CAGR of 5.43% during the forecast period. 13. Mama Geraldine’s Chipotle Cheddar Cheese StrawsAvailable at Walmart for: $3.96Oven baked to crunchy perfection, these are traditional southern cheese straws with a spicy kick. Mama Geraldine’s snacking cheese straws are made with 12-month aged premium Wisconsin Cheddar and are a perfect addition to your next charcuterie board, paired with your favorite wine, or also just enjoyed right out of the bag. These low calorie, sugar free crunchies are a healthy last minute party snack to buy. Cathy Cunningham, the CEO and founder of Mama Geraldine’s Bodacious Food Company, came up with the idea while snacking on some expensive cheese bites one night and believed that they were not nearly as good as the ones her mother, Geraldine Cunningham, used to make. She then decided to make a business out of her mom’s recipe. 12. Kirkland Signature Shrimp CocktailAvailable at Costco for: $13.99The Kirkland Signature shrimp tray with cocktail sauce and lemon is the best party snack to buy at Costco and worth every penny. The fully cooked, peeled shrimps come with a zesty cocktail sauce and lemon wedges. Each package of this super easy and classic appetizer is about 1.5 pounds and will be the first thing your guests beeline towards. The Kirkland Signature brands brought in close to $60 billion in 2021 for Costco Wholesale Corporation (NASDAQ:COST), about 25% of total revenue of Costco Wholesale Corporation (NASDAQ:COST). The goal of Costco Wholesale Corporation (NASDAQ:COST) is to make Kirkland’s products ‘equal or better quality than national brands’ while striving for comparative savings of at least 20%. 11. Archer Farms Sweet Cajun Trail MixAvailable at Target for: $4.49Made with butter toffee peanuts, spicy seasoned peanuts, Cajun sesame sticks, roasted salted corn kernels and honey roasted sesame sticks, this mix offers sweet pops of flavor amidst a heap of crunch. The resealable stand-up bag makes it easy to store and keep the mix fresh, while the 11-ounce size makes it an inexpensive snack for large groups, providing enough mix for your guests to munch on, while they enjoy their drinks. Target Corporation (NYSE:TGT) has confirmed that it is phasing out Archer Farms and slowly replacing it with its new store brand Good and Gather, which has been around since 2019. 10. Whole Foods SpanakopitaAvailable at Whole Foods for: $7.69Next up on our list of Easy Party Snacks to Buy for Adults is the Greek-inspired combo of spinach, flaky phyllo dough and cheese. There are three cheeses – feta, cream cheese and ricotta – that work their magic inside these pillows of hors d’oeuvre deliciousness. These Mediterranean treats can be prepared easily in a conventional oven in 20-25 minutes, and are a great snack for a party at home.9. Hormel Gatherings Supreme Party Tray Available at Walmart for: $19.42Hormel Gatherings Supreme Party Trays are your entertaining go-to for any get-together, big or small. This 39.7 oz tray comes with crowd-favorite deli meats, Genoa and hard salami, paired with pepper jack and Havarti cheeses, pitted Peloponnese olives and crackers. The party tray is a good snack food for a party, as it requires no serving platter and no prep, so you can serve without fuss. Shares of Hormel Foods Corporation (NYSE:HRL) inched 0.9% higher to $40.22 on June 30th, short $11.47 of its 52-week high of $51.69, which the company achieved on August 26th 2022. 8. Marketside Jalapeño Artichoke Dip Available at Walmart for: $5.54Vegetables with dips are usually the cheapest food to serve at a party and this jalapeño artichoke dip is the perfect crowd pleaser. Made with cream cheese, parmesan cheese, mayonnaise, jalapeño peppers, artichoke hearts and sour cream, this flavorful dip is ideal for veggies, game-day appetizers, or for parties of any kind. Marketside is a private brand owned by Walmart Inc. (NYSE:WMT). 7. Hebrew National Beef Franks in a Puff Pastry BlanketAvailable at Walmart for: $18.33Making pigs in a blanket from scratch may be quite tedious, but with these frozen beef franks in puff pastry, all you have to do is bake them in the oven until the puff pastry is golden brown. If you really want to get fancy, you can even put a toothpick in each one. Each beef frank is made with premium cuts of 100% kosher beef and you get 33 of them in this box of 18.4 oz, which coupled with a charcuterie board, a couple of dips, and a few other snacks, is even enough to feed a party of 12. It was reported in 2021 that America’s largest beef producer, Brazil’s JBS S.A. was in talks with Conagra Brands, Inc. (NYSE:CAG) to acquire Hebrew National, but nothing appeared to have come of it. 6. SuperPretzel Frozen Pretzel Bites with Jalapeño CheeseAvailable at Target for: $5.49Pretzels are obviously among the top 10 party snacks in our list of party snack ideas for adults. Serving full-size soft pretzels may not be the best idea because they’ll likely be on the table with lots of other goodies, and they can be pretty filling. So opting for a bite-sized option is a great way to bring pretzels on the menu, and these even come with 2 jalapeño cheese dip packets. SuperPretzel is owned and marketed by the New Jersey-based J&amp;J Snack Foods Corp. (NASDAQ:JJSF). It was revealed last year that J&amp;J Snack Foods Corp. (NASDAQ:JJSF) also closed the acquisition of flash frozen ice cream beads manufacturer Dippin’ Dots for $222 million. Some other brands owned by J&amp;J Snack Foods Corp. (NASDAQ:JJSF) include Mary B’s biscuits and dumplings, and Icee and Slush Puppie frozen drinks. Click to continue reading and see the 5 Easy Party Snacks to Buy for Adults.Suggested Articles:Top 20 Countries with Highest Fast Food ConsumptionFood Production per Capita by Country: Top 20 Countries10 Cheapest Fast Food Chains Right NowDisclaimer: None. 15 Easy Party Snacks to Buy for Adults is originally published on Insider Monkey.]"
