,Id,Company,Date,Title,Publisher,Link,ProviderPublishTime,Type,Related Company,Text
65,256a3c11-f82a-34ce-bdd9-09a4739f967c,DVN,2023-09-10,Devon Energy (NYSE:DVN) Could Be A Buy For Its Upcoming Dividend,Simply Wall St.,https://finance.yahoo.com/news/devon-energy-nyse-dvn-could-121600975.html,1694261760,STORY,['DVN'],"[Key InsightsInstitutions' substantial holdings in Devon Energy implies that they have significant influence over the company's share price45% of the business is held by the top 25 shareholdersUsing data from analyst forecasts alongside ownership research, one can better assess the future performance of a companyIf you want to know who really controls Devon Energy Corporation (NYSE:DVN), then you'll have to look at the makeup of its share registry. And the group that holds the biggest piece of the pie are institutions with 70% ownership.  That is, the group stands to benefit the most if the stock rises (or lose the most if there is a downturn).And so it follows that institutional investors was the group most impacted after the company's market cap fell to US$33b last week after a 4.0% drop in the share price. Needless to say, the recent loss which further adds to the one-year loss to shareholders of 25% might not go down well especially with this category of shareholders. Also referred to as ""smart money"", institutions have a lot of sway over how a stock's price moves. Hence, if weakness in Devon Energy's share price continues, institutional investors may feel compelled to sell the stock, which might not be ideal for individual investors.Let's take a closer look to see what the different types of shareholders can tell us about Devon Energy. Check out our latest analysis for Devon Energy ownership-breakdownWhat Does The Institutional Ownership Tell Us About Devon Energy?Institutions typically measure themselves against a benchmark when reporting to their own investors, so they often become more enthusiastic about a stock once it's included in a major index. We would expect most companies to have some institutions on the register, especially if they are growing.Devon Energy already has institutions on the share registry. Indeed, they own a respectable stake in the company. This suggests some credibility amongst professional investors. But we can't rely on that fact alone since institutions make bad investments sometimes, just like everyone does. If multiple institutions change their view on a stock at the same time, you could see the share price drop fast. It's therefore worth looking at Devon Energy's earnings history below. Of course, the future is what really matters.Story continuesearnings-and-revenue-growthInvestors should note that institutions actually own more than half the company, so they can collectively wield significant power. We note that hedge funds don't have a meaningful investment in Devon Energy. Looking at our data, we can see that the largest shareholder is The Vanguard Group, Inc. with 12% of shares outstanding. For context, the second largest shareholder holds about 8.1% of the shares outstanding, followed by an ownership of 6.5% by the third-largest shareholder.On studying our ownership data, we found that 25 of the top shareholders collectively own less than 50% of the share register, implying that no single individual has a majority interest.While studying institutional ownership for a company can add value to your research, it is also a good practice to research analyst recommendations to get a deeper understand of a stock's expected performance. There are a reasonable number of analysts covering the stock, so it might be useful to find out their aggregate view on the future.Insider Ownership Of Devon EnergyWhile the precise definition of an insider can be subjective, almost everyone considers board members to be insiders. Company management run the business, but the CEO will answer to the board, even if he or she is a member of it.I generally consider insider ownership to be a good thing. However, on some occasions it makes it more difficult for other shareholders to hold the board accountable for decisions.Our most recent data indicates that insiders own less than 1% of Devon Energy Corporation. Being so large, we would not expect insiders to own a large proportion of the stock. Collectively, they own US$201m of stock. In this sort of situation, it can be more interesting to  see if those insiders have been buying or selling.  General Public OwnershipWith a 29% ownership, the general public, mostly comprising of individual investors, have some degree of sway over Devon Energy. While this group can't necessarily call the shots, it can certainly have a real influence on how the company is run. Next Steps:I find it very interesting to look at who exactly owns a company. But to truly gain insight, we need to consider other information, too. Consider for instance, the ever-present spectre of investment risk.   We've identified 4 warning signs  with Devon Energy (at least 2 which shouldn't be ignored)  , and understanding them should be part of your investment process.But ultimately  it is the future, not the past, that will determine how well the owners of this business will do. Therefore we think it advisable to take a look at this free report showing whether analysts are predicting a brighter future.NB: Figures in this article are calculated using data from the last twelve months, which refer to the 12-month period ending on the last date of the month the financial statement is dated. This may not be consistent with full year annual report figures.Have feedback on this article? Concerned about the content? Get in touch with us directly. Alternatively, email editorial-team@simplywallst.comSimply Wall St analyst Simply Wall St and Simply Wall St have no position in any of the companies mentioned. This article is general in nature. We provide commentary based on historical data and analyst forecasts only using an unbiased methodology and our articles are not intended to be financial advice. It does not constitute a recommendation to buy or sell any stock and does not take account of your objectives, or your financial situation. We aim to bring you long-term focused analysis driven by fundamental data. Note that our analysis may not factor in the latest price-sensitive company announcements or qualitative material.]"
66,adf86857-6fcf-31e1-aae0-fab15e31db5c,ORCL,2023-09-10,"Dow Jones Futures: Market Rally Battered; Apple iPhone, AI Giants Oracle, Adobe Loom",Investor's Business Daily,https://finance.yahoo.com/m/adf86857-6fcf-31e1-aae0-fab15e31db5c/dow-jones-futures%3A-market.html,1694319482,STORY,"['TGT', 'ADBE', 'AAPL', 'TSLA', 'COMP', '^GSPC', '^DJI', '^RUT', 'PATH', 'ORCL', 'SHOP', 'DKNG']","[Futures rose Monday, with Tesla set to clear an early buy point on a huge price target hike. Apple, Adobe and Oracle in focus this week.Continue reading]"
67,1dd8d0c1-bc49-304b-a275-624aa92b1686,ORCL,2023-09-10,Oracle: A Heavily In-Demand Stock,FX Empire,https://finance.yahoo.com/news/oracle-heavily-demand-stock-203344164.html,1694291624,STORY,['ORCL'],"[Oracle Shares Attract Big Money InflowsWant an edge in trading? Follow the Big Money.What’s Big Money? Said simply, it’s when a stock rises due to institutional demand. Top stocks tend to attract savvy investors.You see, fund managers are always looking to bet on the next outperforming stocks…the best in class. They spend countless hours sizing up companies, reading reports, speaking to analysts…you name it. When they find a company firing on all cylinders, they pounce in a big way.The YTD action tells the story. Each green bar signals unusual increasing volumes in ORCL shares, pushing the stock higher. We believe this to be institutional demand:Source: www.mapsignals.comFew stocks have charts this strong. Recent green bars suggest healthy demand. But, what about the fundamental story?Oracle Fundamental AnalysisNext, I want to make sure the fundamental story is healthy too. As you can see, ORCL has had positive sales and EPS growth in recent years:3-year sales growth rate (+8.7%)3-year EPS growth rate (+9.3%)Source: FactSetMarrying great fundamentals with our proprietary Big Money software has found some big winning stocks over the long-term.Check this out. Oracle has been a top-rated stock at MAPsignals. That means the stock has had buy pressure and growing fundamentals. We have a ranking process that showcases stocks like this on a weekly basis.It’s made the rare Top 20 report numerous times. The blue bars below shows when ORCL was a top pick:Source: www.mapsignals.comTracking unusual volumes reveals the power of the MAPsignals process.Don’t fight the Big Money!Oracle Price PredictionThe Oracle rally has been in place all year. Big Money buying in the shares is signaling to take notice. Given the historical gains in share price and strong fundamentals, this stock could be worth a spot in a diversified portfolio.Disclosure: the author holds no position in ORCL at the time of publication.If you want to take your investing to the next level, learn more about the MAPsignals process here.Story continuesFollow our free insights here.This article was originally posted on FX EmpireMore From FXEMPIRE:Eli Lilly: Unusual Demand is Sending the Stock HigherGBP/JPY Forecast – British Pound Sells Off Against the YenAUD/USD Weekly Forecast – Aussie Dollar Continues to Show Downward PressureGBP/JPY Forecast – British Pound Recovers After Initial PullbackOracle: A Heavily In-Demand StockGBP/USD Forecast – British Pound Looking for Buyers]"
68,a6d06a3e-e6d3-37ce-bf52-c99d6229dfcb,MU,2023-09-10,"Insider Sell: Micron Technology Inc CEO and President Sanjay Mehrotra Sells 7,000 Shares",GuruFocus.com,https://finance.yahoo.com/news/insider-sell-micron-technology-inc-170200465.html,1694278920,STORY,['MU'],"[On September 6, 2023, Sanjay Mehrotra, CEO and President of Micron Technology Inc (NASDAQ:MU), sold 7,000 shares of the company. This move is part of a trend for the insider, who over the past year has sold a total of 88,000 shares and purchased none.Warning! GuruFocus has detected 10 Warning Signs with MU. Click here to check it out. MU 30-Year Financial DataThe intrinsic value of MUInsider Sell: Micron Technology Inc CEO and President Sanjay Mehrotra Sells 7,000 SharesSanjay Mehrotra is a seasoned leader in the technology industry. He has been at the helm of Micron Technology Inc, a global leader in memory and storage solutions, since 2017. Under his leadership, the company has continued to innovate and expand its product portfolio, solidifying its position in the market.Micron Technology Inc is a world leader in innovative memory solutions that transform how the world uses information. With over 40 years of technology leadership, the company's memory and storage solutions define what the world can do with data. Micron's broad portfolio of high-performance memory technologiesincluding DRAM, NAND, and NOR Flashis the basis for solid state drives, modules, multichip packages, and other system solutions.The insider's recent sell comes at a time when Micron Technology Inc's stock is trading at $70.11, giving the company a market cap of $76.87 billion. This is significantly higher than the GuruFocus Value of $41.99, indicating that the stock is significantly overvalued.Insider Sell: Micron Technology Inc CEO and President Sanjay Mehrotra Sells 7,000 SharesThe GF Value is an intrinsic value estimate developed by GuruFocus. It is calculated based on historical multiples that the stock has traded at, a GuruFocus adjustment factor based on the companys past returns and growth, and future estimates of business performance from Morningstar analysts. With a price-to-GF-Value ratio of 1.67, Micron Technology Inc's stock is considered significantly overvalued.Over the past year, there have been no insider buys at Micron Technology Inc, while there have been 19 insider sells. This trend could indicate that insiders believe the stock is overvalued at its current price. Investors should keep a close eye on the insider's actions and the company's stock price in the coming months.Story continuesIt's important to note that while insider sell transactions can provide valuable insights into a company's valuation and future prospects, they should not be used as the sole basis for investment decisions. Investors should also consider other factors such as the company's financial health, market conditions, and industry trends.As always, it's recommended to conduct thorough research and consider multiple factors before making investment decisions.This article first appeared on GuruFocus.]"
69,d8fe45a3-da45-3c6a-b876-ad470991e270,MCD,2023-09-10,McDonald's menu adds a unique twist to a beloved classic,TheStreet.com,https://finance.yahoo.com/m/d8fe45a3-da45-3c6a-b876-ad470991e270/mcdonald%27s-menu-adds-a-unique.html,1694268900,STORY,['MCD'],"[McDonald's has had mixed success with dessert. The same is true for its pies and, now, the chain has added a pie to one of its global menus that seems so perfect for the U.S. that it's hard to think it won't eventually find its way stateside.Continue reading]"
70,dfba9502-b4d0-37d0-a84f-a5cb369304b2,AXP,2023-09-10,'You can't produce a baby in 1 month by getting nine women pregnant': Buffett says the key to investing is emotional control — not great talent or effort. 3 'forever' stocks for the long haul,Moneywise,https://finance.yahoo.com/news/cant-produce-baby-1-month-100000185.html,1694340000,STORY,"['KHC', 'AXP', 'KO']","['You can't produce a baby in 1 month by getting nine women pregnant': Buffett says the key to investing is emotional control — not great talent or effort. 3 'forever' stocks for the long haulWarren Buffett’s wealth wasn’t built overnight.Instead, the Oracle of Omaha has been steadily, gradually accumulating over several decades. He’s the undisputed champion of long-term investing. “No matter how great the talent or efforts, some things just take time,” he once said. “You can't produce a baby in one month by getting nine women pregnant.”Don't missRich young Americans have lost confidence in the stock market — and are betting on these 3 assets instead. Get in now for strong long-term tailwindsCommercial real estate has outperformed the S&amp;P 500 over 25 years. Here's how to diversify your portfolio without the headache of being a landlordWorried about the economy? Here are the best shock-proof assets for your portfolio. (They’re all outside of the stock market.)That’s good advice. Building wealth through investing is certainly possible, but only if the investor is patient, disciplined and committed to long-term thinking. The final ingredient is a stock that has the endurance to withstand market cycles and deliver steady returns over the long haul.With that in mind, here are the top three forever stocks you might want to consider adding to your “Patient Capital” watch list.Kraft HeinzThe Kraft Heinz corporation is only eight years old, but the two brands that constitute it have each been around for more than a century. Kraft Foods Inc. was founded in 1909 while the H. J. Heinz Co. was established in 1869. Both brands have steadily grown their footprints across the world over the intervening decades.In some parts of the world, these brands are synonymous with cheese, ketchup and macaroni. Brand recognition like this takes forever to build, which is why the combined business has so much underlying value.Today, the company (NASDAQ:KHC) is worth more than $41 billion, and the stock trades at about 17 times earnings — reasonable for a low-growth consumer brand.Buffett’s company, Berkshire Hathaway (NYSE:BKR.B), first acquired a stake in Heinz in 2013. Two years later, the firm put up $5 billion as part of the mega-merger that brought the two household brands together. The combined company is currently the seventh largest Berkshire holding.Story continuesRead more: Warren Buffett gets gloomy: America's 'incredible period' is coming to an end. Here's what nervous investors can do right nowCoca-ColaCoca-Cola (NYSE:KO) is another iconic brand dating to the 19th century. The company was launched in 1892 and has been on Buffett’s portfolio for several decades. He first initiated a position in the beverage giant in 1988. The stock is up more than 2,500% since then.The company is now worth in excess of $260 billion, while the stock trades at a price-to-earnings ratio of around 25. KO — the company’s ticker symbol — also offers a 3% dividend yield, which makes it an ideal target for income-seeking investors like Buffett.Buffett currently owns 400 million shares of KO worth $24 billion. It’s the fourth-largest position in his portfolio, which is a testament to his long-term commitment to this brand. Retail investors should certainly take a closer look at this blue chip.American ExpressAmerican Express (NYSE:AXP) is 173 years old, which makes it the oldest company on this list. The firm was launched in 1850 as an express mail business in Buffalo, New York. Now, of course, it’s one of the largest payment networks in the world, with more than $214.5 billion passing through the network last year.Amex gets a tiny slice of each transaction. Meanwhile, Buffett owns a large slice of the company. His stake in Amex is worth over $26 billion, making it his third-largest holding.This “forever” stock currently trades at a little more than 16 times earnings and should certainly be on your list.What to read nextThanks to Jeff Bezos, you can now use $100 to cash in on prime real estate — without the headache of being a landlord. Here's howBlackrock’s CEO says art is a ‘serious asset class’ — here’s how you can own a piece of a Pablo PicassoThis janitor in Vermont built an $8M fortune without anyone around him knowing. Here are the 2 simple techniques that made Ronald Read rich — and can do the same for youThis article provides information only and should not be construed as advice. It is provided without warranty of any kind.]"
71,18ae3982-70a0-3dc1-adff-cc19bd8d6064,AXP,2023-09-10,Those who invested in American Express (NYSE:AXP) three years ago are up 58%,Simply Wall St.,https://finance.yahoo.com/news/those-invested-american-express-nyse-140031086.html,1694268031,STORY,['AXP'],"[By buying an index fund, investors can approximate the average market return. But if you pick the right individual stocks, you could make more than that. For example, American Express Company (NYSE:AXP) shareholders have seen the share price rise 52% over three years, well in excess of the market return (27%, not including dividends). On the other hand, the returns haven't been quite so good recently, with shareholders up just 0.8% , including dividends .Let's take a look at the underlying fundamentals over the longer term, and see if they've been consistent with shareholders returns. View our latest analysis for American Express In his essay The Superinvestors of Graham-and-Doddsville Warren Buffett described how share prices do not always rationally reflect the value of a business. By comparing earnings per share (EPS) and share price changes over time, we can get a feel for how investor attitudes to a company have morphed over time.American Express was able to grow its EPS at 27% per year over three years, sending the share price higher. The average annual share price increase of 15% is actually lower than the EPS growth. So it seems investors have become more cautious about the company, over time.The company's earnings per share (over time) is depicted in the image below (click to see the exact numbers).earnings-per-share-growthWe like that insiders have been buying shares in the last twelve months. Having said that, most people consider earnings and revenue growth trends to be a more meaningful guide to the business. Before buying or selling a stock, we always recommend a close examination of historic growth trends, available here..What About Dividends?As well as measuring the share price return, investors should also consider the total shareholder return (TSR). The TSR is a return calculation that accounts for the value of cash dividends (assuming that any dividend received was reinvested) and the calculated value of any discounted capital raisings and spin-offs. Arguably, the TSR gives a more comprehensive picture of the return generated by a stock. We note that for American Express the TSR over the last 3 years was 58%, which is better than the share price return mentioned above. And there's no prize for guessing that the dividend payments largely explain the divergence!Story continuesA Different PerspectiveAmerican Express shareholders are up 0.8% for the year (even including dividends). But that was short of the market average. On the bright side, the longer term returns (running at about 9% a year, over half a decade) look better. It may well be that this is a business worth popping on the watching, given the continuing positive reception, over time, from the market. It is all well and good that insiders have been buying shares, but we suggest you check here to see what price insiders were buying at.There are plenty of other companies that have insiders buying up shares. You probably do not want to miss this free list of growing companies that insiders are buying.Please note, the market returns quoted in this article reflect the market weighted average returns of stocks that currently trade on American exchanges.Have feedback on this article? Concerned about the content? Get in touch with us directly. Alternatively, email editorial-team (at) simplywallst.com.This article by Simply Wall St is general in nature. We provide commentary based on historical data and analyst forecasts only using an unbiased methodology and our articles are not intended to be financial advice. It does not constitute a recommendation to buy or sell any stock, and does not take account of your objectives, or your financial situation. We aim to bring you long-term focused analysis driven by fundamental data. Note that our analysis may not factor in the latest price-sensitive company announcements or qualitative material. Simply Wall St has no position in any stocks mentioned.]"
72,0ebe04a8-f7bf-3b70-9fa1-e8cd5de6f710,NTAP,2023-09-10,"NetApp Inc President Cesar Cernuda Sells 22,000 Shares",GuruFocus.com,https://finance.yahoo.com/news/netapp-inc-president-cesar-cernuda-050147584.html,1694235707,STORY,['NTAP'],"[On September 6, 2023, President Cesar Cernuda of NetApp Inc (NASDAQ:NTAP) sold 22,000 shares of the company's stock. This move comes as part of a series of transactions by the insider over the past year, during which Cernuda has sold a total of 58,000 shares and made no purchases.Warning! GuruFocus has detected 8 Warning Sign with NTAP. Click here to check it out. NTAP 30-Year Financial DataThe intrinsic value of NTAPCesar Cernuda is a prominent figure in the tech industry, with a career spanning over two decades. He joined NetApp Inc, a company that provides software, systems, and services to manage and store customer data, as President in 2020. Under his leadership, NetApp has continued to innovate and expand its product offerings, solidifying its position in the data management market.NetApp Inc, headquartered in Sunnyvale, California, is a pioneer in the data management industry. The company's products and services are designed to help businesses manage and leverage their data more effectively. NetApp's offerings include cloud data services, data storage software, data infrastructure management, and data backup and recovery solutions. With a market cap of $16.51 billion, NetApp is a significant player in the tech sector.The insider's recent sell-off raises questions about the company's stock performance and valuation. On the day of the insider's recent sell, shares of NetApp Inc were trading at $79.44, giving the company a market cap of $16.51 billion. The price-earnings ratio stands at 14.30, lower than the industry median of 22.14 and the company's historical median price-earnings ratio.The insider transaction history for NetApp Inc shows a trend of more sells than buys over the past year. There have been 20 insider sells and 0 insider buys in total over the past year. This trend is illustrated in the following image:NetApp Inc President Cesar Cernuda Sells 22,000 SharesThe GF Value, an intrinsic value estimate developed by GuruFocus, is calculated based on historical multiples, a GuruFocus adjustment factor, and future estimates of business performance. With a price of $79.44 and a GuruFocus Value of $75.25, NetApp Inc has a price-to-GF-Value ratio of 1.06. This suggests that the stock is fairly valued based on its GF Value.Story continuesNetApp Inc President Cesar Cernuda Sells 22,000 SharesThe insider's recent sell-off, coupled with the company's valuation and the overall trend of insider sells over the past year, may suggest that the stock is currently fairly valued. However, investors should always conduct their own research and consider multiple factors before making investment decisions.This article first appeared on GuruFocus.]"
73,1fae6db3-90b9-385f-8600-9bd05409104b,VRTX,2023-09-10,A Bull Market Is (Still) Coming: Here Are 3 Spectacular Stocks to Buy Sooner Rather Than Later,Motley Fool,https://finance.yahoo.com/m/1fae6db3-90b9-385f-8600-9bd05409104b/a-bull-market-is-%28still%29.html,1694339520,STORY,"['AMZN', 'SHOP', 'VRTX', 'MA', '^GSPC']",[Many investors have been loudly heralding a new bull market for the S&amp;P 500. A bull market is (still) coming. Amazon is poised to become an even more dominant player in the logistics market thanks to its recent deal with Shopify.Continue reading]
