,Id,Company,Date,Title,Publisher,Link,ProviderPublishTime,Type,Related Company,Text
0,c0cd846a-beb3-3d6a-b86d-140c87c700bc,SCHW,2023-01-03,Should Schwab Fundamental U.S. Large Company Index ETF (FNDX) Be on Your Investing Radar?,Zacks,https://finance.yahoo.com/news/schwab-fundamental-u-large-company-112011082.html,1672744811,STORY,['SCHW'],"[Designed to provide broad exposure to the Large Cap Value segment of the US equity market, the Schwab Fundamental U.S. Large Company Index ETF (FNDX) is a passively managed exchange traded fund launched on 08/13/2013.The fund is sponsored by Charles Schwab. It has amassed assets over $9.93 billion, making it one of the larger ETFs attempting to match the Large Cap Value segment of the US equity market.Why Large Cap ValueCompanies that find themselves in the large cap category typically have a market capitalization above $10 billion. They tend to be stable companies with predictable cash flows and are usually less volatile than mid and small cap companies.Carrying lower than average price-to-earnings and price-to-book ratios, value stocks also have lower than average sales and earnings growth rates. Considering long-term performance, value stocks have outperformed growth stocks in almost all markets; however, they are more likely to underperform growth stocks in strong bull markets.CostsWhen considering an ETF's total return, expense ratios are an important factor, and cheaper funds can significantly outperform their more expensive counterparts in the long term if all other factors remain equal.Annual operating expenses for this ETF are 0.25%, putting it on par with most peer products in the space.It has a 12-month trailing dividend yield of 2.07%.Sector Exposure and Top HoldingsWhile ETFs offer diversified exposure, which minimizes single stock risk, a deep look into a fund's holdings is a valuable exercise. And, most ETFs are very transparent products that disclose their holdings on a daily basis.This ETF has heaviest allocation to the Information Technology sector--about 14.90% of the portfolio. Financials and Healthcare round out the top three.Looking at individual holdings, Apple Inc (AAPL) accounts for about 4.39% of total assets, followed by Exxon Mobil Corp (XOM) and Microsoft Corp (MSFT).The top 10 holdings account for about 19.55% of total assets under management.Story continuesPerformance and RiskFNDX seeks to match the performance of the Russell RAFI US Large Co. Index before fees and expenses. The Russell RAFI US Large Company Index measures the performance of the large company size segment by fundamental overall company scores.The ETF has added roughly 0% so far this year and is down about -6.94% in the last one year (as of 01/03/2023). In the past 52-week period, it has traded between $47.76 and $59.90.The ETF has a beta of 1.01 and standard deviation of 25.40% for the trailing three-year period, making it a medium risk choice in the space. With about 729 holdings, it effectively diversifies company-specific risk.AlternativesSchwab Fundamental U.S. Large Company Index ETF holds a Zacks ETF Rank of 2 (Buy), which is based on expected asset class return, expense ratio, and momentum, among other factors. Because of this, FNDX is an outstanding option for investors seeking exposure to the Style Box - Large Cap Value segment of the market. There are other additional ETFs in the space that investors could consider as well.The iShares Russell 1000 Value ETF (IWD) and the Vanguard Value ETF (VTV) track a similar index. While iShares Russell 1000 Value ETF has $54.20 billion in assets, Vanguard Value ETF has $97.90 billion. IWD has an expense ratio of 0.18% and VTV charges 0.04%.Bottom-LinePassively managed ETFs are becoming increasingly popular with institutional as well as retail investors due to their low cost, transparency, flexibility and tax efficiency. They are excellent vehicles for long term investors.To learn more about this product and other ETFs, screen for products that match your investment objectives and read articles on latest developments in the ETF investing universe, please visit Zacks ETF Center.Want the latest recommendations from Zacks Investment Research? Today, you can download 7 Best Stocks for the Next 30 Days. Click to get this free reportSchwab Fundamental U.S. Large Company Index ETF (FNDX): ETF Research ReportsApple Inc. (AAPL) : Free Stock Analysis ReportMicrosoft Corporation (MSFT) : Free Stock Analysis ReportExxon Mobil Corporation (XOM) : Free Stock Analysis ReportVanguard Value ETF (VTV): ETF Research ReportsiShares Russell 1000 Value ETF (IWD): ETF Research ReportsTo read this article on Zacks.com click here.Zacks Investment Research]"
1,a3b0c97b-a986-3829-b330-a4c0cdb8c7ad,SCHW,2023-01-03,Is SWCAX a Strong Bond Fund Right Now?,Zacks,https://finance.yahoo.com/news/swcax-strong-bond-fund-now-120012475.html,1672660812,STORY,['SCHW'],"[Mutual Fund Bond fund seekers should not consider taking a look at Schwab California Tax-Free Bond Fund (SWCAX) at this time. SWCAX possesses a Zacks Mutual Fund Rank of 4 (Sell), which is based on nine forecasting factors like size, cost, and past performance.History of Fund/ManagerSchwab Funds is based in San Francisco, CA, and is the manager of SWCAX. The Schwab California Tax-Free Bond Fund made its debut in February of 1992 and SWCAX has managed to accumulate roughly $419.85 million in assets, as of the most recently available information. The fund is currently managed by a team of investment professionals.PerformanceOf course, investors look for strong performance in funds. This fund in particular has delivered a 5-year annualized total return of 0.77%, and is in the middle third among its category peers. But if you are looking for a shorter time frame, it is also worth looking at its 3-year annualized total return of -1.21%, which places it in the bottom third during this time-frame.When looking at a fund's performance, it is also important to note the standard deviation of the returns. The lower the standard deviation, the less volatility the fund experiences. The standard deviation of SWCAX over the past three years is 5.32% compared to the category average of 5.39%. Over the past 5 years, the standard deviation of the fund is 4.35% compared to the category average of 4.44%. This makes the fund less volatile than its peers over the past half-decade.This fund has a beta of 0.64, meaning that it is less volatile than a broad market index of fixed income securities. Taking this into account, SWCAX has a negative alpha of -0.62, which measures performance on a risk-adjusted basis.ExpensesFor investors, taking a closer look at cost-related metrics is key, since costs are increasingly important for mutual fund investing. Competition is heating up in this space, and a lower cost product will likely outperform its otherwise identical counterpart, all things being equal. In terms of fees, SWCAX is a no load fund. It has an expense ratio of 0.38% compared to the category average of 0.79%. Looking at the fund from a cost perspective, SWCAX is actually cheaper than its peers.Story continuesInvestors need to be aware that with this product, the minimum initial investment is $0; each subsequent investment has no minimum amount.Bottom LineOverall, Schwab California Tax-Free Bond Fund ( SWCAX ) has a low Zacks Mutual Fund rank, and in conjunction with its comparatively similar performance, average downside risk, and lower fees, Schwab California Tax-Free Bond Fund ( SWCAX ) looks like a somewhat weak choice for investors right now.This could just be the start of your research on SWCAXin the Mutual Fund Bond category. Consider going to www.zacks.com/funds/mutual-funds for additional information about this fund, and all the others that we rank as well for additional information. Zacks provides a full suite of tools to help you analyze your portfolio - both funds and stocks - in the most efficient way possible.Want the latest recommendations from Zacks Investment Research? Today, you can download 7 Best Stocks for the Next 30 Days. Click to get this free reportGet Your Free (SWCAX): Fund Analysis ReportTo read this article on Zacks.com click here.Zacks Investment Research]"
2,d0a18e95-5f83-34c4-8bdc-d8311e0a554e,AYI,2023-01-03,Acuity Brands (AYI) Expected to Beat Earnings Estimates: Should You Buy?,Zacks,https://finance.yahoo.com/news/acuity-brands-ayi-expected-beat-150003624.html,1672671603,STORY,['AYI'],"[Wall Street expects a year-over-year decline in earnings on higher revenues when Acuity Brands (AYI) reports results for the quarter ended November 2022. While this widely-known consensus outlook is important in gauging the company's earnings picture, a powerful factor that could impact its near-term stock price is how the actual results compare to these estimates.The earnings report, which is expected to be released on January 9, 2023, might help the stock move higher if these key numbers are better than expectations. On the other hand, if they miss, the stock may move lower.While the sustainability of the immediate price change and future earnings expectations will mostly depend on management's discussion of business conditions on the earnings call, it's worth handicapping the probability of a positive EPS surprise.Zacks Consensus EstimateThis lighting maker is expected to post quarterly earnings of $2.82 per share in its upcoming report, which represents a year-over-year change of -1.1%.Revenues are expected to be $1 billion, up 8.3% from the year-ago quarter.Estimate Revisions TrendThe consensus EPS estimate for the quarter has been revised 1.08% higher over the last 30 days to the current level. This is essentially a reflection of how the covering analysts have collectively reassessed their initial estimates over this period.Investors should keep in mind that an aggregate change may not always reflect the direction of estimate revisions by each of the covering analysts.Earnings WhisperEstimate revisions ahead of a company's earnings release offer clues to the business conditions for the period whose results are coming out. This insight is at the core of our proprietary surprise prediction model -- the Zacks Earnings ESP (Expected Surprise Prediction).The Zacks Earnings ESP compares the Most Accurate Estimate to the Zacks Consensus Estimate for the quarter; the Most Accurate Estimate is a more recent version of the Zacks Consensus EPS estimate. The idea here is that analysts revising their estimates right before an earnings release have the latest information, which could potentially be more accurate than what they and others contributing to the consensus had predicted earlier.Story continuesThus, a positive or negative Earnings ESP reading theoretically indicates the likely deviation of the actual earnings from the consensus estimate. However, the model's predictive power is significant for positive ESP readings only.A positive Earnings ESP is a strong predictor of an earnings beat, particularly when combined with a Zacks Rank #1 (Strong Buy), 2 (Buy) or 3 (Hold). Our research shows that stocks with this combination produce a positive surprise nearly 70% of the time, and a solid Zacks Rank actually increases the predictive power of Earnings ESP.Please note that a negative Earnings ESP reading is not indicative of an earnings miss. Our research shows that it is difficult to predict an earnings beat with any degree of confidence for stocks with negative Earnings ESP readings and/or Zacks Rank of 4 (Sell) or 5 (Strong Sell).How Have the Numbers Shaped Up for Acuity Brands?For Acuity Brands, the Most Accurate Estimate is higher than the Zacks Consensus Estimate, suggesting that analysts have recently become bullish on the company's earnings prospects. This has resulted in an Earnings ESP of +7.71%.On the other hand, the stock currently carries a Zacks Rank of #3.So, this combination indicates that Acuity Brands will most likely beat the consensus EPS estimate.Does Earnings Surprise History Hold Any Clue?While calculating estimates for a company's future earnings, analysts often consider to what extent it has been able to match past consensus estimates. So, it's worth taking a look at the surprise history for gauging its influence on the upcoming number.For the last reported quarter, it was expected that Acuity Brands would post earnings of $3.35 per share when it actually produced earnings of $3.95, delivering a surprise of +17.91%.Over the last four quarters, the company has beaten consensus EPS estimates four times.Bottom LineAn earnings beat or miss may not be the sole basis for a stock moving higher or lower. Many stocks end up losing ground despite an earnings beat due to other factors that disappoint investors. Similarly, unforeseen catalysts help a number of stocks gain despite an earnings miss.That said, betting on stocks that are expected to beat earnings expectations does increase the odds of success. This is why it's worth checking a company's Earnings ESP and Zacks Rank ahead of its quarterly release. Make sure to utilize our Earnings ESP Filter to uncover the best stocks to buy or sell before they've reported.Acuity Brands appears a compelling earnings-beat candidate. However, investors should pay attention to other factors too for betting on this stock or staying away from it ahead of its earnings release.Stay on top of upcoming earnings announcements with the Zacks Earnings Calendar.Want the latest recommendations from Zacks Investment Research? Today, you can download 7 Best Stocks for the Next 30 Days. Click to get this free reportAcuity Brands Inc (AYI) : Free Stock Analysis ReportTo read this article on Zacks.com click here.Zacks Investment Research]"
3,3a09b857-a665-3755-bdc1-c2b3e7c24dd5,UNM,2023-01-03,"Zacks.com featured highlights PVH, Signet Jewelers, Unum Group, Aercap and Sterling Infrastructure",Zacks,https://finance.yahoo.com/news/zacks-com-featured-highlights-pvh-094009186.html,1672738809,STORY,"['SIG', 'UNM', 'PVH', 'AER']","[For Immediate ReleaseChicago, IL – January 3, 2023 – Stocks in this week’s article are PVH Corp. PVH, Signet Jewelers SIG, Unum Group UNM, Aercap AER and Sterling Infrastructure STRL.5 Low Price-to-Book Stocks to Buy in the New YearValue investors have, over the years, preferred price-to-earnings ratio or P/E as a means to identify value stocks. However, in the case of loss-making companies that have a negative price-to-earnings ratio, the price-to-sales or P/S ratio is considered in determining their true value.However, the price-to-book ratio (P/B ratio), though used less often, is also an easy-to-use valuation tool for identifying low-priced stocks with great returns.The P/B ratio is calculated as below:P/B ratio = market capitalization/book value of equityThe P/B ratio helps to identify low-priced stocks that have high growth prospects. PVH Corp., Signet Jewelers, Unum Group, Aercap and Sterling Infrastructure are some such stocks.Now let us understand the concept of book value.What’s Book Value?Book value is the total value that would be left over, according to the company’s balance sheet, if it goes bankrupt immediately. In other words, this is what shareholders would theoretically receive if a company liquidates all its assets after paying off all its liabilities.It is calculated by subtracting total liabilities from the total assets of a company. In most cases, this equates to the common stockholders’ equity on the balance sheet. However, depending on the company’s balance sheet, intangible assets should also be subtracted from the total assets to determine book value.Understanding P/B RatioBy comparing the book value of equity to its market price, we get an idea of whether a company is under-or overpriced. However, like P/E or P/S ratio, it is always better to compare P/B ratios within industries.A P/B ratio of less than one means that the stock is trading at less than its book value, or the stock is undervalued and, therefore a good buy. Conversely, a stock with a ratio greater than one can be interpreted as being overvalued or relatively expensive.Story continuesFor example, a stock with a P/B ratio of 2 means that we pay $2 for every $1 of book value. Thus, the higher the P/B, the more expensive the stock.But there is a caveat. A P/B ratio of less than one can also mean that the company is earning weak or even negative returns on its assets or that the assets are overstated, in which case the stock should be shunned because it may be destroying shareholder value. Conversely, the stock’s price may be significantly high — thereby pushing the P/B ratio to more than one — in the likely case that it has become a takeover target, a good enough reason to own the stock.Moreover, the P/B ratio isn't without limitations. It is useful for businesses — like finance, investments, insurance, and banking or manufacturing companies — with many liquid/tangible assets on the books. However, it can be misleading for firms with significant R&amp;D expenditure, high debt, service companies, or those with negative earnings.In any case, the ratio is not particularly relevant as a standalone number. One should analyze other ratios like P/E, P/S and debt to equity before arriving at a reasonable investment decision.Here are our five picks out of the 10 stocks that qualified the screening:PVH Corp. specializes in designing and marketing branded dress shirts, neckwear, sportswear, jeanswear, intimate apparel, swim products, footwear, handbags and related products.PVH Corp. has a Zacks Rank #2 and a Value Score of A. You can see the complete list of today’s Zacks #1 Rank stocks here.PVH Corp. has a projected 3–5 year EPS growth rate of 10.22%.Signet Jewelers is a retailer of diamond jewelry, watches as well as other products. The company operates in the United States, Canada, the U.K., the Republic of Ireland and the Channel Islands.Signet Jewelers has a projected 3–5-year EPS growth rate of 8%. SIG currently has a Zacks Rank #1 and a Value Score of B.Unum Group was created following the June 1999 merger of Provident Companies and Unum Corporation. Along with disability insurance, the company provides long-term care insurance, life insurance, employer- and employee-paid group benefits and related services.Unum Group has a Zacks Rank #2 and a Value Score of A. Unum Group has a projected 3–5 year EPS growth rate of 12.24%.AerCap is the global leader in aviation leasing with an attractive order book in the industry. AerCap serves approximately 300 customers around the world with its comprehensive fleet solutions.AerCap currently carries a Zacks Rank #2 and has a Value Score of A. It also has an impressive five-year expected growth rate of 8.2%.Sterling Infrastructure operates through subsidiaries within segments specializing in E-Infrastructure, Building and Transportation Solutions. E-Infrastructure Solutions projects develop advanced, large-scale site development systems and services for data centers, e-commerce distribution centers, warehousing, transportation, energy and more. Building Solutions projects include residential and commercial concrete foundations for single-family and multi-family homes, parking structures, elevated slabs and other concrete work. Transportation Solutions includes infrastructure and rehabilitation projects for highways, roads, bridges, airports, ports, light rail, water, wastewater and storm drainage systems.Sterling Infrastructure has a projected 3-5-year EPS growth rate of 18%. Sterling Infrastructure currently has a Zacks Rank #1 and a Value Score of B.Get the rest of the stocks on the list and startputting this and other ideas to the test. It can all be done with the Research Wizard stock picking and backtesting software.The Research Wizard is a great place to begin. It's easy to use. Everything is in plain language. And it's very intuitive. Start your Research Wizard trial today. And the next time you read an economic report, open up the Research Wizard, plug your finds in, and see what gems come out.Click here to sign up for a free trial to the Research Wizard today.For the rest of this Screen of the Week article please visit Zacks.com at: https://www.zacks.com/stock/news/2033853/5-low-price-to-book-stocks-to-buy-in-the-new-yearDisclosure: Officers, directors and/or employees of Zacks Investment Research may own or have sold short securities and/or hold long and/or short positions in options that are mentioned in this material. An affiliated investment advisory firm may own or have sold short securities and/or hold long and/or short positions in options that are mentioned in this material.About Screen of the WeekZacks.com created the first and best screening system on the web earning the distinction as the ""#1 site for screening stocks"" by Money Magazine.  But powerful screening tools is just the start. That is why Zacks created the Screen of the Week to highlight profitable stock picking strategies that investors can actively use.Strong Stocks that Should Be in the NewsMany are little publicized and fly under the Wall Street radar. They're virtually unknown to the general public. Yet today's 220 Zacks Rank #1 ""Strong Buys"" were generated by the stock-picking system that has more than doubled the market from 1988 through 2016. Its average gain has been a stellar +25% per year. See these high-potential stocks free &gt;&gt;.Follow us on Twitter:  https://www.twitter.com/zacksresearchJoin us on Facebook:  https://www.facebook.com/ZacksInvestmentResearchZacks Investment Research is under common control with affiliated entities (including a broker-dealer and an investment adviser), which may engage in transactions involving the foregoing securities for the clients of such affiliates.Contact: Jim GiaquintoCompany: Zacks.comPhone: 312-265-9268Email: pr@zacks.comVisit: https://www.zacks.com/Zacks.com provides investment resources and informs you of these resources, which you may choose to use in making your own investment decisions. Zacks is providing information on this resource to you subject to the Zacks ""Terms and Conditions of Service"" disclaimer. www.zacks.com/disclaimer. Past performance is no guarantee of future results. Inherent in any investment is the potential for loss. This material is being provided for informational purposes only and nothing herein constitutes investment, legal, accounting or tax advice, or a recommendation to buy, sell or hold a security. No recommendation or advice is being given as to whether any investment is suitable for a particular investor. It should not be assumed that any investments in securities, companies, sectors or markets identified and described were or will be profitable. All information is current as of the date of herein and is subject to change without notice. Any views or opinions expressed may not reflect those of the firm as a whole. Zacks Investment Research does not engage in investment banking, market making or asset management activities of any securities. These returns are from hypothetical portfolios consisting of stocks with Zacks Rank = 1 that were rebalanced monthly with zero transaction costs. These are not the returns of actual portfolios of stocks. The S&amp;P 500 is an unmanaged index. Visit https://www.zacks.com/performance  for information about the performance numbers displayed in this press release.Want the latest recommendations from Zacks Investment Research? Today, you can download 7 Best Stocks for the Next 30 Days. Click to get this free reportUnum Group (UNM) : Free Stock Analysis ReportSignet Jewelers Limited (SIG) : Free Stock Analysis ReportPVH Corp. (PVH) : Free Stock Analysis ReportSterling Infrastructure, Inc. (STRL) : Free Stock Analysis ReportAercap Holdings N.V. (AER) : Free Stock Analysis ReportTo read this article on Zacks.com click here.Zacks Investment Research]"
