,Id,Company,Date,Title,Publisher,Link,ProviderPublishTime,Type,Related Company,Text
32,1e72211d-4f39-3aee-9677-9cd31f6c30ab,MA,2023-09-10,Marathon Digital Holdings Announces Private Exchanges of Approximately $417 Million of 1.00% Convertible Notes Due 2026 for Shares of Common Stock,GlobeNewswire,https://finance.yahoo.com/news/marathon-digital-holdings-announces-private-124500911.html,1694177100,STORY,['MARA'],"[Marathon Digital Holdings Inc.Fort Lauderdale, FL, Sept. 08, 2023 (GLOBE NEWSWIRE) -- Marathon Digital Holdings, Inc. (NASDAQ:MARA) (""Marathon"" or ""Company""), today announced that the Company has entered into privately negotiated exchange agreements with certain holders of its 1.00% Convertible Senior Notes due 2026 (the “Notes”) to exchange approximately $417 million aggregate principal amount of the Notes held by such holders (the “Exchanges”) for an aggregate of approximately 26.2 million newly issued shares of Marathon common stock (based upon the per share closing price of the Company’s common stock as of September 7, 2023), pursuant to an exemption from registration provided in Section 4(a)(2) of the Securities Act of 1933, as amended. Marathon will not receive any cash proceeds from the issuance of the shares of its common stock, and the final number of shares that Marathon will issue will be determined over a number of days. Marathon will also pay investors in cash for accrued and unpaid interest on the exchanged Notes. In certain circumstances during a short period following today’s announcement the transaction size could be reduced or the entire transaction could be canceled.After completing the Exchanges approximately $331 million aggregate principal amount of the Notes will remain outstanding. The Exchanges could affect the market price of Marathon’s common stock.This press release shall not constitute an offer to sell or the solicitation of an offer to buy the Notes, shares of the Company’s common stock or any other securities and shall not constitute an offer, solicitation or sale in any jurisdiction in which such offering, solicitation or sale would be unlawful.Investor NoticeInvesting in our securities involves a high degree of risk. Before making an investment decision, you should carefully consider the risks, uncertainties and forward-looking statements described under ""Risk Factors"" in Item 1A of our most recent Annual Report on Form 10-K for the fiscal year ended December 31, 2022, filed with the SEC on March 16, 2023. If any of these risks were to occur, our business, financial condition or results of operations would likely suffer. In that event, the value of our securities could decline, and you could lose part or all of your investment. The risks and uncertainties we describe are not the only ones facing us. Additional risks not presently known to us or that we currently deem immaterial may also impair our business operations. In addition, our past financial performance may not be a reliable indicator of future performance, and historical trends should not be used to anticipate results in the future. Future changes in the network-wide mining difficulty rate or Bitcoin hash rate may also materially affect the future performance of Marathon's production of bitcoin. Additionally, all discussions of financial metrics assume mining difficulty rates as of September 2023. See ""Forward-Looking Statements"" below.Story continuesForward-Looking StatementsStatements made in this press release include forward-looking statements within the meaning of Section 27A of the Securities Act of 1933, as amended, and Section 21E of the Securities Exchange Act of 1934. Forward-looking statements can be identified by the use of words such as “may,” “will,” “plan,” “should,” “expect,” “anticipate,” “estimate,” “continue,” or comparable terminology. Such forward-looking statements are inherently subject to certain risks, trends and uncertainties, many of which the Company cannot predict with accuracy and some of which the Company might not even anticipate and involve factors that may cause actual results to differ materially from those projected or suggested. Readers are cautioned not to place undue reliance on these forward-looking statements and are advised to consider the factors listed above together with the additional factors under the heading “Risk Factors” in the Company's Annual Reports on Form 10-K, as may be supplemented or amended by the Company's Quarterly Reports on Form 10-Q. The Company assumes no obligation to update or supplement forward-looking statements that become untrue because of subsequent events, new information or otherwise.About Marathon Digital HoldingsMarathon is a digital asset technology company that focuses on supporting and securing the Bitcoin ecosystem. The Company is currently in the process of becoming one of the largest and most sustainably powered Bitcoin mining operations in North America.For more information, visit www.mara.com, or follow us on:Twitter: @MarathonDHLinkedIn: www.linkedin.com/company/marathon-digital-holdingsFacebook: www.facebook.com/MarathonDigitalHoldings Instagram: @marathondigitalholdingsMarathon Digital Holdings Company Contact: Telephone: 800-804-1690Email: ir@mara.comMarathon Digital Holdings Media Contact:Email: marathon@wachsman.com]"
33,7ff0374f-0aef-3519-ba11-f62e2a3db20f,MA,2023-09-10,UPDATE 1-World food price index back at two-year low despite rice surge -FAO,Reuters,https://finance.yahoo.com/news/1-world-food-price-index-083358208.html,1694162038,STORY,"['KW=F', 'SB=F', 'RR=F']","[(Adds details, background in paragraph 3 and from paragraph 5)PARIS, Sept 8 (Reuters) - The United Nations food agency's world price index fell in August to a new two-year low, reversing a rebound seen the previous month, as a decline in most food commodities offset increases for rice and sugar.The Food and Agriculture Organization's (FAO) price index, which tracks the most globally traded food commodities, averaged 121.4 points in August against a revised 124.0 for the previous month, the agency said on Friday.The July reading was initially given as 123.9 in a rebound from a two-year low in June.The August figure was the lowest since March 2021 and also 24% below an all-time high reached in March 2022 in the wake of Russia's invasion of Ukraine.The drop in the overall index reflected declines for dairy products, vegetable oils, meat and cereals, despite a jump in FAO's rice benchmark to a 15-year high following Indian export restrictions, the agency said.FAO's cereal index edged down 0.7% from July as wheat prices fell in the face of northern hemisphere harvests while maize (corn) fell for a seventh straight month to a near three-year low, pressured by a record Brazilian crop and the approaching U.S. harvest, it said.In contrast, the agency's rice index surged by almost 10% month-on-month as India's decision in July to ban Indica white rice exports disrupted trade at a time of tight availabilities ahead of new-crop harvests, FAO said.FAO's sugar index rose 1.3% month-on-month in August, putting it 34% above the year-earlier level, supported by concerns about impact of the El Nino weather pattern on global production.Vegetable oil prices were down 3.1% in August, while dairy prices slipped 4%, an eighth straight monthly drop that reflected ample supply in Oceania and slower Chinese imports.In a separate report on cereal supply and demand, the FAO forecast world cereal production this year at 2.815 billion tonnes, down slightly from a previous estimate of 2.819 billion.The latest forecast was nonetheless up 0.9% on 2022 and matched record output from 2021, the FAO said.The downward revision mainly reflected a cut to projected wheat output as dry weather affected Canada and the European Union and heavy rain affected Chinese crops, FAO said. (Reporting by Gus Trompiz; Editing by Hugh Lawson and Andrew Cawthorne)]"
34,625baf3a-83a9-310f-8963-1946646b27d0,MA,2023-09-10,World food price index back at two-year low despite rice surge -FAO,Reuters,https://finance.yahoo.com/news/world-food-price-index-falls-080245317.html,1694160165,STORY,"['SB=F', 'RR=F', 'KW=F']","[PARIS (Reuters) -The United Nations food agency's world price index fell in August to a new two-year low, reversing a rebound seen the previous month, as a decline in most food commodities offset increases for rice and sugar.The Food and Agriculture Organization's (FAO) price index, which tracks the most globally traded food commodities, averaged 121.4 points in August against a revised 124.0 for the previous month, the agency said on Friday.The July reading was initially given as 123.9 in a rebound from a two-year low in June.The August figure was the lowest since March 2021 and also 24% below an all-time high reached in March 2022 in the wake of Russia's invasion of Ukraine.The drop in the overall index reflected declines for dairy products, vegetable oils, meat and cereals, despite a jump in FAO's rice benchmark to a 15-year high following Indian export restrictions, the agency said.FAO's cereal index edged down 0.7% from July as wheat prices fell in the face of northern hemisphere harvests while maize (corn) fell for a seventh straight month to a near three-year low, pressured by a record Brazilian crop and the approaching U.S. harvest, it said.In contrast, the agency's rice index surged by almost 10% month-on-month as India's decision in July to ban Indica white rice exports disrupted trade at a time of tight availabilities ahead of new-crop harvests, FAO said.FAO's sugar index rose 1.3% month-on-month in August, putting it 34% above the year-earlier level, supported by concerns about impact of the El Nino weather pattern on global production.Vegetable oil prices were down 3.1% in August, while dairy prices slipped 4%, an eighth straight monthly drop that reflected ample supply in Oceania and slower Chinese imports.In a separate report on cereal supply and demand, the FAO forecast world cereal production this year at 2.815 billion tonnes, down slightly from a previous estimate of 2.819 billion.Story continuesThe latest forecast was nonetheless up 0.9% on 2022 and matched record output from 2021, the FAO said.The downward revision mainly reflected a cut to projected wheat output as dry weather affected Canada and the European Union and heavy rain affected Chinese crops, FAO said.(Reporting by Gus Trompiz; Editing by Hugh Lawson and Andrew Cawthorne)]"
35,b822ee9a-b807-3998-b31e-e9d47da50fd5,MA,2023-09-10,World food price index falls back to two-year low -FAO,Reuters,https://finance.yahoo.com/news/world-food-price-index-falls-080000441.html,1694160000,STORY,"['SB=F', 'RR=F']","[PARIS, Sept 8 (Reuters) - The United Nations food agency's world price index fell in August to a new two-year low, reversing a rebound seen the previous month, as a decline in most food commodities offset increases for rice and sugar.The Food and Agriculture Organization's (FAO) price index, which tracks the most globally traded food commodities, averaged 121.4 points in August against a revised 124.0 for the previous month, the agency said on Friday.The August reading was the lowest since March 2021 and also 24% below an all-time high reached in March 2022 in the wake of Russia's invasion of Ukraine.In a separate report on cereal supply and demand, the FAO forecast world cereal production this year at 2.815 billion tonnes, down slightly from a previous estimate of 2.819 billion.The revised forecast was nonetheless up 0.9% on 2022 and matched record output from 2021, the FAO said. (Reporting by Gus Trompiz; Editing by Hugh Lawson)]"
36,4a8d767e-8ff4-33f9-845d-e4724aee910e,JNJ,2023-09-10,Bargain Hunting With $100? This New S&P 500 Dividend Stock Is a No-Brainer to Buy on the Dip,Motley Fool,https://finance.yahoo.com/m/4a8d767e-8ff4-33f9-845d-e4724aee910e/bargain-hunting-with-%24100%3F.html,1694340000,STORY,"['^GSPC', 'JNJ']","[The market may be sleeping on this dividend stock, down 19% in its short history as a stand-alone business.Continue reading]"
37,72558de3-a7f7-3d59-8510-c35475041bf9,MDT,2023-09-10,7 Stocks Hedge Funds Are Loading Up On,InvestorPlace,https://finance.yahoo.com/news/7-stocks-hedge-funds-loading-212233762.html,1693776153,STORY,"['MDT', 'GSK', 'JPM', 'TMO', 'NVDA', 'WMT', 'CRM']","[Emulating the moves of hedge fund stock pickers, and some of the most successful hedge funds can produce sizable profits for retail investors. In fact, here are seven of the top institutional stock picks you may want to consider as we near the last few months of 2023.Top Institutional Stock Picks: GSK (GSK)A GlaxoSmithKline (GSK) office in London.Source: Willy Barton / Shutterstock.comAt the end of the second quarter, 35 hedge funds had bullish positions in GSK (NYSE:GSK), up from 33 at the end of Q1. Moreover, Ken Fisher, the highly successful, multi-billionaire hedge fund had 13.8 million shares of the name as of June 30.According to the research firm GlobalData, GSK’s Arexvy, a vaccine for the RSV virus, will generate $2.5 billion in sales for the firm between 2023 and 2029. In addition, in line with my previous predictions, the company’s cancer treatment, Jemperli continues to be approved for new indications. For example, the US FDA approved it as a treatment for a type of primary advanced or recurrent endometrial cancer on July 31. I continue to believe that the drug will be a huge revenue generator for GSK over the longer term. GSK stock has a very low forward price-earnings (P/E) ratio of just 9.5 and a high dividend yield of  3.9%.InvestorPlace - Stock Market News, Stock Advice &amp; Trading TipsMedtronic (MDT)Medtronic (MDT) sign outside office building representing healthcare stocksSource: JHVEPhoto / Shutterstock.comAt the end of Q2, 63 hedge funds owned shares of medical device maker Medtronic (NYSE:MDT), up from 52 at the end of Q1. Moreover, Ken Fisher’s Fisher Asset Management owned 3.2 million shares of MDT as of June 30.According to the Appleseed Fund, another hedge fund that owns MDT stock, “Medtronic is the world’s largest device manufacturer, and it holds the number one or number two market share in most of its product segments.” Appleseed added that MDT’s products tend to facilitate “complicated in-patient procedures, which are typically quite profitable.” The fund expects MDT to benefit from the aging population in Western countries “and the growth of improved healthcare in emerging markets.”Story continuesLast quarter, MDT’s sales climbed about 5% versus the same period a year earlier while its bottom line rose about 6% year-over-year. The company slightly raised its full-year earnings per share guidance and has a low forward price-earnings ratio of 16.Walmart (WMT)Image of Walmart (WMT) logo on Walmart store with clear blue sky in the backgroundSource: Jonathan Weiss / Shutterstock.comAs of the end of Q2, 91 hedge funds had obtained stakes in Walmart (NYSE:WMT), and institutional investors added 60.68 million of its shares last quarter while unloading just 36.795 million. Among prominent hedge funds, D.E. Shaw increased its stake by 13.9%, while Neuberger Berman increased its ownership of WMT stock by 45.3%.Last quarter, WMT’s U.S. comparable sales jumped an impressive 6.4% versus the same period a year earlier, and its operating income, excluding certain items, soared 8% year-over-year. WMT raised its 2023 EPS guidance to a range of $6.36 and $6.46 from $6.10 and $6.20.Thermo Fisher Scientific (TMO)A Thermo Fisher Scientific sign out front of an office in Silicon Valley, California.Source: Michael Vi / Shutterstock.comThermo Fisher Scientific (NYSE:TMO) sells products to life sciences companies and organizations. As of the end of Q2, 98 hedge funds owned TMO stock, while institutional investors added 21.78 million shares of the name last quarter and sold only 17.93 million units. Among top hedge funds, T. Rowe Prince increased its stake in TMO by 6.2% last quarter, while TCI Fund Management’s stake soared by 280% to 3.17 million shares and Arthur M. Cohen &amp; Associates’ holding jumped 30,904% to 3.12 million shares.In a letter to its investors, hedge fund Polen Global Growth Strategy said TMO is “well balanced (and) durable, (with) a strong management team at the helm.”JPMorgan (JPM)JPMorgan Chase (JPM) lettering on a corporate office in New York City.Source: Roman Tiraspolsky / Shutterstock.comAs of the end of Q2, 112 hedge funds were long JPMorgan (NYSE:JPM), up from 100 as of the end of Q1. Last quarter, 1,804 institutions increased their stakes in JPM by 60.6 million shares, while 1,633 institutions lowered their stakes by 58.06 million shares, making it one of the top institutional stock picks. Among prominent hedge funds, Wellington Management raised its stake in JPM by 1.6% to 37.8 million shares, while T. Rowe Price added 1.1% to 33.13 million shares.According to hedge fund Manole Capital Management,  the bank “now has 13% of total US deposits and it manages 21% of America’s credit card spending.” Manole Capital also believes that JPM’s large size is “a competitive advantage” for it. JPM stock has a very low forward price-earnings ratio of just 9.7, and its net income jumped to $14.47 billion last quarter from $8.65 billion during the same period a year earlier.Nvidia (NVDA)Nvidia (NVDA) logo and sign on headquarters. Blurred foreground with green treesSource: Michael Vi / Shutterstock.comAs of the end of Q2, 132 hedge funds owned Nvidia (NASDAQ:NVDA) stock versus 106 at the end of Q1. In Q2, 1,558 institutions increased their positions in NVDA by 91.575 million shares, while 1,858 institutions lowered their stakes by 76.4 million shares, making it one of the top institutional stock picks.Among prominent hedge funds, Geode Capital increased its stake by 3% or 1.4 million shares while Wellington Management Group added 2.9 million shares, raising its stake by 39%. Well-respected analyst Dan Ives was very enthusiastic about Nvidia’s recently reported Q2 results, calling its report a “historical moment for the broader tech sector” and saying its “guidance and commentary (were at a)  drop the mic level.” Ives also compared NVDA to elite professional athletes.Salesforce (CRM)lose up of Salesforce (CRM) logo displayed on one of their towers in downtown San Francisco. Salesforce layoffsSource: Sundry Photography / Shutterstock.comAs of June 30, 136 hedge funds had long positions in Salesforce (NYSE:CRM), way up from 117 as of the end of Q1. Harris Associates had the largest position of any hedge fund, as it owned 7.7 million shares of CRM. Last quarter, 1,120 financial institutions increased their holdings in CRM by 52.3 million shares, while 1,047 of them reduced their stakes by 54.4 million units.Among prominent hedge funds, Capital World Investors raised its stake by 30% of 4.46 million shares while Nuveen Asset Management raised its holdings by 11.5% or 1.03 million shares. JPMorgan raised its price target on CRM stock to $240 from $230 and stated that the company is “infusing Generative AI capabilities into its clouds.”On the date of publication, Larry Ramer did not hold (either directly or indirectly) any positions in the securities mentioned in this article. The opinions expressed in this article are those of the writer, subject to the InvestorPlace.com Publishing Guidelines.Larry Ramer has conducted research and written articles on U.S. stocks for 15 years. He has been employed by The Fly and Israel’s largest business newspaper, Globes. Larry began writing columns for InvestorPlace in 2015. Among his highly successful, contrarian picks have been PLUG, XOM and solar stocks. You can reach him on Stocktwits at @larryramer.More From InvestorPlaceMusk’s “Project Omega” May Be Set to Mint New Millionaires. Here’s How to Get In.ChatGPT IPO Could Shock the World, Make This Move Before the AnnouncementIt doesn’t matter if you have $500 or $5 million. Do this now.The post 7 Stocks Hedge Funds Are Loading Up On appeared first on InvestorPlace.]"
38,f7a0fe84-4fd5-3060-b514-1adc91538e1d,WFC,2023-09-10,"Insiders At Wells Fargo Sold US$1.6m In Stock, Alluding To Potential Weakness",Simply Wall St.,https://finance.yahoo.com/news/insiders-wells-fargo-sold-us-120047720.html,1694347247,STORY,['WFC'],"[In the last year, many Wells Fargo &amp; Company (NYSE:WFC) insiders sold a substantial stake in the company which may have sparked shareholders' attention. When evaluating insider transactions, knowing whether insiders are buying versus if they selling is usually more beneficial, as the latter can be open to many interpretations. However, if numerous insiders are selling, shareholders should investigate more.While we would never suggest that investors should base their decisions solely on what the directors of a company have been doing, we would consider it foolish to ignore insider transactions altogether. See our latest analysis for Wells Fargo The Last 12 Months Of Insider Transactions At Wells FargoOver the last year, we can see that the biggest insider sale was by the insider, Kleber Santos, for US$1.6m worth of shares, at about US$46.27 per share. While insider selling is a negative, to us, it is more negative if the shares are sold at a lower price. The silver lining is that this sell-down took place above the latest price (US$41.00). So it may not shed much light on insider confidence at current levels.In total, Wells Fargo insiders sold more than they bought over the last year. The chart below shows insider transactions (by companies and individuals) over the last year. If you click on the chart, you can see all the individual transactions, including the share price, individual, and the date!insider-trading-volumeIf you like to buy stocks that insiders are buying, rather than selling, then you might just love this free list of companies. (Hint: insiders have been buying them).Insider OwnershipLooking at the total insider shareholdings in a company can help to inform your view of whether they are well aligned with common shareholders. We usually like to see fairly high levels of insider ownership. Wells Fargo insiders own 0.07% of the company, currently worth about US$109m based on the recent share price. This kind of significant ownership by insiders does generally increase the chance that the company is run in the interest of all shareholders.Story continuesSo What Do The Wells Fargo Insider Transactions Indicate?There haven't been any insider transactions in the last three months -- that doesn't mean much. While we feel good about high insider ownership of Wells Fargo, we can't say the same about the selling of shares. While we like knowing what's going on with the insider's ownership and transactions, we make sure to also consider what risks are facing a stock before making any investment decision. In terms of investment risks, we've identified 1 warning sign with Wells Fargo and understanding it should be part of your investment process.If you would prefer to check out another company -- one with potentially superior financials -- then do not miss this free list of interesting companies, that have HIGH return on equity and low debt.For the purposes of this article, insiders are those individuals who report their transactions to the relevant regulatory body. We currently account for open market transactions and private dispositions of direct interests only, but not derivative transactions or indirect interests.Have feedback on this article? Concerned about the content? Get in touch with us directly. Alternatively, email editorial-team (at) simplywallst.com.This article by Simply Wall St is general in nature. We provide commentary based on historical data and analyst forecasts only using an unbiased methodology and our articles are not intended to be financial advice. It does not constitute a recommendation to buy or sell any stock, and does not take account of your objectives, or your financial situation. We aim to bring you long-term focused analysis driven by fundamental data. Note that our analysis may not factor in the latest price-sensitive company announcements or qualitative material. Simply Wall St has no position in any stocks mentioned.]"
39,cb50a1fa-5114-316f-b939-6c4848a87b3c,WFC,2023-09-10,Wells Fargo Pays $40 Million to Customers for Excessive Fees,Motley Fool,https://finance.yahoo.com/m/cb50a1fa-5114-316f-b939-6c4848a87b3c/wells-fargo-pays-%2440-million.html,1694347217,STORY,['WFC'],"[After overcharging customers for nearly a decade, Wells Fargo is now making restitution. Keep reading to learn more about what happened.Continue reading]"
40,854a153a-f358-324b-85fd-db6911712fdc,PFE,2023-09-10,3 Top Healthcare Stocks to Buy for September,Motley Fool,https://finance.yahoo.com/m/854a153a-f358-324b-85fd-db6911712fdc/3-top-healthcare-stocks-to.html,1694265300,STORY,"['PFE', 'UNH', 'NVO']","[Healthcare is an evergreen frontier for investing. An endless need for better treatments and cures demands innovation and growth, which isn't a bad place to find long-term winners you can stick in a diversified portfolio. Here are three quality healthcare stocks you should consider buying this month.Continue reading]"
