,Id,Company,Date,Title,Publisher,Link,ProviderPublishTime,Type,Related Company,Text
0,aadc837b-c0f7-388e-abe2-44de87775b2f,SCHW,2023-03-25,Here's Why Schwab Stock Looks Like a Steal Right Now,Motley Fool,https://finance.yahoo.com/m/aadc837b-c0f7-388e-abe2-44de87775b2f/here%27s-why-schwab-stock-looks.html,1679734920,STORY,"['SIVB', 'SCHW']","[After the recent collapse of Silicon Valley Bank and Signature Bank, investors sent Schwab shares down sharply in fears it could follow suit. That looks very unlikely.Continue reading]"
1,970a8057-9151-383d-b237-707ed8c51451,SCHW,2023-03-25,Charles Schwab Stock Got Hit in the Bank Mess. Be Careful.,Barrons.com,https://finance.yahoo.com/m/970a8057-9151-383d-b237-707ed8c51451/charles-schwab-stock-got-hit.html,1679692500,STORY,['SCHW'],[The brokerage’s stock has plunged by more than a third this year as customers yank cash from low-yielding “sweep” accounts. What’s ahead.Continue reading]
2,8f7db930-f573-3b7a-a282-a46918b8249c,SCHW,2023-03-25,LPL Financial's (LPLA) February Metrics Down on Weak Markets,Zacks,https://finance.yahoo.com/news/lpl-financials-lpla-february-metrics-130501625.html,1679663101,STORY,"['LPLA', 'SCHW']","[LPL Financial's LPLA total brokerage and advisory assets were $1.15 trillion at the end of February 2023, decreasing 1.5% from the prior month but growing 0.3% year over year. The fall in LPLA’s assets balance from the January 2023 level was mainly due to weak market performance.Of LPLA’s total assets, brokerage assets were $541.7 billion and advisory assets amounted to $606.1 billion. Brokerage assets were down 1.5% from January 2023 but increased 1.8% year over year. Advisory assets declined 1.5% from the prior month and 1.1% from February 2022.LPL Financial’s total net new assets (NNAs) were $5.2 billion in the reported month. NNAs were $8.6 billion and $5.2 billion in January 2023 and February 2022, respectively.The company reported $56.2 billion of total client cash balance, down 5.9% from January 2023 and 7% from February 2022. Of the total balance, $40.7 billion was insured cash and $10.3 billion was deposit cash, while the remaining was money-market balance.Additionally, LPLA provided an update to its total client cash balance as of Mar 22, given the current market condition. The company noted that total client cash balances were down marginally from the February level, while net buying activity was elevated.LPL Financial’s recruiting efforts and solid advisor productivity will aid advisory revenues. Also, it is expanding through strategic buyouts on the back of a solid balance sheet position. However, the challenging operating backdrop is a major near-term headwind.The stock has gained 8.7% over the past year against a 15.8% decline witnessed by the industry.Zacks Investment ResearchImage Source: Zacks Investment ResearchLPLA currently carries a Zacks Rank #3 (Hold). You can see the complete list of today’s Zacks #1 Rank (Strong Buy) stocks here.Competitive LandscapeA couple of other brokerage firms that have already come out with monthly data for February are Interactive Brokers Group IBKR and Charles Schwab SCHW.Interactive Brokers’ Electronic Brokerage segment announced performance metrics for February 2023. The segment (dealing with the clearance and settlement of trades for individual and institutional clients globally) reported a rise in client Daily Average Revenue Trades (DARTs) on a sequential basis. On a year-over-year basis, client DARTs declined.Total client DARTs for the month were 2,121,000, up 7% from the January 2023 level but down 13% year over year. On an annualized basis, IBKR recorded Cleared Average DARTs per customer account of 222. The metric increased 5% sequentially but fell 30% from the prior-year period.Schwab released its monthly activity report for February 2023. Core net new assets were $41.7 billion in the reported month, up 16% sequentially and 3% year over year.SCHW’s total client assets were $7.38 trillion, down 1% from January 2023 and 4% from February 2022. Client assets receiving ongoing advisory services were $3.81 trillion, down 2% from the prior month as well as year over year.Story continuesWant the latest recommendations from Zacks Investment Research? Today, you can download 7 Best Stocks for the Next 30 Days. Click to get this free reportThe Charles Schwab Corporation (SCHW) : Free Stock Analysis ReportInteractive Brokers Group, Inc. (IBKR) : Free Stock Analysis ReportLPL Financial Holdings Inc. (LPLA) : Free Stock Analysis ReportTo read this article on Zacks.com click here.Zacks Investment Research]"
3,29bca28d-28a7-394c-b11c-9268d8b42079,SCHW,2023-03-25,"Even if Depositors Flee, Charles Schwab Is Prepared, CEO Says",Barrons.com,https://finance.yahoo.com/m/29bca28d-28a7-394c-b11c-9268d8b42079/even-if-depositors-flee%2C.html,1679662800,STORY,['SCHW'],"[The brokerage last week issued a statement, saying the company's 'longstanding reputation as a safe port in a storm remains intact.'Continue reading]"
4,16836a50-56c7-3842-8a0c-0930062b705c,NUE,2023-03-25,Why You Might Be Interested In Nucor Corporation (NYSE:NUE) For Its Upcoming Dividend,Simply Wall St.,https://finance.yahoo.com/news/why-might-interested-nucor-corporation-121244652.html,1679746364,STORY,['NUE'],"[Nucor Corporation (NYSE:NUE) stock is about to trade ex-dividend in four days. Typically, the ex-dividend date is one business day before the record date which is the date on which a company determines the shareholders eligible to receive a dividend. The ex-dividend date is important as the process of settlement involves two full business days. So if you miss that date, you would not show up on the company's books on the record date. Therefore, if you purchase Nucor's shares on or after the 30th of March, you won't be eligible to receive the dividend, when it is paid on the 11th of May.The company's upcoming dividend is US$0.51 a share, following on from the last 12 months, when the company distributed a total of US$2.04 per share to shareholders. Last year's total dividend payments show that Nucor has a trailing yield of 1.4% on the current share price of $148.65. Dividends are a major contributor to investment returns for long term holders, but only if the dividend continues to be paid. So we need to check whether the dividend payments are covered, and if earnings are growing. Check out our latest analysis for Nucor Dividends are typically paid from company earnings. If a company pays more in dividends than it earned in profit, then the dividend could be unsustainable. Nucor has a low and conservative payout ratio of just 7.0% of its income after tax. A useful secondary check can be to evaluate whether Nucor generated enough free cash flow to afford its dividend. The good news is it paid out just 6.6% of its free cash flow in the last year.It's positive to see that Nucor's dividend is covered by both profits and cash flow, since this is generally a sign that the dividend is sustainable, and a lower payout ratio usually suggests a greater margin of safety before the dividend gets cut.Click here to see the company's payout ratio, plus analyst estimates of its future dividends.historic-dividendHave Earnings And Dividends Been Growing?Companies with consistently growing earnings per share generally make the best dividend stocks, as they usually find it easier to grow dividends per share. If business enters a downturn and the dividend is cut, the company could see its value fall precipitously. That's why it's comforting to see Nucor's earnings have been skyrocketing, up 49% per annum for the past five years. Nucor looks like a real growth company, with earnings per share growing at a cracking pace and the company reinvesting most of its profits in the business.Story continuesMany investors will assess a company's dividend performance by evaluating how much the dividend payments have changed over time. In the last 10 years, Nucor has lifted its dividend by approximately 3.4% a year on average. It's good to see both earnings and the dividend have improved - although the former has been rising much quicker than the latter, possibly due to the company reinvesting more of its profits in growth.The Bottom LineIs Nucor an attractive dividend stock, or better left on the shelf? Nucor has been growing earnings at a rapid rate, and has a conservatively low payout ratio, implying that it is reinvesting heavily in its business; a sterling combination. There's a lot to like about Nucor, and we would prioritise taking a closer look at it.With that in mind, a critical part of thorough stock research is being aware of any risks that stock currently faces. For instance, we've identified 2 warning signs for Nucor (1 is a bit concerning) you should be aware of.A common investing mistake is buying the first interesting stock you see. Here you can find a full list of high-yield dividend stocks.Have feedback on this article? Concerned about the content? Get in touch with us directly. Alternatively, email editorial-team (at) simplywallst.com.This article by Simply Wall St is general in nature. We provide commentary based on historical data and analyst forecasts only using an unbiased methodology and our articles are not intended to be financial advice. It does not constitute a recommendation to buy or sell any stock, and does not take account of your objectives, or your financial situation. We aim to bring you long-term focused analysis driven by fundamental data. Note that our analysis may not factor in the latest price-sensitive company announcements or qualitative material. Simply Wall St has no position in any stocks mentioned.Join A Paid User Research SessionYou’ll receive a US$30 Amazon Gift card for 1 hour of your time while helping us build better investing tools for the individual investors like yourself. Sign up here]"
5,f68d9270-ff71-38c2-ab73-9b12c00d506c,ARE,2023-03-25,These 3 Dividend Stocks Can Help Beat the Spring Market Malaise,Motley Fool,https://finance.yahoo.com/m/f68d9270-ff71-38c2-ab73-9b12c00d506c/these-3-dividend-stocks-can.html,1679745900,STORY,"['O', 'SKT', 'ARE']","[The stock market hasn't been a comfortable place for investors this year. While 2023 started with a bit of a bounceback, volatility has returned heading toward the spring on concerns about weakness in the banking industry. Three that stand out to a few Fool.com contributors right now are Realty Income (NYSE: O), Tanger Factory Outlet Centers (NYSE: SKT) and Alexandria Real Estate Equities (NYSE: ARE), and .Continue reading]"
6,0fe5e5c4-b47c-3fe1-ad38-8cdf8b3eb133,ARE,2023-03-25,Americold (COLD) Boosts Portfolio With New Facility in Spain,Zacks,https://finance.yahoo.com/news/americold-cold-boosts-portfolio-facility-150403881.html,1679670243,STORY,"['COLD', 'ARE', 'TRNO']","[Americold Realty Trust COLD recently announced that it has opened its facility expansion located on Poligono Industrial La Torre del Rector Calle, Santa Perpetua, Barcelona, Spain, as part of its expansion efforts.This facility marks the fourth Americold facility in Spain. COLD’s other facilities in Spain include Valencia, Algeciras and Palau.   With this move, this real estate investment trust, focused on ownership, operation, acquisitions and development of temperature-controlled warehouses, added 11 loading bays and 12,000 pallet positions to its portfolio. Consequently, the Santa Perpetua facility now has more than 20,000 pallet positions offering storage for frozen, chilled and ambient produce.Customers in the region will be benefited from greater capacity in temperature-controlled products and services brought about by this new facility. Also, the facility provides order preparation, transportation and a large variety of value-added services to serve customers in Spain and across Europe.Per George Chappelle, CEO, Americold, “We continue to expand our operations in support of our customers’ needs. This Barcelona expansion reflects our most recent investment in expanding our global presence and fulfilling our mission to help our customers feed the world.”Americold’s facilities are an integral component of the supply chain and connects food producers, processors, distributors and retailers to consumers. It has been focusing on several acquisitions and development activities to maximize its growth opportunities.In 2022, it closed the acquisition of De Bruyn Cold Storage which operates a single facility located in Tasmania, Australia, for $16 million.For 2023, management anticipates development starts to be between $100 million and $200 million. The 2023 adjusted funds from operations per share is expected in the range of $1.14 - $1.24.Analysts seem bullish on this Zacks Rank #2 (Buy) company. The Zacks Consensus Estimate for 2023 FFO per share has been revised marginally upward over the past week to $1.91. Shares of the company have gained 6.2% in the past six months against its industry’s fall of 5.6%.Story continuesZacks Investment ResearchImage Source: Zacks Investment ResearchNonetheless, macroeconomic uncertainty remains a key concern for the company. Also, rising interest rates are likely to increase borrowing costs, affecting the company’s ability to purchase or develop real estate.Other Stocks to ConsiderSome other top-ranked stocks from the REIT sector are Alexandria Real Estate Equities ARE, Terreno Realty TRNO and Service Properties Trust SVC. While Alexandria Real Estate and Terreno Realty currently carry a Zacks Rank #2, Service Properties Trust sports a Zacks Rank #1 (Strong Buy). You can see the complete list of today’s Zacks #1 Rank stocks here.The Zacks Consensus Estimate for Alexandria Real Estate’s 2023 FFO per share is pegged at $8.95.The Zacks Consensus Estimate for Terreno Realty’s current-year FFO per share is pegged at $2.17.The Zacks Consensus Estimate for Service Properties Trust’s 2023 FFO per share is pegged at $1.89.Note: Anything related to earnings presented in this write-up represents FFO — a widely used metric to gauge the performance of REITs.Want the latest recommendations from Zacks Investment Research? Today, you can download 7 Best Stocks for the Next 30 Days. Click to get this free reportTerreno Realty Corporation (TRNO) : Free Stock Analysis ReportAlexandria Real Estate Equities, Inc. (ARE) : Free Stock Analysis ReportAmericold Realty Trust Inc. (COLD) : Free Stock Analysis ReportService Properties Trust (SVC) : Free Stock Analysis ReportTo read this article on Zacks.com click here.Zacks Investment Research]"
7,8a05c3bc-a0b9-3738-94c6-20f570538003,ARE,2023-03-25,Is American Tower (AMT) an Apt Choice for Your Portfolio Now?,Zacks,https://finance.yahoo.com/news/american-tower-amt-apt-choice-150203913.html,1679670123,STORY,"['AMT', 'ARE', 'TRNO']","[American Tower Corporation’s AMT extensive and geographically diversified communication real estate portfolio is well-poised to gain from the rise in capital spending by wireless carriers on the incremental demand from global 4G and 5G deployment efforts, growing wireless penetration and spectrum auctions.Moreover, AMT has a resilient and stable business model. It generates most of its revenues from non-cancellable, long-term (typically 5-10 years) tower leases with major wireless carriers and has multiple renewal period options. This assures stable revenue generation for the company.Shares of AMT, currently carrying a Zacks Rank #3 (Hold), have lost 9.6% in the quarter-to-date period compared with its industry’s fall of 6.4%. However, given the secular growth trends in the wireless industry and its robust fundamentals, the stock is likely to keep performing well in the quarters ahead. Hence the dip offers a good entry point.Zacks Investment ResearchImage Source: Zacks Investment ResearchAmerican Tower has a solid track of delivering a healthy performance due to robust demand for its global macro tower-oriented asset base. It has witnessed strong growth in key financial metrics while continuing platform expansion. Between 2012 and 2022, AMT’s revenues from the Property segment and adjusted EBITDA grew at CAGRs of 14.1% and 13.4%, respectively.  This healthy performance is expected to continue in 2023, with management projecting property revenues and adjusted EBITDA to rise 2.9% and 4.1%, respectively, at the midpoint. We expect property revenues and adjusted EBITDA to increase 2.3% and 4.2%, respectively. In 2024, we estimate property revenues and adjusted EBITDA to report an increase of 4.1% and 9.1%, respectively.To capitalize on the tailwinds, American Tower continues to focus on macro-tower investment opportunities and expansionary efforts across global markets. In 2022, American Tower registered record organic growth complemented by the construction of nearly 7,000 sites, of which, 2,300 were built in fourth-quarter 2022. This marked the highest level over the past eight quarters.We expect an increase of 1.9%, 4% and 4.3% in 2023, 2024 and 2025, respectively, in total International property revenues.American Tower is also strengthening its data center assets through acquisitions, which is encouraging.On the balance sheet front, AMT exited 2022 with total liquidity of $7.1 billion and net leverage ratio of 5.4. Moreover, its investment-grade credit ratings of BBB- and Baa3 with stable outlook from Standard &amp; Poor’s and Moody’s, respectively, enable the company to borrow at a favorable rate.In addition, its trailing 12-month return on equity (ROE) is 15.80% compared with the industry’s average of 3.60%. This reflects that the company is more efficient in using shareholders’ funds than its peers.Solid dividend payouts are arguably the biggest enticements for REIT shareholders, and American Tower remains committed to that. In the last five years, AMT has increased its dividend 20 times and its five-year annualized dividend growth rate is 17.43%. Such efforts boost investors’ confidence in the stock.Nonetheless, T-Mobile, AT&amp;T and Verizon Wireless are the top three customers for American Tower in terms of total revenues for 2022, contributing 18%, 17% and 11%, respectively. The loss of any of these customers, consolidation among them or reduction in network spending might adversely impact the company’s top line.Also, increasing interest rates are likely to increase borrowing costs, affecting the company’s ability to purchase or develop real estate.Story continuesStocks to ConsiderSome better-ranked stocks from the REIT sector are Alexandria Real Estate Equities ARE, Terreno Realty TRNO and Service Properties Trust SVC. While Alexandria Real Estate and Terreno Realty currently carry a Zacks Rank #2 (Buy), Service Properties Trust sports a Zacks Rank #1 (Strong Buy). You can see the complete list of today’s Zacks #1 Rank stocks here.The Zacks Consensus Estimate for Alexandria Real Estate’s 2023 FFO per share is pegged at $8.95.The Zacks Consensus Estimate for Terreno Realty’s current-year FFO per share is pegged at $2.17.The Zacks Consensus Estimate for Service Properties Trust’s 2023 FFO per share is pegged at $1.89.Note: Anything related to earnings presented in this write-up represent funds from operations (FFO) — a widely used metric to gauge the performance of REITs.Want the latest recommendations from Zacks Investment Research? Today, you can download 7 Best Stocks for the Next 30 Days. Click to get this free reportAmerican Tower Corporation (AMT) : Free Stock Analysis ReportTerreno Realty Corporation (TRNO) : Free Stock Analysis ReportAlexandria Real Estate Equities, Inc. (ARE) : Free Stock Analysis ReportService Properties Trust (SVC) : Free Stock Analysis ReportTo read this article on Zacks.com click here.Zacks Investment Research]"
8,c61a32f3-a155-3506-981a-8e23a3e257b6,STT,2023-03-25,State Street (STT) Enters Deal to Acquire CF Global Trading,Zacks,https://finance.yahoo.com/news/state-street-stt-enters-deal-135601224.html,1679666161,STORY,"['STT', 'JPM', 'NYCB']","[In an effort to further expand its outsourced trading capabilities, State Street Corporation STT has agreed to acquire CF Global Trading. Financial terms of the deal, expected to close by the end of 2023, have not been disclosed.CF Global Trading specializes in outsourced trading on an agency basis for a variety of asset classes, including equities, listed derivatives and fixed income. Its established team of traders has helped asset managers extend global trading infrastructure, improve access to liquidity, streamline workflow, and reduce trading and infrastructure costs.This acquisition is expected to further expand State Street’s current outsourced trading. Clients can expect the ability to provide outsourced trading services to new clients and markets.In addition to adding significant expertise to State Street’s outsourced trading services, clients can expect multi-asset class execution across equities, fixed income, exchange-traded derivatives and foreign exchange along with modular-based solutions that allow clients to outsource components of their trade execution without giving up control, as well as access to the front, middle and back office through State Street Alpha.Clients can also expect 24-hour global trading capabilities across multi-asset classes via a transparent, broker neutral, agency model offering, along with reduced operational risk and potential cost savings.Dan Morgan, the global head of portfolio solutions at State Street, informed, “Market volatility, margin compression, increased regulation and cost pressures have presented multiple challenges for investment managers. Survival and growth depend on the ability to streamline processes, reduce costs and integrate infrastructure to allow more focus on core competencies of investment selection and alpha generation. With the addition of CF Global Trading, we add scale and significant expertise to our outsourced trading services that will complement and help further bolster our current offerings.”Scott Chace, the co-founder and CEO of CF Global Trading, stated, “This is a very exciting day for all of us at CF Global Trading. Our team has worked with our clients for 20+ years to develop a global, multi asset class execution platform with a focus on accessing liquidity, improving workflows and reducing costs. We look forward to joining the State Street team and continuing to build on our client platform and experience with the scale of one of the world’s largest institutional financial services providers.”Over the past six months, shares of STT have gained 16.1% against the industry’s decline of 2.4%.Story continues Zacks Investment ResearchImage Source: Zacks Investment Research Currently, State Street carries a Zacks Rank #2 (Buy). You can see the complete list of today’s Zacks #1 Rank (Strong Buy) stocks here.Inorganic Expansion Efforts by Other FirmsRecently, JPMorgan JPM entered an agreement to acquire Aumni. Founded in 2018, Aumni provides investment analytics software to venture capitalists. The financial terms of the deal, expected to close in the first half of 2023, were not disclosed.The acquisition strengthens JPM’s commitment to building a leading private markets platform for companies, their employees and investors, as well as its confidence in the resilience of the venture-backed ecosystem.New York Community Bancorp, Inc. NYCB announced that its bank subsidiary, Flagstar Bank, acquired $38 billion in assets and assumed $36 billion of liabilities of Signature Bridge Bank, N.A., from the Federal Deposit Insurance Corporation.The deal comes after Signature Bank was closed by the regulators, following the collapse of Silicon Valley Bank. The FDIC took over the fallen bank and transferred all the deposits and substantially all the assets to Signature Bridge Bank, N.A.NYCB received all the required regulatory approvals, including approval from the Office of the Comptroller of the Currency, and the deal has been closed.Want the latest recommendations from Zacks Investment Research? Today, you can download 7 Best Stocks for the Next 30 Days. Click to get this free reportJPMorgan Chase &amp; Co. (JPM) : Free Stock Analysis ReportState Street Corporation (STT) : Free Stock Analysis ReportNew York Community Bancorp, Inc. (NYCB) : Free Stock Analysis ReportTo read this article on Zacks.com click here.Zacks Investment Research]"
