,Id,Company,Date,Title,Publisher,Link,ProviderPublishTime,Type,Related Company,Text
74,9a08182f-ffe3-39e0-9e36-9401b4f63bab,DIS,2023-09-24,Disney Can't Catch a Break,Motley Fool,https://finance.yahoo.com/m/9a08182f-ffe3-39e0-9e36-9401b4f63bab/disney-can%27t-catch-a-break.html,1695478200,STORY,['DIS'],"[Not much is going right for Walt Disney (NYSE: DIS) these days. The company seemed to come up on the losing end in its deal with Charter Communications earlier this month. It also seems to be soliciting bids for ABC and other ""noncore"" media assets and said it would consider a partner for ESPN.Continue reading]"
75,c08f738a-08c5-3c67-99bd-4fb9b3914862,DIS,2023-09-24,Disney World finally brings back a popular free perk,TheStreet.com,https://finance.yahoo.com/m/c08f738a-08c5-3c67-99bd-4fb9b3914862/disney-world-finally-brings.html,1695476160,STORY,['DIS'],"[The theme-park giant rarely gives back things it has taken away from ticketholders, but people will be happy with this change.Continue reading]"
76,f76227aa-0ae8-3af6-9dbe-51592ed148a9,DIS,2023-09-24,Theme Parks Pin Hopes on a Fall Rebound After Summer Flop,The Wall Street Journal,https://finance.yahoo.com/m/f76227aa-0ae8-3af6-9dbe-51592ed148a9/theme-parks-pin-hopes-on-a.html,1695474000,STORY,"['SIX', 'SEAS', 'FUN', 'DIS']","[Disney, Six Flags and others are counting on ghouls, ghosts and zombie attractions after hot weather cut into summer visits.Continue reading]"
77,2f5fc13d-6a89-3482-86b3-203bfe8cb91f,OKE,2023-09-24,Bets on energy transition spark rise in North American pipeline deals,Financial Times,https://finance.yahoo.com/m/2f5fc13d-6a89-3482-86b3-203bfe8cb91f/bets-on-energy-transition.html,1695470437,STORY,['OKE'],[]
78,ea848b51-d14d-3fc9-9c2f-f2d9665adce0,CL,2023-09-24,10 Best Investments During High Interest Rates,Insider Monkey,https://finance.yahoo.com/news/10-best-investments-during-high-215854848.html,1695506334,STORY,"['USB', 'PM', 'WFC', 'PEP', 'CL', 'PG', 'BRK-B', 'V']","[In this article, we discuss 10 best investments during high interest rates. If you want to skip our detailed discussion on the stock market outlook and industries benefiting the most due to high interest rates, head directly to 5 Best Investments During High Interest Rates.According to J.P. Morgan's analysis last year, as mentioned by Forbes, starting from February 2009, there was a strong correlation between the movements of the S&amp;P 500 and the 10-year Treasury bond yield until the 10-year yield reached 3.5%, at which point they began to diverge. In simpler terms, increasing interest rates can benefit the overall stock market up to a certain threshold. Rising interest rates have several implications for financial markets. They tend to put pressure on stock valuations, impacting corporate profits and growth prospects, especially for growth stocks. Dividend-paying stocks may need to increase yields to compete with potentially higher bond coupon rates. However, financials, particularly banks and lending institutions, historically perform well in rising rate environments as they can earn more on loans.""As the Federal Reserve increases interest rates, we can anticipate a deceleration in economic growth,"" Eric Freedman, Chief Investment Officer, U.S. Bank Wealth and Institutional Asset Management, commented in July 2023. Indeed, the Gross Domestic Product (GDP) expanded at a notably slower rate in 2022, registering a 2.1% growth compared to the 5.9% seen in 2021. In the first quarter of 2023, the economy seemed to stabilize, achieving a 2.0% annualized growth rate. Hiked interest rates have also altered the landscape for equity investors, leading to potential impacts on future earnings growth for U.S. companies. Economic weakness, resulting in slower GDP growth, can affect corporate earnings and stock prices. Additionally, the attractiveness of bonds and other fixed income investments increases with higher interest rates, potentially reducing demand for stocks. Stocks with premium price-to-earnings (P/E) multiples, particularly those with future earnings expectations that may not materialize, face risks in this changing environment. Higher debt costs due to elevated interest rates could also impact corporate profits and stock prices. While the Federal Reserve has signaled more rate hikes to come, the outlook for equities remains uncertain, with factors like corporate performance and inflation influencing market dynamics and potential volatility ahead.Story continuesIt's not only financial companies that can thrive in a favorable rising interest rate environment. Consumer discretionary stocks can also experience a boost, as improved employment and a healthier housing market tend to encourage consumers to indulge in non-essential purchases beyond basic staples like food, beverages, and hygiene products. According to CNBC, in July 2022, the United States' inflation rate, assessed through the Consumer Price Index, stood at 8.5%. Although the impact of inflation varied across different goods and services, categories like food and energy witnessed the most significant price increases. Some noteworthy companies to watch during interest rate hikes include Bank of America Corporation (NYSE:BAC), in the banking and finance sector, as well as consumer goods retailers such as Walmart Inc. (NYSE:WMT).Investors should consider strategies for navigating this environment, such as strategic bond investments to manage rate exposure, actively managed strategies to mitigate concentration risk, and diversification across sectors, regions, and market capitalization to maintain a balanced portfolio. Investors looking to expand their portfolio through low-risk investment opportunities during a period with hiked interest rates can look at Visa Inc. (NYSE:V), JPMorgan Chase &amp; Co. (NYSE:JPM), and Berkshire Hathaway Inc. (NYSE:BRK.A).Our Methodology We selected stocks from industries that historically perform well during high interest rate environments, such as consumer staples, banking, retail, and insurance. We aimed to select stocks that had the highest hedge fund sentiment in the aforementioned sectors. We assessed the hedge fund sentiment from Insider Monkey’s database of 910 elite hedge funds tracked as of the end of the second quarter of 2023. The list is arranged in ascending order of the number of hedge fund investors in each firm.10 Best Investments During High Interest RatesPhoto by Mirza Babic on UnsplashBest Investments During High Interest Rates10. Philip Morris International Inc. (NYSE:PM)Number of Hedge Fund Holders: 54Philip Morris International Inc. (NYSE:PM) functions as a tobacco enterprise working to create a smoke-free future. On September 13, Philip Morris International Inc. (NYSE:PM) declared a $1.30 per share quarterly dividend, a 2.4% increase from its prior dividend of $1.27. The dividend is distributable on October 12, to shareholders of record on September 27. According to Insider Monkey’s second quarter database, 54 hedge funds were bullish on Philip Morris International Inc. (NYSE:PM), compared to 55 funds in the last quarter. Terry Smith’s Fundsmith LLP is one of the major stakeholders of the company, with 15.8 million shares worth $1.54 billion.In addition to Visa Inc. (NYSE:V), JPMorgan Chase &amp; Co. (NYSE:JPM), and  Berkshire Hathaway Inc. (NYSE:BRK.A), Philip Morris International Inc. (NYSE:PM) is one of the best investments during high interest rates.Ariel International Fund made the following comment about Philip Morris International Inc. (NYSE:PM) in its Q1 2023 investor letter:“Finally, tobacco maker, Philip Morris International Inc. (NYSE:PM) declined in the period on concerns related to supply-chain disruptions resulting from the war in Ukraine, which we view as temporary. We believe the favorable economics and margin expansion associated with market share gains from the IQOS brand and Reduced Risk Products should yield value creation opportunities in the years ahead. Furthermore, at current trading levels, we think the company’s operating leverage, pricing power, and free cash flow profile offer a margin of safety.”9. Colgate-Palmolive Company (NYSE:CL)Number of Hedge Fund Holders: 58Colgate-Palmolive Company (NYSE:CL) produces and markets consumer goods on a global scale. The corporation is divided into two divisions – Oral, Personal, Home Care, and Pet Nutrition. On July 28, Colgate-Palmolive Company (NYSE:CL) reported a Q2 non-GAAP EPS of $0.77, beating Wall Street estimates by $0.02. The revenue of $4.82 billion increased 7.6% year-over-year, surpassing market consensus by $120 million. Colgate-Palmolive Company (NYSE:CL), as part of the consumer goods industry, benefits from several factors that make it less susceptible to the impacts of high-interest rates, such as strong brand loyalty and product differentiation to shield it from price sensitivity, as well as its global presence. According to Insider Monkey’s second quarter database, 58 hedge funds were bullish on Colgate-Palmolive Company (NYSE:CL), as compared to 55 in the previous quarter. Jean-Marie Eveillard’s First Eagle Investment Management is the leading stakeholder of the company, with an estimated 11 million shares worth $854.5 million.Third Point Management made the following comment about Colgate-Palmolive Company (NYSE:CL) in its Q1 2023 investor letter:“Existing positions in LVMH, Disney and Microsoft gained while FIS, Bath &amp; Body Works, and Colgate-Palmolive Company (NYSE:CL) posted losses after their management teams lowered 2023 guidance despite reporting solid quarterly results. FIS and Colgate have both since “beat and raised” this guidance, indicating that many management teams are adopting very conservative tones in this uncertain macro environment.”8. PepsiCo, Inc. (NASDAQ:PEP)Number of Hedge Fund Holders: 68PepsiCo, Inc. (NASDAQ:PEP) is a global company known for producing, marketing, and distributing a wide range of beverages and convenient foods. On July 20, PepsiCo, Inc. (NASDAQ:PEP) declared a quarterly dividend of $1.265 per share, in line with previous. The dividend will be distributed on September 29, to shareholders of record on September 1. PepsiCo, Inc. (NASDAQ:PEP) is less affected by high interest rates due to its diversification across multiple sectors and regions, a strong financial position with ample cash reserves, pricing power, efficient capital management, hedging strategies, and a portfolio of strong brands.According to Insider Monkey’s second quarter database, 68 hedge funds were bullish on PepsiCo, Inc. (NASDAQ:PEP), two down from the last quarter. Ric Dillon’s Diamond Hill Capital is a prominent stakeholder of the company, with 2.70 million shares worth nearly $501 million.Madison Sustainable Equity Fund made the following comment about PepsiCo, Inc. (NASDAQ:PEP) in its Q1 2023 investor letter:“PepsiCo, Inc. (NASDAQ:PEP) announced that it will commit $3.3 million in funds toward water replenishment projects across North America. These projects aim to reduce absolute water use and replenish back into the local watershed more than 100% of the water used at company-owned and third-party sites in high water-risk areas.”7. The Procter &amp; Gamble Company (NYSE:PG)Number of Hedge Fund Holders: 74The Procter &amp; Gamble Company (NYSE:PG) offers branded consumer packaged goods worldwide. Its operations are divided into five segments – Beauty, Grooming, Health Care, Fabric &amp; Home Care, and Baby, Feminine &amp; Family Care. On July 28, The Procter &amp; Gamble Company (NYSE:PG) reported fourth quarter results for fiscal 2023. The non-GAAP EPS of $1.37 exceeded Wall Street estimates by $0.05. The revenue of $20.6 billion increased 5.5% year-over-year, surpassing market consensus by $610 million.According to Insider Monkey’s second quarter database, 74 hedge funds were bullish on The Procter &amp; Gamble Company (NYSE:PG), one down from the last quarter. Ray Dalio’s Bridgewater Associates is a significant position holder in the company, with a stake worth $700.5 million. 6. Wells Fargo &amp; Company (NYSE:WFC)Number of Hedge Fund Holders: 75Wells Fargo &amp; Company (NYSE:WFC), a diversified financial services corporation, offers a range of banking, investment, mortgage, and consumer and commercial financial products and services both in the United States and globally. The company is organized into four segments – Consumer Banking and Lending, Commercial Banking, Corporate and Investment Banking, and Wealth and Investment Management. On July 14, Wells Fargo &amp; Company (NYSE:WFC) reported a Q2 GAAP EPS of $1.25, beating Wall Street estimates by $0.09. The revenue of $20.53 billion increased 20.6% year-on-year, surpassing market estimates by $410 million. Wells Fargo's loan portfolio diversification, pricing flexibility, investment management, loyal customer base, and regulatory risk measures enable it to navigate changing interest rate environments well. According to Insider Monkey’s second quarter database, 75 hedge funds were bullish on Wells Fargo &amp; Company (NYSE:WFC), as compared to 78 in the last quarter. Harris Associates is the top stakeholder of the firm, with over 24 million shares valued at approximately $1.02 billion.Like Visa Inc. (NYSE:V), JPMorgan Chase &amp; Co. (NYSE:JPM), and  Berkshire Hathaway Inc. (NYSE:BRK.A), Wells Fargo &amp; Company (NYSE:WFC) is one of the best investments for high interest rate periods. Rowan Street Capital made the following comment about The Procter &amp; Gamble Company (NYSE:PG) in its Q4 2022 investor letter:“Let’s look at The Procter &amp; Gamble Company (NYSE:PG). Dividend yield is 2.4%. Earnings are forecasted to grow at 5.9%, and its current earnings multiple is at 25x. Now, lets say over the next 3-5 years the market loses interest in the “safe”, mature companies that grow at anemic rates and gets an appetite for growth again. It’s very unlikely that Mr. Market will be paying 25x for 5.9% earnings growth. Let's assume that multiple declines to the market average of 18x — that would be ~6.9% drag per year on the total expected return over next 3-5 years. If we get 2.4% (dividend) + 5.9% (earnings growth) – 6.9% (decrease in earnings multiple) = 1.4% (annual return we can expect on average from this stock).”Click to continue reading and see 5 Best Investments During High Interest Rates.  Suggested articles:30 Low Cost Business Ideas With High Profit12 Best Streaming and TV Stocks To Buy Now12 Best Growth ETFs to Buy Disclosure: None. 10 Best Investments During High Interest Rates is originally published on Insider Monkey.]"
79,5838edc3-f26c-36ce-816f-d25a97a06362,XRAY,2023-09-24,"DENTSPLY SIRONA Inc. (NASDAQ:XRAY) Is About To Go Ex-Dividend, And It Pays A 1.7% Yield",Simply Wall St.,https://finance.yahoo.com/news/dentsply-sirona-inc-nasdaq-xray-124229782.html,1695472949,STORY,['XRAY'],"[Some investors rely on dividends for growing their wealth, and if you're one of those dividend sleuths, you might be intrigued to know that DENTSPLY SIRONA Inc. (NASDAQ:XRAY) is about to go ex-dividend in just 4 days. The ex-dividend date is one business day before a company's record date, which is the date on which the company determines which shareholders are entitled to receive a dividend. It is important to be aware of the ex-dividend date because any trade on the stock needs to have been settled on or before the record date. Therefore, if you purchase DENTSPLY SIRONA's shares on or after the 28th of September, you won't be eligible to receive the dividend, when it is paid on the 13th of October.The company's next dividend payment will be US$0.14 per share, on the back of last year when the company paid a total of US$0.56 to shareholders. Based on the last year's worth of payments, DENTSPLY SIRONA stock has a trailing yield of around 1.7% on the current share price of $33.88. If you buy this business for its dividend, you should have an idea of whether DENTSPLY SIRONA's dividend is reliable and sustainable. That's why we should always check whether the dividend payments appear sustainable, and if the company is growing. Check out our latest analysis for DENTSPLY SIRONA If a company pays out more in dividends than it earned, then the dividend might become unsustainable - hardly an ideal situation. DENTSPLY SIRONA's dividend is not well covered by earnings, as the company lost money last year. This is not a sustainable state of affairs, so it would be worth investigating if earnings are expected to recover. Given that the company reported a loss last year, we now need to see if it generated enough free cash flow to fund the dividend. If cash earnings don't cover the dividend, the company would have to pay dividends out of cash in the bank, or by borrowing money, neither of which is long-term sustainable. Dividends consumed 56% of the company's free cash flow last year, which is within a normal range for most dividend-paying organisations.Story continuesClick here to see the company's payout ratio, plus analyst estimates of its future dividends.historic-dividendHave Earnings And Dividends Been Growing?Businesses with strong growth prospects usually make the best dividend payers, because it's easier to grow dividends when earnings per share are improving. If business enters a downturn and the dividend is cut, the company could see its value fall precipitously. DENTSPLY SIRONA was unprofitable last year, but at least the general trend suggests its earnings have been improving over the past five years. Even so, an unprofitable company whose business does not quickly recover is usually not a good candidate for dividend investors.The main way most investors will assess a company's dividend prospects is by checking the historical rate of dividend growth. Since the start of our data, 10 years ago, DENTSPLY SIRONA has lifted its dividend by approximately 9.8% a year on average. We're glad to see dividends rising alongside earnings over a number of years, which may be a sign the company intends to share the growth with shareholders.Get our latest analysis on DENTSPLY SIRONA's balance sheet health here.Final TakeawayFrom a dividend perspective, should investors buy or avoid DENTSPLY SIRONA? First, it's not great to see the company paying a dividend despite being loss-making over the last year. On the plus side, the dividend was covered by free cash flow."" Overall, it's hard to get excited about DENTSPLY SIRONA from a dividend perspective.However if you're still interested in DENTSPLY SIRONA as a potential investment, you should definitely consider some of the risks involved with DENTSPLY SIRONA. To help with this, we've discovered 1 warning sign for DENTSPLY SIRONA that you should be aware of before investing in their shares.Generally, we wouldn't recommend just buying the first dividend stock you see. Here's a curated list of interesting stocks that are strong dividend payers.Have feedback on this article? Concerned about the content? Get in touch with us directly. Alternatively, email editorial-team (at) simplywallst.com.This article by Simply Wall St is general in nature. We provide commentary based on historical data and analyst forecasts only using an unbiased methodology and our articles are not intended to be financial advice. It does not constitute a recommendation to buy or sell any stock, and does not take account of your objectives, or your financial situation. We aim to bring you long-term focused analysis driven by fundamental data. Note that our analysis may not factor in the latest price-sensitive company announcements or qualitative material. Simply Wall St has no position in any stocks mentioned.]"
80,cbf2eb7a-73de-377a-bac6-6c17c66d44b0,DVN,2023-09-24,3 Oil Stocks to Buy Before It's Too Late,Motley Fool,https://finance.yahoo.com/m/cbf2eb7a-73de-377a-bac6-6c17c66d44b0/3-oil-stocks-to-buy-before.html,1695557700,STORY,"['DVN', 'CVX', 'MRO']","[Oil prices have caught fire in recent months, surging 30% over the past 90 days. Oil could continue rising. Devon Energy (NYSE: DVN), Chevron (NYSE: CVX), and Marathon Oil (NYSE: MRO) stand out to a few Fool.com contributors as the leading oil stocks to buy right now so that investors don't miss their potential rally.Continue reading]"
81,c6bbe661-7a35-3b01-b74f-de9fd26e3ba8,ORCL,2023-09-24,"These Stocks Moved the Most Today: Ford, Activision, Alibaba, Squarespace, Amazon, Scholastic, and More",Barrons.com,https://finance.yahoo.com/m/c6bbe661-7a35-3b01-b74f-de9fd26e3ba8/these-stocks-moved-the-most.html,1695415020,STORY,"['ATVI', 'F', 'X', '9988.HK', 'SQSP', 'GM', 'MSFT', 'SCHL', 'ORCL']","[The United Auto Workers expands its strike to 38 General Motors and Stellantis parts distribution facilities, while Microsoft’s acquisition of Activision Blizzard is closer to being cleared.Continue reading]"
82,f09bf2a5-df93-3607-ad7d-4087e642d9ae,MU,2023-09-24,Better AI Value Stock: Micron vs. Intel,Motley Fool,https://finance.yahoo.com/m/f09bf2a5-df93-3607-ad7d-4087e642d9ae/better-ai-value-stock%3A-micron.html,1695547800,STORY,"['INTC', 'MU']",[Both stocks should benefit from AI but still trade well below all-time highs.Continue reading]
