,Id,Company,Date,Title,Publisher,Link,ProviderPublishTime,Type,Related Company,Text
44,ebe951a7-53c9-3fca-b0a0-5681dc5a8ecd,MRK,2023-01-15,7 Hot Healthcare Stocks to Watch in 2023,InvestorPlace,https://finance.yahoo.com/news/7-hot-healthcare-stocks-watch-180637851.html,1673460397,STORY,"['LLY', '^GSPC', 'UNH', 'JNJ', 'PFE', 'MRNA', 'MRK', 'HUM']","[While it has not produced the big gains seen among other sectors such as energy, healthcare has been a quiet outperformer over the past year. The S&amp;P 500 Healthcare Index is essentially flat over the past 12 months. While that might not sound great, it is a lot better than the 16% decline of the benchmark S&amp;P 500 index during the same period. The stocks of several pharmaceutical companies have increased more than 30% in the last year, driven higher by a combination of strong sales and a pipeline of promising, new medications. Healthcare stocks have also proven to be resilient in the wake of inflation, rising interest rates, and a volatile economy. That is because medications and health insurance are viewed as necessary staples rather than discretionary items. As we embark on a New Year, we offer the following list of seven promising healthcare stocks for 2023.UNHUnited Health$490.50MRNAModerna$185LLYEli Lilly$356.20HUMHumana$488PFEPfizer$47.30MRKMerck$110JNJJohnson &amp; Johnson$173.30UnitedHealth Group (UNH)The UnitedHealth (UNH) headquarters in Minnetonka, Minnesota.Source: Ken Wolter / Shutterstock.comFor a solid, long-term investment, look to UnitedHealth Group (NYSE:UNH). The Minnesota-based company specializes in both individual and group health insurance, and it is the largest healthcare company by revenue and the largest insurance company by net premiums in the world. UnitedHealth Group is also the world’s seventh biggest company with annual revenues approaching $300 billion.InvestorPlace - Stock Market News, Stock Advice &amp; Trading TipsGiven the nature of its business, UnitedHealth Group is a great stock to own during a recession. Businesses and, to a lesser extent, consumers,  are likely to prioritize paying their health insurance premiums even during an economic downturn. That helps to explain why UNH stock has risen 4.5% over the past 12 months, outperforming the S&amp;P 500 index that has fallen 16% in the same time period.Over the last five years, UNH stock has gained 115%, making it a great investment to hold over the long term. And despite its recent outperformance, 23 analysts who cover the company have a median price target on the stock of $600,  23% above its current levels.Story continuesModerna (MRNA)The Moderna (MRNA) logo surrounded by syringes, pills and disposable face masks.Source: Ascannio / Shutterstock.comBoston-based biopharmaceutical company Moderna (NASDAQ:MRNA) is winning back investors with its robust pipeline of new medications, including a promising vaccine that would simultaneously protect people against both Covid-19 and influenza, as well as several cancer treatments.While still below the highs reached during the pandemic when its vaccine against Covid-19 was one of the first to be approved by the FDA, MRNA stock has risen 40% in the past three months, and is now up nearly 4% over the last five trading days.At around $185 a share and with a price-earnings ratio of only 6.7, MRNA stock looks cheap when compared to many other pharmaceutical stocks. The company has also continued to report strong earnings due to the global sales of its Covid-19 vaccine, which generated $18.4 billion of revenue for it in 2022.Eli Lilly (LLY)Eli Lilly and Company World Headquarters. Lilly makes Medicines and Pharmaceuticals XISource: Jonathan Weiss / Shutterstock.comEli Lilly (NYSE:LLY) might have the blockbuster medication of the next decade on its hands with its obesity drug, Tirzepatide. While not yet commercially available, Tirzepatide has been granted “fast track” designation by the FDA.If approved, Tirzepatide could help more than 2 billion adults worldwide who struggle with their weight. Some analysts are forecasting that Tirzepatide could be the best-selling drug ever produced. The hype surrounding the weight-loss medication has propelled LLY stock 38% higher over the past year, making it a top performer in the S&amp;P 500 index.Of course, Tirzepatide would not be the first blockbuster medication from Indiana-based Eli Lilly. The company also produces Prozac that’s used to treat depression and Cialis for erectile dysfunction. Those medications, and others, have powered Eli Lilly to annual sales of more than $30 billion.Humana (HUM)A Humana (HUM) office buildingSource: Shutterstock.comAnother promising healthcare stock for 2023 is insurer Humana (NYSE:HUM). The Kentucky-based company, which is the third-largest health insurance provider in America, had a very good 2022. In the last 12 months, HUM stock has risen 23% to $488 a share.Most analysts expect the stock to climb further going forward. The 23 analysts who cover the company have a median price target on the name of $625, which is nearly 30% higher than where it currently trades.The reason everyone seems bullish on HUM stock is the company’s growth potential. Humana currently insures more than 22 million people. And its Medicare Advantage customer base is forecast to grow an average of 14.7% annually through the next five years.While the company’s dividend looks skimpy with a yield of only 0.65%, its dividend payout ratio is currently 12%, enabling the company to deliver strong annual dividend increases of 15% or more over the next five to ten years.Pfizer (PFE)Pfizer logo on Pfizer building. Pfizer is an American pharmaceutical corporation.Source: Manuel Esteban / Shutterstock.comPfizer (NYSE:PFE) remains a solid, blue-chip pharmaceutical stock. The company has produced many blockbuster drugs over the years, with its Covid-19 vaccine being the latest global bestseller. The New York City-based company sold $36.7 billion worth of Covid-19 vaccines in 2021.The company has predicted that it sold $54.5 billion of Covid-19 vaccines last year, including booster shots, in 2022. Yet for all its success, PFE stock has fallen 17% in the last 12 months, matching the decline of the S&amp;P 500 index. The company’s P/E ratio is a modest 9.17, suggesting the stock is cheap at its current levels.Additionally, investors who buy PFE stock get a quarterly dividend that yields 3.4%. Pfizer also has in its pipeline a Covid-19 treatment called Paxlovid that some analysts say could be the company’s newest blockbuster medication. Investors should buy the dip of this stock.Merck &amp; Co. (MRK)Merck (MRK) logo outside of corporate buildingSource: Atmosphere1 / Shutterstock.comAnother healthcare stock that has been a winner over the last year and looks promising in 2023 is Merck &amp; Co. (NYSE:MRK). The firm’s rapid earnings growth and its strong pipeline of products helped push MRK stock up 36% in the last year. The stock now trades at $110 and could gain even more in  the coming months.MRK stock really took off last autumn after its medication, Keytruda, was approved for the treatment of certain cancers. The company is also working with Moderna on a medication to treat skin cancer that has shown promising results. Finally, Merck has a robust Animal Health unit that makes leading veterinary pharmaceuticals.The company’s P/E ratio of 18 is about average among the stocks of pharma companies, and its dividend yield of 2.64% is significant, making MRK stock more attractive.Johnson &amp; Johnson (JNJ)A red Johnson &amp; Johnson (JNJ) sign hangs inside in Moscow, Russia.Source: Alexander Tolstykh / Shutterstock.comJohnson &amp; Johnson (NYSE:JNJ) is a steady stock. It doesn’t post spectacular gains, but it motors along at a decent clip. And investors who are worried about inflation and a possible recession should be attracted to its diverse line of consumer health products that include everything from Tylenol and Sudafed to Band-Aids and Polysporin.Of course, Johnson &amp; Johnson also produces vaccines and medications used to treat illnesses ranging from cancer to cardiovascular disease and hypertension. The company is preparing to spin off its consumer health segment into a separate company that will be called “Kenvue.” Investors may want to look into buying shares of that company once it is publicly traded.JNJ stock rose 2% over the past year. That’s not overly inspiring, but it represents a huge outperformance compared to the overall stock market. In the past five years, the stock has gained 20%. Shareholders also benefit from a decent dividend yield of 2.58%.On the date of publication, Joel Baglole did not have (either directly or indirectly) any positions in the securities mentioned in this article. The opinions expressed in this article are those of the writer, subject to the InvestorPlace.com Publishing Guidelines.Joel Baglole has been a business journalist for 20 years. He spent five years as a staff reporter at The Wall Street Journal, and has also written for The Washington Post and Toronto Star newspapers, as well as financial websites such as The Motley Fool and Investopedia.More From InvestorPlaceBuy This $5 Stock BEFORE This Apple Project Goes LiveThe Best $1 Investment You Can Make TodayEarly Bitcoin Millionaire Reveals His Next Big Crypto Trade “On Air”It doesn’t matter if you have $500 or $5 million. Do this now.The post 7 Hot Healthcare Stocks to Watch in 2023 appeared first on InvestorPlace.]"
45,ed60fa9f-72dc-3941-9ca7-46a215aac8f2,NKE,2023-01-15,Better Buy: Disney Stock vs. Nike Stock,Motley Fool,https://finance.yahoo.com/m/ed60fa9f-72dc-3941-9ca7-46a215aac8f2/better-buy%3A-disney-stock-vs..html,1673787780,STORY,"['NKE', 'DIS']",[Disney (NYSE: DIS) and Nike (NYSE: NKE) both disappointed the bulls in 2022. Nike's stock dropped 30% as investors worried about its rising inventories and shrinking margins. What happened to Disney?Continue reading]
46,85c3a951-829a-3102-94f5-5fe42d2d29a1,NKE,2023-01-15,Nike Stock In 2023: Bull vs. Bear,Motley Fool,https://finance.yahoo.com/m/85c3a951-829a-3102-94f5-5fe42d2d29a1/nike-stock-in-2023%3A-bull-vs..html,1673705220,STORY,['NKE'],"[There's no doubt that Nike (NYSE: NKE) is one of the most well-known consumer businesses in the world. Not only am I willing to bet that readers have seen one of their favorite athletes wearing a Nike product on TV or at a sporting event, but they most likely have some Nike shoes or clothing in their closets. As I touched on in the intro to this article, Nike possesses one of the strongest consumer brands out there.Continue reading]"
47,1eec5499-1cf4-3647-b948-8b614d04445b,NKE,2023-01-15,Looking for a Winning Dividend Grower? Buy Nike Stock,Motley Fool,https://finance.yahoo.com/m/1eec5499-1cf4-3647-b948-8b614d04445b/looking-for-a-winning.html,1673703900,STORY,"['NKE', '^GSPC']","[Iconic footwear and apparel maker Nike (NYSE: NKE) is a good example. Investors who put $10,000 into the stock 20 years ago would now have $290,000 with dividends reinvested. Let's dive into the company's fundamentals and valuations to better understand why.Continue reading]"
48,a1b3e9e3-8610-3546-a7b9-3fa2efd06265,WFC,2023-01-15,Here Is Why Wells Fargo Is Shrinking Its Mortgage Business,Motley Fool,https://finance.yahoo.com/m/a1b3e9e3-8610-3546-a7b9-3fa2efd06265/here-is-why-wells-fargo-is.html,1673784000,STORY,['WFC-PD'],[Mortgage origination is one of the most cyclical businesses out there. Businesses in this sector need to be ready for that cyclicality or they need to consider not participating. Wells Fargo (NYSE: WFC) recently announced it will drastically shrink its mortgage banking business.Continue reading]
49,c87e1eff-5d2e-3530-b663-52d41a202be1,FOXA,2023-01-15,Former Executives of Fox Subsidiary Face Trial in FIFA Bribery Case,The Wall Street Journal,https://finance.yahoo.com/m/c87e1eff-5d2e-3530-b663-52d41a202be1/former-executives-of-fox.html,1673780400,STORY,['FOXA'],[]
50,596010a9-75d0-32b9-8052-117d3468a43d,MPC,2023-01-15,10 Stocks with the Biggest Buybacks,Insider Monkey,https://finance.yahoo.com/news/10-stocks-biggest-buybacks-165255288.html,1673715175,STORY,"['NVDA', '^GSPC', 'PG', 'CVX', 'GOOGL', 'MPC', 'LOW']","[In this article, we take a look at 10 stocks with the biggest buybacks. If you want to see more stocks with the biggest buybacks, go directly to 5 Stocks with the Biggest Buybacks.When they generate a profit, companies can choose to keep the profits on their balance sheet, invest the profits back into the company, use the profits to buy other companies, or return the profits back to shareholders.In terms of returning profits back to shareholders, the two main ways companies return capital back to shareholders is through stock buybacks and dividends.When it comes to whether companies should return capital through buybacks or through dividends, both have their advantages and disadvantages.Whereas many shareholders would not be happy if a company were to cut its regular dividend, most investors don't expect companies to buy back their stock regularly. As a result, stock buybacks offer management more flexibility than dividends. Stock buybacks have historically also been taxed less than dividends as well although different investors have different tax rates.Stock buybacks can add value if done correctly as they can increase earnings per share if a company maintains its profits. If a company earns $1 per share, for instance, and the company buys back half of its stock and doesn't issue new shares, that company would then earn $2 per share. If that company's P/E valuation stays the same, its stock could potentially rise substantially as a result and generate a total return of potentially more than if the same company were to return the same amount of capital through a dividend.Stock buybacks can also destroy value if done incorrectly. If a company's management buys back its stock at too high of a price, shareholders would have been better off if management had paid a dividend instead.Given the advantages and disadvantages of stock buybacks and dividends, many companies have chosen to return capital through both. In terms of recent years, however, companies in the S&amp;P 500 in aggregate have returned more capital through stock buybacks than through dividends.Story continuesBuybacksIn terms of recent buybacks versus dividends, total aggregate buybacks in the S&amp;P 500 for Q3 2022 were $210.8 billion, down 10.1% from Q3 2021's $234.6 billion. By comparison total Q3 2022 dividends paid were $140.3 billion, up from $130 billion in Q3 2021.In Q3 2022, 319 companies in the S&amp;P 500 bought back stock of at least $5 million in the quarter, up from 309 in Q3 2021.In terms of taxes, 2023 is a new year with new rules when it comes to stock buybacks.As a result of the inflation reduction act of 2022, there will be a 1% excise tax on the repurchases of stocks after December 31, 2022.Many believe there could be slightly less buybacks and potentially more dividends as a result.Image by Sergei Tokmakov Terms.Law from PixabayMethodologyFor our list of 10 Stocks with the Biggest Buybacks, we used preliminary S&amp;P 500 stock buyback data for Q3 2022 from S&amp;P Dow Jones Indices and we ranked them based on their Q3 2022 buybacks.We also included the number of hedge funds in our database of 920 funds that owned shares of the same stock at the end of Q3.For those of you interested, check out 15 Companies That Are Buying Back Their Stock.10 Stocks with the Biggest Buybacks10. Chevron Corporation (NYSE:CVX)Q3 2022 Buybacks (Million): $3,697 Number of Hedge Fund Holders: 66Given the Russia Ukraine war, oil and gas prices have increased from 2021 levels and many big oil companies have benefited with bigger profits. In the third quarter of 2022, Chevron Corporation (NYSE:CVX) adjusted earnings surged to $10.8 billion versus adjusted earnings of $5.7 billion in Q3 2021 as a result.Given the profit increases and substantial free cash flow, Chevron Corporation (NYSE:CVX) paid dividends of $2.7 billion and also repurchased around $3.7 billion of shares in the quarter. Considering strong earnings in Q2 2022, the company in July boosted the top end of its annual share repurchase guidance range to $15 billion. Chevron Corporation (NYSE:CVX)'s previous annual buyback guidance was $5 billion to $10 billion.Alongside Meta Platforms, Inc. (NASDAQ:META), Alphabet Inc. (NASDAQ:GOOG), and Apple Inc. (NASDAQ:AAPL), Chevron Corporation (NYSE:CVX) is a stock that is owned by many hedge funds in our database that repurchased a lot of shares in Q3.9. NVIDIA Corporation (NASDAQ:NVDA)Q3 2022 Buybacks (Million): $3,779 Number of Hedge Fund Holders: 89Given the company doesn't have a substantial dividend yield, NVIDIA Corporation (NASDAQ:NVDA) has returned most of its excess capital through buybacks in recent years. Considering its profits have increased substantially given demand growth for GPUs, NVIDIA Corporation (NASDAQ:NVDA) board of directors in May of 2022 increased and extended the company's repurchase program to up to $15 billion through December 2023. With the buyback authorization, NVIDIA Corporation (NASDAQ:NVDA) bought back nearly $3.8 billion worth of shares in Q3, ranking the company #9 on our list of 10 Stocks with the Biggest Buybacks.Baron Funds commented on NVIDIA Corporation (NASDAQ:NVDA) in a Q3 investor letter,“NVIDIA Corporation (NASDAQ:NVDA) is a fabless semiconductor company and a leader in gaming and accelerated computing. NVIDIA is powering the growth of AI from the data center to the edge. Shares detracted due to inventory right sizing in NVIDIA’s gaming segment coupled with the broader market sell-off in growth stocks. Given NVIDIA’s end-to-end AI platform and its leading market share in gaming, data centers, and autonomous machines, along with the size of these markets, we believe the company can sustain its growth trajectory. See further discussion of NVIDIA in the top net purchases section below. During the third quarter, we took advantage of its stock sell-off to add to NVIDIA Corporation, a fabless semiconductor mega cap that is a global leader in gaming cards and accelerated computing hardware and software. The sell-off was driven by a near-term inventory correction in gaming as a result of a COVID-related pull forward in demand as well as the shift in the Ethereum cryptocurrency from proof-of-work to proof-of-stake. Additionally, investors are concerned over the potential slowdown in data center revenues as a result of a weaker macroeconomic environment as well as the recently announced limitations on semiconductor shipments to China. Despite the near-term uncertainty, we believe that NVIDIA’s end-to-end AI platform and its leading market share in gaming, data centers, and autonomous machines, along with the size of these markets, would enable the company to benefit from durable growth for years to come and therefore view the stock price where we added shares as a compelling value for long-term investors. With demand for computing power doubling every one to two years, and Moore’s Law slowing down, there is more need for computing than ever. At the same time, “near free” supply growth (that was possible thanks to Moore’s Law) has slowed dramatically. NVIDIA’s accelerated architecture, with parallel computing at scale, answers that need.”8. Marathon Petroleum Corporation (NYSE:MPC)Q3 2022 Buybacks (Million): $3,908 Number of Hedge Fund Holders: 50Marathon Petroleum Corporation (NYSE:MPC) bought back over $3.9 billion worth of its own shares in the third quarter as it completed its $15 billion return of capital commitment in October utilizing proceeds from its Speedway divestiture. In 2021, Marathon Petroleum Corporation (NYSE:MPC) sold Speedway to 7-Eleven for an estimated $16.5 billion of after-tax cash proceeds. As a result of its buyback program, Marathon Petroleum Corporation (NYSE:MPC) repurchased around 30% of its outstanding shares. After completing its $15 billion return of capital commitment, Marathon Petroleum Corporation (NYSE:MPC) has approximately $5 billion remaining available under its current share repurchase authorizations.7. Lowe's Companies, Inc. (NYSE:LOW)Q3 2022 Buybacks (Million): $3,999 Number of Hedge Fund Holders: 61Lowe's Companies, Inc. (NYSE:LOW) has one of the biggest buyback authorizations among retailers after its board of directors announced a $15 billion buyback authorization with no expiration date. The company also still has $6.4 billion left on its previous buyback program as of December 2022. As far as buybacks go, Lowe's Companies, Inc. (NYSE:LOW) bought back a lot of stock in Q3, with repurchases of nearly $4 billion. If it can increase earnings and not issue any new shares, the buybacks could help increase EPS for Lowe's Companies, Inc. (NYSE:LOW) in the long term.6. The Procter &amp; Gamble Company (NYSE:PG)Q3 2022 Buybacks (Million): $4,000 Number of Hedge Fund Holders: 69While it is more famous for its dividend given the consumer staple's long history of increasing it every year, The Procter &amp; Gamble Company (NYSE:PG) has also returned a lot of capital back to shareholders through share repurchases. In the third quarter, The Procter &amp; Gamble Company (NYSE:PG) returned $4 billion of capital through buybacks, ranking #6 on our list of 10 Stocks with the Biggest Buybacks. For fiscal 2023, the company expects to pay around $9 billion in dividends and to repurchase $6 billion to $8 billion of common shares. Of the 920 hedge funds in our database, 69 owned shares of The Procter &amp; Gamble Company (NYSE:PG) at the end of Q3.Like The Procter &amp; Gamble Company (NYSE:PG), Meta Platforms, Inc. (NASDAQ:META), Alphabet Inc. (NASDAQ:GOOG), and Apple Inc. (NASDAQ:AAPL) are stocks held by many hedge funds in our database that have bought back a lot of shares in the third quarter.Click to continue reading and see 5 Stocks with the Biggest Buybacks.Suggested articles:15 Most Innovative Countries in the World15 Most Valuable Silicon Valley Companies in the World25 Highest Paid Athletes of All TimeDisclosure: None. 10 Stocks with the Biggest Buybacks is originally published on Insider Monkey.]"
51,b101ef29-4685-34df-b897-937f9706eeb9,TAP,2023-01-15,Coca-Cola and Pepsi Face an Unlikely New Rival With a Unique New Drink,TheStreet.com,https://finance.yahoo.com/m/b101ef29-4685-34df-b897-937f9706eeb9/coca-cola-and-pepsi-face-an.html,1673718840,STORY,"['TAP-A', 'PEP', 'KO']",[The beverage wars have become even more complicated and that means a lot of new choices for consumers.Continue reading]
