,Id,Company,Date,Title,Publisher,Link,ProviderPublishTime,Type,Related Company,Text
0,f6005599-ea12-3c4a-ab01-e557023b2745,NUE,2023-02-20,Kinross' (KGC) Earnings and Sales Surpass Estimates in Q4,Zacks,https://finance.yahoo.com/news/kinross-kgc-earnings-sales-surpass-115511600.html,1676894111,STORY,"['K.TO', 'KGC', 'NUE']","[Kinross Gold Corporation KGC recorded a loss of $106 million or 8 cents per share in fourth-quarter 2022 compared with a loss of $66.2 million or 5 cents in the year-ago quarter.KGC reported adjusted earnings of 9 cents per share in the fourth quarter, up from the prior year’s figure of 2 cents. It beat the Zacks Consensus Estimate of 7 cents.  Revenues climbed by 75% year over year to $1,076.2 million in the fourth quarter. It topped the Zacks Consensus Estimate of $962.8 million.Kinross Gold Corporation Price, Consensus and EPS SurpriseKinross Gold Corporation Price, Consensus and EPS SurpriseKinross Gold Corporation price-consensus-eps-surprise-chart | Kinross Gold Corporation QuoteOperational PerformanceThe company produced 595,683 gold equivalent ounces from continuing operations in the reported quarter, up 75% year over year.Average realized gold prices were $1,731 per ounce in the quarter, down 3.7% from the year-ago quarter’s figure.The production cost of sales per gold equivalent ounce was $848, down 4.6% from the prior-year quarter. All-in sustaining cost per gold equivalent ounce sold fell roughly 17% year over year to $1,236.Margin per gold equivalent ounce sold was $883 in the quarter, down from the prior quarter’s $908.FY22 ResultsEarnings, as adjusted, for full-year 2022 were 22 cents per share compared with 17 cents a year ago. Net sales climbed 33% to $3,455.1 million.FinancialsCash and cash equivalents were $418.1 million at the end of the reported quarter, down around 21% year over year. Long-term debt was $2,556.9 million at the end of the quarter, up about 61%.Operating cash flow increased approximately 220% year over year in the fourth quarter to $474.3 million.OutlookFor 2023, Kinross expects production to be 2.1 million gold equivalent ounces (+/- 5%). For the first quarter, the company expects production to be lower than the rest of the year due to shutdowns at Tasiast related to the 24K project and at La Coipa. Seasonal impacts of mining at Paracatu are also expected to slow down production in the first quarter.The company expects production cost of sales of $970 per gold equivalent ounce (+/- 5%) for the year, factoring in inflation, including higher labor and consumables costs. The company expects all-in sustaining cost per gold equivalent ounce of $1,320 for 2023.Capital expenditures are predicted at around $1 billion (+/- 5%) for this year.Story continuesPrice PerformanceShares of Kinross have declined 33.7% in the past year compared with a 13.4% fall of the industry.Zacks Investment ResearchImage Source: Zacks Investment ResearchZacks Rank &amp; Other Key PicksKinross currently carries a Zacks Rank #2 (Buy).Some other top-ranked stocks to consider in the basic materials space are Alpha Metallurgical Resources, Inc. AMR, ATI Inc. ATI and Nucor Corporation NUE. ATI and NUE currently sport a Zacks Rank #1 (Strong Buy), while AMR carries a Zacks Rank #2. You can see the complete list of today’s Zacks #1 Rank stocks here.  Alpha Metallurgical’s shares have gained 90.4% in the past year. The Zacks Consensus Estimate for AMR’s current-year earnings has been revised 1.7% upward in the past 60 days. The company has an earnings growth rate of 425% for the current year.Alpha Metallurgical topped Zacks Consensus Estimate in two of the last four quarters. It delivered a trailing four-quarter earnings surprise of 1.1% on average.ATI’s shares have gained 72.1% in the past year. The Zacks Consensus Estimate for ATI’s current-year earnings has been revised 0.9% upward in the past 60 days. The company has an earnings growth rate of 8% for the current year.ATI topped Zacks Consensus Estimate in all the last four quarters. It delivered a trailing four-quarter earnings surprise of 32.4% on average.Nucor’s shares have gained 36.7% in the past year. The Zacks Consensus Estimate for NUE’s current-year earnings has been revised 12.5% upward in the past 60 days.Nucor topped Zacks Consensus Estimate in all the last four quarters. It delivered a trailing four-quarter earnings surprise of 7.7% on average.Want the latest recommendations from Zacks Investment Research? Today, you can download 7 Best Stocks for the Next 30 Days. Click to get this free reportAlpha Metallurgical Resources, Inc. (AMR) : Free Stock Analysis ReportNucor Corporation (NUE) : Free Stock Analysis ReportATI Inc. (ATI) : Free Stock Analysis ReportKinross Gold Corporation (KGC) : Free Stock Analysis ReportTo read this article on Zacks.com click here.Zacks Investment Research]"
1,b95c4cca-b9a7-3f33-b4d6-766d2d944693,AYI,2023-02-20,Investors Met With Slowing Returns on Capital At Acuity Brands (NYSE:AYI),Simply Wall St.,https://finance.yahoo.com/news/investors-met-slowing-returns-capital-103132417.html,1676889092,STORY,['AYI'],"[Finding a business that has the potential to grow substantially is not easy, but it is possible if we look at a few key financial metrics. Firstly, we'll want to see a proven return on capital employed (ROCE) that is increasing, and secondly, an expanding base of capital employed. Put simply, these types of businesses are compounding machines, meaning they are continually reinvesting their earnings at ever-higher rates of return. Although, when we looked at Acuity Brands (NYSE:AYI), it didn't seem to tick all of these boxes.Understanding Return On Capital Employed (ROCE)If you haven't worked with ROCE before, it measures the 'return' (pre-tax profit) a company generates from capital employed in its business. To calculate this metric for Acuity Brands, this is the formula:Return on Capital Employed = Earnings Before Interest and Tax (EBIT) ÷ (Total Assets - Current Liabilities)0.19 = US$513m ÷ (US$3.4b - US$698m) (Based on the trailing twelve months to November 2022).Thus, Acuity Brands has an ROCE of 19%.  In absolute terms, that's a satisfactory return, but compared to the Electrical industry average of 10% it's much better. Check out our latest analysis for Acuity Brands roceIn the above chart we have measured Acuity Brands' prior ROCE against its prior performance, but the future is arguably more important. If you'd like to see what analysts are forecasting going forward, you should check out our free report for Acuity Brands.What The Trend Of ROCE Can Tell UsOver the past five years, Acuity Brands' ROCE and capital employed have both remained mostly flat. Businesses with these traits tend to be mature and steady operations because they're past the growth phase. With that in mind, unless investment picks up again in the future, we wouldn't expect Acuity Brands to be a multi-bagger going forward.The Key TakeawayWe can conclude that in regards to Acuity Brands' returns on capital employed and the trends, there isn't much change to report on. And investors may be recognizing these trends since the stock has only returned a total of 35% to shareholders over the last five years. Therefore, if you're looking for a multi-bagger, we'd propose looking at other options.Story continuesOn a separate note, we've found   1 warning sign for Acuity Brands   you'll probably want to know about.While Acuity Brands isn't earning the highest return, check out this free list of companies that are earning high returns on equity with solid balance sheets.Have feedback on this article? Concerned about the content? Get in touch with us directly. Alternatively, email editorial-team (at) simplywallst.com.This article by Simply Wall St is general in nature. We provide commentary based on historical data and analyst forecasts only using an unbiased methodology and our articles are not intended to be financial advice. It does not constitute a recommendation to buy or sell any stock, and does not take account of your objectives, or your financial situation. We aim to bring you long-term focused analysis driven by fundamental data. Note that our analysis may not factor in the latest price-sensitive company announcements or qualitative material. Simply Wall St has no position in any stocks mentioned.Join A Paid User Research SessionYou’ll receive a US$30 Amazon Gift card for 1 hour of your time while helping us build better investing tools for the individual investors like yourself. Sign up here]"
2,d0896d40-9f42-3ef4-b0c7-5fc8f5add4a6,ARE,2023-02-20,3 Exceptional Dividend Stocks to Buy and Hold Forever,Motley Fool,https://finance.yahoo.com/m/d0896d40-9f42-3ef4-b0c7-5fc8f5add4a6/3-exceptional-dividend-stocks.html,1676824560,STORY,"['HASI', 'ARE', 'O']",[These stocks stand out as exceptional buys considering their growth opportunities and dividend histories.Continue reading]
3,901ddfd6-fe56-3c61-95b4-897c641127f8,STT,2023-02-20,Bet on These 5 Low-Leverage Stocks Amid Persistent Inflation,Zacks,https://finance.yahoo.com/news/bet-5-low-leverage-stocks-115911124.html,1676894351,STORY,"['ALK', 'STT']","[U.S. stocks ended on a mixed note on Feb 17, following Federal Reserve officials’ comments on renewed fears about interest rates. Persistent inflation also continued to be a major concern for investors.However, this should not dissuade investors from putting their money in the stock market. In fact, a prudent investor knows that this is the right time to buy stocks that are safe bets.  To this end, we recommend stocks like Rollins ROL, Alaska Air Group ALK, Linde LIN, Skyline SKY and State Street STT, which bear low leverage and, therefore, can shield investors from incurring losses in times of crisis.Now, before selecting low-leverage stocks, let’s explore what leverage is and how choosing a low-leverage stock helps investors.In finance, leverage is a term used to denote the practice of borrowing capital by companies to run their operations smoothly and expand the same. Such borrowings are done through debt financing. But there remains an option for equity finance. This is probably due to the cheap and easy availability of debt over equity financing.However, debt financing has its share of drawbacks. Particularly, it is desirable only as long as it successfully generates a higher rate of return compared to the interest rate. So, to avoid considerable losses in your portfolio, one should always avoid companies that resort to exorbitant debt financing.Therefore, the crux of safe investment lies in choosing a company that is not burdened with debt, as a debt-free stock is almost impossible to find.Such an event shows how volatile the equity market can be at times and as an investor, if you don’t want to lose big time, we suggest you invest in stocks, which bear low leverage and are, hence, less risky.To identify such stocks, historically, several leverage ratios have been developed to measure the amount of debt a company bears and the debt-to-equity ratio is one of the most common ratios.Analyzing Debt/EquityDebt-to-Equity Ratio = Total Liabilities/Shareholders’ EquityStory continuesThis metric is a liquidity ratio that indicates the amount of financial risk a company bears. A lower debt-to-equity ratio reflects improved solvency for a company.With the fourth-quarter earnings cycle going on full-fledged, investors must be eyeing stocks that have exhibited solid earnings growth in the recent past. But if a stock bears a high debt-to-equity ratio in times of economic downturn, its so-called booming earnings picture might turn into a nightmare.The Winning StrategyConsidering the aforementioned factors, it is prudent to choose stocks with a low debt-to-equity ratio to ensure steady returns.Yet, an investment strategy based solely on the debt-to-equity ratio might not fetch the desired outcome. To choose stocks that have the potential to give you steady returns, we have expanded our screening criteria to include some other factors.Here are the other parameters:Debt/Equity less than X-Industry Median: Stocks that are less leveraged than their industry peers.Current Price greater than or equal to 10: The stocks must be trading at a minimum of $10 or above.Average 20-day Volume greater than or equal to 50000: A substantial trading volume ensures that the stock is easily tradable.Percentage Change in EPS F(0)/F(-1) greater than X-Industry Median: Earnings growth adds to optimism, leading to a stock’s price appreciation.VGM Score of A or B: Our research shows that stocks with a VGM Score of A or B, when combined with a Zacks Rank #1 (Strong Buy) or 2 (Buy), offer the best upside potential.Estimated One-Year EPS Growth F(1)/F(0) greater than 5: This shows earnings growth expectation.Zacks Rank #1 or 2: Irrespective of market conditions, stocks with a Zacks Rank #1 or 2 have a proven history of success.Excluding stocks with a negative or a zero debt-to-equity ratio, here we present five out of 13 picks that made it through screening.Rollins: It provides pest and termite control services to residential and commercial customers. The company offers protection against termite damage, insects and rodents to homes and businesses, including food manufacturers, food service establishments, hotels, transportation companies and retailers. On Feb 15, 2023, Rollins released its fourth-quarter 2022 results. Its fourth-quarter revenues were $661.4 million, an increase of 10.2% from the fourth quarter of 2021.ROL delivered an earnings surprise of 5.85%, on average, in the trailing four quarters. It currently carries a Zacks Rank #2. The Zacks Consensus Estimate for 2023 earnings implies a 6.7% improvement from the 2022 reported figure.Alaska Air Group: This airline company, together with its partner regional carriers, serves more than 120 cities across North America. In January 2023, Alaska Air announced its fourth-quarter 2022 results. The company reported operating revenues of $2,479 million in the fourth quarter, up 31% year over year.ALK currently carries a Zacks Rank #2. The Zacks Consensus Estimate for its 2023 earnings suggests a 32.6% improvement from the 2022 reported figure. It delivered an earnings surprise of 8.98%, on average, in the trailing four quarters.Linde: It is a leading producer of industrial gases utilized in various industries like chemicals &amp; refining, food &amp; beverage, electronics, healthcare, manufacturing, and primary metals. On Feb 8, 2023, Linde Engineering signed an agreement with BASF for the engineering, procurement and construction of a synthesis gas plant in Zhanjiang, China.LIN currently carries a Zacks Rank #2. It delivered an earnings surprise of 5.87%, on average, in the trailing four quarters. The Zacks Consensus Estimate for 2023 earnings indicates an 8.1% improvement from the 2022 reported figure. You can see the complete list of today’s Zacks #1 Rank stocks here.Skyline: It designs, produces and distributes manufactured housing and recreational vehicles. On Feb 6, 2023, Skyline announced its third-quarter fiscal 2023 results. Its net sales for third- quarter fiscal 2023 increased 8.9% from the prior-year period to $582.3 million.SKY currently carries a Zacks Rank #2. It delivered a four-quarter earnings surprise of 43.18%, on average. The Zacks Consensus Estimate for fiscal 2023 earnings suggests a 55.6% improvement from the 2022 reported figure.State Street: It provides a range of products and services for institutional investors worldwide through its subsidiaries. On Jan 27, 2023, State Street announced that it has joined forces with black-owned businesses to underwrite $1.25 billion of senior unsecured debt, thereby reinforcing its commitment to strengthen Black-owned businesses. STT currently carries a Zacks Rank #2. It delivered a four-quarter earnings surprise of 5.89%, on average. The Zacks Consensus Estimate for 2023 earnings suggests a 15.1% improvement from the 2022 reported figure.Get the rest of the stocks on the list and start putting this and other ideas to the test. It can all be done with the Research Wizard stock picking and back testing software.The Research Wizard is a great place to begin. It's easy to use. Everything is in plain language. And it's very intuitive. Start your Research Wizard trial today. And the next time you read an economic report, open up the Research Wizard, plug your finds in, and see what gems come out.Click here to sign up for a free trial to the Research Wizard today.Disclosure: Officers, directors and/or employees of Zacks Investment Research may own or have sold short securities and/or hold long and/or short positions in options that are mentioned in this material. An affiliated investment advisory firm may own or have sold short securities and/or hold long and/or short positions in options that are mentioned in this material.Disclosure: Performance information for Zacks’ portfolios and strategies are available at: https://www.zacks.com/performance.Want the latest recommendations from Zacks Investment Research? Today, you can download 7 Best Stocks for the Next 30 Days. Click to get this free reportState Street Corporation (STT) : Free Stock Analysis ReportAlaska Air Group, Inc. (ALK) : Free Stock Analysis ReportRollins, Inc. (ROL) : Free Stock Analysis ReportLinde plc (LIN) : Free Stock Analysis ReportSkyline Corporation (SKY) : Free Stock Analysis ReportTo read this article on Zacks.com click here.Zacks Investment Research]"
4,04e6d67a-d934-3750-b579-4dbc2a685963,USB,2023-02-20,Warren Buffett Is Ditching This Stock After 17 Years,Motley Fool,https://finance.yahoo.com/m/04e6d67a-d934-3750-b579-4dbc2a685963/warren-buffett-is-ditching.html,1676890680,STORY,"['BRK-A', 'USB-PQ']",[Buffett's company Berkshire Hathaway recently sold most of its position in one of its long-time bank holdings.Continue reading]
5,19a658e6-d94a-3cdd-b6c6-580bbd47adcb,CF,2023-02-20,"Time To Worry? Analysts Are Downgrading Their CF Industries Holdings, Inc. (NYSE:CF) Outlook",Simply Wall St.,https://finance.yahoo.com/news/time-worry-analysts-downgrading-cf-101155427.html,1676887915,STORY,['CF'],"[The analysts covering CF Industries Holdings, Inc. (NYSE:CF) delivered a dose of negativity to shareholders today, by making a substantial revision to their statutory forecasts for this year. Revenue and earnings per share (EPS) forecasts were both revised downwards, with the analysts seeing grey clouds on the horizon.Following the latest downgrade, the current consensus, from the 15 analysts covering CF Industries Holdings, is for revenues of US$8.0b in 2023, which would reflect a stressful 29% reduction in CF Industries Holdings' sales over the past 12 months. Statutory earnings per share are supposed to nosedive 32% to US$11.64 in the same period. Before this latest update, the analysts had been forecasting revenues of US$9.3b and earnings per share (EPS) of US$14.61 in 2023. Indeed, we can see that the analysts are a lot more bearish about CF Industries Holdings' prospects, administering a substantial drop in revenue estimates and slashing their EPS estimates to boot. View our latest analysis for CF Industries Holdings earnings-and-revenue-growthAnalysts made no major changes to their price target of US$106, suggesting the downgrades are not expected to have a long-term impact on CF Industries Holdings' valuation. There's another way to think about price targets though, and that's to look at the range of price targets put forward by analysts, because a wide range of estimates could suggest a diverse view on possible outcomes for the business. Currently, the most bullish analyst values CF Industries Holdings at US$132 per share, while the most bearish prices it at US$75.00. There are definitely some different views on the stock, but the range of estimates is not wide enough as to imply that the situation is unforecastable, in our view.Of course, another way to look at these forecasts is to place them into context against the industry itself. These estimates imply that sales are expected to slow, with a forecast annualised revenue decline of 29% by the end of 2023. This indicates a significant reduction from annual growth of 21% over the last five years. Compare this with our data, which suggests that other companies in the same industry are, in aggregate, expected to see their revenue grow 3.4% per year. It's pretty clear that CF Industries Holdings' revenues are expected to perform substantially worse than the wider industry.Story continuesThe Bottom LineThe biggest issue in the new estimates is that analysts have reduced their earnings per share estimates, suggesting business headwinds lay ahead for CF Industries Holdings. Regrettably, they also downgraded their revenue estimates, and the latest forecasts imply the business will grow sales slower than the wider market. We're also surprised to see that the price target went unchanged. Still, deteriorating business conditions (assuming accurate forecasts!) can be a leading indicator for the stock price, so we wouldn't blame investors for being more cautious on CF Industries Holdings after the downgrade.With that said, the long-term trajectory of the company's earnings is a lot more important than next year. We have estimates - from multiple CF Industries Holdings analysts - going out to 2025, and you can see them free on our platform here.Of course, seeing company management  invest large sums of money in a stock can be just as useful as knowing whether analysts are downgrading their estimates. So you may also wish to search this free list of stocks that insiders are buying.Have feedback on this article? Concerned about the content? Get in touch with us directly. Alternatively, email editorial-team (at) simplywallst.com.This article by Simply Wall St is general in nature. We provide commentary based on historical data and analyst forecasts only using an unbiased methodology and our articles are not intended to be financial advice. It does not constitute a recommendation to buy or sell any stock, and does not take account of your objectives, or your financial situation. We aim to bring you long-term focused analysis driven by fundamental data. Note that our analysis may not factor in the latest price-sensitive company announcements or qualitative material. Simply Wall St has no position in any stocks mentioned.Join A Paid User Research SessionYou’ll receive a US$30 Amazon Gift card for 1 hour of your time while helping us build better investing tools for the individual investors like yourself. Sign up here]"
6,92c5538c-1f1c-3b18-8329-cb0e9a634cf3,WMT,2023-02-20,Walmart Stock Could Rally After Earnings. Why Some on Wall Street Are Still Cautious.,Barrons.com,https://finance.yahoo.com/m/92c5538c-1f1c-3b18-8329-cb0e9a634cf3/walmart-stock-could-rally.html,1676883600,STORY,['WMT'],"[America's largest retailer's disappointing outlook is pressuring shares, despite a strong fourth quarter and a dividend boost.Continue reading]"
