,Id,Company,Date,Title,Publisher,Link,ProviderPublishTime,Type,Related Company,Text
33,66291c3b-9e0a-3477-adca-ef14705f1545,MNST,2023-08-28,Monster Beverage: One Chart Explains the Mega-Rally,FX Empire,https://finance.yahoo.com/news/monster-beverage-one-chart-explains-080118189.html,1693123278,STORY,['MNST'],"[Monster Beverage Attracts Big Money InflowsWant an edge in trading? Follow the Big Money.What’s Big Money? Said simply, it’s when a stock rises due to institutional demand. Top stocks tend to attract savvy investors.You see, fund managers are always looking to bet on the next outperforming stocks…the best in class. They spend countless hours sizing up companies, reading reports, speaking to analysts…you name it. When they find a company firing on all cylinders, they pounce in a big way.The YTD action tells the story. Each green bar signals unusual buying volumes in MNST shares, pushing the stock higher:Source: www.mapsignals.comFew stocks have charts this strong. Historical green bars suggest healthy demand. But, what about the fundamental story?Monster Beverage Fundamental AnalysisNext, I want to make sure the fundamental story is healthy too. As you can see, MNST has had positive sales and EPS growth in recent years:3-year sales growth rate (+14.6%)3-year EPS growth rate (+5%)The company is also expected to grow EPS 16.7% this year.Source: FactSetMarrying great fundamentals with our proprietary Big Money software has found some big winning stocks over the long-term.Check this out. Monster Beverage has been a top-rated stock at MAPsignals. That means the stock has had buy pressure and growing fundamentals. We have a ranking process that showcases stocks like this on a weekly basis.It’s made the rare Top 20 report numerous times. The blue bars below shows when MNST was a top pick:Source: www.mapsignals.comTracking unusual volumes reveals the power of the MAPsignals process.Monster Beverage Price PredictionThe MNST rally has been in place for years. Big Money buying in the shares is signaling to take notice. Given the historical gains in share price and strong fundamentals, this stock could be worth a spot in a diversified portfolio.Disclosure: the author holds no position in MNST at the time of publication.If you want to take your investing to the next level, learn more about the MAPsignals process here.Story continuesFollow our free insights here.This article was originally posted on FX EmpireMore From FXEMPIRE:Arista Networks: One Chart Explains the Mega-RallyAUD/USD Forecast – Australian Dollar Pulls BackUSD/JPY Weekly Forecast – US Dollar Continues to Grind Against the Japanese YenGBP/JPY Forecast – British Pound Finds Buyers on the DipMeta Platforms: One Chart Explains the Mega-RallyGBP/USD Forecast – British Pound Recovers After Initial Dip]"
34,669e470a-7380-3d39-a80c-0b3291a61d74,LUV,2023-08-28,Investors warn ‘fluffy’ ESG metrics are being gamed to boost bonuses,Financial Times,https://finance.yahoo.com/m/669e470a-7380-3d39-a80c-0b3291a61d74/investors-warn-%E2%80%98fluffy%E2%80%99-esg.html,1693134008,STORY,['LUV'],[]
35,c336a1a5-e04a-346c-88a0-2a9741f643c9,TDG,2023-08-28,15 Most Undervalued Large Cap Stocks to Buy According to Wall Street Analysts,Insider Monkey,https://finance.yahoo.com/news/15-most-undervalued-large-cap-124430101.html,1693140270,STORY,"['COMP', 'FCNCA', 'MKL', 'FICO', 'DECK', 'CMG', 'IDXX', 'NOW', 'TDG', 'MSCI', 'AZO', 'MELI']","[In this piece, we will take a look at the 15 most undervalued large cap stocks to buy according to Wall Street analysts. If you want to skip our analysis of the latest in the stock market, then take a look at 5 Most Undervalued Large Cap Stocks to Buy. With the second half of 2023 having set in, all eyes on Wall Street were on officials of the Federal Reserve. Fed chairman Jerome Powell and other central bankers were set to meet at Jackson Hole in late August, and given the crucial role that the banks have played in the stock market for more than a year now, investors were naturally tuned in to see if anything had changed.So far, the Federal Reserve has hiked interest rates to multi year high levels, and courtesy of the strong hype surrounding artificial intelligence, markets have reversed the massive losses that they had bled through last year. However, while the first half of 2023 was one of the best time periods on the market in history, the second half is rather muted when it comes to share price gains. In fact, major indexes have pared back some of their gains particularly since August is vacation time in the financial world and because some folks likely took profits and re balanced their portfolios.At Jackson Hall, Chairman Powell's comments made it clear that since inflation is high, any hopes of interest rates coming down any time soon are unwarranted. However, at the same time, it's also clear that 2023 and ahead will be different when it comes to an extremely hawkish Fed. The Fed chair made it clear that the central bank will be more cautious moving forward and will be more cognizant of any risks to economic health from further interest rate hikes. The labor market continues to be one of the Fed's top markers in determining future interest rate hikes, and Mr. Powell is of the view that should wages grow or unemployment drop, then the labor market could provide consumers with higher discretionary income to drive up prices. Naturally, this is unacceptable, since bringing down inflation is one of the primary objectives of the recent interest rate hiking cycle.Story continuesThe key takeaway from Chair Powell's latest remarks is that the central bank is able and willing to further increase interest rates. Yet, markets seemed to have shrugged off this willingness, as during the last trading day of the week, the S&amp;P500 was up 29 points and the NASDAQ Composite gained 126 points. Both of these indexes had initially dropped as Mr. Powell was explaining his latest position, showing the fear that is currently prevalent in the market when it comes to the Federal Reserve. Even though markets might have been relatively calm today, the fact still remains that there is no fixed formula for the Fed chair and his team to decide when interest rates have reached the perfect level to avoid seriously damaging the economy and bringing down inflation at the same time.This hair wrenching problem was part of his closing remarks as Mr. Powell outlined:Two percent is and will remain our inflation target. We are committed to achieving and sustaining a stance of monetary policy that is sufficiently restrictive to bring inflation down to that level over time. It is challenging, of course, to know in real time when such a stance has been achieved. There are some challenges that are common to all tightening cycles. For example, real interest rates are now positive and well above mainstream estimates of the neutral policy rate. We see the current stance of policy as restrictive, putting downward pressure on economic activity, hiring, and inflation. But we cannot identify with certainty the neutral rate of interest, and thus there is always uncertainty about the precise level of monetary policy restraint.That assessment is further complicated by uncertainty about the duration of the lags with which monetary tightening affects economic activity and especially inflation. Since the symposium a year ago, the Committee has raised the policy rate by 300 basis points, including 100 basis points over the past seven months. And we have substantially reduced the size of our securities holdings. The wide range of estimates of these lags suggests that there may be significant further drag in the pipeline.. . . .These uncertainties, both old and new, complicate our task of balancing the risk of tightening monetary policy too much against the risk of tightening too little. Doing too little could allow above-target inflation to become entrenched and ultimately require monetary policy to wring more persistent inflation from the economy at a high cost to employment. Doing too much could also do unnecessary harm to the economy.Today, we'll take a look at some large cap stocks that are undervalued according to Wall Street analysts. Large caps are generally more stable in the time of a stock market downturn when compared to their small cap peers. At the same time, they also provide more liquidity to lock in potential gains, and the nature of the firms and their business models reduces the risks of stock market scams. There are also several ways to determine whether a stock is undervalued. One of these involves taking a look at the price to earnings ratio while another involves calculating the differential between an analyst's projected share price and the market price.Today we'll rely on the latter and the top three picks are First Citizens BancShares, Inc. (NASDAQ:FCNCA), Humana Inc. (NYSE:HUM), and MercadoLibre, Inc. (NASDAQ:MELI).15 Most Undervalued Large Cap Stocks To Buy According To Wall Streetsource: pixabayOur Methodology To compile our list of undervalued large cap stocks to buy according to Wall Street analysts, we selected the stocks with the highest share price upside and Buy or better analyst ratings with market capitalization greater than $10 billion and less than $200 billion.15 Most Undervalued Large Cap Stocks To Buy According To Wall Street15. Markel Group Inc. (NYSE:MKL)Latest Share Price Upside: 10%Average Analyst Share Price Target: $1,616Markel Group Inc. (NYSE:MKL) is a diversified American insurance firm with a global operations base. Its shares are rated Strong Buy on average and the stock is up a reasonable 10.87% year to date.As of Q2 2023, 29 hedge funds out of the 910 part of Insider Monkey's research were Markel Group Inc. (NYSE:MKL)'s investors. Out of these, the biggest shareholder is Warren Buffett's Berkshire Hathaway through an investment of $652 million.Along with Humana Inc. (NYSE:HUM), First Citizens BancShares, Inc. (NASDAQ:FCNCA), and MercadoLibre, Inc. (NASDAQ:MELI), Markel Group Inc. (NYSE:MKL) is an undervalued stock to buy according to Wall Street analysts.14. MSCI Inc. (NYSE:MSCI)Latest Share Price Upside: 10% Average Analyst Share Price Target: $586MSCI Inc. (NYSE:MSCI) is an investment advisory, management, and financial services firm. Like other financial firms, it has performed well lately and beaten analyst EPS estimates in all four of its latest quarters.By the end of this year's second quarter, 51 out of the 910 hedge funds part of Insider Monkey's database had held a stake in MSCI Inc. (NYSE:MSCI). Out of these, the firm's largest shareholder is Henry Ellenbogen's Durable Capital Partners since it owns 678,556 shares that are worth $318 million.13. Fair Isaac Corporation (NYSE:FICO)Latest Share Price Upside: 11%Average Analyst Share Price Target: $947Fair Isaac Corporation (NYSE:FICO) is a software company that provides data analytics and other services to firms all over the world. The firm is slated to perform well in the future according to Baron Funds, as its latest investor letter cited confidence in Fair Isaac's CEO.As of June 2023, 46 of the 910 hedge funds polled by Insider Monkey had invested in the company. Fair Isaac Corporation (NYSE:FICO)'s biggest hedge fund shareholder is Dev Kantesaria's Valley Forge Capital through its $763 million stake.12. AutoZone, Inc. (NYSE:AZO)Latest Share Price Upside: 13%Average Analyst Share Price Target: $2,775AutoZone, Inc. (NYSE:AZO) is a car parts retailer. The firm has been performing well this year as the car market has been resilient in a high rate environment but the shares are nearly flat year to date after dropping in May.Insider Monkey dug through 910 hedge funds for their June quarter of 2023 investments to discover that 52 had bought the firm's shares. AutoZone, Inc. (NYSE:AZO)'s largest stakeholder is Peter Rathjens, Bruce Clarke, and John Campbell's Arrowstreet Capital courtesy of its $328 million investment.11. ServiceNow, Inc. (NYSE:NOW)Latest Share Price Upside: 13%Average Analyst Share Price Target: $639ServiceNow, Inc. (NYSE:NOW) is one of the dominating players when it comes to data analytics and corporate digital transformation. It has partnered up with NVIDIA to offer artificial intelligence capabilities to customers and the stock is 46% year to date.By the end of 2023's second quarter, 93 out of the 910 hedge funds part of Insider Monkey's study had held a stake in ServiceNow, Inc. (NYSE:NOW). Out of these, the biggest investor is Rajiv Jain's GQG Partners since it owns $859 million worth of shares.10. TransDigm Group Incorporated (NYSE:TDG)Latest Share Price Upside: 15%Average Analyst Share Price Target: $991TransDigm Group Incorporated (NYSE:TDG) is an aircraft component manufacturer that sells products such as pumps, actuators, and motors. It is among the handful of companies that are slated to benefit from an uptick in global air travel and the stock is rated Buy on average.67 out of the 910 hedge funds part of Insider Monkey's Q2 2023 database have bought the firm's shares. TransDigm Group Incorporated (NYSE:TDG)'s largest stakeholder among these is Mark Massey's AltaRock Partners since it owns 1.3 million shares that are worth $1.2 billion.9. Texas Pacific Land Corporation (NYSE:TPL)Latest Share Price Upside: 15%Average Analyst Share Price Target: $2,186Texas Pacific Land Corporation (NYSE:TPL) is a land management company that manages oil production activities and provides its land for other use cases. Most of the firm's shares are owned by institutional investors, and analysts have set an average share price target of $2,186.As of June 2023, out of the 910 hedge fund portfolios studied by Insider Monkey, 23 had held a stake in Texas Pacific Land Corporation (NYSE:TPL). Murray Stahl's Horizon Asset Management is the company's biggest investor since it holds a $1.8 billion stake.8. Chipotle Mexican Grill, Inc. (NYSE:CMG)Latest Share Price Upside: 16%Average Analyst Share Price Target: $2,168Chipotle Mexican Grill, Inc. (NYSE:CMG) is a popular restaurant chain in America. Resilience in the U.S. consumer has helped the firm beat analyst EPS estimates in three of its four latest quarters and the shares are rated Strong Buy on average.After digging through 910 hedge fund holdings for their second quarter of 2023 investments, Insider Monkey discovered that 55 had bought the firm's shares. Chipotle Mexican Grill, Inc. (NYSE:CMG)'s largest hedge fund stakeholder is Bill Ackman's Pershing Square due to its $2 billion investment.7. IDEXX Laboratories, Inc. (NASDAQ:IDXX)Latest Share Price Upside: 17%Average Analyst Share Price Target: $678IDEXX Laboratories, Inc. (NASDAQ:IDXX) is a medical company that deals in animal health management products. The firm had good news for investors in August as it raised annual revenue and profit guidance.Insider Monkey's June quarter of 2023 research covering 910 revealed that 43 had invested in IDEXX Laboratories, Inc. (NASDAQ:IDXX). Terry Smith's Fundsmith LLP is the largest shareholder out of these, owning 2.9 million shares that are worth $1.4 billion.6. Deckers Outdoor Corporation (NYSE:DECK)Latest Share Price Upside: 18%Average Analyst Share Price Target: $616Deckers Outdoor Corporation (NYSE:DECK) is a footwear company headquartered in Goleta, California. Its shares are rated Strong Buy on average and analysts have penciled in an 18% upside to the shares.As of Q2 2023, 47 out of the 910 hedge funds polled by Insider Monkey had bought the firm's shares. Deckers Outdoor Corporation (NYSE:DECK)'s biggest investor is Robert Pitts' Steadfast Capital Management through its $218 million stake.First Citizens BancShares, Inc. (NASDAQ:FCNCA), Deckers Outdoor Corporation (NYSE:DECK), Humana Inc. (NYSE:HUM), and MercadoLibre, Inc. (NASDAQ:MELI) are some undervalued large cap stocks being favored by Wall Street analysts.Click to continue reading and see 5 Most Undervalued Large Cap Stocks to Buy.Suggested Articles:11 Most Undervalued Renewable Energy Stocks to Buy11 Most Undervalued REIT Stocks to Buy 11 Most Undervalued Dow Stocks To Buy According To Hedge FundsDisclosure: None. 15 Most Undervalued Large Cap Stocks To Buy According To Wall Street is originally published on Insider Monkey.]"
36,e3220a7d-ba0f-3ead-85ad-a73449fcca00,LEG,2023-08-28,"Is Leggett & Platt, Incorporated (NYSE:LEG) Trading At A 27% Discount?",Simply Wall St.,https://finance.yahoo.com/news/leggett-platt-incorporated-nyse-leg-110446143.html,1693220686,STORY,['LEG'],"[Key InsightsLeggett &amp; Platt's estimated fair value is US$37.90 based on 2 Stage Free Cash Flow to EquityLeggett &amp; Platt's US$27.66 share price signals that it might be 27% undervalued The US$28.00 analyst price target for LEG is 26% less than our estimate of fair valueHow far off is Leggett &amp; Platt, Incorporated (NYSE:LEG) from its intrinsic value? Using the most recent financial data, we'll take a look at whether the stock is fairly priced by estimating the company's future cash flows and discounting them to their present value. This will be done using the Discounted Cash Flow (DCF) model. Before you think you won't be able to understand it, just read on! It's actually much less complex than you'd imagine.Remember though, that there are many ways to estimate a company's value, and a DCF is just one method. If you still have some burning questions about this type of valuation, take a look at the Simply Wall St analysis model. View our latest analysis for Leggett &amp; Platt The CalculationWe are going to use a two-stage DCF model, which, as the name states, takes into account two stages of growth. The first stage is generally a higher growth period which levels off heading towards the terminal value, captured in the second 'steady growth' period. In the first stage we need to estimate the cash flows to the business over the next ten years. Where possible we use analyst estimates, but when these aren't available we extrapolate the previous free cash flow (FCF) from the last estimate or reported value. We assume companies with shrinking free cash flow will slow their rate of shrinkage, and that companies with growing free cash flow will see their growth rate slow, over this period. We do this to reflect that growth tends to slow more in the early years than it does in later years.Generally we assume that a dollar today is more valuable than a dollar in the future, and so the sum of these future cash flows is then discounted to today's value:Story continues10-year free cash flow (FCF) estimate2024202520262027202820292030203120322033 Levered FCF ($, Millions) US$328.0mUS$325.0mUS$374.0mUS$394.0mUS$409.8mUS$423.9mUS$436.8mUS$449.0mUS$460.7mUS$472.0mGrowth Rate Estimate SourceAnalyst x1Analyst x1Analyst x1Analyst x1Est @ 4.00%Est @ 3.45%Est @ 3.06%Est @ 2.78%Est @ 2.59%Est @ 2.46% Present Value ($, Millions) Discounted @ 9.6% US$299US$271US$284US$273US$259US$244US$230US$216US$202US$189(""Est"" = FCF growth rate estimated by Simply Wall St)Present Value of 10-year Cash Flow (PVCF) = US$2.5bThe second stage is also known as Terminal Value, this is the business's cash flow after the first stage. For a number of reasons a very conservative growth rate is used that cannot exceed that of a country's GDP growth. In this case we have used the 5-year average of the 10-year government bond yield (2.2%) to estimate future growth. In the same way as with the 10-year 'growth' period, we discount future cash flows to today's value, using a cost of equity of 9.6%.Terminal Value (TV)= FCF2033 × (1 + g) ÷ (r – g) = US$472m× (1 + 2.2%) ÷ (9.6%– 2.2%) = US$6.5bPresent Value of Terminal Value (PVTV)= TV / (1 + r)10= US$6.5b÷ ( 1 + 9.6%)10= US$2.6bThe total value, or equity value, is then the sum of the present value of the future cash flows, which in this case is US$5.0b. To get the intrinsic value per share, we divide this by the total number of shares outstanding. Relative to the current share price of US$27.7, the company appears a touch undervalued at a 27% discount to where the stock price trades currently. Valuations are imprecise instruments though, rather like a telescope - move a few degrees and end up in a different galaxy. Do keep this in mind.dcfThe AssumptionsWe would point out that the most important inputs to a discounted cash flow are the discount rate and of course the actual cash flows. If you don't agree with these result, have a go at the calculation yourself and play with the assumptions. The DCF also does not consider the possible cyclicality of an industry, or a company's future capital requirements, so it does not give a full picture of a company's potential performance. Given that we are looking at Leggett &amp; Platt as potential shareholders, the cost of equity is used as the discount rate, rather than the cost of capital (or weighted average cost of capital, WACC) which accounts for debt. In this calculation we've used 9.6%, which is based on a levered beta of 1.492. Beta is a measure of a stock's volatility, compared to the market as a whole. We get our beta from the industry average beta of globally comparable companies, with an imposed limit between 0.8 and 2.0, which is a reasonable range for a stable business.SWOT Analysis for Leggett &amp; PlattStrengthDebt is well covered by earnings and cashflows.Dividend is in the top 25% of dividend payers in the market.WeaknessEarnings declined over the past year.OpportunityAnnual earnings are forecast to grow for the next 3 years.Trading below our estimate of fair value by more than 20%.ThreatDividends are not covered by earnings.Annual earnings are forecast to grow slower than the American market.Looking Ahead:Valuation is only one side of the coin in terms of building your investment thesis, and it ideally won't be the sole piece of analysis you scrutinize for a company. DCF models are not the be-all and end-all of investment valuation. Instead the best use for a DCF model is to test certain assumptions and theories to see if they would lead to the company being undervalued or overvalued. For instance, if the terminal value growth rate is adjusted slightly, it can dramatically alter the overall result. What is the reason for the share price sitting below the intrinsic value? For Leggett &amp; Platt, we've put together three further aspects you should further research:Risks: As an example, we've found 3 warning signs for Leggett &amp; Platt that you need to consider before investing here.Future Earnings: How does LEG's growth rate compare to its peers and the wider market? Dig deeper into the analyst consensus number for the upcoming years by interacting with our free analyst growth expectation chart.Other Solid Businesses: Low debt, high returns on equity and good past performance are fundamental to a strong business. Why not explore our interactive list of stocks with solid business fundamentals to see if there are other companies you may not have considered!PS. The Simply Wall St app conducts a discounted cash flow valuation for every stock on the NYSE every day. If you want to find the calculation for other stocks just search here.Have feedback on this article? Concerned about the content? Get in touch with us directly. Alternatively, email editorial-team (at) simplywallst.com.This article by Simply Wall St is general in nature. We provide commentary based on historical data and analyst forecasts only using an unbiased methodology and our articles are not intended to be financial advice. It does not constitute a recommendation to buy or sell any stock, and does not take account of your objectives, or your financial situation. We aim to bring you long-term focused analysis driven by fundamental data. Note that our analysis may not factor in the latest price-sensitive company announcements or qualitative material. Simply Wall St has no position in any stocks mentioned.]"
