,Id,Company,Date,Title,Publisher,Link,ProviderPublishTime,Type,Related Company,Text
66,14960f24-e32e-3cc6-8c38-5579aa8dc871,PYPL,2023-08-28,"How PayPal is using AI to combat fraud, and make it easier to pay",AP Finance,https://finance.yahoo.com/news/paypal-using-ai-combat-fraud-114235212.html,1693222955,STORY,['PYPL'],"[NEW YORK (AP) — Artificial intelligence has been the buzzword of 2023 ever since ChatGPT made its public debut earlier this year, with businesses, schools, universities and even non-profits looking for ways to integrate AI in their operations.John Kim, chief product officer for PayPal, spoke with The Associated Press about how the company is using the early proliferation of artificial intelligence technologies in its business, as well as PayPal's future in payments when there's so much competition. The interview has been edited for length and clarity.Q: How have security issues changed since you’ve been in this role or similar roles? How much more complicated or sophisticated are threats or opportunities to protect customer data?A: One way you you can put it is that the fraud is a pretty big business, it's growing and getting more sophisticated by the day. It used to be that you would get, let’s say, an email sent to you and you’d find something off about it, right? Like there’s a misspelling and you think ""Gosh, I don’t see this person misspelling this common thing"" or the email seems to imply that it doesn't have a deep understanding of who I am. Then it became voices over the phone trying to convince you to do something. Now people can create whole identities using AI.Q: How are you integrating AI into the work you’re doing? Where do you see the most promise for AI in payments?A: We're planning on launching three new products with ties to AI in the next 120 days. For example, we have a checkout feature we are rolling out that uses AI to keep track of all the permutations of your addresses and personal information that you might use, and use AI to predict the right one to use with the right merchant. We currently try to detect unusual patterns — for example, patterns where fraudsters are trying to test your stolen card out to see if it's good or not — and alert you through the PayPal wallet so you can get that card shut down with your bank quickly. But detecting these patterns can get really complicated, and the patterns can change on the fly, so AI we believe will help us anticipate these changes and keep us ahead.Story continuesQ: But on that same point, where do you think AI is being oversold in some ways, or where do you think that the use case in your industry isn’t really there quite yet?A: I think AI has captured a lot of people's imaginations this year. It's made its way to boardrooms, into stores, every product conversation. Some people have been skeptical, and I think some skepticism is healthy. For example, we want to use AI to increase our chatbots' capability to engage with customers, but how much do we invest in such technology — which can be expensive to develop and run — when a customer service agent could do it better? Cost is going to be a massive issue. But in this short timetable since ChatGPT launched in March, I think you can't dismiss any claim you hear about AI at the moment because it's moving so fast.Q: A lot of competition has entered into the payments space in the last several years. Apple Pay. Google Pay. Buy now, pay later. PayPal is the oldest company in the online payments industry. What challenges have there been in trying to differentiate PayPal from the competition?A: PayPal really was a one-of-a-kind company for much of the early part of its life. So back then it was really about just getting scale. You didn’t really have to sell the value proposition. But now we really have to focus on the value proposition. Customers every day choose how they wish to pay for things, so you need to provide value above just being a method to pay, like security and fraud protection, or letting people now they are fully protected while at the same time making us the easiest way to pay.]"
67,bb399c73-d05a-3c83-b455-68bef772a5a0,PYPL,2023-08-28,One PayPal Holdings Insider Raised Their Stake In The Previous Year,Simply Wall St.,https://finance.yahoo.com/news/one-paypal-holdings-insider-raised-110017878.html,1693220417,STORY,['PYPL'],"[Looking at PayPal Holdings, Inc.'s (NASDAQ:PYPL ) insider transactions over the last year, we can see that insiders were net buyers. That is, there were more number of shares purchased by insiders than there were sold.Although we don't think shareholders should simply follow insider transactions, we would consider it foolish to ignore insider transactions altogether. View our latest analysis for PayPal Holdings The Last 12 Months Of Insider Transactions At PayPal HoldingsThe President Daniel Schulman made the biggest insider purchase in the last 12 months. That single transaction was for US$2.0m worth of shares at a price of US$76.17 each. That means that an insider was happy to buy shares at above the current price of US$61.19. Their view may have changed since then, but at least it shows they felt optimistic at the time. In our view, the price an insider pays for shares is very important. It is encouraging to see an insider paid above the current price for shares, as it suggests they saw value, even at higher levels. Daniel Schulman was the only individual insider to buy during the last year.The chart below shows insider transactions (by companies and individuals) over the last year. If you click on the chart, you can see all the individual transactions, including the share price, individual, and the date!insider-trading-volumeThere are plenty of other companies that have insiders buying up shares. You probably do not want to miss this free list of growing companies that insiders are buying.Insider Ownership Of PayPal HoldingsLooking at the total insider shareholdings in a company can help to inform your view of whether they are well aligned with common shareholders. I reckon it's a good sign if insiders own a significant number of shares in the company. PayPal Holdings insiders own 0.1% of the company, currently worth about US$101m based on the recent share price. This kind of significant ownership by insiders does generally increase the chance that the company is run in the interest of all shareholders.Story continuesWhat Might The Insider Transactions At PayPal Holdings Tell Us?It doesn't really mean much that no insider has traded PayPal Holdings shares in the last quarter. On a brighter note, the transactions over the last year are encouraging. With high insider ownership and encouraging transactions, it seems like PayPal Holdings insiders think the business has merit. Of course, the future is what matters most. So if you are interested in PayPal Holdings, you should check out this free report on analyst forecasts for the company.If you would prefer to check out another company -- one with potentially superior financials -- then do not miss this free list of interesting companies, that have HIGH return on equity and low debt.For the purposes of this article, insiders are those individuals who report their transactions to the relevant regulatory body. We currently account for open market transactions and private dispositions, but not derivative transactions.Have feedback on this article? Concerned about the content? Get in touch with us directly. Alternatively, email editorial-team (at) simplywallst.com.This article by Simply Wall St is general in nature. We provide commentary based on historical data and analyst forecasts only using an unbiased methodology and our articles are not intended to be financial advice. It does not constitute a recommendation to buy or sell any stock, and does not take account of your objectives, or your financial situation. We aim to bring you long-term focused analysis driven by fundamental data. Note that our analysis may not factor in the latest price-sensitive company announcements or qualitative material. Simply Wall St has no position in any stocks mentioned.]"
68,1c694e2a-24d6-39cb-adf6-59f826249a9a,PYPL,2023-08-28,Could PayPal's New CEO Send the Stock Skyrocketing?,Motley Fool,https://finance.yahoo.com/m/1c694e2a-24d6-39cb-adf6-59f826249a9a/could-paypal%27s-new-ceo-send.html,1693220400,STORY,['PYPL'],"[PayPal (NASDAQ: PYPL) has been one of the worst stocks to own in 2023. While the broader market has enjoyed significant gains, PayPal shareholders have been left in the dust, and the stock is down around 13% this year. Can this news revitalize the stock?Continue reading]"
69,8c26fde4-14d6-4ba3-9e3e-7912c8b99ebd,IBM,2023-08-28,Why the US war with Big Tech could have unintended consequences,Yahoo Finance,https://finance.yahoo.com/news/why-the-us-war-with-big-tech-could-have-unintended-consequences-130045555.html,1693141245,STORY,"['MSFT', 'AMZN', 'GOOG', 'GOOGL', 'IBM', 'META']","[The US government is taking on some of the country’s biggest tech giants in a series of high-stakes antitrust lawsuits. One lesson from past fights is that these cases can create an opening for a new generation of firms to emerge, even if the government isn’t successful.Take Microsoft (MSFT). The Seattle software and cloud computing giant benefited from a 1969 government case against rival IBM (IBM), which the government eventually dropped after 13 years due to what an assistant attorney general called ""flimsy"" evidence. The litigation had alleged IBM illegally monopolized the market for business computers.Later, between 1998 and 2001, Microsoft found itself hobbled by its own extended antitrust battle with the Justice Department, which resulted in a settlement that opened the door to broader competition in the internet browser software market.Microsoft's Bill Gates at a 1998 hearing before the Senate Judiciary Committee about whether his company was a monopoly that buried the competition. (Harry Hamburg/NY Daily News Archive via Getty Images) (New York Daily News Archive via Getty Images)The settlement — which required Microsoft to design its Windows operating system to interoperate with competing browsers, email clients, media players, and instant messaging software — created an opportunity for Google (GOOG, GOOGL), then a startup, to begin its period of meteoric growth in the 2000s.'These things are highly unpredictable'This scenario may be ripe to repeat itself with a new set of federal and state lawsuits that seek to break up Google, Facebook-owning Meta (META), and possibly Amazon (AMZN).The cases create potential for new tech giants to emerge, but no certain path, said former Federal Communications Commission Chief of Staff Blair Levin.""These things are highly unpredictable,"" said Levin, who is now a fellow at the Brookings Institution. ""I'm pretty sure no one would have predicted that the government's antitrust case against IBM would have produced Microsoft, nor ... that the government's Microsoft antitrust case would have produced Google. But they did.""Assistant Attorney General William Baxter announcing at a news conference in 1982 that a 13-year antitrust case against IBM had been dropped, saying that the case was based on 'flimsy' evidence. (Bettmann Archive) (Bettmann via Getty Images)One reason, Levin said, is that back then the emerging technology wasn't obvious. Microsoft didn't directly compete with IBM, and Google wasn't a direct competitor to Microsoft.Story continues""But what is certain,"" he said, citing the story of 5th century Sicilian tyrant Dionysius, ""is that history demonstrates that a Damocles sword over the big companies can have a positive result.""Rutgers University Law School professor Michael Carrier said even if the suits lead to a breakup of the Big Tech firms, emerging companies could remain hard pressed to compete over the short term with the dominant players' established scale.A small toothbrush business, he explains, could benefit if Amazon is forced to stop selling its own competing toothbrush products alongside its third-party sellers.""On the other hand, I don't see a single company that could replace the entire segment of what Amazon does,"" Carrier said about the retail giant's reach across dozens of markets. The same goes for Meta, he said, because emerging businesses cannot quickly replicate its network of users.That scale might already be compounding competition hurdles for one emerging technology, as the cases make their way through the courts. Unlike the IBM and Microsoft antitrust eras of the past, Levin said, today's emerging technology is obvious: artificial intelligence.And Google, Meta, Microsoft, and Amazon are already spending big on AI.""There is an argument that AI will completely transform the way we do advertising in very scary ways,"" Levin said, ""but nonetheless, if we're going after Google's ad-tracking technology, it's not clear to me what AI does to the value of it.""""Is AI creating new moats? Or, is it creating new attacking vectors?"" he said.The new case against Big TechOne agency in Washington is taking on multiple tech giants at once: the Federal Trade Commission.The FTC is trying to force Meta to split apart Facebook, Instagram, and WhatsApp. A federal case filed in December 2020 alleged the social media giant was illegally monopolizing the personal social networking market.Another recent FTC target was Microsoft. It tried to stop the Windows maker from completing its acquisition of ""Call of Duty"" developer Activision Blizzard (ATVI), before backing away from that attempt.""What the FTC is doing relevant to Al, is adopting a merger policy that will tend to discourage investment in startups,"" said former Justice Department Deputy Attorney General Tad Lipsky. The more the government challenges acquisitions of emerging technologies, the more startup funding dies up, he said, and dominant companies will look to develop technologies in house.The FTC is also reportedly preparing a suit against Amazon over concerns the e-commerce giant is unfairly competing with third-party sellers who use its marketplace.California and Washington, D.C., already sued Amazon over those concerns, arguing that the company illegally forced sellers to hike prices outside of the Amazon platform. The case filed by Washington, D.C., was thrown out by a judge last year, and the California case is ongoing.The FTC's campaign is being led by its 34-year-old chair Lina Khan, who has made taking on Big Tech the cornerstone of her tenure. She rose to prominence after publishing a 2017 article in the Yale Law Journal titled ""Amazon's Antitrust Paradox.""The article argued modern antitrust laws weren't equipped to tackle the tech industry's anticompetitive behavior because they were too focused on pricing as a means of determining consumer harms.FTC chair Lina Khan testifying before a House committee in July. (Tom Williams/CQ-Roll Call, Inc via Getty Images) (Tom Williams via Getty Images)Those laws, she argued, needed to be rethought to bring Big Tech companies to heel. Now she is attempting to rein in these companies as chair.It's the 1990s all over againBut the case that most closely resembles the government's attempts to rein in Microsoft during the 1990s targets the company that benefited most from Microsoft's quarter-century-old battle: Google.The Department of Justice and a collection of state attorneys general are suing Google in two consolidated cases launched during President Trump’s administration, alleging the company abuses its market power across search and search advertising to squeeze competition.Those cases go to trial beginning Sept. 12 before the US District Court for the District of Columbia, which has dismissed some of the claims.Multiple groups of state attorneys general are also targeting Google's mobile app distribution dominance, as well as its dominance across the markets for selling and brokering online ads.US Attorney General Merrick Garland speaking at the Justice Department earlier this month. (Bonnie Cash/REUTERS) (Bonnie Cash / reuters)In its case against Google, the DOJ alleges the search and advertising giant is violating the Sherman Antitrust Act — the same law, first effective in 1890, that was at the heart of its case against Microsoft.In its complaint, federal prosecutors claim that Google makes software that can't be deleted and is contractually required by default.They made a similar claim against Microsoft in the 1990s. The DOJ and a group of states said the software giant sustained an illegal monopoly for personal computer (PC) operating systems using contracts with PC manufacturers that required them to exclude competing software.The government’s case zeroed in on Microsoft’s proprietary web browser, Internet Explorer (IE), that it developed to compete with the world’s first browser, Netscape.Instead of selling IE as a browser to run on top of multiple operating systems, Microsoft gave away the browser free of charge on Windows-equipped PCs, which then accounted for more than 90% of the market. Microsoft also made it difficult for users to uninstall IE in favor of an alternate browser.But back then, prosecutors ran into a major hurdle that could pose problems for them today: a presumption that lower, even free, prices are a consumer advantage and not necessarily anticompetitive.One possible outcome of this period, said Lipsky, is that this push to rein in big companies could have the opposite impact that regulators are hoping for. It could make the big companies even more dominant.Venture capital funding for startups could dry up because investors fear the companies they support are not going to be able to be acquired by larger players. And if giants can't complete mergers without protracted litigation, they will simply decide to develop more products in house.Microsoft's arc over the last three decades helps prove that point. After its humbling encounter with the Justice Department in the 1990s, it went on to become a major new player in several industries, including cloud computing and gaming.""I think the fact of the matter is, it will tend to favor the large incumbents,"" Lipsky said.Click here for the latest stock market news and in-depth analysis, including events that move stocksRead the latest financial and business news from Yahoo Finance]"
70,7ddc16d8-a505-338e-9a05-14a24db77ac2,TAP,2023-08-28,"With 76% ownership of the shares, Molson Coors Beverage Company (NYSE:TAP) is heavily dominated by institutional owners",Simply Wall St.,https://finance.yahoo.com/news/76-ownership-shares-molson-coors-121313951.html,1693224793,STORY,['TAP-A'],"[Key InsightsInstitutions' substantial holdings in Molson Coors Beverage implies that they have significant influence over the company's share price51% of the business is held by the top 16 shareholders Insiders have been buying lately If you want to know who really controls Molson Coors Beverage Company (NYSE:TAP), then you'll have to look at the makeup of its share registry. We can see that institutions own the lion's share in the company with 76% ownership. In other words, the group stands to gain the most (or lose the most) from their investment into the company.Because institutional owners have a huge pool of resources and liquidity, their investing decisions tend to carry a great deal of weight, especially with individual investors. Therefore, a good portion of institutional money invested in the company is usually a huge vote of confidence on its future.Let's take a closer look to see what the different types of shareholders can tell us about Molson Coors Beverage. View our latest analysis for Molson Coors Beverage ownership-breakdownWhat Does The Institutional Ownership Tell Us About Molson Coors Beverage?Institutional investors commonly compare their own returns to the returns of a commonly followed index. So they generally do consider buying larger companies that are included in the relevant benchmark index.We can see that Molson Coors Beverage does have institutional investors; and they hold a good portion of the company's stock. This suggests some credibility amongst professional investors. But we can't rely on that fact alone since institutions make bad investments sometimes, just like everyone does. It is not uncommon to see a big share price drop if two large institutional investors try to sell out of a stock at the same time. So it is worth checking the past earnings trajectory of Molson Coors Beverage, (below). Of course, keep in mind that there are other factors to consider, too.earnings-and-revenue-growthInvestors should note that institutions actually own more than half the company, so they can collectively wield significant power. Molson Coors Beverage is not owned by hedge funds. The Vanguard Group, Inc. is currently the company's largest shareholder with 10% of shares outstanding. For context, the second largest shareholder holds about 7.1% of the shares outstanding, followed by an ownership of 6.8% by the third-largest shareholder.Story continuesLooking at the shareholder registry, we can see that 51% of the ownership is controlled by the top 16 shareholders, meaning that no single shareholder has a majority interest in the ownership.Researching institutional ownership is a good way to gauge and filter a stock's expected performance. The same can be achieved by studying analyst sentiments. There are a reasonable number of analysts covering the stock, so it might be useful to find out their aggregate view on the future.Insider Ownership Of Molson Coors BeverageThe definition of company insiders can be subjective and does vary between jurisdictions. Our data reflects individual insiders, capturing board members at the very least. Management ultimately answers to the board. However, it is not uncommon for managers to be executive board members, especially if they are a founder or the CEO.I generally consider insider ownership to be a good thing. However, on some occasions it makes it more difficult for other shareholders to hold the board accountable for decisions.Our most recent data indicates that insiders own less than 1% of Molson Coors Beverage Company. However, it's possible that insiders might have an indirect interest through a more complex structure. Being so large, we would not expect insiders to own a large proportion of the stock. Collectively, they own US$64m of stock. Arguably recent buying and selling is just as important to consider. You can  click here to see if insiders have been buying or selling. General Public OwnershipThe general public, who are usually individual investors, hold a 19% stake in Molson Coors Beverage. This size of ownership, while considerable, may not be enough to change company policy if the decision is not in sync with other large shareholders.Private Company OwnershipIt seems that Private Companies own 4.0%, of the Molson Coors Beverage stock. It's hard to draw any conclusions from this fact alone, so its worth looking into who owns those private companies. Sometimes insiders or other related parties have an interest in shares in a public company through a separate private company.Next Steps:While it is well worth considering the different groups that own a company, there are other factors that are even more important. Consider for instance, the ever-present spectre of investment risk.   We've identified 4 warning signs  with Molson Coors Beverage , and understanding them should be part of your investment process.If you are like me, you may want to think about whether this company will grow or shrink. Luckily, you can check this free report showing analyst forecasts for its future.NB: Figures in this article are calculated using data from the last twelve months, which refer to the 12-month period ending on the last date of the month the financial statement is dated. This may not be consistent with full year annual report figures.Have feedback on this article? Concerned about the content? Get in touch with us directly. Alternatively, email editorial-team (at) simplywallst.com.This article by Simply Wall St is general in nature. We provide commentary based on historical data and analyst forecasts only using an unbiased methodology and our articles are not intended to be financial advice. It does not constitute a recommendation to buy or sell any stock, and does not take account of your objectives, or your financial situation. We aim to bring you long-term focused analysis driven by fundamental data. Note that our analysis may not factor in the latest price-sensitive company announcements or qualitative material. Simply Wall St has no position in any stocks mentioned.]"
