,Id,Company,Date,Title,Publisher,Link,ProviderPublishTime,Type,Related Company,Text
70,24a033f7-2d1c-321f-9efb-5a8e66ce8f96,MAR,2023-06-19,"Amazon, Marriott and other companies vow to hire thousands of refugees in Europe",AP Finance,https://finance.yahoo.com/news/amazon-marriott-other-companies-vow-051010869.html,1687151410,STORY,"['AMZN', 'MAR']","[LONDON (AP) — Multinational companies including Amazon, Marriott and Hilton pledged Monday to hire more than 13,000 refugees, including Ukrainian women who have fled the war with Russia, over the next three years in Europe.Just ahead of World Refugee Day on Tuesday, more than 40 corporations say they will hire, connect to work or train a total of 250,000 refugees, with 13,680 of them getting jobs directly in those companies.“Every number is a story of an individual family who left everything, seeking safety, seeking protection and wanting to be able to rebuild as quickly as possible,"" said Kelly Clements, U.N. deputy high commissioner for refugees. ""So the commitments that businesses are going to make on Monday are absolutely essential.”She says 110 million people have been displaced worldwide, with an estimated 12 million from Ukraine, nearly half of whom are living in Europe after the continent's largest movement of refugees since World War II.The hiring push in Europe was organized by the Tent Partnership for Refugees, a nonprofit founded by Chobani CEO Hamdi Ulukaya that connects businesses and refugees, and is being unveiled at a gathering in Paris. The group's first summit in the U.S. last year led to commitments to hire 22,725 refugees.In the new round, Amazon leads the pack, vowing to hire at least 5,000 refugees over the next three years in Europe, followed by Marriott and Hilton with 1,500 each, Starbucks and ISS with 1,000 each, and smaller commitments from brands like Adidas, Starbucks, L’Oreal, PepsiCo and Hyatt.“This is good for us as a company because the opportunity to add diversity to our workforce will continue to make us a stronger company,"" said Ofori Agboka, Amazon vice president overseeing human resources. ""With diversity brings innovation, creativity, different insights.”He said the vast majority of jobs will be hourly roles at fulfillment and storage centers and in transport and delivery.Story continuesAmazon announced 27,000 job cuts earlier this year, part of a wave of layoffs after tech companies ramped up hiring during the COVID-19 pandemic. Those layoffs primarily affected salaried office jobs, Agboka said.Daria Sedihi-Volchenko fled Kyiv last year and now works in Warsaw, Poland, as a senior program manager for an Amazon Web Services program providing free tech training for Ukrainians. She says about 40% of those in the program have no tech background.“I went through the same way as many of our learners ... are going through,” she said. “I had to learn, and I took a commitment on my interview. I said that ‘OK, if we can agree and I can start working for you, I promise to learn Polish and I promise to learn technical skills.’”More than a year ago, Sedihi-Volchenko woke up to explosions from Russia's invasion.“I was terrified. I was so scared for Ukraine, for the nation, for the future, for my own life,"" she said. ""But also that was a shocking moment when I understood that everything in my life is changing.”She began living in basements but left as Russian forces approached Kyiv. She drove 40 hours to reach Moldova, thankful that she “didn’t drive on a single land mine and nobody shot into my car.”She went to Poland to find work, embarking on an IT path after working as a project manager for government ministries and as an economist in Ukraine.Companies are hoping refugees can fill staffing needs after the economy bounced back from the pandemic. In Europe, unemployment is at its lowest since the euro currency was introduced in 1999.“We’re seeing record levels of demand for our properties across many markets here in Europe,"" Marriott International CEO Anthony Capuano said. ""And so we are hiring aggressively to make sure we can accommodate our guests as demand ramps up.”Marriott's jobs will largely be hourly positions like housekeepers, kitchen staff and front desk attendants.European nations have welcomed Ukrainians, and while Clements applauded opening schools, workplaces and other opportunities to them, she said the same should be offered to others fleeing conflict and crises in places like Syria, Sudan and Afghanistan.Sedihi-Volchenko knows the challenges ahead for refugees, even as some companies offer help with language skills, counseling and training. Job listings can be difficult to decipher, and like her, they may have difficulty securing a stable internet connection or work clothes.""It’s important to give a refugee just time to learn the language, but the person can start working because if you bring experience with IT systems or finance or project management or any other area, naturally, you understand, it’s not so much about the language. You understand the flow of work,"" she said.___Follow AP’s coverage of the war in Ukraine: https://apnews.com/hub/russia-ukraine]"
71,ae70930a-7494-303f-b81e-66ce53717a6b,MAR,2023-06-19,"Institutional firms are pulling back from the U.S. housing market—just look at Starwood’s decision to shop 2,000 single-family rentals",Fortune,https://finance.yahoo.com/news/institutional-firms-pulling-back-u-212534339.html,1687123534,STORY,"['MAR', 'AMH', 'INVH']","[Starwood Capital CEO Barry Sternlicht doesn't hold back on his Federal Reserve criticism: On multiple occasions he's told CNBC anchors that the central bank's aggressive interest rate hikes could soon spur a deep recession.It's easy to see why Sternlicht is so openly critical of the Fed: Starwood primarily invests in real estate, where the Fed's interest rate hikes have already caused a great deal of economic pain.Last week, Bloomberg reported that Starwood Real Estate Income Trust plans to shop more than 2,000 single-family rentals. Starwood—which declined Fortune's interview request—hasn't publicly explained its motive for pulling back from the residential housing market, where its REIT owns over 3,200 single-family homes. That said, it's clear that the decision to shop these 2,000 homes comes as Starwood faces an uptick in redemption requests and endures pain in the commercial real estate sector.At first glance, one might assume Wall Street types would pull back from the commercial real estate space—where office values are sinking fast—and instead pile into the residential housing market—where national home values are rising again after passing through a mild home price correction last fall.However, institutional firms are also timid on the residential front. According to an analysis conducted by John Burns Research and Consulting, institutional investors—those owning over 1,000 homes—bought 90% fewer homes in January and February than they did in the first two months of 2022.Why are institutional investors pulling back so fast from the U.S. housing market?It boils down to the fact that the financial return on each additional home added just isn't that great right now after factoring in interest rates, house prices, and rents. Not to mention, some big investors like Yieldstreet think that national house prices, despite jumping a bit this spring, are poised for another step down.Story continues“We’re pretty much on pause across all [homebuying] strategies,"" Tejas Joshi, director of single-family residential at Yieldstreet, which owns over 700 single-family homes, recently told Fortune. ""I don’t think [house] prices have bottomed yet… On average, we have another 5% decline nationally, and it’ll vary by market. Peak-to-trough, [we’re expecting] 12% to 15% [national] decline.""View this interactive chart on Fortune.comNot only are institutional investors buying fewer homes, some are reducing their overall single-family portfolios.Look no further than Invitation Homes, the largest owner of U.S. single-family rental homes, which recently became a net seller. In the first quarter of 2023, Invitation Homes bought 194 homes while it sold off 297.A year earlier, in the first quarter of 2022, Invitation Homes—which Blackstone helped to grow before divesting in 2019—bought 822 single-family homes and sold off only 147.View this interactive chart on Fortune.comInvitation Homes isn't alone: American Homes 4 Rent was also a net seller in the first quarter.In the first quarter of 2023, American Homes 4 Rent sold off more single-family homes (666) than it bought (312). That net decline saw the Las Vegas–based company's portfolio shrink from 58,993 rental homes across the country to 58,639 homes.A year earlier, in the first quarter of 2022, American Homes 4 Rent bought 1,131 homes and only sold off 171 homes.Want to stay updated on the housing market? Follow me on Twitter at @NewsLambert.This story was originally featured on Fortune.comMore from Fortune: 5 side hustles where you may earn over $20,000 per year—all while working from homeLooking to make extra cash? This CD has a 5.15% APY right nowBuying a house? Here's how much to saveThis is how much money you need to earn annually to comfortably buy a $600,000 home ]"
72,7756174a-115a-3188-abc5-c291e64596de,NVDA,2023-06-19,Did We Just Go From a Bear Market to a Stock Market Bubble?,Motley Fool,https://finance.yahoo.com/m/7756174a-115a-3188-abc5-c291e64596de/did-we-just-go-from-a-bear.html,1687166460,STORY,"['^GSPC', 'COMP', 'NVDA', 'AAPL', '^DJI']","[It's amazing what a difference a year -- or even a few months -- can make on Wall Street. In 2021, the mature-business-packed Dow Jones Industrial Average (DJINDICES: ^DJI), broad-based S&amp;P 500 (SNPINDEX: ^GSPC), and innovation-driven Nasdaq Composite (NASDAQINDEX: ^IXIC), all galloped to record highs. In 2022, they all plunged into a bear market, with the Nasdaq truly taking it on the chin with a 33% loss.Continue reading]"
73,302a5be1-0963-383b-8176-d99669ad4125,NVDA,2023-06-19,"Dow Jones Futures: Market Strong, But Here's What To Do; AMD, Boeing Lead Stocks To Watch",Investor's Business Daily,https://finance.yahoo.com/m/302a5be1-0963-383b-8176-d99669ad4125/dow-jones-futures%3A-market.html,1687143924,STORY,"['BA', 'AMD', '^GSPC', 'COMP', 'MCK', '^DJI', 'CMG', 'NVDA']","[The market rally has shown bullish action, but be prepared for a pullback in the near term. AMD and Boeing are among stocks to watch.Continue reading]"
74,da987dca-ad6a-3d67-a0c4-ad0842009afe,NVDA,2023-06-19,"This AI Stock May Be a Bit Overpriced, but I Think the Hype Is Right",Motley Fool,https://finance.yahoo.com/m/da987dca-ad6a-3d67-a0c4-ad0842009afe/this-ai-stock-may-be-a-bit.html,1687138500,STORY,['NVDA'],"[Nvidia (NASDAQ: NVDA) is one of the foremost examples of this trend -- shares of the semiconductor giant have jumped a whopping 180% so far in 2023. This terrific rally has made shares of Nvidia very expensive as the stock is now trading at 213 times trailing earnings and 39 times sales. For some more perspective, the S&amp;P 500 has a price-to-sales ratio of 2.45 and earnings multiple of 19.Continue reading]"
75,d77a2ae5-23b0-3179-829b-8aa0ee1dbddc,NVDA,2023-06-19,AMD Could Score This Blockbuster Customer for Its New AI Chips -- Here's Why the Stock Is a Buy Now,Motley Fool,https://finance.yahoo.com/m/d77a2ae5-23b0-3179-829b-8aa0ee1dbddc/amd-could-score-this.html,1687094520,STORY,"['AMD', 'NVDA', 'AMZN']",[Advanced Micro Devices just revealed more details about its new MI300 artificial intelligence chips.Continue reading]
76,c0ebf0dd-17cb-3263-a31f-b206d238b02e,NVDA,2023-06-19,Want to Get Richer? 5 Top Stocks to Buy Now and Hold Forever,Motley Fool,https://finance.yahoo.com/m/c0ebf0dd-17cb-3263-a31f-b206d238b02e/want-to-get-richer%3F-5-top.html,1687091400,STORY,"['NVDA', 'AAPL', 'TSLA', 'AVGO']","[If you're willing to let elite industry leaders do the heavy lifting in your portfolio, consider looking into these five technology stocks. Artificial intelligence (AI) stocks are all the rage today, and none have gotten more recognition than Nvidia (NASDAQ: NVDA). The semiconductor company built a business on gaming graphics processing units (GPUs) but has taken market share across industries that require dedicated GPUs for high-performance computing needs.Continue reading]"
77,f1018241-e1f8-37ed-99d9-e517891d65e9,NVDA,2023-06-19,3 Artificial Intelligence Stocks You Can Buy and Hold for the Next Decade,Motley Fool,https://finance.yahoo.com/m/f1018241-e1f8-37ed-99d9-e517891d65e9/3-artificial-intelligence.html,1687090500,STORY,"['NVDA', 'MSFT', 'GOOGL']","[The artificial intelligence (AI) market is heating up, and some have estimated that AI-powered services could reach a staggering value of $14 trillion by 2030. The technology's capabilities are already integrated into many services, including cloud computing and online search, and the companies that are moving the fastest could be long-term winners. Investors looking for top AI stocks to buy right now and hold for the next decade should take a close look at what Nvidia (NASDAQ: NVDA), Microsoft (NASDAQ: MSFT), and Alphabet (NASDAQ: GOOG) (NASDAQ: GOOGL) are doing.Continue reading]"
78,302a5be1-0963-383b-8176-d99669ad4125,MCK,2023-06-19,"Dow Jones Futures: Market Strong, But Here's What To Do; AMD, Boeing Lead Stocks To Watch",Investor's Business Daily,https://finance.yahoo.com/m/302a5be1-0963-383b-8176-d99669ad4125/dow-jones-futures%3A-market.html,1687143924,STORY,"['BA', 'AMD', '^GSPC', 'COMP', 'MCK', '^DJI', 'CMG', 'NVDA']","[The market rally has shown bullish action, but be prepared for a pullback in the near term. AMD and Boeing are among stocks to watch.Continue reading]"
79,f8dbba7a-ce07-395a-9458-013497cc4409,DIS,2023-06-19,Gavin Newsom Trolls Ron DeSantis With Disneyland Pride Visit,TheStreet.com,https://finance.yahoo.com/m/f8dbba7a-ce07-395a-9458-013497cc4409/gavin-newsom-trolls-ron.html,1687176000,STORY,['DIS'],[Florida Governor Ron DeSantis' war with Disney has spread from Florida to California. Earlier this year the flames started when DeSantis signed into law Florida's Parental Rights in Education Act aka 'Don't Say Gay Bill.' Walt Disney's then CEO Bob Chapek publicly opposed the law and voiced his displeasure at the law on behalf of his employees.Continue reading]
80,81bc0a13-eba2-3f1a-ab00-d7bb8acbd718,DIS,2023-06-19,‘Elemental’ Struggles on Opening Weekend; ‘The Flash’ Also Flat,The Wall Street Journal,https://finance.yahoo.com/m/81bc0a13-eba2-3f1a-ab00-d7bb8acbd718/%E2%80%98elemental%E2%80%99-struggles-on.html,1687129620,STORY,['DIS'],[]
81,43d30bd1-5aa6-36ea-a06b-4bfaf00012a2,DIS,2023-06-19,DeSantis Makes Political Move In War With Disney,TheStreet.com,https://finance.yahoo.com/m/43d30bd1-5aa6-36ea-a06b-4bfaf00012a2/desantis-makes-political-move.html,1687121340,STORY,['DIS'],[The Florida Governor has used his political power to step up his battle with his state's largest single-site employer.Continue reading]
82,f09ae252-4bdc-359c-b6a9-618d2cc53e88,DIS,2023-06-19,Elemental’s poor sales add to fears that Disney’s Pixar has lost its touch,Financial Times,https://finance.yahoo.com/m/f09ae252-4bdc-359c-b6a9-618d2cc53e88/elemental%E2%80%99s-poor-sales-add-to.html,1687118319,STORY,['DIS'],[]
83,1e4a5921-89a0-3350-8fc0-70ad9da5484e,DIS,2023-06-19,UPDATE 2-Pixar film 'Elemental' opens as studio's second-lowest box office debut,Reuters,https://finance.yahoo.com/news/1-pixar-film-elemental-opens-153620176.html,1687102580,STORY,['DIS'],"[(Adds comments from Disney in paragraphs 8-10, box office analyst in paragraphs 12-13)By Lisa RichwineLOS ANGELES, June 18 (Reuters) - Pixar's animated movie ""Elemental"" took in roughly $30 million at U.S. and Canadian box offices over the weekend, the second-lowest debut in the history of the acclaimed studio behind the ""Toy Story"" franchise, ""Finding Nemo"" and other classics.""Elemental,"" a story about overcoming outward differences, added $15 million overseas for a global total of $45 million from Friday through Sunday, distributor Walt Disney Co said. The film opened in just three major international markets and will expand to other countries in the coming weeks.""The Flash,"" the latest DC superhero movie from Warner Bros , also underwhelmed at the box office. It topped the domestic charts with an estimated $55.1 million, according to researcher ComScore, at the low end of pre-weekend forecasts.Analysts had predicted that ""Elemental"" would open with at least $31 million at domestic theaters. The $30 million estimate, which will be finalized on Monday, would rank just ahead of the $29.1 million for 1995's ""Toy Story,"" Pixar's first movie. ""Toy Story"" became a global blockbuster that spawned multiple hit sequels.The studio is looking to rebound from the box office disappointment of its 2022 release ""Lightyear,"" the origin story of ""Toy Story"" hero Buzz Lightyear. The movie brought in an earthbound $226.7 million in global ticket sales, a fraction of the $1 billion take for 2019's ""Toy Story 4.""The director and producer of ""Lightyear"" were laid off last month, Reuters first reported, as Disney shed 7,000 jobs across the company in a cost-cutting effort.""Elemental"" is set in Element City, where Fire, Water, Earth and Air characters live together. An unexpected friendship between Fire and Water borrows from director Peter Sohn’s relationship with his Italian-American wife, which he initially hid from his parents.Story continuesTony Chambers, head of theatrical distribution at Disney, said he was disappointed by the domestic ticket sales for ""Elemental,"" which received positive feedback from movie critics and audiences and was heavily marketed. Audiences gave the film an ""A"" rating in polling by CinemaScore.Chambers noted that both live-action and animated films based on original stories and characters have struggled at theaters since the COVID-19 pandemic. Franchises based on well-known intellectual property (IP), such as current hit ""Spider-Man: Across the Spider-Verse,"" are drawing mass audiences.""Original IP has a harder time cutting through in the market,"" Chambers said. ""At this point in time, it's a very busy marketplace.""During the pandemic, former Chief Executive Bob Chapek decided to release three Pixar movies - ""Soul,"" ""Luca"" and ""Turning Red"" - exclusively on the Disney+ streaming service.That taught audiences to expect Pixar movies would be available to watch at home, said Jeff Bock, senior box office analyst at Exhibitor Relations Co.At theaters, ""they're going to go back to the drawing board, and in this case what the drawing board means is sequels,"" Bock said, pointing to next year's ""Inside Out 2"" and the planned ""Toy Story 5."" ""Disney knows how to sequel,"" he said. (Reporting by Lisa Richwine; Editing by Leslie Adler and Bill Berkrot)]"
84,17cc287e-d489-36db-8c16-90061f0c1c4a,DIS,2023-06-19,Disney Rival Closing a Beloved Roller Coaster,TheStreet.com,https://finance.yahoo.com/m/17cc287e-d489-36db-8c16-90061f0c1c4a/disney-rival-closing-a.html,1687101900,STORY,['DIS'],"[A Florida theme park says farewell to long time attraction, and what's to come has fans talking.Continue reading]"
85,6f9489e2-26fd-30fe-a00d-fa0e2c5cebbf,DIS,2023-06-19,New Pixar film 'Elemental' opens weak for Disney,Reuters,https://finance.yahoo.com/news/pixar-film-elemental-opens-weak-151821798.html,1687101501,STORY,['DIS'],"[LOS ANGELES, June 18 (Reuters) - Pixar's new animated movie ""Elemental"" debuted with $30 million in ticket sales at U.S. and Canadian box offices over the weekend, according to estimates from distributor Walt Disney Co on Sunday.The opening fell shy of box office forecasts and ranked among the lowest ever for a film from Pixar, the acclaimed animation studio behind ""Toy Story,"" ""Finding Nemo"" and other classics.(Reporting by Lisa Richwine; Editing by Leslie Adler)]"
86,44fb0bb2-254a-3727-ba5b-97e0d8d162d8,NDAQ,2023-06-19,5 big deal reports: Microsoft/Activision deal on temporary halt in the U.S.,Investing.com,https://finance.yahoo.com/news/5-big-deal-reports-microsoft-040210724.html,1687147330,STORY,"['ATVI', 'MSFT', 'NDAQ', 'AVGO', 'IRBT', 'VMW', 'PTEN', 'NEX', 'AMZN']","[Here is your Pro Recap of 5 head-turning deal dispatches you may have missed last week: a temporary halt on Microsoft-Activision Blizzard deal, likely approval of Broadcom/VMware deal, UK CMA’s approval of Amazon/iRobot, and merger deals at NASDAQ/Adenza and Patterson-UTI Energy/NexTier.InvestingPro subscribers got this news before anyone else. Start your 7-day trial to get on board.Federal court temporarily halts Microsoft-Activision buyoutA federal court in California ruled in favor of a request from U.S. antitrust regulators to place a temporary block on the completion of Microsoft's (NASDAQ:MSFT) $69 billion merger with Activision Blizzard (NASDAQ:NASDAQ:ATVI).The Federal Trade Commission has argued that the deal, the largest ever in the video games industry, would grant Microsoft the ability and a heightened incentive to restrict Activision's content in ways that significantly reduce competition - a viewpoint that the two companies disagree with.In early December, the FTC, responsible for enforcing antitrust law, had already approached an in-house administrative judge to block the transaction on antitrust grounds. Their contention was that it would grant Microsoft's Xbox exclusive access to Activision games, leaving Nintendo consoles and Sony's (NYSE:SONY) PlayStation at a disadvantage.Despite the news, Microsoft shares were up 5.5% for the week; Activision ticked up fractionally.Broadcom/VMware $61B deal likely receives EU approval VMware (NYSE:VMW) and Broadcom (NASDAQ:AVGO) shares surged 4% and 6% last Monday after Reuters reported that Broadcom is likely to receive conditional approval from the EU antitrust authority for its planned purchase of VMware, citing sources familiar with the matter.The approval from the European Commission is contingent upon Broadcom implementing measures to ensure interoperability with competitors, sources said.Both Broadcom and the EU antitrust watchdog declined to provide any comments on the matter.Story continuesiRobot stock jumps 21% after UK CMA approves Amazon’s acquisition The U.K. Competition and Markets Authority (CMA) approved Amazon's (NASDAQ:AMZN) $1.7 billion acquisition of iRobot (NASDAQ:IRBT), after which iRobot shares jumped more than 21% on Friday.After an investigation, the CMA has determined that the deal does not raise competition concerns in the U.K. However, the acquisition is still under review by regulators in other jurisdictions. The U.S. FTC has requested documents from both companies to further assess the purpose and rationale of the deal. iRobot has stated that the companies will cooperate with the FTC investigation, which typically takes about a year.Nasdaq agrees to buy Adenza for $10.5BNasdaq Inc. (NASDAQ:NDAQ) said it inked a deal to acquire Adenza, which provides risk management and regulatory software to the financial services industry, from private equity giant Thoma Bravo.The deal, will have Nasdaq pay $5.75B cash and 85.6 million common shares, or approximately $10.5B total. Nasdaq says the deal will help accelerate ""Nasdaq’s strategic vision to become the trusted fabric of the world’s financial system.""The stock part of the consideration represents approximately 14.9% of Nasdaq's total outstanding shares, and will make Thoma Bravo a strategic shareholder of the company.Shares of Nasdaq lost some 1.8% for the week.Patterson-UTI to combine with NexTier in merger of equalsPatterson-UTI Energy (NASDAQ:PTEN) shares jumped more than 12% on Thursday following the announcement that it had entered into a merger agreement with NexTier Oilfield Solutions (NYSE:NEX) to combine in an all-stock merger of equals.Under the terms of the $5.4B deal, NexTier shareholders will receive 0.7520 shares of Patterson-UTI common stock for each share of NexTier common stock. Upon closing, Patterson-UTI shareholders will own 55% and NexTier shareholders will own 45% of the combined company.Jump on the biggest news for your portfolio amid a barrage of market headlines: Always be the first to know with InvestingPro.Peter Nurse contributed to this report.Related Articles5 big deal reports: Microsoft-Activision mega deal in trouble againDenmark stocks lower at close of trade; OMX Copenhagen 20 down 1.56%RTX: Pratt &amp; Whitney engines unit to take $500 million free cashflow hit]"
87,f1e559a4-a6f7-3bf1-8ef2-3e40155d6224,CMCSA,2023-06-19,Streaming Customers Get Choosy About When to Pay for Ads,The Wall Street Journal,https://finance.yahoo.com/m/f1e559a4-a6f7-3bf1-8ef2-3e40155d6224/streaming-customers-get.html,1687167000,STORY,['CMCSA'],[]
88,a34b5353-1201-3e3c-aeac-5ebf14b01625,DVN,2023-06-19,3 Oil Stocks to Buy Amid a Murky Outlook for Oil Prices,Motley Fool,https://finance.yahoo.com/m/a34b5353-1201-3e3c-aeac-5ebf14b01625/3-oil-stocks-to-buy-amid-a.html,1687093320,STORY,"['DVN', 'XOM', 'ENB']","[Many oil industry expects expected that oil prices would rally this year, potentially topping $100 a barrel again. While there's a lot of uncertainty about oil prices, many oil companies built their businesses to thrive in these types of market conditions. ExxonMobil (NYSE: XOM), Enbridge (NYSE: ENB), and Devon Energy (NYSE: DVN) stand out to a few Fool.com contributors as oil stocks that can create value for shareholders amid a murky oil market.Continue reading]"
