,Id,Company,Date,Title,Publisher,Link,ProviderPublishTime,Type,Related Company,Text
54,96324e04-628a-3771-9871-656c73cae293,TGT,2023-01-01,An Intrinsic Calculation For Target Corporation (NYSE:TGT) Suggests It's 48% Undervalued,Simply Wall St.,https://finance.yahoo.com/news/intrinsic-calculation-target-corporation-nyse-120016562.html,1672574416,STORY,['TGT'],"[Today we'll do a simple run through of a valuation method used to estimate the attractiveness of Target Corporation (NYSE:TGT) as an investment opportunity by taking the forecast future cash flows of the company and discounting them back to today's value. One way to achieve this is by employing the Discounted Cash Flow (DCF) model. Models like these may appear beyond the comprehension of a lay person, but they're fairly easy to follow.We generally believe that a company's value is the present value of all of the cash it will generate in the future. However, a DCF is just one valuation metric among many, and it is not without flaws. For those who are keen learners of equity analysis, the Simply Wall St analysis model here may be something of interest to you. Check out our latest analysis for Target Crunching The NumbersWe use what is known as a 2-stage model, which simply means we have two different periods of growth rates for the company's cash flows. Generally the first stage is higher growth, and the second stage is a lower growth phase. To begin with, we have to get estimates of the next ten years of cash flows. Where possible we use analyst estimates, but when these aren't available we extrapolate the previous free cash flow (FCF) from the last estimate or reported value. We assume companies with shrinking free cash flow will slow their rate of shrinkage, and that companies with growing free cash flow will see their growth rate slow, over this period. We do this to reflect that growth tends to slow more in the early years than it does in later years.A DCF is all about the idea that a dollar in the future is less valuable than a dollar today, and so the sum of these future cash flows is then discounted to today's value:10-year free cash flow (FCF) estimate2023202420252026202720282029203020312032 Levered FCF ($, Millions) US$170.2mUS$3.79bUS$3.96bUS$4.60bUS$5.87bUS$6.53bUS$7.08bUS$7.54bUS$7.92bUS$8.25bGrowth Rate Estimate SourceAnalyst x5Analyst x6Analyst x5Analyst x3Analyst x2Est @ 11.17%Est @ 8.41%Est @ 6.48%Est @ 5.13%Est @ 4.19% Present Value ($, Millions) Discounted @ 6.6% US$160US$3.3kUS$3.3kUS$3.6kUS$4.3kUS$4.4kUS$4.5kUS$4.5kUS$4.5kUS$4.4k(""Est"" = FCF growth rate estimated by Simply Wall St)Present Value of 10-year Cash Flow (PVCF) = US$37bStory continuesThe second stage is also known as Terminal Value, this is the business's cash flow after the first stage. The Gordon Growth formula is used to calculate Terminal Value at a future annual growth rate equal to the 5-year average of the 10-year government bond yield of 2.0%. We discount the terminal cash flows to today's value at a cost of equity of 6.6%.Terminal Value (TV)= FCF2032 × (1 + g) ÷ (r – g) = US$8.3b× (1 + 2.0%) ÷ (6.6%– 2.0%) = US$182bPresent Value of Terminal Value (PVTV)= TV / (1 + r)10= US$182b÷ ( 1 + 6.6%)10= US$96bThe total value, or equity value, is then the sum of the present value of the future cash flows, which in this case is US$133b. The last step is to then divide the equity value by the number of shares outstanding. Compared to the current share price of US$149, the company appears quite good value at a 48% discount to where the stock price trades currently. Valuations are imprecise instruments though, rather like a telescope - move a few degrees and end up in a different galaxy. Do keep this in mind.dcfThe AssumptionsThe calculation above is very dependent on two assumptions. The first is the discount rate and the other is the cash flows. If you don't agree with these result, have a go at the calculation yourself and play with the assumptions. The DCF also does not consider the possible cyclicality of an industry, or a company's future capital requirements, so it does not give a full picture of a company's potential performance. Given that we are looking at Target as potential shareholders, the cost of equity is used as the discount rate, rather than the cost of capital (or weighted average cost of capital, WACC) which accounts for debt. In this calculation we've used 6.6%, which is based on a levered beta of 0.829. Beta is a measure of a stock's volatility, compared to the market as a whole. We get our beta from the industry average beta of globally comparable companies, with an imposed limit between 0.8 and 2.0, which is a reasonable range for a stable business.SWOT Analysis for TargetStrengthDebt is well covered by earnings and cashflows.WeaknessEarnings declined over the past year.Dividend is low compared to the top 25% of dividend payers in the Multiline Retail market.OpportunityAnnual earnings are forecast to grow faster than the American market.Good value based on P/E ratio and estimated fair value.ThreatPaying a dividend but company has no free cash flows.Annual revenue is forecast to grow slower than the American market.Moving On:Whilst important, the DCF calculation shouldn't be the only metric you look at when researching a company. DCF models are not the be-all and end-all of investment valuation. Instead the best use for a DCF model is to test certain assumptions and theories to see if they would lead to the company being undervalued or overvalued. For instance, if the terminal value growth rate is adjusted slightly, it can dramatically alter the overall result. What is the reason for the share price sitting below the intrinsic value? For Target, there are three essential items you should look at:Risks: Consider for instance, the ever-present spectre of investment risk.   We've identified 4 warning signs  with Target (at least 1 which is significant)  , and understanding these should be part of your investment process.Future Earnings: How does TGT's growth rate compare to its peers and the wider market? Dig deeper into the analyst consensus number for the upcoming years by interacting with our free analyst growth expectation chart.Other Solid Businesses: Low debt, high returns on equity and good past performance are fundamental to a strong business. Why not explore our interactive list of stocks with solid business fundamentals to see if there are other companies you may not have considered!PS. The Simply Wall St app conducts a discounted cash flow valuation for every stock on the NYSE every day. If you want to find the calculation for other stocks just search here.Have feedback on this article? Concerned about the content? Get in touch with us directly. Alternatively, email editorial-team (at) simplywallst.com.This article by Simply Wall St is general in nature. We provide commentary based on historical data and analyst forecasts only using an unbiased methodology and our articles are not intended to be financial advice. It does not constitute a recommendation to buy or sell any stock, and does not take account of your objectives, or your financial situation. We aim to bring you long-term focused analysis driven by fundamental data. Note that our analysis may not factor in the latest price-sensitive company announcements or qualitative material. Simply Wall St has no position in any stocks mentioned.Join A Paid User Research SessionYou’ll receive a US$30 Amazon Gift card for 1 hour of your time while helping us build better investing tools for the individual investors like yourself. Sign up here]"
55,ff6d6986-3bd8-3d06-90dd-8dbca4d9ab13,TGT,2023-01-01,5 Target Tricks That Can Help You Save Money,Motley Fool,https://finance.yahoo.com/m/ff6d6986-3bd8-3d06-90dd-8dbca4d9ab13/5-target-tricks-that-can-help.html,1672524027,STORY,['TGT'],"[If you're a Target loyalist, don't miss out on shopping strategies that help you save money.Continue reading]"
56,a410c63d-97af-3840-b000-216f576d4b76,RCL,2023-01-01,3 Big Changes Royal Caribbean Has Planned for 2023,TheStreet.com,https://finance.yahoo.com/m/a410c63d-97af-3840-b000-216f576d4b76/3-big-changes-royal-caribbean.html,1672510440,STORY,['RCL'],"[This year was about getting back to normal for the cruise line, but the next one will include some major changes.Continue reading]"
57,554da43d-fcb4-398f-a8d2-187b13f6a57c,RF,2023-01-01,These Were the 3 Top-Performing Large U.S. Bank Stocks in 2022,Motley Fool,https://finance.yahoo.com/m/554da43d-fcb4-398f-a8d2-187b13f6a57c/these-were-the-3.html,1672495620,STORY,"['USB', 'SCHW', 'RF-PC', 'AMP']","[The banking sector struggled in 2022, as investment banking revenue fell significantly, and investors repositioned their portfolios to prepare for what could be a difficult year and lower earnings in 2023. Large bank stocks got hit hard, with the KBW Nasdaq Bank Index down close to 26% this year, underperforming the broader market. Here are three of the top-performing large U.S. bank stocks in 2022.Continue reading]"
58,7c61e5ee-2ea7-3e4e-bccc-db18102744a7,V,2023-01-01,Visa Inc. (NYSE:V) insiders sold US$9.6m worth of stock suggesting impending weakness.,Simply Wall St.,https://finance.yahoo.com/news/visa-inc-nyse-v-insiders-110009005.html,1672570809,STORY,['V'],"[In the last year, many Visa Inc. (NYSE:V) insiders sold a substantial stake in the company which may have sparked shareholders' attention. Knowing whether insiders are buying is usually more helpful when evaluating insider transactions, as insider selling can have various explanations. However, when multiple insiders sell stock over a specific duration, shareholders should take notice as that could possibly be a red flag.While insider transactions are not the most important thing when it comes to long-term investing, logic dictates you should pay some attention to whether insiders are buying or selling shares. See our latest analysis for Visa Visa Insider Transactions Over The Last YearOver the last year, we can see that the biggest insider sale was by the President of Technology, Rajat Taneja, for US$5.4m worth of shares, at about US$217 per share. So we know that an insider sold shares at around the present share price of US$208. We generally don't like to see insider selling, but the lower the sale price, the more it concerns us. Given that the sale took place at around current prices, it makes us a little cautious but is hardly a major concern.In the last year Visa insiders didn't buy any company stock. The chart below shows insider transactions (by companies and individuals) over the last year. By clicking on the graph below, you can see the precise details of each insider transaction!insider-trading-volumeFor those who like to find winning investments this free list of growing companies with recent insider purchasing, could be just the ticket.Visa Insiders Are Selling The StockThe last three months saw significant insider selling at Visa. Specifically, insiders ditched US$9.0m worth of shares in that time, and we didn't record any purchases whatsoever. This may suggest that some insiders think that the shares are not cheap.Does Visa Boast High Insider Ownership?I like to look at how many shares insiders own in a company, to help inform my view of how aligned they are with insiders. A high insider ownership often makes company leadership more mindful of shareholder interests. It's great to see that Visa insiders own 0.05% of the company, worth about US$224m. Most shareholders would be happy to see this sort of insider ownership, since it suggests that management incentives are well aligned with other shareholders.Story continuesSo What Do The Visa Insider Transactions Indicate?Insiders sold Visa shares recently, but they didn't buy any. And there weren't any purchases to give us comfort, over the last year. But since Visa is profitable and growing, we're not too worried by this. It is good to see high insider ownership, but the insider selling leaves us cautious. So these insider transactions can help us build a thesis about the stock, but it's also worthwhile knowing the risks facing this company. You'd be interested to know, that we found 1 warning sign for Visa and we suggest you have a look.If you would prefer to check out another company -- one with potentially superior financials -- then do not miss this free list of interesting companies, that have HIGH return on equity and low debt.For the purposes of this article, insiders are those individuals who report their transactions to the relevant regulatory body. We currently account for open market transactions and private dispositions, but not derivative transactions.Have feedback on this article? Concerned about the content? Get in touch with us directly. Alternatively, email editorial-team (at) simplywallst.com.This article by Simply Wall St is general in nature. We provide commentary based on historical data and analyst forecasts only using an unbiased methodology and our articles are not intended to be financial advice. It does not constitute a recommendation to buy or sell any stock, and does not take account of your objectives, or your financial situation. We aim to bring you long-term focused analysis driven by fundamental data. Note that our analysis may not factor in the latest price-sensitive company announcements or qualitative material. Simply Wall St has no position in any stocks mentioned.Join A Paid User Research SessionYou’ll receive a US$30 Amazon Gift card for 1 hour of your time while helping us build better investing tools for the individual investors like yourself. Sign up here]"
59,43b3b32a-e19d-369b-9f88-e9b815e985f7,V,2023-01-01,Our Predictions for the Top 7 Blue-Chip Stocks for 2023,InvestorPlace,https://finance.yahoo.com/news/predictions-top-7-blue-chip-193102657.html,1672255862,STORY,"['IBM', 'WFC-PD', 'LNG', 'NOW', 'BKNG', 'V']","[America’s economic statistics continue to suggest that fears about an imminent recession and a corporate earnings collapse are way overblown. For example, during the recent holiday shopping season, sales climbed 7.6% year-over-year. And since most people don’t buy each other paper towels, eggs, and toothpaste for Christmas, I have to believe that discretionary products account for most of the increase. As a result, it’s clear that consumer spending isn’t going to fall off a cliff anytime soon. And the U.S. GDP rose by a healthy annualized rate of 3.2% in the third quarter. Given these points, I believe that a new bull market will begin in the first quarter of 2023, and I’m excited to unveil my blue-chip stock predictions for 2023.TickerCompanyPriceIBMIBM$140.92VVisa$206.44WFCWells Fargo$41.14VWAGYVolkswagen$15.36LNGCheniere Energy$151.35NOWServiceNow$377.49BKNGBooking Holdings$84.09IBM (IBM)Photo of IBM (IBM) building as seen through the canopy of a tree. IBM logo is in large letters on side of building.Source: shutterstock.com/LCVIBM (NYSE:IBM) stock had risen 6.4% this year, excluding its dividend payments, and, in line with my predictions, the tech giant’s cloud business thrived. In fact, in the third quarter, the revenue of its software and consulting businesses jumped 14% year-over-year and 16% YOY, respectively.InvestorPlace - Stock Market News, Stock Advice &amp; Trading TipsThe strong results indicate that the company’s strategy of developing systems that suit the hybrid cloud –which combines the use of the public cloud, the edge cloud, and local databases — is resonating with its clients. And that’s logical because, as CEO Arvind Krishna explained in a recent interview, it makes perfect sense, in this era when hacking has become a major issue, and there is geopolitical upheaval, that companies and countries would want to store some of their more sensitive data locally. Additionally, the edge cloud is used to support artificial intelligence that’s utilized to replace workers, Krishna stated.Story continuesSpeaking of AI, IBM has emphasized the use of artificial intelligence, which is logical since the technology has become so powerful and useful at this point.Finally, according to IBM’s Senior VP of Sales, Rob Thomas, under Krishna’s leadership, IBM is focusing much more energy and resources on ensuring that its new customers are productively using IBM’s systems and understand how they can benefit by adopting more of its products. Since technology can be challenging to understand, integrate, and appreciate even for IT professionals, that strategy certainly seems worthwhile and profitable.With IBM’s common-sense strategies working and the Street having gained a greater appreciation for the firm, as shown by the outperformance of its shares, IBM belongs on one of my list of top blue-chip stock predictions for 2023.Visa (V)several Visa branded credit cardsSource: Kikinunchi / Shutterstock.comWithout a doubt, Visa (NYSE:V) and V stock will be one of the biggest beneficiaries of much better-than-expected consumer spending in 2023. After all, the vast majority of consumer spending is executed with credit cards these days. Moreover, Visa is America’s largest card network, and it earns a small portion of every transaction that is carried out with its cards.Visa should also get a lift from inflation since higher prices will boost its revenue, and if the company can keep its costs from rising less than inflation, its bottom line will also climb as a result of the phenomenon. Additionally, the card network should be helped by the resurgence of international travel since it earns higher fees when its cards are used for overseas spending.Also encouraging is the fact that the company’s U.S. payments volume jumped 9% year-over-year last month. And billionaire Ray Dalio, a veteran, highly renowned investor, more than doubled his stake in V stock last quarter to 1.2 million shares.Wells Fargo (WFC)A Wells Fargo (WFC) sign hangs on a brick building in Bloomfield, Connecticut.Source: Martina Badini / Shutterstock.comWith the American economy actually performing quite well even as it’s trashed daily in the media by Wall Street analysts, Wells Fargo (NYSE:WFC), a very large bank that’s focused on lending to America’s businesses and consumers, is poised to outperform expectations in 2023.Perhaps that’s why WFC stock was identified on Dec. 4 as the 12th favorite stock of hedge funds and mutual funds by Goldman Sachs.Like all banks that are focused on lending, WFC’s net interest income will be boosted by higher interest rates.In an interview that took place on Dec. 6, CEO Charlie Scharf confirmed that prognosis, saying that “we certainly would expect next year’s net interest income to be higher than this year’s net interest income,”And although Scharf said that overall economic growth is slowing, he stated that the credit card spending of the bank’s customers continues to increase, although the business’s growth is slowing. Moreover, services and experiences businesses are doing quite well. And when it comes to loans, after the bank’s loans increased by 4% in the first three quarters of the year, the CEO reported that the direction of the company’s loan business had not changed meaningfully in Q4.So WFC is poised to benefit from continued credit card spending growth, higher net interest income, and continued strong loan growth. Yet the bank’s forward price-earnings ratio is a minuscule eight, creating a very good opportunity for investors in 2023.Volkswagen (VWAGY)A Volkswagen (VWAGY) logo on a sign in Turkey.Source: multitel / Shutterstock.comThe world’s second-largest automaker in global sales, Volkswagen (OTCMKTS:VWAGY) trades at a tiny valuation, as it’s changing hands for just four times analysts’ average 2022 earnings per share estimate. That’s even below the low valuations of Ford (NYSE:F) and GM (NYSE:GM), which change hands for about fives times analysts’ mean 2022 EPS estimates for them.Volkswagen’s valuation is being weighed down by the fact that its headquarters are in Europe. But the automaker obviously makes and sells vehicles all over the world. Moreover, as research firm Trefis pointed out recently, Volkswagen has a number of important strengths.Specifically, its deliveries jumped 10.6% year-over-year in the third quarter, while its operating profit soared 64% YOY. And the company’s electric-vehicle business is thriving, as its EV sales jumped 25% YOY to 366,400. With Volkswagen also building its own battery factories, the company should start emerging as an obvious winner in the EV race next year.According to Trefis, VWAGY stock is worth roughly $23 per share versus its closing price of $15.61 on Dec. 28.Cheniere Energy (LNG)LNG stock: the Cheniere logo displayed on a phoneSource: IgorGolovniov / Shutterstock.comContinuing our theme of blue-chip stocks with unjustifiably low valuations, let’s look at Cheniere Energy (NYSEMKT:LNG). The company, which exports natural gas from the U.S., is changing hands for just 6.6 times analysts’ average 2022 earnings per share estimate for the company.Yet the company is generating huge profits, as it, as of November, is expected to generate $8.1 billion to $8.6 billion of “distributable cash flow” in 2022.And LNG has strong macro drivers. First, Europe is buying all of the natural gas it can get its hands on, as American LNG exports to the continent soared more than 200% year-over-year in the first nine months of 2022. Meanwhile, China’s reopening should rejuvenate the demand for natural gas from that country.Additionally, Cheniere is continuing to expand its export capacity by building more export facilities, and the company is benefiting from elevated liquid natural gas prices. And continued tensions between the West and Russia, along with the electrification of transportation, should keep natural gas prices high for the foreseeable future.ServiceNow (NOW)ServiceNow office building in Silicon Valley;Source: Sundry Photography / Shutterstock.comNowadays, much of Wall Street seems allergic to buying or recommending Big Tech stocks. But ServiceNow (NYSE:NOW), whose products automatically carry out IT tasks, appears to be an exception to that rule. Between the close of Dec. 7 and the close of Dec. 27, the shares were little changed. And Yahoo Finance earlier this month identified the name as a hedge-fund favorite.What’s more, Morgan Stanley recently identified NOW stock as its “top pick” in the software sector, saying that the company’s subscription model should enable its growth to remain resilient. Additionally, the bank, which has an “overweight” rating on the shares, expects NOW’s profit margins to climb in the coming months.Also noteworthy is that in Q3, institutional investors either held or bought 166 million shares of NOW stock, while only 12 million of its stock was sold by institutions. And showing institutions’ faith in the name, they own 87.7% of its shares.Booking Holdings (BKNG)a person opens up Booking.com on a smartphoneSource: Denys Prykhodov / Shutterstock.comAlong with Expedia (NASDAQ:EXPE) and Trip.com, Booking Holdings (NASDAQ:BKNG) is one of three huge, U.S.-based online travel agencies, or OTAs.In a Dec. 6 interview, Wells Fargo CEO Charlie Scharf stated that U.S. consumers are continuing to spend a great deal of money on travel. Although I think that trend could slow somewhat next year, it should still remain strong for much of 2023, enabling Booking Holdings to continue reporting strong financial results and lifting BKNG stock.And in the third quarter, the number of hotel rooms rented through the site climbed about 8% versus Q3 of 2019, while the value of its gross bookings soared 27% versus the same period in 2019.Also encouragingly, billionaire George Soros, one of the world’s more successful investors, bought 10,000 shares of BKNG last quarter.Finally, the company should greatly benefit from the return of international travel.BKNG has a relatively low forward price-earnings ratio of 16.8 times.On the date of publication, Larry Ramer did not hold (either directly or indirectly) any positions in the securities mentioned in this article. The opinions expressed in this article are those of the writer, subject to the InvestorPlace.com Publishing Guidelines.Larry Ramer has conducted research and written articles on U.S. stocks for 15 years. He has been employed by The Fly and Israel’s largest business newspaper, Globes. Larry began writing columns for InvestorPlace in 2015. Among his highly successful, contrarian picks have been PLUG, XOM and solar stocks. You can reach him on Stocktwits at @larryramer.More From InvestorPlaceBuy This $5 Stock BEFORE This Apple Project Goes LiveThe Best $1 Investment You Can Make TodayEarly Bitcoin Millionaire Reveals His Next Big Crypto Trade “On Air”It doesn’t matter if you have $500 or $5 million. Do this now.The post Our Predictions for the Top 7 Blue-Chip Stocks for 2023 appeared first on InvestorPlace.]"
