,Id,Company,Date,Title,Publisher,Link,ProviderPublishTime,Type,Related Company,Text
22,2989ce60-9843-394e-8348-97d5b792f89f,MSFT,2023-04-10,UPDATE 3-OpenAI CEO considers opening office as Japan govt eyes adoption,Reuters,https://finance.yahoo.com/news/1-japan-eyes-government-ai-031622660.html,1681096582,STORY,['MSFT'],"[(Recasts, adds Altman's comment at ruling party meeting)By Kantaro Komiya and Satoshi SugiyamaTOKYO, April 10 (Reuters) - OpenAI Chief Executive Sam Altman said on Monday he is considering opening an office and expanding services in Japan after a meeting with Japan's prime minister.Prime Minister Fumio Kishida and Altman exchanged views on the technological progress and merits of AI as well as its risks including privacy and copyright infringement, chief cabinet secretary Hirokazu Matsuno said.Japan will evaluate the possibility of introducing artificial intelligence-powered technology such as OpenAI's ChatGPT chatbot, as it examines the benefits and risks, Matsuno added.ChatGPT - developed by Microsoft Corp backed OpenAI - has raised privacy concerns, prompting Italy to temporarily ban the chatbot.""We hope to ... build something great for Japanese people, make the models better for Japanese language and Japanese culture,"" Altman told reporters after the meeting with Kishida. His visit to Japan is the first international trip since the launch of ChatGPT.At a separate meeting at Japan's ruling party headquarters, the chief executive expressed hope that Japan, as a geopolitical power, would play a role in adopting AI and rule-making.Matsuno told reporters in a briefing Japan would consider government adoption of artificial intelligence technology such as OpenAI's ChatGPT chatbot if privacy and cybersecurity concerns were resolved.Following Italy's restriction of ChatGPT, which inspired other European countries to study such measures, OpenAI last week presented measures to remedy privacy breach concerns to the Italian regulator.Japan will continue evaluating possibilities of introducing AI to reduce government workers' workload after assessing how to respond to concerns such as data breaches, Matsuno said.Taro Kono, cabinet minister in charge of Japan's digital transformation, said on Friday he was hopeful that AI technologies would ""greatly contribute"" to the government's workstyle reforms, although saying it would be difficult to introduce ChatGPT at public offices soon due to problems such as machine-generated falsehoods.Kono said he wants the Group of Seven Digital Ministers' meeting, slated for April 29-30 in Japan, to discuss AI technologies including ChatGPT and issue a ""united message of G7"". (Reporting by Kantaro Komiya and Satoshi Sugiyama; Editing by Kenneth Maxwell and Jacqueline Wong)]"
23,9a80c197-da8e-34d8-bd99-4cdd5fe89a70,MSFT,2023-04-10,Stock Funds Rise 5.6% So Far in 2023,The Wall Street Journal,https://finance.yahoo.com/m/9a80c197-da8e-34d8-bd99-4cdd5fe89a70/stock-funds-rise-5.6%25-so-far.html,1681056000,STORY,"['TSLA', 'MSFT', 'META', 'SIVBQ', 'SIVPQ', 'AAPL']","[Investors looked on the bright side in the first quarter, pushing the average fund to a healthy gain.Continue reading]"
24,fe908343-fb97-3acc-aaf8-f6932de0b369,WBA,2023-04-10,"UPDATE 1-White House plans support for drugstores, pharma in abortion pill battle -sources",Reuters,https://finance.yahoo.com/news/1-white-house-plans-support-224053026.html,1681080053.0,STORY,['WBA'],"[(Adds comments from a senior U.S. administration official and Walgreens)By Nandita BoseWASHINGTON, April 9 (Reuters) - The White House is planning to re-up discussions with abortion pill manufacturers and U.S. pharmacy chains on ways to push back against efforts to ban mifepristone, two sources with knowledge of the matter said, as it appeals a Texas court ruling suspending the approval of the drug.U.S. District Judge Matthew Kacsmaryk in Amarillo, Texas, on Friday suspended approval of mifepristone, which will essentially make sales of the pill illegal in the U.S., while a legal challenge proceeds. A conflicting Washington state ruling on Friday blocks changes to pill sales in 17 states.In January, the Food and Drug Administration made a regulatory change that made it possible for retail pharmacies to offer abortion pills in the country for the first time, but more than a dozen states have passed laws limiting such sales.There are no retail pharmacies that are currently certified to dispense mifepristone and many are going through the certification process.""We are discussing ways to offer them legal support,"" one of the sources said of manufacturers and retail pharmacies.Options being discussed include having the U.S. Department of Justice back any legal challenges brought against manufacturers and pharmacies, and providing legal advice on how they can continue dispensing the pills, the sources said. The DOJ is separately seeking an emergency stay of the Texas order.The White House does not direct the DOJ's litigation strategy, a senior administration official said. The official also said the Justice Department does not provide legal advice to private entities. There is a separate volunteer process that gets private attorneys and law firms to do legal work on different issues that the agency oversees.It was not immediately clear which companies will be involved in these discussions. The White House declined comment.Story continuesMajor U.S. manufacturers of abortion pills include GenBioPro Inc and Danco Laboratories. Pharmacy chains dispensing such pills include Walgreens Boots Alliance Inc , CVS Health Corp and Rite Aid Corp.Walgreens said in March it would not dispense abortion pills in the 20 states where it risked breaking the law.On Sunday, Walgreens declined comment. The other companies did not respond to a request for comment on any discussions with the White House.The administration official said the White House has ""absolutely previously connected with both pharmacies and manufacturers but we have not had any discussions on this since Friday when the decision came out.""Any potential future conversations will not include decisions that impact ""how the FDA will operate or is operating,"" the official said.The White House's Gender Policy Council, Inter Governmental Affairs and the vice president's office have been holding strategy calls for nearly two months on how to make medical abortion available after the Texas judge ruled, anticipating Friday's outcome.Discussions between the Biden administration and pill manufacturers and pharmacies over the issue have been ongoing for months, sources said, but Friday's decision brings fresh urgency.RELIEF FROM WASHINGTON STATEA flurry of White House strategy calls on Friday and Saturday also focused on ""immediate, short-term"" relief offered by the conflicting order from Washington state , three sources said.Minutes after Texas judge Kacsmaryk's order, U.S. District Judge Thomas Rice in Spokane, Washington, an Obama appointee, ordered the FDA not to make any changes to mifepristone access in some Democrat-led states.The administration believes that the Washington ruling gives it more time to respond legally to Texas's final decision. It could ""expedite review of Texas, encourage an immediate stay on it and puts a huge question mark over it,"" one of the sources said.Politically, the sources said, it makes it easier for the White House to make its case to the public that the FDA approval of the drug was accurate, mobilize activists and supporters to turn the issue into one that resonates with voters ahead of the 2024 presidential elections.""There's a lot of legal analysis that needs to get done...about how these two orders interact,"" the senior administration official said.President Joe Biden and Vice President Kamala Harris said on Friday the administration will fight the Texas ruling.""We're going to fight it. The Attorney General has announced @TheJusticeDept will file an appeal and seek an immediate stay of the decision,"" Biden tweeted. The legal battle is likely to work through multiple levels of appeals courts over a period of months or years before it is resolved.The administration is seeking an emergency stay of Kacsmaryk's order from the New Orleans-based 5th U.S. Circuit Court of Appeals. The path forward discussed during the White House strategy calls touched on how the DOJ will wait for a decision from the 5th Circuit, which has a conservative reputation, the sources said.If it does not stay the ruling, the department will seek an expedited review by the Supreme Court, they said.(Reporting by Nandita Bose in Washington; Editing by Heather Timmons, Marguerita Choy and Diane Craft)]"
25,193c5f46-b96d-3700-9345-1fa4615f3db2,WBA,2023-04-10,2 Popular Dividend Stocks That Aren't as Safe as They Seem,Motley Fool,https://finance.yahoo.com/m/193c5f46-b96d-3700-9345-1fa4615f3db2/2-popular-dividend-stocks.html,1681047900.0,STORY,['WBA'],[]
26,e071954c-97da-312f-be6c-e745a392d484,SPG,2023-04-10,2 Retail REITs to Buy in April,Motley Fool,https://finance.yahoo.com/m/e071954c-97da-312f-be6c-e745a392d484/2-retail-reits-to-buy-in-april.html,1681129800,STORY,"['KIM', 'SPG']","[Strong wage growth and increasing consumer spending tend to go hand-in-hand. As long as consumer spending holds up, retail-focused real estate investment trusts (REITs) should perform well. Here are two retail REITs that investors may want to consider picking up in April.Continue reading]"
27,faa4b0ae-96fc-3f70-99a9-ce878037a999,HCA,2023-04-10,"Investing $1,000 In These 2 Top Stocks Would Be a Great Move",Motley Fool,https://finance.yahoo.com/m/faa4b0ae-96fc-3f70-99a9-ce878037a999/investing-%241%2C000-in-these-2.html,1681047000,STORY,"['HCA', 'REGN']","[For those with $1,000 that isn't being saved for emergencies, here are two excellent stocks to buy today: HCA Healthcare (NYSE: HCA) and Regeneron (NASDAQ: REGN). HCA Healthcare is a leading hospital chain in the U.S. It makes money based on occupancy rates in its 182 hospitals (among other facilities) and based on the services physicians order for their patients. For instance, occupancy levels in HCA Healthcare's hospitals would soar along with the number of cases of COVID-19 and then drop back down, sometimes rendering year-over-year comparisons difficult.Continue reading]"
28,2a0ce319-6422-3316-9ae4-fbc5b4962042,NFLX,2023-04-10,The Video Streaming Numbers Game Is Shifting,The Wall Street Journal,https://finance.yahoo.com/m/2a0ce319-6422-3316-9ae4-fbc5b4962042/the-video-streaming-numbers.html,1681124400,STORY,"['AMZN', 'WBD', 'DIS', 'NFLX']","[Viewers certainly are awash in content: According to Reelgood, which aggregates data from streaming platforms, subscribers can currently choose from a total of 36,674 TV shows and movies among the nine largest subscription-based streaming services, at any time day or night. This creates a bit of a conundrum for the operators of streaming platforms. Compelling new content is vital to keeping subscribers—and landing new ones—in a market where viewers can now sign up and cancel services with a mouse click.Continue reading]"
29,182e8cc1-2aed-309d-a9da-63950e2210e1,TJX,2023-04-10,7 A-Rated Stocks to Buy for April 2023,InvestorPlace,https://finance.yahoo.com/news/7-rated-stocks-buy-april-113034390.html,1680867034,STORY,"['VLO', 'ARDX', 'TJX', 'DGII', 'BP', 'CPRX', 'AEHR']","[The first quarter’s in the books, and happily, the stock market is having a much better year than we endured in 2022. If you’re an investor looking for stocks to buy, you’re probably feeling pretty good about your chances for a good April.The Dow Jones Industrial Average is up 1% for the year but has been building much-needed momentum over the last several weeks. The S&amp;P 500 is up 6% in 2023, and the tech-heavy Nasdaq composite shows a 14% gain.But this isn’t the time to stand pat. The world’s still spinning, and market conditions change rapidly. OPEC announced that it’s cutting production, which will directly affect oil prices. InvestorPlace - Stock Market News, Stock Advice &amp; Trading TipsThe Federal Reserve continues to raise interest rates and battle high inflation, and Congress and President Biden are wrestling with the debt ceiling, setting up a showdown that could significantly impact the economy.I’ve used my Portfolio Grader to identify the best stocks to buy in April as we launch into the year’s second quarter. The Portfolio Grader evaluates and grades stocks to buy based on performance, earnings history, momentum, analyst sentiment and quantitative measurements. It assigns a grade from “A” to “F” to each name – and just like in school, you want to be shooting for straight As on your report card.Here are seven A-rated stocks to buy for April to keep your portfolio in top-notch shape.VLOValero Energy $133.29BPBP $39.71DGIIDigi International $32.72AEHRAehr Test Systems $28.07ARDXArdelyx $4.40CPRXCatalyst Pharmaceuticals $17.22TJXTJX Companies $78.14Valero Energy (VLO)A daytime picture of a Valero (VLO) gas station located in San Francisco bay and clear blue sky in the background.Source: Sundry Photography / Shutterstock.comValero Energy (NYSE:VLO) is a downstream oil and gas company that is the world’s largest producer of renewable fuels. Valero’s ethanol plants can produce dry distillers’ grains, ethanol and corn oil for gasoline blenders and refiners.Story continuesRenewable energy is a coveted space that becomes more appealing with OPEC’s production cuts and the rising oil price. The global ethanol market is expected to grow at a compound annual growth rate of 4.8% through 2027, reaching $129.3 billion.Valero reported fourth-quarter earnings of $41.75 billion, that was 17.5% better than a year ago. While it narrowly missed analysts’ revenue estimates, the company showed solid profits by posting earnings per share of $8.45, which was better than analysts’ expectations of $7.25.VLO stock is up 25% over the last 12 months and provides a 3% dividend yield, which is a nice perk all by itself. VLO has an “A” rating in the Portfolio Grader and it one of the better stocks to buy on oil price increases.BP (BP)BP stock: the BP company logo on a buildingSource: FotograFFF / Shutterstock.com BP (NYSE:BP) is in a prominent position to profit from higher oil and gas prices. It’s already coming off its most profitable year, banking $27.7 billion in 2022 (compared to $12.8 billion in 2021). It also is in a prime position to continue profiting from the European energy market, which sees tight supply because Russia invaded Ukraine and Moscow’s subsequent cuts of natural gas to the West.BP is also expected to complete its TravelCenters of America (NYSE:TA) acquisition by mid-year. The $1.3 billion deal will give BP an additional 281 fuel stations in 44 U.S. states and another opportunity to capitalize on rising oil prices, making it one of the best multi-stream stocks to buy.BP has an “A” rating in the Portfolio Grader.Digi International (DGII)5G digital hologram floating over a phone on a city background. representing 5g stocks investing for the next decadeSource: Fit Ztudio / Shutterstock.comDigi International (NASDAQ:DGII) is a Minnesota-based company that develops products and solutions for the Internet of Things (IoT). Digi’s products and services support retail, banking, medical and transportation industries, helping them create next-generation connected products and manage infrastructure.Digi has been a consistent winner on Wall Street, with earnings for the fiscal first quarter 2023 (ending Dec. 31, 2022) coming in at $109.3 million, or 29.7% better than the previous year. Digi is projecting fiscal Q2 revenue to be $105 million to $109 million, with analysts’ consensus estimates at $104.5 million. It’s one of the more interesting stocks to buy in the sector.DGII stock has an “A” rating in the Portfolio Grader.Aehr Test Systems (AEHR)Illustration of an electric car charging outside of a city with wind turbines in the background; EVSource: petovarga / ShutterstockI consider Aehr Test Systems (NASDAQ:AEHR) a calculated gamble, even with its “A” rating, but it’s still worth your attention because it has massive potential.Aehr makes the burn-in equipment in silicon carbine chips commonly found in electric vehicles. EVs are a growing market with tremendous upside: a compound annual growth rate of 17% through 2027 and a projected market of $858 billion. Each EV requires thousands of semiconductors, making Aehr’s services valuable.The problem is that Tesla (NASDAQ:TSLA) announced it’s come up with a new power inverter that cuts reliance on silicon carbide. The announcement sent AEHR stock down 8% in a single day, but Aehr’s executives say its market won’t be impacted.That remains to be seen.Aehr posted fiscal third-quarter revenue of $17.2 million and earnings of 16 cents per share, beating analysts’ estimates of $16 million and 14 cents per share. It also reiterated its guidance for the full fiscal year ending May 31 with sales between $60 million to $70 million. But its implied sales goal for the current quarter is $22.3 million, below the $23.6 million that Wall Street expects. That sent AEHR stock down 25% since April 1.Tesla’s new power inverter won’t be included on its vehicles until the next model platform, which is still in development. So I’m banking on Aehr to hit its revenue goals, at least, and churn out a solid return at a suddenly discounted price. AEHR stock has an “A” rating in the Portfolio Grader. Ardelyx (ARDX)Illustration of a biopharma company. Doctor standing in front of various medical icons.Source: Billion Photos / ShutterstockI won’t blame you if Ardelyx (NASDAQ:ARDX) isn’t on your radar right now. It’s a penny stock – for now – with a market capitalization of only $931 million.But it’s probably time to pay attention to this one.Based in Waltham, Massachusetts, Ardelyx is a rising pharmaceutical company. The company is glowing from its successful launch of Ibsrela, the brand name for tenapanor, used to treat irritable bowel syndrome.What’s exciting about this development, however, is that Ardelyx has paperwork before the Food and Drug Administration to use tenapanor to treat patients on dialysis with chronic kidney disease. Ardelyx would see projected sales of $800 million in five years if granted.Ardelyx won’t stay under the radar for long – shares are already up 55% this year. Happily, analysts are putting a consensus price target of $7.59 on ARDX stock, meaning it still has a 71% runway.You have time to get on board, but this bandwagon isn’t sticking around. ARDX stock has an “A” rating in the Portfolio Grader.Catalyst Pharmaceuticals (CPRX)medicine research, pharmaceutical background, LJPC stockSource: Sisacorn / Shutterstock.comCatalyst Pharmaceuticals (NASDAQ:CPRX) is at the forefront of developing medications to treat the aging population. Its top drug is Firdapse, which treats adults with Lambert-Eaton Myasthenic Syndrome, a rare condition that affects signals sent from nerves to muscles, making them unable to contract properly.Firdapse sales account for the company’s entire revenue stream, which was $61 million in Q4 (up 58% from a year ago).Catalyst is another company discounted severely right now because it faced some bad news. In late January, Teva Pharmaceutical (NYSE:TEVA) announced plans for a generic version of Firdapse, and that news sent CPRX stock down 27%. Catalyst is working on a label expansion for Firdapse and purchasing U.S. rights to an epilepsy treatment developed by Eisai (OTCMKTS:ESAIY).For now, however, Catalyst is projecting continued growth. Its issued guidance for full-year 2023 revenue between $375 million and $385 million, which is well above the consensus analysts’ estimate of $337.6 million.As far as April goes, I think Catalyst remains a solid pick, and many agree. Shares have already rebounded 14% since bottoming out in January, and I expect that trend to continue. CPRX stock has an “A” rating in the Portfolio Grader.TJX Companies (TJX)An outside shot of a T.J. Maxx (TJX) store in Romeoville, Illinois.Source: Joe Hendrickson / Shutterstock.comTJX Companies (NYSE:TJX), the parent company of well-known retailers such as T.J. Maxx, Marshalls, Sierra, Homegoods and Homesense, offers discounted apparel and home goods by 20% to 60% below department stores or online retailers.TJX has roughly 4,700 stores in the U.S., Canada, Australia and Europe.Earnings for the company’s fiscal Q4 2023 (ending Jan. 28, 2023) included revenue of $14.52 billion, up 4.8% from a year ago and better than analysts’ expectations for $14.07 billion. It’s guiding for continued solid performance for this quarter, with projected comparable store sales to be up 2% to 3% and earnings per share to range from 68 cents to 71 cents.TJX stock is holding steady this year, down about 2% since January 1, but I’m expecting a solid April to make this one of the best retailers you can buy. And it also offers a decent dividend yield of 1.7%.Like other names on this list, TJX stock has an “A” rating in the Portfolio Grader.On the date of publication, Louis Navellier held VLO, BP, DGII and CPRX. He did not hold (either directly or indirectly) any other positions in the securities mentioned in this article.On the date of publication, the InvestorPlace Research Staff member primarily responsible for this article held TSLA. The staff member did not hold (either directly or indirectly) any other positions in the securities mentioned in this article.Louis Navellier, who has been called “one of the most important money managers of our time,” has broken the silence in this shocking “tell all” video… exposing one of the most shocking events in our country’s history… and the one move every American needs to make today.More From InvestorPlaceBuy This $5 Stock BEFORE This Apple Project Goes LiveThe Best $1 Investment You Can Make TodayIt doesn’t matter if you have $500 or $5 million. Do this now.Massive Bear Market “Divergence Event” Ahead… And The #1 Way to Play ItThe post 7 A-Rated Stocks to Buy for April 2023 appeared first on InvestorPlace.]"
30,fdb446de-72a7-346c-8447-2de19326f859,M,2023-04-10,A Bull Market Is Coming: 3 Reasons to Buy Devon Energy Stock,Motley Fool,https://finance.yahoo.com/m/fdb446de-72a7-346c-8447-2de19326f859/a-bull-market-is-coming%3A-3.html,1681127100,STORY,['M'],"[Oil prices have been in a rut over concerns about the global economy. West Texas Intermediate, the primary U.S. oil price benchmark, was down about 30% from its peak last year. Here are three reasons to buy the oil stock before its shares recover.Continue reading]"
31,24a7b323-7dce-3f83-99b3-c5b96584c3e8,M,2023-04-10,Oil Steadies as Market Awaits Updates on Crude Supply Challenges,Bloomberg,https://finance.yahoo.com/news/oil-pushes-higher-week-open-224032405.html,1681118811,STORY,['M'],"[(Bloomberg) -- Oil fell in a low-volume session, unable to withstand a rising US dollar while investors waited for upcoming supply constraints to hit the market.Most Read from BloombergUS Navy Challenges Beijing in South China Sea Amid Taiwan DrillsApple’s 40% Plunge in PC Shipments Is Steepest Among Major Computer MakersFedEx Overhaul Contemplates a Future With No Drivers on PayrollBond Market Is Overplaying the Risk of a Deep RecessionKatie Cotton, Who Led Apple’s Media Strategy for 18 Years, DiesTraders exited risk assets Monday, pausing a rally in which prices have risen roughly 20% in the last three weeks. OPEC+’s surprise decision to slash output beginning in May reignited bullish bets on prices, yet some demand indicators are flashing signs of weakness.“We’re waiting to see what’s really happening with the economy, but it is a slower recovery,” Ed Morse, global head of commodities research at Citigroup Inc., said in a Bloomberg Television interview. “It’s a services recovery. If anything, that will be an end-of-year phenomenon.”Traders are awaiting insights this week into monthly outlooks from OPEC and the International Energy Agency as well as US inflation data and Federal Reserve minutes.Separately, Turkey wants to negotiate payments it owes Iraq before a pipeline that exports 400,000 barrels a day is reopened, according to Turkish officials familiar with the situation.Russia’s Energy Ministry, meanwhile, said that the nation reduced its oil output by about 700,000 barrels a day last month, according to a person familiar with the data. Nevertheless, that figure is inconsistent with indicators on the nation’s March seaborne exports and supplies to domestic refineries.Energy Daily, Bloomberg’s daily energy and commodities newsletter, is now available. Sign up here.Most Read from Bloomberg BusinessweekWhat to Do With Your Money—and Your Life—in a Wild New WorldScaramucci’s SkyBridge Capital Was Spiraling, and Then Came FTXThe Chainsmokers Are Dancing Through the Silicon Valley DownturnAI Is Moving Fast Enough to Break Things. Sound Familiar?Apple’s Complex, Secretive Gamble to Move Beyond China©2023 Bloomberg L.P.]"
