,Id,Company,Date,Title,Publisher,Link,ProviderPublishTime,Type,Related Company,Text
111,88480a9d-b91a-3012-8ab6-a5765667a38d,UPS,2023-02-12,7 Dividend Stocks to Buy for a Reliable Income Stream,InvestorPlace,https://finance.yahoo.com/news/7-dividend-stocks-buy-reliable-100722471.html,1675937242,STORY,"['JNJ', 'SNA', 'UPS', 'CSCO', 'DOX', 'TSCO', 'TXN']","[With 2022 featuring a deluge of red ink, the temptation this year centers on scooping up popular names for cheap. Though investors shouldn’t ignore the relatively boring option of dividend stocks to buy. True, companies that provide reliable passive income don’t generate much excitement. However, with so many variables ahead of the markets, a dull but dependable route may be more prudent.For this list of dividend stocks to buy, every company features a payout ratio – or the proportion of earnings a company pays its shareholders via dividends – below 70%. As well, each enterprise carries a consensus rating among analysts of moderate buy or its equivalent. That way, prospective investors can also enjoy capital gains potential.TXNTexas Instruments$176.50UPSUnited Parcel Service$186.36DOXAmdocs$95.21TSCOTractor Supply$231.24SNASnap-on$251.20JNJJohnson &amp; Johnson$163.61CSCOCisco$46.96InvestorPlace - Stock Market News, Stock Advice &amp; Trading TipsTexas Instrument (TXN)A photo of a paper with a chart and the word ""Dividends"" written on it, with a pen and calculator resting on top of it.Source: jittawit21/Shutterstock.comOne of the top technology firms in the nation, Texas Instruments (NASDAQ:TXN) designs and manufactures semiconductors and various integrated circuits, which it sells to electronics designers and manufacturers globally. So far, TXN has avoided the wild volatility that impacted its peers. In the trailing year, shares gained over 6%. In contrast, the Nasdaq Composite index dropped nearly 15% during the same period.Currently, Texas Instruments carries a forward yield of 2.7%. This ranks conspicuously above the tech sector’s average yield of 1.37%. Further, its payout ratio pings at 59.28%. As well, the company commands 19 years of consecutive annual dividend increases. Therefore, it’s unlikely that management will give up this trend without a fight.Financially, Texas Instruments features a stable balance sheet (an Altman Z-Score of 12.85) and excellent profitability margins. These attributes may have contributed to Wall Street analysts rating TXN as a consensus moderate buy. Further, TipRanks notes that hedge fund sentiment rates as “positive.” Therefore, it offers a solid choice among dividend stocks to buy.Story continuesUnited Parcel Service (UPS)A photo of a young boy wearing sunglasses, jeans, a blazer, a white shirt and suspenders holding money in various denominations in one hand and sitting in a plush chair.Source: Dmitry Lobanov/Shutterstock.comA stalwart in the shipping and receiving industry, United Parcel Service (NYSE:UPS) represents a critical cog in the broader supply chain management complex. Admittedly, though, circumstances have been challenging for UPS amid 2022’s spike in inflation. However, the situation appears to be turning around, with shares gaining over 7% since the January opener.Presently, UPS carries a forward yield of 3.44%. This rates better than the industrial sector’s average yield of 2.36%. Notably, the company’s payout ratio is 52.73%. In addition, UPS features 14 years of consecutive dividend increases.Despite wider challenges, UPS commands a three-year revenue growth rate of 10.4%, outpacing 75% of the competition. Also, its net margin stands at 11.51%, beating over 68% of its rivals.Turning to Wall Street, covering analysts peg UPS as a consensus moderate buy. In addition, their average price target is $194.94, implying potential upside of 3.53%. While not particularly exciting, UPS ranks among the dividend stocks to buy this year.Amdocs (DOX)A hand reaches out of a mailbox holding a wad of cash.Source: ShutterstockA multinational software firm, Amdocs (NASDAQ:DOX) specializes in software and services for communications, media and financial services providers and digital enterprises. Contrary to many of its tech peers, Amdocs performed very well in 2022. For instance, in the trailing 365 days, DOX gained nearly 22%. It’s still up almost 4% since the January opener.At the moment, DOX carries a forward yield of 1.83%. Though not the highest yield, it still rates better than the tech sector’s average yield of 1.37%. Also, Amdocs features a low payout ratio of 26.75%, meaning investors can depend on it for reliable passive income. Plus, the company enjoys 10 consecutive years of dividend increases.Financially, DOX might attract investors for its value proposition. The market prices shares at a forward multiple of 16.77. As a discount to forward earnings, Amdocs ranks better than 72%.Finally, Wall Street analysts peg DOX as a consensus moderate buy. Also, their average price target stands at $99, implying 4% upside potential. Combined with its strong market performance, DOX represents one of the dividend stocks to buy.Tractor Supply (TSCO)7 Safe Dividend Stocks for Investors to Buy Right NowSource: ShutterstockHeadquartered in Brentwood, Tennessee, Tractor Supply (NASDAQ:TSCO) is an American retail chain of stores that sells products for various purposes. These include home improvement, agriculture, lawn and garden maintenance, livestock, equine and pet care for recreational farmers and ranchers, pet owners, and landowners.Although a boring entry among dividend stocks to buy, Tractor did what it does best: keep the ship afloat. In the trailing year, shares gained nearly 5%. While not particularly impressive, it’s a heckuva lot better than falling into negative territory.Presently, Tractor Supply carries a forward yield of 1.58%. To be fair, this slips a bit below the consumer discretionary sector’s average yield of 1.89%. However, the payout ratio sits at 31.69%, making TSCO one of the more dependable dividend stocks to buy.Finally, Wall Street analysts assess TSCO as a consensus moderate buy. Further, their average price target pings at $245.78, implying upside potential of almost 6%.Snap-on (SNA)dividend stocks: A calculator projecting the word ""DIVIDEND"" rests on a pile of gold and silver coins.Source: ShutterstockNot to be confused with the similar-sounding social media firm, Snap-on (NYSE:SNA) is an American designer, manufacturer and marketer of high-end tools and equipment for professional use in the transportation industry. These sectors included the automotive, heavy duty, equipment, marine, aviation and railroad industries.Though another boring behind-the-shadows example of dividend stocks to buy, SNA proves that boring can be profitable. In the trailing year, shares gained nearly 20% of equity value. Further, since the Jan. opener, SNA moved up 11%.At time of writing, Snap-on carries a forward yield of 2.55%. This rates higher than the consumer discretionary sector’s average yield of 1.89%. Further, the payout ratio sits at 36.65%, making it one of the reliable dividend stocks to buy. As well, Snap-on enjoys 13 years of consecutive dividend increases.Turning to Wall Street, analysts peg SNA as a consensus moderate buy. Also, their average price target stands at $281, implying upside potential of over 10%.Johnson &amp; Johnson (JNJ)Source: ShutterstockFounded in 1886, Johnson &amp; Johnson (NYSE:JNJ) represents an American icon. As a business enterprise, Johnson &amp; Johnson develops medical devices, pharmaceuticals and consumer packaged goods. However, JNJ hasn’t posted a great performance recently. In the trailing year, it fell nearly 5%. And since the January opener, JNJ faces a deficit of more than 8%.Nevertheless, this may open the door for contrarians to pick up one of the dividend stocks to buy on discount. Currently, the healthcare giant carries a forward yield of 2.77%. This ranks notably higher than the underlying sector’s average yield of 1.58%. Also, its payout ratio of 41.5% provides prospective investors with confidence. Lastly, regarding the passive income, it’s on a 61-year consecutive streak of dividend increases.Looking to Wall Street, analysts peg JNJ as a consensus moderate buy. As well, their average price target stands at $186.11, implying upside potential of nearly 14%.Cisco Systems (CSCO)7 Winning High-Yield Dividend Stocks With Payouts Over 5%Source: ShutterstockHeadquartered in San Jose, California, Cisco (NASDAQ:CSCO) is a digital communications technology conglomerate. Per its website, Cisco develops, manufactures, and sells networking hardware, software, telecommunications equipment and other high-technology services and products. However, CSCO hasn’t been a great performer last year. In the trailing 365 days, CSCO lost almost 14% of equity value.Even in the year so far, Cisco presently posts unimpressive numbers, slipping a few basis points below parity. Nonetheless, for bargain hunters, CSCO may be one of the best dividend stocks to buy. Currently, the company offers a forward yield of 3.18%. In contrast, the tech sector’s average yield sits at 1.37%. Moreover, the payout ratio offers confidence, coming in just under 40%. Lastly regarding dividends, it features 12 years of consecutive payout increases.Right now, analysts peg CSCO as a consensus moderate buy. Additionally, their average price target stands at $54.70, implying upside potential of over 14%.On the date of publication, Josh Enomoto did not have (either directly or indirectly) any positions in the securities mentioned in this article. The opinions expressed in this article are those of the writer, subject to the InvestorPlace.com Publishing Guidelines.A former senior business analyst for Sony Electronics, Josh Enomoto has helped broker major contracts with Fortune Global 500 companies. Over the past several years, he has delivered unique, critical insights for the investment markets, as well as various other industries including legal, construction management, and healthcare.More From InvestorPlaceBuy This $5 Stock BEFORE This Apple Project Goes LiveThe Best $1 Investment You Can Make TodayIt doesn’t matter if you have $500 or $5 million. Do this now.Massive Bear Market “Divergence Event” Ahead… And The #1 Way to Play ItThe post 7 Dividend Stocks to Buy for a Reliable Income Stream appeared first on InvestorPlace.]"
112,6b45dfa5-2e66-3bce-b174-f7a7d80bca6a,TSCO,2023-02-12,Tractor Supply (NASDAQ:TSCO) Is Increasing Its Dividend To $1.03,Simply Wall St.,https://finance.yahoo.com/news/tractor-supply-nasdaq-tsco-increasing-121704511.html,1676204224.0,STORY,['TSCO'],"[The board of Tractor Supply Company (NASDAQ:TSCO) has announced that it will be increasing its dividend by 12% on the 14th of March to $1.03, up from last year's comparable payment of $0.92. Based on this payment, the dividend yield for the company will be 1.6%, which is fairly typical for the industry. See our latest analysis for Tractor Supply Tractor Supply's Earnings Easily Cover The DistributionsUnless the payments are sustainable, the dividend yield doesn't mean too much. However, Tractor Supply's earnings easily cover the dividend. This means that most of its earnings are being retained to grow the business.Over the next year, EPS is forecast to expand by 28.7%. If the dividend continues along recent trends, we estimate the payout ratio will be 36%, which is in the range that makes us comfortable with the sustainability of the dividend.historic-dividendTractor Supply Has A Solid Track RecordEven over a long history of paying dividends, the company's distributions have been remarkably stable. Since 2013, the dividend has gone from $0.40 total annually to $3.68. This implies that the company grew its distributions at a yearly rate of about 25% over that duration. Rapidly growing dividends for a long time is a very valuable feature for an income stock.The Dividend Looks Likely To GrowInvestors could be attracted to the stock based on the quality of its payment history. Tractor Supply has seen EPS rising for the last five years, at 24% per annum. Earnings have been growing rapidly, and with a low payout ratio we think that the company could turn out to be a great dividend stock.We Really Like Tractor Supply's DividendOverall, we think this could be an attractive income stock, and it is only getting better by paying a higher dividend this year. Earnings are easily covering distributions, and the company is generating plenty of cash. All of these factors considered, we think this has solid potential as a dividend stock.It's important to note that companies having a consistent dividend policy will generate greater investor confidence than those having an erratic one. However, there are other things to consider for investors when analysing stock performance. As an example, we've identified 1 warning sign for Tractor Supply that you should be aware of before investing. If you are a dividend investor, you might also want to look at our curated list of high yield dividend stocks.Have feedback on this article? Concerned about the content? Get in touch with us directly. Alternatively, email editorial-team (at) simplywallst.com.This article by Simply Wall St is general in nature. We provide commentary based on historical data and analyst forecasts only using an unbiased methodology and our articles are not intended to be financial advice. It does not constitute a recommendation to buy or sell any stock, and does not take account of your objectives, or your financial situation. We aim to bring you long-term focused analysis driven by fundamental data. Note that our analysis may not factor in the latest price-sensitive company announcements or qualitative material. Simply Wall St has no position in any stocks mentioned.Join A Paid User Research SessionYou’ll receive a US$30 Amazon Gift card for 1 hour of your time while helping us build better investing tools for the individual investors like yourself. Sign up here]"
113,88480a9d-b91a-3012-8ab6-a5765667a38d,TSCO,2023-02-12,7 Dividend Stocks to Buy for a Reliable Income Stream,InvestorPlace,https://finance.yahoo.com/news/7-dividend-stocks-buy-reliable-100722471.html,1675937242.0,STORY,"['JNJ', 'SNA', 'UPS', 'CSCO', 'DOX', 'TSCO', 'TXN']","[With 2022 featuring a deluge of red ink, the temptation this year centers on scooping up popular names for cheap. Though investors shouldn’t ignore the relatively boring option of dividend stocks to buy. True, companies that provide reliable passive income don’t generate much excitement. However, with so many variables ahead of the markets, a dull but dependable route may be more prudent.For this list of dividend stocks to buy, every company features a payout ratio – or the proportion of earnings a company pays its shareholders via dividends – below 70%. As well, each enterprise carries a consensus rating among analysts of moderate buy or its equivalent. That way, prospective investors can also enjoy capital gains potential.TXNTexas Instruments$176.50UPSUnited Parcel Service$186.36DOXAmdocs$95.21TSCOTractor Supply$231.24SNASnap-on$251.20JNJJohnson &amp; Johnson$163.61CSCOCisco$46.96InvestorPlace - Stock Market News, Stock Advice &amp; Trading TipsTexas Instrument (TXN)A photo of a paper with a chart and the word ""Dividends"" written on it, with a pen and calculator resting on top of it.Source: jittawit21/Shutterstock.comOne of the top technology firms in the nation, Texas Instruments (NASDAQ:TXN) designs and manufactures semiconductors and various integrated circuits, which it sells to electronics designers and manufacturers globally. So far, TXN has avoided the wild volatility that impacted its peers. In the trailing year, shares gained over 6%. In contrast, the Nasdaq Composite index dropped nearly 15% during the same period.Currently, Texas Instruments carries a forward yield of 2.7%. This ranks conspicuously above the tech sector’s average yield of 1.37%. Further, its payout ratio pings at 59.28%. As well, the company commands 19 years of consecutive annual dividend increases. Therefore, it’s unlikely that management will give up this trend without a fight.Financially, Texas Instruments features a stable balance sheet (an Altman Z-Score of 12.85) and excellent profitability margins. These attributes may have contributed to Wall Street analysts rating TXN as a consensus moderate buy. Further, TipRanks notes that hedge fund sentiment rates as “positive.” Therefore, it offers a solid choice among dividend stocks to buy.Story continuesUnited Parcel Service (UPS)A photo of a young boy wearing sunglasses, jeans, a blazer, a white shirt and suspenders holding money in various denominations in one hand and sitting in a plush chair.Source: Dmitry Lobanov/Shutterstock.comA stalwart in the shipping and receiving industry, United Parcel Service (NYSE:UPS) represents a critical cog in the broader supply chain management complex. Admittedly, though, circumstances have been challenging for UPS amid 2022’s spike in inflation. However, the situation appears to be turning around, with shares gaining over 7% since the January opener.Presently, UPS carries a forward yield of 3.44%. This rates better than the industrial sector’s average yield of 2.36%. Notably, the company’s payout ratio is 52.73%. In addition, UPS features 14 years of consecutive dividend increases.Despite wider challenges, UPS commands a three-year revenue growth rate of 10.4%, outpacing 75% of the competition. Also, its net margin stands at 11.51%, beating over 68% of its rivals.Turning to Wall Street, covering analysts peg UPS as a consensus moderate buy. In addition, their average price target is $194.94, implying potential upside of 3.53%. While not particularly exciting, UPS ranks among the dividend stocks to buy this year.Amdocs (DOX)A hand reaches out of a mailbox holding a wad of cash.Source: ShutterstockA multinational software firm, Amdocs (NASDAQ:DOX) specializes in software and services for communications, media and financial services providers and digital enterprises. Contrary to many of its tech peers, Amdocs performed very well in 2022. For instance, in the trailing 365 days, DOX gained nearly 22%. It’s still up almost 4% since the January opener.At the moment, DOX carries a forward yield of 1.83%. Though not the highest yield, it still rates better than the tech sector’s average yield of 1.37%. Also, Amdocs features a low payout ratio of 26.75%, meaning investors can depend on it for reliable passive income. Plus, the company enjoys 10 consecutive years of dividend increases.Financially, DOX might attract investors for its value proposition. The market prices shares at a forward multiple of 16.77. As a discount to forward earnings, Amdocs ranks better than 72%.Finally, Wall Street analysts peg DOX as a consensus moderate buy. Also, their average price target stands at $99, implying 4% upside potential. Combined with its strong market performance, DOX represents one of the dividend stocks to buy.Tractor Supply (TSCO)7 Safe Dividend Stocks for Investors to Buy Right NowSource: ShutterstockHeadquartered in Brentwood, Tennessee, Tractor Supply (NASDAQ:TSCO) is an American retail chain of stores that sells products for various purposes. These include home improvement, agriculture, lawn and garden maintenance, livestock, equine and pet care for recreational farmers and ranchers, pet owners, and landowners.Although a boring entry among dividend stocks to buy, Tractor did what it does best: keep the ship afloat. In the trailing year, shares gained nearly 5%. While not particularly impressive, it’s a heckuva lot better than falling into negative territory.Presently, Tractor Supply carries a forward yield of 1.58%. To be fair, this slips a bit below the consumer discretionary sector’s average yield of 1.89%. However, the payout ratio sits at 31.69%, making TSCO one of the more dependable dividend stocks to buy.Finally, Wall Street analysts assess TSCO as a consensus moderate buy. Further, their average price target pings at $245.78, implying upside potential of almost 6%.Snap-on (SNA)dividend stocks: A calculator projecting the word ""DIVIDEND"" rests on a pile of gold and silver coins.Source: ShutterstockNot to be confused with the similar-sounding social media firm, Snap-on (NYSE:SNA) is an American designer, manufacturer and marketer of high-end tools and equipment for professional use in the transportation industry. These sectors included the automotive, heavy duty, equipment, marine, aviation and railroad industries.Though another boring behind-the-shadows example of dividend stocks to buy, SNA proves that boring can be profitable. In the trailing year, shares gained nearly 20% of equity value. Further, since the Jan. opener, SNA moved up 11%.At time of writing, Snap-on carries a forward yield of 2.55%. This rates higher than the consumer discretionary sector’s average yield of 1.89%. Further, the payout ratio sits at 36.65%, making it one of the reliable dividend stocks to buy. As well, Snap-on enjoys 13 years of consecutive dividend increases.Turning to Wall Street, analysts peg SNA as a consensus moderate buy. Also, their average price target stands at $281, implying upside potential of over 10%.Johnson &amp; Johnson (JNJ)Source: ShutterstockFounded in 1886, Johnson &amp; Johnson (NYSE:JNJ) represents an American icon. As a business enterprise, Johnson &amp; Johnson develops medical devices, pharmaceuticals and consumer packaged goods. However, JNJ hasn’t posted a great performance recently. In the trailing year, it fell nearly 5%. And since the January opener, JNJ faces a deficit of more than 8%.Nevertheless, this may open the door for contrarians to pick up one of the dividend stocks to buy on discount. Currently, the healthcare giant carries a forward yield of 2.77%. This ranks notably higher than the underlying sector’s average yield of 1.58%. Also, its payout ratio of 41.5% provides prospective investors with confidence. Lastly, regarding the passive income, it’s on a 61-year consecutive streak of dividend increases.Looking to Wall Street, analysts peg JNJ as a consensus moderate buy. As well, their average price target stands at $186.11, implying upside potential of nearly 14%.Cisco Systems (CSCO)7 Winning High-Yield Dividend Stocks With Payouts Over 5%Source: ShutterstockHeadquartered in San Jose, California, Cisco (NASDAQ:CSCO) is a digital communications technology conglomerate. Per its website, Cisco develops, manufactures, and sells networking hardware, software, telecommunications equipment and other high-technology services and products. However, CSCO hasn’t been a great performer last year. In the trailing 365 days, CSCO lost almost 14% of equity value.Even in the year so far, Cisco presently posts unimpressive numbers, slipping a few basis points below parity. Nonetheless, for bargain hunters, CSCO may be one of the best dividend stocks to buy. Currently, the company offers a forward yield of 3.18%. In contrast, the tech sector’s average yield sits at 1.37%. Moreover, the payout ratio offers confidence, coming in just under 40%. Lastly regarding dividends, it features 12 years of consecutive payout increases.Right now, analysts peg CSCO as a consensus moderate buy. Additionally, their average price target stands at $54.70, implying upside potential of over 14%.On the date of publication, Josh Enomoto did not have (either directly or indirectly) any positions in the securities mentioned in this article. The opinions expressed in this article are those of the writer, subject to the InvestorPlace.com Publishing Guidelines.A former senior business analyst for Sony Electronics, Josh Enomoto has helped broker major contracts with Fortune Global 500 companies. Over the past several years, he has delivered unique, critical insights for the investment markets, as well as various other industries including legal, construction management, and healthcare.More From InvestorPlaceBuy This $5 Stock BEFORE This Apple Project Goes LiveThe Best $1 Investment You Can Make TodayIt doesn’t matter if you have $500 or $5 million. Do this now.Massive Bear Market “Divergence Event” Ahead… And The #1 Way to Play ItThe post 7 Dividend Stocks to Buy for a Reliable Income Stream appeared first on InvestorPlace.]"
114,8073319d-649b-3fca-a8b6-5ccdbb391809,VRTX,2023-02-12,"The Best Stocks To Invest $5,000 in Right Now",Motley Fool,https://finance.yahoo.com/m/8073319d-649b-3fca-a8b6-5ccdbb391809/the-best-stocks-to-invest.html,1676199000,STORY,"['AMZN', 'VRTX', 'GOOGL']","[When Bill Miller says a stock is a great pick, it pays to listen. Specifically, Miller called Amazon ""one of the easiest names in the market right now."" This optimism about Amazon isn't just because the stock remains more than 40% below its previous high (although that is the case).Continue reading]"
115,489694c9-7b56-369b-aff9-0f4e3f08e808,VRTX,2023-02-12,3 Surefire Growth Stocks You Can Buy Right Now,Motley Fool,https://finance.yahoo.com/m/489694c9-7b56-369b-aff9-0f4e3f08e808/3-surefire-growth-stocks-you.html,1676143860,STORY,"['VRTX', 'LLY', 'AXSM']","[With this in mind, we asked three Motley Fool contributors to identify surefire growth stocks you can buy right now. Here's why they chose Axsome Therapeutics (NASDAQ: AXSM), Eli Lilly (NYSE: LLY), and Vertex Pharmaceuticals (NASDAQ: VRTX). Keith Speights (Axsome Therapeutics): It usually takes only one big product to be a game changer for a small biotech stock.Continue reading]"
