,Id,Company,Date,Title,Publisher,Link,ProviderPublishTime,Type,Related Company,Text
0,89de9411-99f1-34a9-b0e1-705b165705ab,NUE,2023-01-15,11 Undervalued Dividend Aristocrats To Buy Now,Insider Monkey,https://finance.yahoo.com/news/11-undervalued-dividend-aristocrats-buy-190032287.html,1673722832,STORY,"['CVX', 'NUE', 'AFL', 'NFG', 'KO', 'BEN', 'PG', 'EXPD', 'JNJ']","[In this article, we discuss 11 undervalued dividend aristocrats to buy now. You can skip our detailed analysis of dividend and value investing, and go directly to read 5 Undervalued Dividend Aristocrats To Buy Now. After engaging in tight monetary policies in 2022, central banks are expected to ""pivot and signal cutting interest rates sometime"" in 2023, according to a report by JPMorgan. However, the report presented a skeptical view on global growth due to the re-emergence of Covid in China and the ongoing natural gas crisis in Europe. In the current market situation, investors expect defensive value stocks to hold the reins this year as recession fears will continue to haunt the stock market.Over the years, high-quality growth stocks outperformed value equities. However, with the tech sell-off last year, value investing gained traction among investors. In Bloomberg’s MLIV Pulse survey conducted in the first week of January 2023, 54% of respondents mentioned that they are inclined to invest more in value stocks this year, up from 39% three months ago. Another survey by CNBC revealed that 72% of the participants will prefer value over growth this year. Last year’s returns also showed the dominance of value stocks over growth equities. In 2022, the Russell 1000 Value Index fell by 7.5%, compared with a much harsh decline of 29.1% for the Russell 1000 Growth Index.Analysts expect the value investing trend to continue this year as well. Sarah Ketterer, a chief executive of Causeway Capital Management, spoke to The Street about the investment outlook in 2023. She asserted that stable interest rates would bode well for value stocks. She also mentioned that while investing in value stocks, investors should also consider the return on capital like dividends and buybacks.Dividend stocks also reported strong performance in 2022 as investors preferred income-generating stocks. Companies in the S&amp;P 500 distributed over $561 billion in dividends last year, up from $511.2 billion in 2021, as reported by Wall Street Journal. Among these companies, The Coca-Cola Company (NYSE:KO), Johnson &amp; Johnson (NYSE:JNJ), and The Procter &amp; Gamble Company (NYSE:PG) remained popular among investors as these companies have shown solid dividend growth over the years.Story continues11 Undervalued Dividend Aristocrats To Buy NowPhoto by buian_photos on UnsplashOur Methodology:The stocks mentioned below have raised their dividends for 25 years or more. These companies have P/E ratios of less than 20. We also considered Wall Street analysts' ratings in examining these stocks along with hedge fund sentiment as of Q3 2022. The stocks are ranked in an ascending order of their P/E ratios as of January 12.11 Undervalued Dividend Aristocrats To Buy Now11. Nucor Corporation (NYSE:NUE)P/E Ratio as of January 12: 4.69Nucor Corporation (NYSE:NUE) is an American company that specializes in the production of steel. In the third quarter of 2022, the company reported revenue of $10.5 billion, which showed a 2% growth from the same period last year. Its cash and cash equivalents at the end of October amounted to over $3 billion, up from $2.3 billion ten months ago. As of January 12, Nucor Corporation (NYSE:NUE) has a price-to-earnings ratio of 4.69 and is among the undervalued dividend aristocrats to buy now.On December 14, Nucor Corporation (NYSE:NUE) declared a 2% hike in its quarterly dividend to $0.51 per share. This was the company's 50th consecutive year of dividend growth. The stock's dividend yield came in at 1.32% on January 12. In addition to popular dividend stocks like The Coca-Cola Company (NYSE:KO), Johnson &amp; Johnson (NYSE:JNJ), and The Procter &amp; Gamble Company (NYSE:PG), Nucor Corporation (NYSE:NUE) is also gaining traction among investors.In January, BofA reinstated its coverage on Nucor Corporation (NYSE:NUE) with a Buy rating and a $172 price target. The firm presented a positive outlook on the US steel sector.Nucor Corporation (NYSE:NUE) was a popular stock among hedge funds in the third quarter of 2022, as 41 funds tracked by Insider Monkey reported owning stakes in the company, compared with 32 in the previous quarter. The collective value of these stakes is roughly $403 million. With over 1.2 million shares, Citadel Investment Group was the company's leading stakeholder in Q3.10. Aflac Incorporated (NYSE:AFL)P/E Ratio as of January 12: 9.24Aflac Incorporated (NYSE:AFL) is a Georgia-based insurance company that provides related services to its consumers in the country. In November, Piper Sandler raised its price target on the stock to $80 with an Overweight rating on the shares, highlighting the company's capital optimization. The firm also appreciated the company's quarterly earnings.In the third quarter of 2022, Aflac Incorporated (NYSE:AFL) reported revenue of $4.8 billion, which beat estimates by $240 million. The company's total investments at the end of September amounted to over $114 billion. With a price-to-earnings ratio of 9.24, the company is among the undervalued dividend aristocrats among us.On November 8, Aflac Incorporated (NYSE:AFL) declared a quarterly dividend of $0.42 per share, increasing it by 5% from its previous dividend. The company has been raising its dividends consistently for the past 40 years. As of January 12, the stock has a dividend yield of 2.33%.As of the close of Q3 2022, 34 hedge funds in Insider Monkey's database reported owning stakes in Aflac Incorporated (NYSE:AFL), up from 32 in the previous quarter. These stakes are collectively valued at nearly $380 million.9. National Fuel Gas Company (NYSE:NFG)P/E Ratio as of January 12: 9.93National Fuel Gas Company (NYSE:NFG) is an American diversified energy company that specializes in the distribution of energy resources. The company has been doling out consistent dividend payments for the past 120 years and has raised its payouts for 52 years straight. It currently offers $0.475 per share in quarterly dividends and has a dividend yield of 3.07%, as of January 12.At the end of September, National Fuel Gas Company (NYSE:NFG) reported over $46 million in cash and investments, up from $31.5 million during the same period last year. The company's operating cash flow for the period came in at $812.5 million, compared with $791.5 million in the prior-year period. It is one of the undervalued dividend aristocrats on our list with a P/E ratio of 9.93.At the end of September 2022, 29 hedge funds in Insider Monkey's database reported owning stakes in National Fuel Gas Company (NYSE:NFG), up from 23 in the preceding quarter. The collective value of these stakes is roughly $219 million. Among these hedge funds, GAMCO Investors was the company's leading stakeholder in Q3.8. Chevron Corporation (NYSE:CVX)P/E Ratio as of January 12: 9.97Chevron Corporation (NYSE:CVX) is a California-based multinational energy company that has operations in over 180 countries. As of January 12, the company is trading at a P/E multiple of 9x and is among the undervalued aristocrats on our list.Chevron Corporation (NYSE:CVX) currently pays a quarterly dividend of $1.42 per share for a dividend yield of 3.19%. The company's dividend growth streak stands at 35 years. In the third quarter, its operating cash flow came in at $15.3 billion and its free cash amounted to $12.3 billion. During the quarter, it paid $2.7 billion in dividends to shareholders, which represented a 6% growth from the same period last year.The number of hedge funds tracked by Insider Monkey owning stakes in Chevron Corporation (NYSE:CVX) grew to 66 in Q3 2022, from 59 in the previous quarter. These stakes have a total value of over $27 billion. Berkshire Hathaway was the company’s leading stakeholder in Q3.Diamond Hill Capital mentioned Chevron Corporation (NYSE:CVX) in its Q1 2022 investor letter. Here is what the firm had to say:“Other top contributors in Q1 included multinational energy company Chevron Corp. (NYSE:CVX). The company benefited from increased energy demand as COVID-related economic restrictions eased in tandem with concerns regarding supply interruptions related to Russia’s invasion of Ukraine.”7. Expeditors International of Washington, Inc. (NASDAQ:EXPD)P/E Ratio as of January 12: 11.37Expeditors International of Washington, Inc. (NASDAQ:EXPD) is an American logistics company, based in Washington. The company currently pays a dividend of $0.67 per share twice a year and has a dividend yield of 1.23%, as of January 12. It maintains a 28-year streak of consistent dividend growth, falling into the category of dividend aristocrats.In the third quarter of 2022, Expeditors International of Washington, Inc. (NASDAQ:EXPD) reported a 1% year-over-year growth in its revenue at $4.36 billion. The company's operating cash flow for the quarter came in at $670.3 million, up from $177.3 million during the same period last year. It is among the undervalued dividend aristocrats with a price-to-earnings ratio of 11.37, as of January 12.In January, Cowen maintained a Market Perform rating on Expeditors International of Washington, Inc. (NASDAQ:EXPD).At the end of Q3 2022, 31 hedge funds tracked by Insider Monkey owned stakes in Expeditors International of Washington, Inc. (NASDAQ:EXPD), up from 28 in the previous quarter. The collective value of these stakes is over $260.8 million. With 2.6 million shares, First Eagle Investment Management was the company's leading stakeholder in Q3.6. Franklin Resources, Inc. (NYSE:BEN)P/E Ratio as of January 12: 11.65Franklin Resources, Inc. (NYSE:BEN) is a California-based multinational holding company that provides investment services to its consumers. In November, Deutsche Bank maintained a Hold rating on the stock, presenting a neutral stance on asset managers, brokers, and exchanges due to market fluctuations.In December, Franklin Resources, Inc. (NYSE:BEN) reported a 1.6% decline in its assets under management to $1.39 trillion due to a stock market sell-off. However, the company remained committed to shareholder return, paying over $773 million to stakeholders in dividends and share repurchases during FY21.On December 13, Franklin Resources, Inc. (NYSE:BEN) declared a 3.4% hike in its quarterly dividend to $0.30 per share. This marked the company's 43rd consecutive year of dividend growth. As of January 12, the stock has a dividend yield of 4.03%. It can be added to dividend portfolios alongside some of the best dividend stocks like The Coca-Cola Company (NYSE:KO), Johnson &amp; Johnson (NYSE:JNJ), and The Procter &amp; Gamble Company (NYSE:PG).At the end of September, 25 hedge funds in Insider Monkey’s database owned stakes in Franklin Resources, Inc. (NYSE:BEN), up from 24 in the previous quarter. These stakes have a collective value of nearly $126 million. Click to continue reading and see 5 Undervalued Dividend Aristocrats To Buy Now.  Suggested articles:12 Cheap Value Stocks To Buy According To Warren Buffett10 Most Overvalued Companies10 Undervalued Chip Stocks To BuyDisclosure. None. 11 Undervalued Dividend Aristocrats To Buy Now is originally published on Insider Monkey.]"
1,58036b2b-08b3-38c2-8fd6-dd96e61d2364,TMO,2023-01-15,Thermo Fisher Scientific's (NYSE:TMO) five-year earnings growth trails the splendid shareholder returns,Simply Wall St.,https://finance.yahoo.com/news/thermo-fisher-scientifics-nyse-tmo-120026043.html,1673784026,STORY,['TMO'],"[The worst result, after buying shares in a company (assuming no leverage), would be if you lose all the money you put in. But on the bright side, you can make far more than 100% on a really good stock. Long term Thermo Fisher Scientific Inc. (NYSE:TMO) shareholders would be well aware of this, since the stock is up 173% in five years. Also pleasing for shareholders was the 13% gain in the last three months. But this move may well have been assisted by the reasonably buoyant market (up 11% in 90 days).After a strong gain in the past week, it's worth seeing if longer term returns have been driven by improving fundamentals. View our latest analysis for Thermo Fisher Scientific To quote Buffett, 'Ships will sail around the world but the Flat Earth Society will flourish. There will continue to be wide discrepancies between price and value in the marketplace...' One way to examine how market sentiment has changed over time is to look at the interaction between a company's share price and its earnings per share (EPS).During five years of share price growth, Thermo Fisher Scientific achieved compound earnings per share (EPS) growth of 25% per year. So the EPS growth rate is rather close to the annualized share price gain of 22% per year. That suggests that the market sentiment around the company hasn't changed much over that time. Rather, the share price has approximately tracked EPS growth.The graphic below depicts how EPS has changed over time (unveil the exact values by clicking on the image).earnings-per-share-growthDive deeper into Thermo Fisher Scientific's key metrics by checking this interactive graph of Thermo Fisher Scientific's earnings, revenue and cash flow.What About Dividends?When looking at investment returns, it is important to consider the difference between total shareholder return (TSR) and share price return. The TSR incorporates the value of any spin-offs or discounted capital raisings, along with any dividends, based on the assumption that the dividends are reinvested. So for companies that pay a generous dividend, the TSR is often a lot higher than the share price return. We note that for Thermo Fisher Scientific the TSR over the last 5 years was 177%, which is better than the share price return mentioned above. This is largely a result of its dividend payments!Story continuesA Different PerspectiveAlthough it hurts that Thermo Fisher Scientific returned a loss of 1.6% in the last twelve months, the broader market was actually worse, returning a loss of 15%. Longer term investors wouldn't be so upset, since they would have made 23%, each year, over five years. In the best case scenario the last year is just a temporary blip on the journey to a brighter future. While it is well worth considering the different impacts that market conditions can have on the share price, there are other factors that are even more important. Take risks, for example - Thermo Fisher Scientific has   2 warning signs   we think you should be aware of.We will like Thermo Fisher Scientific better if we see some big insider buys. While we wait, check out this free list of growing companies with considerable, recent, insider buying.Please note, the market returns quoted in this article reflect the market weighted average returns of stocks that currently trade on US exchanges.Have feedback on this article? Concerned about the content? Get in touch with us directly. Alternatively, email editorial-team (at) simplywallst.com.This article by Simply Wall St is general in nature. We provide commentary based on historical data and analyst forecasts only using an unbiased methodology and our articles are not intended to be financial advice. It does not constitute a recommendation to buy or sell any stock, and does not take account of your objectives, or your financial situation. We aim to bring you long-term focused analysis driven by fundamental data. Note that our analysis may not factor in the latest price-sensitive company announcements or qualitative material. Simply Wall St has no position in any stocks mentioned.Join A Paid User Research SessionYou’ll receive a US$30 Amazon Gift card for 1 hour of your time while helping us build better investing tools for the individual investors like yourself. Sign up here]"
2,e412bb13-eade-3b09-8302-016874b45dbd,JWN,2023-01-15,Nordstrom’s Chief Merchant Sets Retirement,WWD,https://finance.yahoo.com/m/e412bb13-eade-3b09-8302-016874b45dbd/nordstrom%E2%80%99s-chief-merchant.html,1673755097,STORY,['JWN'],"[Nordstrom Inc. chief merchandising officer Teri Bariquit is retiring after 37 years at the company.The Seattle-based retailer has started a search for a successor and will be considering both internal and external candidates. Bariquit will remain in her role until the company identifies her successor.More from WWDNordstrom NYFW Dinner hosted by Shalom Harlow, Tonne Goodman and Rickie De SoleBrooklyn Museum Celebrates Virgil Abloh: Figures of Speech Opening6 Headlines that Captivated the Retail Industry in 2019Throughout her career at Nordstrom, Bariquit has held a variety of leadership roles across the merchandising organization, supporting inventory audit, merchandising technology, planning and more before becoming the company’s first-ever chief merchandising officer in 2019.“During her tenure, Bariquit has transformed the company’s approach to merchandising, leading the development of a digital-first, omnichannel strategy designed to meet the needs of Nordstrom customers, growing the company’s unowned inventory models and supporting significant growth within its designer business,” the company said statement on her departure.Nordstrom also indicated that while she lead the merchandising organization, The company made “critical investments in technology and organizational design within merchandising to fuel its long-term growth.”“We’re extremely grateful for the contributions Teri has made to our company over the past 37 years,” Pete Nordstrom, the retailer’s president and chief brand officer, said in a statement. “From her earliest days with the company, Teri has lived our values and led with courage and purpose. During her tenure, she’s transformed every element of our merchandising organization and positioned our merchandising team for continued success. The impact Teri has made on our company will last well into the future and I appreciate the thoughtful approach she has taken to planning her retirement. We wish her the best as she begins this next chapter.”Story continues“It has been a privilege to spend my career at Nordstrom and work alongside such a talented team – one with a relentless focus on providing customers with the most relevant and inspirational products from the world’s best brands,” Bariquit said. “I’m confident in the team and strategy that are in place and excited about what’s ahead for Nordstrom.”The company reported top- and bottom-line declines for the third quarter ended Oct. 29, though it managed to meet its expectations on both fronts.The Seattle-based retailer had a third-quarter net loss of $20 million, or $0.13 per diluted share, compared to a net profit of $64 million, or $0.40 per share in the year-ago period.Earnings before interest and taxes were $3 million in the third quarter of 2022, compared with $127 million during the year-ago period, primarily due to higher markdowns and a supply chain technology and related asset impairment charge, partially offset by fulfillment expense efficiencies.“We are right-sizing our inventory levels and mix, and are on track to end 2022 in a healthy and current position,” said Pete Nordstrom at the time. “Customers continue to respond to newness and fashion in our offering, and we are focused on remaining agile to respond to their changing needs.”The company has also been focused on improving the mix and pricing at Rack.]"
