,Id,Company,Date,Title,Publisher,Link,ProviderPublishTime,Type,Related Company,Text
132,25bdf4b9-c249-3548-82be-5d03ae5e8b13,NOC,2023-03-25,General Dynamics (GD) Wins Deal to Support Trident II Missile,Zacks,https://finance.yahoo.com/news/general-dynamics-gd-wins-deal-183606844.html,1679682966,STORY,"['GD', 'LMT', 'NOC', 'RTX']","[General Dynamics Corp.’s GD business unit, Mission Systems, recently secured a modification contract involving Trident II Missile system. The award has been offered by the Strategic Systems Programs, Washington, D.C.Details of the DealValued at $44 million, the contract is expected to be completed by Apr 30, 2025. Per the terms of the deal, General Dynamics will provide support to SSBN Fire Control System and SSGN Attack Weapon Control System for Trident II (D-5) missile.The contract will serve the United States and the United Kingdom. Majority of the work related to this deal will be executed in Pittsfield, MA.Significance of Trident IITrident II D5 is the latest generation of the U.S. Navy's submarine-launched fleet ballistic missiles, following the highly successful Polaris, Poseidon and Trident I C4 programs.Trident missiles are carried by 14 U.S. Navy Ohio-class submarines with American warheads and four Royal Navy Vanguard-class submarines with British warheads.Due to its remarkable features, which are well-suited for any military mission, the Trident missile is projected to enjoy a steady inflow of orders. This may benefit General Dynamics as it may continue to witness an inflow of orders involving SWS services for the missile. The latest contract win is a testament to the same. This will bolster GD’s revenues from the missile strategic weapon system business line.Growth ProspectsNations have increased their defense spending on military equipment and various arsenals to strengthen their defense capabilities. The surge in the demand for defense products is primarily due to rising geopolitical tensions and amplified terrorist threats. Hence, military missiles, an integral part of any defense system, have registered a steady growth in demand.Per the report from Mordor Intelligence, the missiles and missile defense system market is projected to witness a CAGR of 4.9% during the 2022-2027 period. Such abounding growth trends indicate ample development opportunities for General Dynamics as it enjoys a lucrative position in the missile market.Story continuesA few defense primes that can reap the benefits of the aforementioned market are Northrop Grumman NOC, Raytheon Technologies RTX and Lockheed Martin LMT.Northrop Grumman designs and produces missile products, including advanced high-speed propulsion systems, fuses, warheads and controls for air, sea and land-based systems.It boasts a long-term earnings growth of 2.2%. NOC shares have increased 36.4% in the past year.Raytheon’s Missiles &amp; Defense is a leading designer, developer, integrator, producer and sustainer of integrated air and missile defense systems. The unit serves as a prime contractor or major subcontractor on numerous missile and related programs with the U.S. Department of Defense.Raytheon’s long-term earnings growth is pegged at 10.4%. The Zacks Consensus Estimate for RTX’s 2022 earnings indicates a 9.1% increase from the prior-year reported figure.Lockheed Martin’s Missiles and Fire Control (“MFC”) is a recognized designer, developer and manufacturer of precision engagement aerospace and defense systems for the United States and allied militaries. MFC develops, manufactures and supports advanced combat, missile, rocket, manned and unmanned systems for military customers. These include the U.S. Army, Navy, Air Force, Marine Corps, NASA and dozens of foreign allies.LMT’s long-term earnings growth is pegged at 5.5%. Shares of the company have increased 6.7% in the past year.Price PerformanceShares of General Dynamics have rallied 8.6% in the past year against the industry’s 17.8% decline.Zacks Investment ResearchImage Source: Zacks Investment ResearchZacks RankGeneral Dynamics currently carries a Zacks Rank #4 (Sell).You can see the complete list of today’s Zacks #1 Rank (Strong Buy) stocks here.Want the latest recommendations from Zacks Investment Research? Today, you can download 7 Best Stocks for the Next 30 Days. Click to get this free reportLockheed Martin Corporation (LMT) : Free Stock Analysis ReportNorthrop Grumman Corporation (NOC) : Free Stock Analysis ReportGeneral Dynamics Corporation (GD) : Free Stock Analysis ReportRaytheon Technologies Corporation (RTX) : Free Stock Analysis ReportTo read this article on Zacks.com click here.Zacks Investment Research]"
133,60f66973-be52-3899-8ef3-d222e8a9693b,NOC,2023-03-25,Raytheon (RTX) Wins $320.3M Deal for StormBreaker Production,Zacks,https://finance.yahoo.com/news/raytheon-rtx-wins-320-3m-133501912.html,1679664901,STORY,"['RTX', 'NOC', 'LMT', 'GD']","[Raytheon Technologies Corp.’s RTX business unit, Missiles and Defense, recently clinched a contract for the production of the ninth lot of the StormBreaker Bomb. The Air Force Life Cycle Management Center, Eglin Air Force Base, FL, has awarded the deal.Valued at $320.3 million, this contract entails the supply of StormBreaker’s assembled weapons and containers. The work related to this deal will be carried out in Tucson, AZ, and is scheduled to be completed by Jun 30, 2027.What's Favoring Raytheon Technologies?The increasing geo-political tension has alarmed nations to upgrade and modernize their defense landscape to meet the evolving requirements of military missions. In this context, arms and ammunition, including military bombs that play a pivotal role in military missions, have witnessed a significant rise in demand.The U.S. fiscal 2024 defense budget proposal highlights $20.4 billion for investments in missile defeat and defense and $11 billion for a mix of highly-lethal precision weapons. This opportunistic defense spending entails probable orders for companies manufacturing military missiles and related weapons.In light of the aforementioned factors, one may say that Raytheon Technologies, which enjoys an established position in the missile defense system, may continue to capitalize on the growing demand and witness a strong inflow of orders, like the latest one. This shall boost RTX’s revenues from the Missiles and Defense business unit.Growth ProspectsPer the reports from Markets and Markets, the global missile defense system market is expected to witness a CAGR of 3.9% from 2021 to 2026. Considering the expanding size of the missile defense market and the fortifying defense spending worldwide, defense companies like Raytheon, which boast a comprehensive portfolio of missile defense products, stand to benefit from the increasing demand.In this regard, companies other than RTX that may witness the surging demand for missiles portfolio of products are as follows:Story continuesNorthrop Grumman NOC designs and produces missile products, including advanced high-speed propulsion systems, fuses, warheads, etc.Northrop Grumman has a long-term earnings growth rate of 3.5%. The Zacks Consensus Estimate for NOC’s 2023 sales suggests a growth rate of 4.6% from the prior-year reported figure.Lockheed Martin’s LMT Missiles and Fire Control business unit develops, manufactures and supports advanced combat, missile, rocket, manned and unmanned systems for military customers. Some of its product range includes the PAC-3 family of missiles, M270, RRPR, THHAD, etc.Lockheed Martin’s long-term earnings growth rate is pegged at 6.9%. Shares of LMT have returned 3.2% value to investors in the past year.General Dynamics’ GD Ordnance and Tactical Systems (“OTS”) designs, develops and produces a comprehensive array of sophisticated weapon systems for ground forces and produces next-generation weapon systems for shipboard and aircraft applications. OTS maintains a leading position in providing missile subsystems in support of U.S. tactical and strategic missiles.General Dynamics boasts a long-term earnings growth rate of 8.6%. The Zacks Consensus Estimate for GD’s 2023 earnings suggests a growth rate of 5.8% from the prior-year reported figure.Price MovementIn the past six months, shares of Raytheon Technologies have rallied 18.3% compared with the industry’s growth of 20.6%.Zacks Investment ResearchImage Source: Zacks Investment ResearchZacks RankRaytheon Technologies currently carries a Zacks Rank #3 (Hold). You can see the complete list of today’s Zacks #1 Rank (Strong Buy) stocks here.Want the latest recommendations from Zacks Investment Research? Today, you can download 7 Best Stocks for the Next 30 Days. Click to get this free reportLockheed Martin Corporation (LMT) : Free Stock Analysis ReportNorthrop Grumman Corporation (NOC) : Free Stock Analysis ReportGeneral Dynamics Corporation (GD) : Free Stock Analysis ReportRaytheon Technologies Corporation (RTX) : Free Stock Analysis ReportTo read this article on Zacks.com click here.Zacks Investment Research]"
134,38224e0d-d9ef-38cf-bf35-447d6568c91d,NOC,2023-03-25,Lockheed (LMT) Wins Deal to Offer Training for F-16 Jets,Zacks,https://finance.yahoo.com/news/lockheed-lmt-wins-deal-offer-131701810.html,1679663821,STORY,"['LMT', 'TXT', 'NOC']","[Lockheed Martin Corp.’s LMT business segment, Rotary and Mission Systems, recently clinched a contract to provide international training for F-16 jets. The award has been offered by the 338th Enterprise Sourcing Squadron, JBSA-Randolph, San Antonio, TX.Details of the DealValued at $25 million, the contract is projected to be completed by Mar 21, 2026. This contract will offer F-16 operational capability for countries that have purchased F-16 jets recently.For nations that had previously purchased and operated F-16 jets, this contract offers aircraft maintenance and pilot training to support ongoing sustainment training or in-country training to aid aircraft upgrade programs.This award involves Foreign Military Sales (FMS) to Bahrain.Importance of the F-16 JetsOver the past decade, a rapid rise in global terrorism and adverse geopolitical situations across borders have boosted the demand for defense products. Combat aircraft constitute a major portion of this portfolio. It is imperative to mention here that the F-16 Falcon jets have significantly risen in importance on a global scale over the past few years.Over the past couple of years, the F-16 witnessed significant development, with nations like Taiwan, Bulgaria, Morocco and Bahrain signing agreements to procure new F-16 aircraft. To reap the benefits of the rising demand for F-16, Lockheed Martin introduced F-16 Block 70/72 in 2020, the most advanced F-16 aircraft, combining numerous capabilities and structural upgrades. This model provides a new aircraft structure that lasts 50% longer than the previously produced F-16 aircraft. Such advancements might have been ushering in contracts from Pentagon and other U.S. allies, like the latest one, thereby boosting Lockheed Martin’s revenue prospects.Growth ProspectsWith rising security threats across the globe, emerging economies like the Asia Pacific, the Middle East and South America are spending a lot on enhancing their defense arsenals. Meanwhile, other nations like Europe and the United States have already been leading the defense market. With the United States being the largest weapons exporter worldwide, the nation has been spending significantly on defense products including combat aircraft.Story continuesLockheed, being a prominent combat aircraft manufacturer in the United States, enjoys a dominant position in the combat aircraft market.Per a Mordor Intelligence report, the global fighter aircraft market is expected to witness a CAGR of 3.95% during the 2023-2028 period, with North America constituting the largest share of this market. Such growth can be attributed to a rise in global threats and geopolitical instabilities, and increased spending on defense. These projections should benefit Lockheed, along with other U.S.-based combat jet manufacturers like Boeing BA, Northrop Grumman NOC and Textron TXT.Boeing’s Defense, Space &amp; Security segment engages in the research, development, production and modification of manned and unmanned military aircraft. This segment's primary products include military aircraft like F/A-18E/F Super Hornet, F-15, P-8, KC-46A Tanker and T-7A Red Hawk aircraft.BA stock has a long-term earnings growth of 4%. The Zacks Consensus Estimate for 2023 sales implies a 22.1% increase from the year-ago reported figure.Since its inception, Northrop Grumman has been a pioneer in the development of manned combat aircraft. The company also has a tradition of providing technological leadership in all aspects of military aviation and aircraft, such as manned, unmanned, targeting, surveillance and aircraft self-protection systems. This is to help warfighters in accomplishing missions anytime, anywhere and under any conditions.NOC stock boasts a long-term earnings growth of 3.5%. The Zacks Consensus Estimate for 2023 sales indicates a 4.6% increase from the year-ago reported figure.Textron’s business unit, Textron Aviation Defense designs, builds and supports versatile and globally known military aircraft, preferred for training and attack missions. Some of Textron’s renowned products include the Beechcraft T-6C trainer and AT-6 Wolverine.TXT stock boasts a long-term earnings growth of 11.2%. The Zacks Consensus Estimate for 2023 earnings indicates an 8.1% increase from the year-ago reported figure.Price Movement and Zacks RankShares of Lockheed Martin have gained 4.1% in the past year against the industry's 17.8% decline.Zacks Investment ResearchImage Source: Zacks Investment ResearchThe company currently carries a Zacks Rank #3 (Hold). You can see the complete list of today’s Zacks #1 Rank (Strong Buy) stocks here.Want the latest recommendations from Zacks Investment Research? Today, you can download 7 Best Stocks for the Next 30 Days. Click to get this free reportThe Boeing Company (BA) : Free Stock Analysis ReportLockheed Martin Corporation (LMT) : Free Stock Analysis ReportNorthrop Grumman Corporation (NOC) : Free Stock Analysis ReportTextron Inc. (TXT) : Free Stock Analysis ReportTo read this article on Zacks.com click here.Zacks Investment Research]"
135,37ef0ea5-7366-3296-b80a-5146283086ca,NKE,2023-03-25,Stock Market Sell-Off: Is Nike a Buy?,Motley Fool,https://finance.yahoo.com/m/37ef0ea5-7366-3296-b80a-5146283086ca/stock-market-sell-off%3A-is.html,1679691600,STORY,"['NKE', '^GSPC']","[The stock market has been very volatile lately; stocks are soaring one day and plummeting the next. Sporting apparel company Nike (NYSE: NKE) has held its own; shares are down just 10% over the past year. Nike may be a proven winner, but that doesn't make it a buy today.Continue reading]"
136,43f40cc0-4be8-325e-9824-6b587eb150c1,NKE,2023-03-25,"Stock Market Split As Fed Hikes Rates, Banks Keep Tumbling; Nvidia, On Holding In Focus: Weekly Review",Investor's Business Daily,https://finance.yahoo.com/m/43f40cc0-4be8-325e-9824-6b587eb150c1/stock-market-split-as-fed.html,1679673567,STORY,"['NVDA', 'NKE']","[The stock market showed volatile, divergent action as a handful of megacaps propped up the Nasdaq while banks kept tumbling.Continue reading]"
