,Id,Company,Date,Title,Publisher,Link,ProviderPublishTime,Type,Related Company,Text
49,64bd26bf-b584-3f6f-a371-1bd4c276affe,LUV,2023-01-03,Southwest’s Meltdown Should Be a Technology Warning for Airlines,Skift,https://finance.yahoo.com/news/southwest-meltdown-technology-warning-airlines-073000656.html,1672731000,STORY,['LUV'],"[Southwest Airlines canceled more than 15,000 flights during the week of Christmas. Synthex / AbodeSouthwest Airlines capped off its 2022 with the unenviable distinction of cancelling more than 15,000 flights in total during the week of Christmas, the result of a system failure caused by several issues that were exacerbated by a nationwide winter storm.It was an unmitigated disaster for the Dallas-based airline, with the story leading news sites and network TV news broadcasts day after day, a public relations disaster that showcased its deficiencies in keeping its technology up to date.As the debacle was being scrutinized heavily in the media each step of the way, the airline’s CEO, Bob Jordan, made several statements and appearances in an attempt to get ahead of the unfolding crisis and improve public perception.Southwest Incoming CEO Bob JordanMeanwhile, the issues that other airlines faced during the storm were quickly remedied, no system shutdown needed.The primary reason for the major issue at Southwest was its outdated optimization technology, which the airline has outgrown over the past couple of decades. Company executives have admitted to prioritizing other things over investing in technology for operations, despite warnings from staff and some close calls previously. Paired with a staff shortage, the issue became too much for Southwest’s system to handle.“This one clearly pushed it over the cliff,” said Robert Mann, airline industry veteran and president of aviation consultancy R.W. Mann &amp; Co. “While they’re working this problem out, they’ve got to be absolutely certain that this never happens again.”But whether this can happen again is a legitimate question for the entire airline industry.Being behind technologically is a common criticism experts make of the aviation industry. Will it result in other meltdowns similar to Southwest’s?The airline’s disaster over the holidays should serve as a reminder for other carriers to take stock of their operations to ensure nothing like this happens again, and when it comes to looking where to cut costs, leave the technology alone.Story continuesNow the question is what Southwest will do next.What went wrong with the technology?There is always a backlog of updates that need to happen in the airline industry, but they get pushed aside in a system where safety and regulatory issues are paramountIt appears that was the case for Southwest — to the extreme.Unions said they had been warning Southwest of tech inadequacies for years and that the problem could have been avoided if the company would have invested in its own operations. Southwest had invested in some new technology, mostly customer-facing applications like self-service capabilities, as outlined in a public filing in early 2022. The filing also said the company had deferred a “significant number of technology projects” during the pandemic, though it did finish the “long-awaited milestone” of establishing a single system for all aircraft maintenance and record-keeping.Jordan told employees in a memo obtained by CNN that the airline has a lack of tools, and there has been talk internally about the need to modernize further.The main piece of failing tech was the airline optimization software called SkySolver, which is supposed to assign crew to flights using a complicated mathematical system. Southwest has grown beyond the capabilities of that old technology, which it began using when it was much smaller.On top of that, the airline flight crew has no front-end technology to input its whereabouts into that system, meaning the crew has to call a crew scheduler on the phone to share that information.The shortcomings of that system and its inability to catch up with the problem snowballed into the mass cancellation, which was needed to allow the system to reset.“As good as these companies are, as good as their brand halos seem to be, they all have warts that maybe people don’t see every day, but boy, they become pretty clear when you have a problem that involves them,” Mann said.How did an employee shortage contribute to the problem?Hand-in-hand with the tech issues, Southwest had a lack of workers that led to the CEO declaring a company state of operational emergency in Denver.The airline has been relying on employee overtime to staff operations. The union representing ground workers at Southwest said many of the employees had worked up to 18-hour days during the holiday season, and some experienced frostbite.The company sent a memo to its Denver ramp agents on Dec. 21 threatening their jobs if they did not comply with the operational emergency rules.“Looking particularly at that memo to the Denver staff, I think that’s illustrative of a serious cultural failure,” Mann said.During a time when the entire industry is facing a worker shortage, he believes that approach was counteractive.“This should have been done the way many other carriers did it, particularly after last summer. A lot of them decided to use a carrot, not a stick. They would be able to offer incentives for peak demand,” Mann said. “They don’t actually pay very much on those incentives, but at the end of the day, they get people to volunteer for work on their vacation days. The result is you take the stress level right out of the airline, and you get better results.What solutions will Southwest make?An immediate solution to keep a backlog from occurring would be to put a front end on the optimization system so employees don’t have to use the phone to update their whereabouts. Long term, the company would need to either build or contract an optimization system that it can grow into over its next phase of development, not one that it will outgrow again.It would likely take months to implement a new system.Southwest said in an emailed statement on New Year’s Eve:“It’s too soon to share a look ahead (beyond what’s been posted to SWAMedia.com) as we focus on our Operation over the holiday weekend. That work and analysis is a priority, and will be done in the coming weeks and months ahead.”Southwest posted some comments on Dec. 31 that it said were made by Jordan to employees, including, “We’ll move forward with lessons learned here, as we always do. We have plans to invest in tools and technology and processes, but there will be immediate work to understand what happened.”The airline will also need a plan to have more staff on hand.In response to a question about employee attraction and retention, the airline stated, “We’re proud to be an employer of choice and hired more than 17,000 new employees in 2022 with more hiring planned in 2023.”What’s at stake if Southwest gets this wrong again, or another airline stumbles?The federal government including the department of transportation has already said it is investigating the issue.Financially, Southwest is a stable company. It had said in December that it was going to start paying dividends to investors again, the first to do so post-pandemic.So, a financial failure likely isn’t the immediate concern, but it could be if business goes bad. The public typically has a short memory, even in situations like this, so Southwest has that going for it.“The brand damage has been done here in a big way. And so developing the trust of your employees, developing the trust of your customers, is going to be important, and you cannot afford another lost ship kind of moment with either of them.”Get breaking travel news and exclusive hotel, airline, and tourism research and insights at Skift.com.]"
50,cb380534-eb1d-35c5-bff3-8287143c848d,LUV,2023-01-03,Denver airport cancels or delays hundreds of flights: reports,Fox Business,https://finance.yahoo.com/news/denver-airport-cancels-delays-hundreds-011711911.html,1672708631,STORY,['LUV'],[]
51,5bc2948f-1226-3ad0-97b3-4e4a2d392fb0,LUV,2023-01-03,Southwest Meltdown Shows Airlines Need Tighter Software Integration,The Wall Street Journal,https://finance.yahoo.com/m/5bc2948f-1226-3ad0-97b3-4e4a2d392fb0/southwest-meltdown-shows.html,1672687980,STORY,['LUV'],[]
52,549ff002-4a0a-38ac-91bb-eae7213a544b,LUV,2023-01-03,Want Better Returns? Don't Ignore These 2 Transportation Stocks Set to Beat Earnings,Zacks,https://finance.yahoo.com/news/want-better-returns-dont-ignore-140002060.html,1672668002,STORY,['LUV'],"[Wall Street watches a company's quarterly report closely to understand as much as possible about its recent performance and what to expect going forward. Of course, one figure often stands out among the rest: earnings.Life and the stock market are both about expectations, and rising above what is expected is often rewarded, while falling short can come with negative consequences. Investors might want to try to capture stronger returns by finding positive earnings surprises.2 Stocks to Add to Your WatchlistThe Zacks Earnings ESP is more formally known as the Expected Surprise Prediction, and it aims to grab the inside track on the latest analyst estimate revisions ahead of a company's report. The idea is relatively intuitive as a newer projection might be based on more complete information. The ESP is calculated by comparing the Most Accurate Estimate to the Zacks Consensus Estimate, with the percentage difference between the two giving us the Zacks ESP figure.Now that we understand what the ESP is and how beneficial it can be, let's dive into a stock that currently fits the bill. Norfolk Southern (NSC) earns a Zacks Rank #3 right now and its Most Accurate Estimate sits at $3.45 a share, just 23 days from its upcoming earnings release on January 25, 2023.Norfolk Southern's Earnings ESP sits at 1.42%, which, as explained above, is calculated by taking the percentage difference between the $3.45 Most Accurate Estimate and the Zacks Consensus Estimate of $3.41.NSC is just one of a large group of Transportation stocks with a positive ESP figure. Southwest Airlines (LUV) is another qualifying stock you may want to consider.Southwest Airlines, which is readying to report earnings on January 26, 2023, sits at a Zacks Rank #3 (Hold) right now. It's Most Accurate Estimate is currently $0.86 a share, and LUV is 24 days out from its next earnings report.The Zacks Consensus Estimate for Southwest Airlines is $0.82, and when you take the percentage difference between that number and its Most Accurate Estimate, you get the Earnings ESP figure of 5.02%.Story continuesNSC and LUV's positive ESP metrics may signal that a positive earnings surprise for both stocks is on the horizon.Find Stocks to Buy or Sell Before They're ReportedUse the Zacks Earnings ESP Filter to turn up stocks with the highest probability of positively, or negatively, surprising to buy or sell before they're reported for profitable earnings season trading. Check it out here &gt;&gt;Want the latest recommendations from Zacks Investment Research? Today, you can download 7 Best Stocks for the Next 30 Days. Click to get this free reportNorfolk Southern Corporation (NSC) : Free Stock Analysis ReportSouthwest Airlines Co. (LUV) : Free Stock Analysis ReportTo read this article on Zacks.com click here.Zacks Investment Research]"
53,dba68276-f690-3dab-8682-65d55f6122d7,PM,2023-01-03,What Philip Morris International Inc.'s (NYSE:PM) P/E Is Not Telling You,Simply Wall St.,https://finance.yahoo.com/news/philip-morris-international-inc-nyse-130018461.html,1672750818,STORY,['PM'],"[Philip Morris International Inc.'s  (NYSE:PM) price-to-earnings (or ""P/E"") ratio of 18x might make it look like a sell right now compared to the market in the United States, where around half of the companies have P/E ratios below 14x and even P/E's below 8x are quite common. Although, it's not wise to just take the P/E at face value as there may be an explanation why it's lofty.Philip Morris International hasn't been tracking well recently as its declining earnings compare poorly to other companies, which have seen some growth on average. It might be that many expect the dour earnings performance to recover substantially, which has kept the P/E from collapsing. If not, then existing shareholders may be extremely nervous about the viability of the share price. View our latest analysis for Philip Morris International peIf you'd like to see what analysts are forecasting going forward, you should check out our free report on Philip Morris International.How Is Philip Morris International's Growth Trending?The only time you'd be truly comfortable seeing a P/E as high as Philip Morris International's is when the company's growth is on track to outshine the market.Taking a look back first, the company's earnings per share growth last year wasn't something to get excited about as it posted a disappointing decline of 2.4%. That put a dampener on the good run it was having over the longer-term as its three-year EPS growth is still a noteworthy 17% in total. So we can start by confirming that the company has generally done a good job of growing earnings over that time, even though it had some hiccups along the way.Turning to the outlook, the next three years should generate growth of 2.5% per year as estimated by the analysts watching the company. With the market predicted to deliver 9.2% growth per year, the company is positioned for a weaker earnings result.With this information, we find it concerning that Philip Morris International is trading at a P/E higher than the market. It seems most investors are hoping for a turnaround in the company's business prospects, but the analyst cohort is not so confident this will happen. There's a good chance these shareholders are setting themselves up for future disappointment if the P/E falls to levels more in line with the growth outlook.Story continuesThe Bottom Line On Philip Morris International's P/EWhile the price-to-earnings ratio shouldn't be the defining factor in whether you buy a stock or not, it's quite a capable barometer of earnings expectations.Our examination of Philip Morris International's analyst forecasts revealed that its inferior earnings outlook isn't impacting its high P/E anywhere near as much as we would have predicted. When we see a weak earnings outlook with slower than market growth, we suspect the share price is at risk of declining, sending the high P/E lower. Unless these conditions improve markedly, it's very challenging to accept these prices as being reasonable.There are also other vital risk factors to consider before investing and we've discovered 1 warning sign for Philip Morris International that you should be aware of.You might be able to find a better investment than Philip Morris International. If you want a selection of possible candidates, check out this free list of interesting companies that trade on a P/E below 20x (but have proven they can grow earnings).Have feedback on this article? Concerned about the content? Get in touch with us directly. Alternatively, email editorial-team (at) simplywallst.com.This article by Simply Wall St is general in nature. We provide commentary based on historical data and analyst forecasts only using an unbiased methodology and our articles are not intended to be financial advice. It does not constitute a recommendation to buy or sell any stock, and does not take account of your objectives, or your financial situation. We aim to bring you long-term focused analysis driven by fundamental data. Note that our analysis may not factor in the latest price-sensitive company announcements or qualitative material. Simply Wall St has no position in any stocks mentioned.Join A Paid User Research SessionYou’ll receive a US$30 Amazon Gift card for 1 hour of your time while helping us build better investing tools for the individual investors like yourself. Sign up here]"
54,02c96d90-eb74-3847-be70-07be0c635af5,ROP,2023-01-03,Save the Date: Roper Technologies Investor Day,GlobeNewswire,https://finance.yahoo.com/news/save-date-roper-technologies-investor-133000058.html,1672752600,STORY,['ROP'],"[Roper Technologies, Inc.SARASOTA, Fla., Jan. 03, 2023 (GLOBE NEWSWIRE) -- Roper Technologies, Inc. (NYSE: ROP) today announced that it will host an investor day on March 21, 2023 in New York. The event is scheduled to begin at 8:30 AM ET and conclude at 1:30 PM ET. Live and on-demand webcasts of the event will be available for those unable to attend in person. Additional details, including registration instructions, will be provided closer to the event.About Roper TechnologiesRoper Technologies is a constituent of the S&amp;P 500 and Fortune 500. Roper has a proven, long-term track record of compounding cash flow and shareholder value. The Company operates market leading businesses that design and develop vertical software and technology enabled products for a variety of defensible niche markets. Roper utilizes a disciplined, analytical, and process-driven approach to redeploy its excess free cash flow toward high-quality acquisitions. Additional information about Roper is available on the Company’s website at www.ropertech.com.Contact Information: Investor Relations941-556-2601 investor-relations@ropertech.com]"
55,105a6330-580a-35dc-b39b-09dce645d78c,GS,2023-01-03,Should Goldman Sachs ActiveBeta U.S. Small Cap Equity ETF (GSSC) Be on Your Investing Radar?,Zacks,https://finance.yahoo.com/news/goldman-sachs-activebeta-u-small-112011966.html,1672744811,STORY,"['GS', 'SM', 'GSBD']","[Launched on 06/28/2017, the Goldman Sachs ActiveBeta U.S. Small Cap Equity ETF (GSSC) is a passively managed exchange traded fund designed to provide a broad exposure to the Small Cap Blend segment of the US equity market.The fund is sponsored by Goldman Sachs Funds. It has amassed assets over $436.64 million, making it one of the average sized ETFs attempting to match the Small Cap Blend segment of the US equity market.Why Small Cap BlendWith more potential comes more risk, and small cap companies, with market capitalization below $2 billion, epitomizes this way of thinking.Blend ETFs usually hold a mix of growth and value stocks as well as stocks that exhibit both value and growth characteristics.CostsCost is an important factor in selecting the right ETF, and cheaper funds can significantly outperform their more expensive counterparts if all other fundamentals are the same.Annual operating expenses for this ETF are 0.20%, putting it on par with most peer products in the space.It has a 12-month trailing dividend yield of 1.31%.Sector Exposure and Top HoldingsEven though ETFs offer diversified exposure that minimizes single stock risk, investors should also look at the actual holdings inside the fund. Luckily, most ETFs are very transparent products that disclose their holdings on a daily basis.This ETF has heaviest allocation to the Financials sector--about 19.90% of the portfolio. Industrials and Information Technology round out the top three.Looking at individual holdings, Sep 22 Cme Eminirus2k (RTYU2) accounts for about 2.19% of total assets, followed by Usd U.s. Dollar and Sm Energy Co (SM).The top 10 holdings account for about 5.52% of total assets under management.Performance and RiskGSSC seeks to match the performance of the Goldman Sachs ActiveBeta U.S. Small Cap Equity Index before fees and expenses. The Goldman Sachs ActiveBeta U.S. Small Cap Equity Index is designed to deliver exposure to equity securities of small capitalization U.S. issuers.Story continuesThe ETF has added about 0% so far this year and is down about -16.81% in the last one year (as of 01/03/2023). In the past 52-week period, it has traded between $50.18 and $67.49.The ETF has a beta of 0.97 and standard deviation of 30.37% for the trailing three-year period. With about 1278 holdings, it effectively diversifies company-specific risk.AlternativesGoldman Sachs ActiveBeta U.S. Small Cap Equity ETF carries a Zacks ETF Rank of 3 (Hold), which is based on expected asset class return, expense ratio, and momentum, among other factors. Thus, GSSC is a reasonable option for those seeking exposure to the Style Box - Small Cap Blend area of the market. Investors might also want to consider some other ETF options in the space.The iShares Russell 2000 ETF (IWM) and the iShares Core S&amp;P SmallCap ETF (IJR) track a similar index. While iShares Russell 2000 ETF has $52.28 billion in assets, iShares Core S&amp;P SmallCap ETF has $64.88 billion. IWM has an expense ratio of 0.19% and IJR charges 0.06%.Bottom-LineAn increasingly popular option among retail and institutional investors, passively managed ETFs offer low costs, transparency, flexibility, and tax efficiency; they are also excellent vehicles for long term investors.To learn more about this product and other ETFs, screen for products that match your investment objectives and read articles on latest developments in the ETF investing universe, please visit Zacks ETF Center.Want the latest recommendations from Zacks Investment Research? Today, you can download 7 Best Stocks for the Next 30 Days. Click to get this free reportGoldman Sachs ActiveBeta U.S. Small Cap Equity ETF (GSSC): ETF Research ReportsSM Energy Company (SM) : Free Stock Analysis ReportiShares Russell 2000 ETF (IWM): ETF Research ReportsiShares Core S&amp;P SmallCap ETF (IJR): ETF Research ReportsTo read this article on Zacks.com click here.Zacks Investment Research]"
56,a0f8610a-ebfb-30f4-b361-b0883a7e0c31,GS,2023-01-03,More Bosses Order Workers Back to the Office as Job Market Shifts,The Wall Street Journal,https://finance.yahoo.com/m/a0f8610a-ebfb-30f4-b361-b0883a7e0c31/more-bosses-order-workers.html,1672741800,STORY,"['GS', 'PAYC']","[Vanguard Group, Paycom Software and others push staffers to return on required days, but some employees are pushing back.Continue reading]"
