,Id,Company,Date,Title,Publisher,Link,ProviderPublishTime,Type,Related Company,Text
18,aa5e9d25-fb49-32d2-ad55-d886ba0e0336,MSFT,2023-09-10,Beleaguered Google faces day in court as Biden cracks down on monopolies,The Telegraph,https://finance.yahoo.com/m/aa5e9d25-fb49-32d2-ad55-d886ba0e0336/beleaguered-google-faces-day.html,1694344301,STORY,"['GOOGL', 'MSFT', 'AAPL']","[google legalThe moment that Bill Gates turned from boy wonder geek to ruthless capitalist symbol is easy to pinpoint: it was captured on camera.The Microsoft co-founder and chief executive, who had become the world’s richest man in 1995, had been the face of a bright new digital era in which millions of households were able to buy their first computer.But his videotaped deposition, released as part of the US government’s landmark monopoly case against Microsoft in 1998, presented him as evasive, rude and superior.It took years for Gates, who had believed the tape would never be shown to the public, to rebuild his reputation.It took Microsoft even longer. While the company avoided being broken up in the legal battle, which centred around its dominance of the PC market, the years of litigation have been cited as a key reason why the company missed out on a new generation of technology such as internet search, social media and smartphones.This week, starting on Tuesday, a courtroom in Washington DC will host the biggest tech monopoly case since the US government came close to breaking up Microsoft a quarter of a century ago. Its subject is Google, one of the companies that took the innovation crown from Gates’ business.Bill Gates' reputation took a hit in the late 1990s after a recording of his deposition in a monopoly court case were made public - JESSICA PERSSON/AFP via Getty ImagesWhy is Google on trial?Google is being sued by the US Justice Department under the same 19th century law used to go after Microsoft, and is accused of using similar tactics. In this case, prosecutors allege that the company used a web of illegal deals to freeze out competitors to its search engine, cementing its own vice-like grip over the web.The agency is seeking an order forcing Google to stop its behaviour, but a judge could go as far as a breakup of the company.Like Microsoft at the turn of the millennium, Google is also reckoning with a changing tide in the tech industry. For the first time in decades, its search engine is under threat, not from a traditional competitor, but from artificial intelligence chatbots such as ChatGPT that could replace the cascade of links that Google’s search engine offers with concise and precise answers.Story continuesThe US case against Google is the culmination of more than a decade of growing regulatory pressure against the company, which last week celebrated its 25th birthday.The European Union has repeatedly fined Google billions of euros and ordered it to make changes to its constellation of services, from price comparison to its Android phone software and internet advertising business.The UK’s competition regulator has launched multiple investigations into the company, and forced it to make changes to its web browser.The US case was first launched almost three years ago under the Trump administration but has been taken forward by Biden’s Justice Department. The case gets to the gravitational centre of the company’s power: its all-conquering search engine.How did Google break antitrust laws?The Justice Department argues that Google’s dominance – accounting for nine in 10 search queries in the US – is not the result of having the best search engine, but the consequence of a series of exclusivity agreements signed with phone manufacturers and software makers that made it the primary search engine for almost all consumers and froze out potential rivals.“It’s not about the tech anymore, it’s about the moat they put around themselves,” says Colin Hayhurst, who runs the British search engine Mojeek. “It’s the fact they have these agreements with the other big players.”In particular, the Justice Department’s case zeroes in on a deal with Apple to be the iPhone browser’s default search engine, a contract believed to be worth up to $15bn (£12bn) a year.According to the complaint, one Apple employee told their Google counterpart: “Our vision is that we work as if we are one company.”The regulatory focus on Google's search prevalence on iPhones has drawn in deputies of Apple boss Tim Cook - Justin Sullivan/Getty ImagesApple has produced more than on million pages of evidence to prosecutors. Three executives, all of whom report directly to chief executive Tim Cook, are scheduled to appear in the witness box after the iPhone maker lost an attempt to block legal demands that they testify. (Apple says it makes Google the main search engine on its phones because it considers it to be the best on the market, not because of the billions that flow the other way as a result.)Google’s top lawyer, Kent Walker, has called the case “deeply flawed” and says people use its search engine “because they choose to, not because they’re forced to, or because they can’t find alternatives”.The trial is scheduled to take just over two months, with a string of high-powered decision makers, including Google’s chief executive Sundar Pichai, expected to give evidence.The American government’s chances of success are unclear. The courts have been dealt a series of setbacks to efforts to rein in Big Tech. Regulators’ attempts to block deals such as Microsoft’s purchase of games company Activision Blizzard and Meta’s purchase of virtual reality company Within have been overruled.Last week, a group of US states that had sued Google for breaking monopoly laws with its app store, settled with the company. The terms of the deal were kept private.Google chief Sundar Pichai is expected to give evidence when the US Justice Department's case goes to court - Kyle Grillot/BloombergMaurice Stucke, a former Justice Department prosecutor and law professor at the University of Tennessee, says the outcome of the case is hard to call.“The problem today is that the courts are a moving target and it’s very hard to predict how they will rule,” he says. “There haven’t been many monopolisation cases brought by the agency, the last really was the Microsoft one.”What happens if Google loses the antitrust trial?Even if the Justice Department’s case ultimately fails, it may not matter. The barrage of evidence and testimony will be its own form of punishment. Gary Reback, one of the government lawyers who took on Microsoft in the Nineties, is fond of saying “the trial is the remedy”, meaning the public scrutiny itself is punishment enough.Google’s lawyers have attempted to prevent the case from being broadcast over Zoom, which opponents say is an attempt to suppress the amount of attention it receives.Meanwhile, the distraction of a major court case is also likely to have an impact on day-to-day operations.Former Microsoft executives say its own battle with the US government meant the company became bureaucratic and slow, with every product update having to go through layers of legal reviews before it would be released to the public.Google’s case comes as its search engine faces a growing threat from AI. The company has declared an internal “code red” over the rise of ChatGPT. Engineers have warned that the company has “no moat” against the rise of free, open source models, and many of its AI experts have quit, citing a stuffy culture that impedes innovation.Even if Google wins its battle with the US government, the encounter may do lasting damage.Shivaun Raff, the co-founder of the price comparison service Foundem, who has campaigned against Google in Europe for over a decade, says of the US court battle: “This is the first step. I believe that there’s several arrows in their quiver, but it’s only just getting started.”Broaden your horizons with award-winning British journalism. Try The Telegraph free for 1 month, then enjoy 1 year for just $9 with our US-exclusive offer.]"
19,e6d646e5-cbd7-3a24-9599-e38b4d679cd9,MSFT,2023-09-10,Artificial intelligence technology behind ChatGPT was built in Iowa — with a lot of water,AP Finance,https://finance.yahoo.com/news/artificial-intelligence-technology-behind-chatgpt-131421138.html,1694265261,STORY,"['MSFT', 'GOOGL']","[DES MOINES, Iowa (AP) — The cost of building an artificial intelligence product like ChatGPT can be hard to measure.But one thing Microsoft-backed OpenAI needed for its technology was plenty of water, pulled from the watershed of the Raccoon and Des Moines rivers in central Iowa to cool a powerful supercomputer as it helped teach its AI systems how to mimic human writing.As they race to capitalize on a craze for generative AI, leading tech developers including Microsoft, OpenAI and Google have acknowledged that growing demand for their AI tools carries hefty costs, from expensive semiconductors to an increase in water consumption.But they’re often secretive about the specifics. Few people in Iowa knew about its status as a birthplace of OpenAI's most advanced large language model, GPT-4, before a top Microsoft executive said in a speech it “was literally made next to cornfields west of Des Moines.”Building a large language model requires analyzing patterns across a huge trove of human-written text. All of that computing takes a lot of electricity and generates a lot of heat. To keep it cool on hot days, data centers need to pump in water — often to a cooling tower outside its warehouse-sized buildings.In its latest environmental report, Microsoft disclosed that its global water consumption spiked 34% from 2021 to 2022 (to nearly 1.7 billion gallons, or more than 2,500 Olympic-sized swimming pools), a sharp increase compared to previous years that outside researchers tie to its AI research.“It’s fair to say the majority of the growth is due to AI,” including “its heavy investment in generative AI and partnership with OpenAI,” said Shaolei Ren, a researcher at the University of California, Riverside who has been trying to calculate the environmental impact of generative AI products such as ChatGPT.In a paper due to be published later this year, Ren’s team estimates ChatGPT gulps up 500 milliliters of water (close to what’s in a 16-ounce water bottle) every time you ask it a series of between 5 to 50 prompts or questions. The range varies depending on where its servers are located and the season. The estimate includes indirect water usage that the companies don’t measure — such as to cool power plants that supply the data centers with electricity.Story continues“Most people are not aware of the resource usage underlying ChatGPT,” Ren said. “If you’re not aware of the resource usage, then there’s no way that we can help conserve the resources.”Google reported a 20% growth in water use in the same period, which Ren also largely attributes to its AI work. Google’s spike wasn’t uniform -- it was steady in Oregon where its water use has attracted public attention, while doubling outside Las Vegas. It was also thirsty in Iowa, drawing more potable water to its Council Bluffs data centers than anywhere else.In response to questions from The Associated Press, Microsoft said in a statement this week that it is investing in research to measure AI's energy and carbon footprint ""while working on ways to make large systems more efficient, in both training and application.”“We will continue to monitor our emissions, accelerate progress while increasing our use of clean energy to power data centers, purchasing renewable energy, and other efforts to meet our sustainability goals of being carbon negative, water positive and zero waste by 2030,” the company's statement said.OpenAI echoed those comments in its own statement Friday, saying it's giving “considerable thought"" to the best use of computing power.“We recognize training large models can be energy and water-intensive"" and work to improve efficiencies, it said.Microsoft made its first $1 billion investment in San Francisco-based OpenAI in 2019, more than two years before the startup introduced ChatGPT and sparked worldwide fascination with AI advancements. As part of the deal, the software giant would supply computing power needed to train the AI models.To do at least some of that work, the two companies looked to West Des Moines, Iowa, a city of 68,000 people where Microsoft has been amassing data centers to power its cloud computing services for more than a decade. Its fourth and fifth data centers are due to open there later this year.“They’re building them as fast as they can,” said Steve Gaer, who was the city's mayor when Microsoft came to town. Gaer said the company was attracted to the city's commitment to building public infrastructure and contributed a “staggering” sum of money through tax payments that support that investment.“But, you know, they were pretty secretive on what they’re doing out there,” he added.Microsoft first said it was developing one of the world's most powerful supercomputers for OpenAI in 2020, declining to reveal its location to AP at the time but describing it as a “single system” with more than 285,000 cores of conventional semiconductors, and 10,000 graphics processors — a kind of chip that's become crucial to AI workloads.Experts have said it can make sense to ""pretrain"" an AI model at a single location because of the large amounts of data that need to be transferred between computing cores.It wasn't until late May that Microsoft's president, Brad Smith, disclosed that it had built its “advanced AI supercomputing data center” in Iowa, exclusively to enable OpenAI to train what has become its fourth-generation model, GPT-4. The model now powers premium versions of ChatGPT and some of Microsoft's own products and has accelerated a debate about containing AI's societal risks.“It was made by these extraordinary engineers in California, but it was really made in Iowa,” Smith said.In some ways, West Des Moines is a relatively efficient place to train a powerful AI system, especially compared to Microsoft's data centers in Arizona that consume far more water for the same computing demand.“So if you are developing AI models within Microsoft, then you should schedule your training in Iowa instead of in Arizona,"" Ren said. ""In terms of training, there’s no difference. In terms of water consumption or energy consumption, there’s a big difference.”For much of the year, Iowa's weather is cool enough for Microsoft to use outside air to keep the supercomputer running properly and vent heat out of the building. Only when the temperature exceeds 29.3 degrees Celsius (about 85 degrees Fahrenheit) does it withdraw water, the company has said in a public disclosure.That can still be a lot of water, especially in the summer. In July 2022, the month before OpenAI says it completed its training of GPT-4, Microsoft pumped in about 11.5 million gallons of water to its cluster of Iowa data centers, according to the West Des Moines Water Works. That amounted to about 6% of all the water used in the district, which also supplies drinking water to the city's residents.In 2022, a document from the West Des Moines Water Works said it and the city government “will only consider future data center projects"" from Microsoft if those projects can “demonstrate and implement technology to significantly reduce peak water usage from the current levels” to preserve the water supply for residential and other commercial needs.Microsoft said Thursday it is working directly with the water works to address its feedback. In a written statement, the water works said the company has been a good partner and has been working with local officials to reduce its water footprint while still meeting its needs.—-O'Brien reported from Providence, Rhode Island.——The Associated Press and OpenAI have a licensing agreement that allows for part of AP's text archives to be used to train the tech company’s large language model. AP receives an undisclosed fee for use of its content.]"
20,c16f8080-80e1-3e23-ac00-600bda7437f7,MSFT,2023-09-10,"Will ChatGPT Ever Actually Be the ""Google Killer"" Everyone Thought It Would Be? (Answer -- not yet!)",Motley Fool,https://finance.yahoo.com/m/c16f8080-80e1-3e23-ac00-600bda7437f7/will-chatgpt-ever-actually-be.html,1694262900,STORY,"['GOOGL', 'MSFT', 'AMZN']","[Alphabet's (NASDAQ: GOOG)(NASDAQ: GOOG) Google Search has enjoyed a tremendous run as the world's preferred search engine, but change is coming. Let's look at the threat and how Alphabet is adapting. It also led some to question whether Alphabet would keep its stranglehold on the search market.Continue reading]"
21,93546c35-46cb-374f-8844-c9ccdfbd61fd,LUV,2023-09-10,Exclusive: Southwest Airlines passengers should be very worried,TheStreet.com,https://finance.yahoo.com/m/93546c35-46cb-374f-8844-c9ccdfbd61fd/exclusive%3A-southwest-airlines.html,1694264460,STORY,"['LUV', 'DAL']","[The airline has problems that are very different from what United, Delta, and American Airlines have dealt with.Continue reading]"
22,5966ae5c-de9b-37e4-91a9-e794a1a94d3a,TDG,2023-09-10,"Insider Sell: CFO Sarah Wynne Sells 5,420 Shares of TransDigm Group Inc",GuruFocus.com,https://finance.yahoo.com/news/insider-sell-cfo-sarah-wynne-090100250.html,1694250060,STORY,['TDG'],"[On September 7, 2023, Sarah Wynne, the Chief Financial Officer of TransDigm Group Inc (NYSE:TDG), sold 5,420 shares of the company. This move is part of a trend observed over the past year, where Wynne has sold a total of 5,600 shares and made no purchases.Warning! GuruFocus has detected 8 Warning Signs with TDG. Click here to check it out. TDG 30-Year Financial DataThe intrinsic value of TDGSarah Wynne is a seasoned financial executive with a wealth of experience in the aerospace industry. As the CFO of TransDigm Group Inc, she plays a crucial role in the company's financial strategy and operations. Her insider trading activities provide valuable insights into the company's financial health and future prospects.TransDigm Group Inc is a leading global designer, producer, and supplier of highly engineered aircraft components for use on nearly all commercial and military aircraft in service today. The company's product offerings include mechanical/electro-mechanical actuators and controls, ignition systems and engine technology, specialized pumps and valves, power conditioning devices, specialized AC/DC electric motors and generators, NiCad batteries and chargers, engineered latching and locking devices, rods and locking devices, engineered connectors and elastomers, cockpit security components and systems, aircraft audio systems, specialized lavatory components, seatbelts and safety restraints, engineered interior surfaces, and lighting and control technology.The insider transaction history for TransDigm Group Inc shows a clear trend of insider selling. Over the past year, there have been 27 insider sells and no insider buys. This trend could indicate that insiders believe the company's stock is currently overvalued.Insider Sell: CFO Sarah Wynne Sells 5,420 Shares of TransDigm Group IncOn the day of the insider's recent sell, shares of TransDigm Group Inc were trading for $883.16 apiece, giving the company a market cap of $48.11 billion. The price-earnings ratio is 46.45, which is higher than both the industry median of 33.58 and the companys historical median price-earnings ratio. This suggests that the stock may be overpriced compared to its earnings.Story continuesThe GuruFocus Value for TransDigm Group Inc is $822.68, resulting in a price-to-GF-Value ratio of 1.07. This indicates that the stock is fairly valued based on its GF Value. The GF Value is an intrinsic value estimate developed by GuruFocus, calculated based on historical multiples, a GuruFocus adjustment factor, and future estimates of business performance from Morningstar analysts.Insider Sell: CFO Sarah Wynne Sells 5,420 Shares of TransDigm Group IncIn conclusion, the insider's recent sell, along with the trend of insider selling over the past year, could be a signal that the stock is currently overvalued. However, the stock's price-to-GF-Value ratio suggests that it is fairly valued. Investors should carefully consider these factors when making investment decisions.This article first appeared on GuruFocus.]"
23,1fc4e9c3-827d-3aeb-b835-b6c52dbf4f45,GPN,2023-09-10,"Senior EVP and CFO Joshua Whipple Sells 37,096 Shares of Global Payments Inc (GPN)",GuruFocus.com,https://finance.yahoo.com/news/senior-evp-cfo-joshua-whipple-050412928.html,1694235852,STORY,['GPN'],"[On September 6, 2023, Senior EVP and CFO Joshua Whipple sold 37,096 shares of Global Payments Inc (NYSE:GPN). This move comes amidst a year where the insider has sold a total of 37,096 shares and purchased none.Warning! GuruFocus has detected 7 Warning Signs with GPN. Click here to check it out. GPN 30-Year Financial DataThe intrinsic value of GPNJoshua Whipple is a key figure in the Global Payments Inc company. As the Senior EVP and CFO, he plays a crucial role in the financial decision-making process of the company. His actions and decisions can significantly impact the company's financial health and stock performance.Global Payments Inc is a leading worldwide provider of payment technology and software solutions, delivering innovative services to its customers. The company's technologies, services, and employee expertise enable it to provide a broad range of solutions that allow its customers to accept various payment types and operate their businesses more efficiently across a variety of distribution channels in many markets around the world.The insider transaction history for Global Payments Inc shows a trend of more sells than buys over the past year. There have been 2 insider buys and 4 insider sells, including the recent sell by Joshua Whipple.Senior EVP and CFO Joshua Whipple Sells 37,096 Shares of Global Payments Inc (GPN)The relationship between insider buy/sell actions and the stock price can be complex. However, it's generally perceived that insider selling may indicate a lack of confidence in the company's future performance. In this case, the insider's decision to sell a significant number of shares could potentially signal to investors that he may believe the company's current stock price doesn't reflect its future growth potential.On the day of the insider's recent sell, shares of Global Payments Inc were trading for $127.28 each, giving the stock a market cap of $32.74 billion. The price-earnings ratio is 41.97, which is higher than both the industry median of 17.02 and the companys historical median price-earnings ratio.Story continuesDespite this, the stock appears to be modestly undervalued based on its GF Value. With a price of $127.28 and a GuruFocus Value of $161.74, Global Payments Inc has a price-to-GF-Value ratio of 0.79.Senior EVP and CFO Joshua Whipple Sells 37,096 Shares of Global Payments Inc (GPN)The GF Value is an intrinsic value estimate developed by GuruFocus. It's calculated based on historical multiples that the stock has traded at, a GuruFocus adjustment factor based on the companys past returns and growth, and future estimates of business performance from Morningstar analysts.In conclusion, the recent sell by the insider may raise questions among investors. However, the stock's current valuation suggests that it may still be a good investment opportunity. As always, potential investors should conduct their own research and consider multiple factors before making investment decisions.This article first appeared on GuruFocus.]"
