,Id,Company,Date,Title,Publisher,Link,ProviderPublishTime,Type,Related Company,Text
41,21e97c5d-43d5-3c7d-a1dd-940c29fc079f,DIS,2023-05-21,Florida's DeSantis seeks to disqualify judge in Disney case,Reuters,https://finance.yahoo.com/news/floridas-desantis-seeks-disqualify-judge-192921145.html,1684610961,STORY,['DIS'],"[WASHINGTON (Reuters) - Lawyers for Florida Governor Ron DeSantis, a Republican mulling a 2024 presidential run, are asking that a federal judge be disqualified from overseeing a dispute between DeSantis and Walt Disney Co, questioning the judge's impartiality in the case.Lawyers for DeSantis, who is being sued for allegedly targeting Disney for company leadership's political views, filed a motion on Friday in Tallahassee, Florida, asking U.S. District Judge Mark Walker be recused in the case.Disney sued DeSantis in April for allegedly ""weaponizing"" state government in retaliation for the company's criticism of a law that banned classroom discussion of sexuality and gender identity with younger children. Opponents labeled the measure the ""don't say gay"" law.The company alleged DeSantis rallied the Republican-controlled legislature to strike back at ""woke Disney"" and seize control of an administrative district, created in 1967, that helped Disney develop theme parks and resorts. The district, originally known as Reedy Creek Improvement District, was also named as a defendant.DeSantis' lawyers argued on Friday that the judge overseeing that case demonstrated potential partiality while handling separate cases in which the judge mentioned Disney as an example of state retaliation.Considering Walker's statements, ""the court's impartiality in this matter might reasonably be questioned,"" DeSantis' lawyers said in the their motion.DeSantis is expected to jump in to the Republican presidential nomination contest in the coming days and could be a potentially tough challenger to front-runner Donald Trump. The eventual Republican nominee is expected to challenge President Joe Biden, a Democrat, in November 2024.(Reporting by Jason Lange in Washington; Editing by Matthew Lewis)]"
42,4e3e1a9c-37e9-3ad1-b22a-50e2606097ef,DIS,2023-05-21,DeSantis asks that judge be disqualified from Disney's free speech lawsuit,AP Finance,https://finance.yahoo.com/news/desantis-asks-judge-disqualified-disneys-153819789.html,1684597099,STORY,['DIS'],"[ORLANDO, Fla. (AP) — Gov. Ron DeSantis is asking that a federal judge be disqualified from the First Amendment lawsuit filed by Disney against the Florida governor and his appointees, claiming the jurist's prior statements in other cases have raised questions about his impartiality on the state's efforts to take over Disney World's governing body.DeSantis ' attorney filed a motion in federal court in Tallahassee on Friday seeking to disqualify Chief U.S. District Judge Mark Walker from overseeing the lawsuit filed by Disney last month. The lawsuit alleges that DeSantis and his appointees violated the company's right to free speech, as well as the contracts clause, by taking over the special governing district that previously had been controlled by Disney supporters after Disney opposed Florida legislation that critics have dubbed “Don't Say Gay.”The Republican governor's motion was filed a day after Disney announced that it was scrapping plans to build a new campus in central Florida and relocate 2,000 employees from Southern California to work in digital technology, finance and product development, amid an ongoing feud with DeSantis.DeSantis' motion said Walker referenced the ongoing dispute between his administration and Disney during hearings in two unrelated lawsuits before him dealing with free speech issues and fear of retaliation for violating new laws championed by DeSantis and Republican lawmakers. One of those was a First Amendment lawsuit filed by Florida professors that challenged a new law establishing a survey about “intellectual freedom and viewpoint diversity” on state campuses.Walker, who was nominated to the federal bench in 2012 by President Barack Obama and is now chief judge of the district, tossed out that lawsuit on the grounds that the professors didn't have standing to challenge the law championed by DeSantis and Florida lawmakers.In the first case, Walker said, “What’s in the record, for example — is there anything in the record that says we are now going to take away Disney’s special status because they’re woke?""Story continuesIn the second case, the judge said, “And then Disney is going to lose its status because—arguably, because they made a statement that run afoul—ran afoul of state policy of the controlling party,” according to the DeSantis motion.Disney and DeSantis have been engaged in a tug-of-war for more than a year that has engulfed the GOP governor in criticism as he prepares to launch an expected presidential bid next week.The feud started after Disney, in the face of significant pressure, publicly opposed the state concerning lessons on sexual orientation and gender identity in early grades that critics called “Don’t Say Gay.”As punishment, DeSantis took over Disney World’s self-governing district through legislation passed by lawmakers and appointed a new board of supervisors. Before the new board came in, the company signed agreements with the old board stripping the new supervisors of design and construction authority.In response, the Republican-controlled Florida Legislature passed legislation allowing the DeSantis-appointed board to repeal those agreements and made the theme park resort’s monorail system subject to state inspection, when it previously had been done in-house.Disney filed the First Amendment lawsuit against the Florida governor and the DeSantis-appointed board last month in federal court in Tallahassee, and it landed in Walker's court. The DeSantis-appointed board earlier this month sued Disney in state court in Orlando seeking to void the deals the company made with the previous board.The creation of Disney’s self-governing district by the Florida Legislature was instrumental in the company’s decision in the 1960s to build near Orlando. Disney told the state at the time that it planned to build a futuristic city that would include a transit system and urban planning innovations, so the company needed autonomy. The futuristic city never materialized, however, and instead morphed into a second theme park that opened in 1982.___This story has been corrected to reflect that Disney filed the First Amendment lawsuit against the Florida governor and the DeSantis-appointed board, not a Disney-appointed board; and that the DeSantis-appointed board, not a Disney-appointed board, earlier this month sued Disney in state court in Orlando.___Follow Mike Schneider on Twitter at @MikeSchneiderAP]"
43,4a9c6491-6b52-3510-91a8-2c09085bce36,DIS,2023-05-21,Walt Disney Makes Its Boldest Anti-DeSantis Threats Yet,TheStreet.com,https://finance.yahoo.com/m/4a9c6491-6b52-3510-91a8-2c09085bce36/walt-disney-makes-its-boldest.html,1684593300,STORY,['DIS'],[The Mouse House has made it very clear that it's not going to back down because of the right-wing governor's threats.Continue reading]
44,82c1b361-4d1c-3f03-8138-8eaba9706fd5,CMCSA,2023-05-21,Comcast's (NASDAQ:CMCSA) investors will be pleased with their decent 45% return over the last five years,Simply Wall St.,https://finance.yahoo.com/news/comcasts-nasdaq-cmcsa-investors-pleased-110039662.html,1684666839,STORY,['CMCSA'],"[When you buy and hold a stock for the long term, you definitely want it to provide a positive return. Furthermore, you'd generally like to see the share price rise faster than the market. But Comcast Corporation (NASDAQ:CMCSA) has fallen short of that second goal, with a share price rise of 30% over five years, which is below the market return. Unfortunately the share price is down 2.0% in the last year.With that in mind, it's worth seeing if the company's underlying fundamentals have been the driver of long term performance, or if there are some discrepancies. See our latest analysis for Comcast In his essay The Superinvestors of Graham-and-Doddsville Warren Buffett described how share prices do not always rationally reflect the value of a business. By comparing earnings per share (EPS) and share price changes over time, we can get a feel for how investor attitudes to a company have morphed over time.During five years of share price growth, Comcast actually saw its EPS drop 23% per year.Essentially, it doesn't seem likely that investors are focused on EPS. Because earnings per share don't seem to match up with the share price, we'll take a look at other metrics instead.On the other hand, Comcast's revenue is growing nicely, at a compound rate of 6.2% over the last five years. In that case, the company may be sacrificing current earnings per share to drive growth.The image below shows how earnings and revenue have tracked over time (if you click on the image you can see greater detail).earnings-and-revenue-growthComcast is a well known stock, with plenty of analyst coverage, suggesting some visibility into future growth. So we recommend checking out this free report showing consensus forecastsWhat About Dividends?It is important to consider the total shareholder return, as well as the share price return, for any given stock. Whereas the share price return only reflects the change in the share price, the TSR includes the value of dividends (assuming they were reinvested) and the benefit of any discounted capital raising or spin-off. So for companies that pay a generous dividend, the TSR is often a lot higher than the share price return. We note that for Comcast the TSR over the last 5 years was 45%, which is better than the share price return mentioned above. The dividends paid by the company have thusly boosted the total shareholder return.Story continuesA Different PerspectiveComcast shareholders gained a total return of 1.1% during the year. But that was short of the market average. If we look back over five years, the returns are even better, coming in at 8% per year for five years. Maybe the share price is just taking a breather while the business executes on its growth strategy. I find it very interesting to look at share price over the long term as a proxy for business performance. But to truly gain insight, we need to consider other information, too. Consider for instance, the ever-present spectre of investment risk.   We've identified 3 warning signs  with Comcast , and understanding them should be part of your investment process.But note: Comcast may not be the best stock to buy. So take a peek at this free list of interesting companies with past earnings growth (and further growth forecast).Please note, the market returns quoted in this article reflect the market weighted average returns of stocks that currently trade on American exchanges.Have feedback on this article? Concerned about the content? Get in touch with us directly. Alternatively, email editorial-team (at) simplywallst.com.This article by Simply Wall St is general in nature. We provide commentary based on historical data and analyst forecasts only using an unbiased methodology and our articles are not intended to be financial advice. It does not constitute a recommendation to buy or sell any stock, and does not take account of your objectives, or your financial situation. We aim to bring you long-term focused analysis driven by fundamental data. Note that our analysis may not factor in the latest price-sensitive company announcements or qualitative material. Simply Wall St has no position in any stocks mentioned.Join A Paid User Research SessionYou’ll receive a US$30 Amazon Gift card for 1 hour of your time while helping us build better investing tools for the individual investors like yourself. Sign up here]"
45,f8d63825-aaa8-3b79-b79f-c47e3fb21c47,PX,2023-05-21,"P10, Inc. (NYSE:PX) Looks Like A Good Stock, And It's Going Ex-Dividend Soon",Simply Wall St.,https://finance.yahoo.com/news/p10-inc-nyse-px-looks-121247468.html,1684671167,STORY,['PX'],"[Regular readers will know that we love our dividends at Simply Wall St, which is why it's exciting to see P10, Inc. (NYSE:PX) is about to trade ex-dividend in the next four days. The ex-dividend date is usually set to be one business day before the record date which is the cut-off date on which you must be present on the company's books as a shareholder in order to receive the dividend. The ex-dividend date is important because any transaction on a stock needs to have been settled before the record date in order to be eligible for a dividend. Therefore, if you purchase P10's shares on or after the 26th of May, you won't be eligible to receive the dividend, when it is paid on the 20th of June.The company's upcoming dividend is US$0.033 a share, following on from the last 12 months, when the company distributed a total of US$0.12 per share to shareholders. Last year's total dividend payments show that P10 has a trailing yield of 1.1% on the current share price of $10.74. If you buy this business for its dividend, you should have an idea of whether P10's dividend is reliable and sustainable. So we need to investigate whether P10 can afford its dividend, and if the dividend could grow. Check out our latest analysis for P10 Dividends are typically paid from company earnings. If a company pays more in dividends than it earned in profit, then the dividend could be unsustainable. That's why it's good to see P10 paying out a modest 48% of its earnings.When a company paid out less in dividends than it earned in profit, this generally suggests its dividend is affordable. The lower the % of its profit that it pays out, the greater the margin of safety for the dividend if the business enters a downturn.Click here to see the company's payout ratio, plus analyst estimates of its future dividends.historic-dividendHave Earnings And Dividends Been Growing?Companies with consistently growing earnings per share generally make the best dividend stocks, as they usually find it easier to grow dividends per share. Investors love dividends, so if earnings fall and the dividend is reduced, expect a stock to be sold off heavily at the same time. That's why it's comforting to see P10's earnings have been skyrocketing, up 68% per annum for the past five years.Story continuesUnfortunately P10 has only been paying a dividend for a year or so, so there's not much of a history to draw insight from.Final TakeawayFrom a dividend perspective, should investors buy or avoid P10? When companies are growing rapidly and retaining a majority of the profits within the business, it's usually a sign that reinvesting earnings creates more value than paying dividends to shareholders. Perhaps even more importantly - this can sometimes signal management is focused on the long term future of the business. Overall, P10 looks like a promising dividend stock in this analysis, and we think it would be worth investigating further.So while P10 looks good from a dividend perspective, it's always worthwhile being up to date with the risks involved in this stock. Case in point: We've spotted 3 warning signs for P10 you should be aware of.A common investing mistake is buying the first interesting stock you see. Here you can find a full list of high-yield dividend stocks.Have feedback on this article? Concerned about the content? Get in touch with us directly. Alternatively, email editorial-team (at) simplywallst.com.This article by Simply Wall St is general in nature. We provide commentary based on historical data and analyst forecasts only using an unbiased methodology and our articles are not intended to be financial advice. It does not constitute a recommendation to buy or sell any stock, and does not take account of your objectives, or your financial situation. We aim to bring you long-term focused analysis driven by fundamental data. Note that our analysis may not factor in the latest price-sensitive company announcements or qualitative material. Simply Wall St has no position in any stocks mentioned.Join A Paid User Research SessionYou’ll receive a US$30 Amazon Gift card for 1 hour of your time while helping us build better investing tools for the individual investors like yourself. Sign up here]"
46,2d0a9266-03b5-32b1-a534-ef7ae53f1b2e,PSA,2023-05-21,"Buying $1,000 of These Dividend Stocks Could Supply Passive Income Forever",Motley Fool,https://finance.yahoo.com/m/2d0a9266-03b5-32b1-a534-ef7ae53f1b2e/buying-%241%2C000-of-these.html,1684663620,STORY,"['PSA', 'INVH', 'WPC']","[Investing in real estate is a great way to collect passive income. Anyone can invest in real estate investment trusts (REITs) and receive dividend income. Invitation Homes (NYSE: INVH), Public Storage (NYSE: PSA), and W. P. Carey (NYSE: WPC) are great ways to begin building your real estate empire through REITs.Continue reading]"
