,Id,Company,Date,Title,Publisher,Link,ProviderPublishTime,Type,Related Company,Text
28,a1f1e48e-7034-3f7d-b461-58e762e0eca6,PSX,2023-01-15,The 7 Best Bargain Stocks to Buy in January 2023,InvestorPlace,https://finance.yahoo.com/news/7-best-bargain-stocks-buy-231224570.html,1673478744,STORY,"['BHP', 'UMC', 'TSN', 'INTC', 'LPX', 'KR', 'PSX']","[Following a rough outing in 2022, investors seeking to make up for lost time may want to consider the best bargain stocks to buy in Jan. To be sure, plenty of headwinds exist, including historically high inflation and concerns about monetary policy. That said, it’s doubtful that every single enterprise will fail. Therefore, amid last year’s fallout, contrarians should consider certain compelling discounts.Primarily, the best bargain stocks to buy center on the necessities. As well, they target social trends that investors can reliably bank on. However, other market ideas simply offer a great deal based on their underlying fundamentals. And because 2022 was so awful, plenty of bargains exist, as you can see below.UMCUnited Microelectronics$7.44INTCIntel$29.85KRKroger$45.61PSXPhillips 66$101.42BHPBHP Group$67.30TSNTyson Foods$65.81LPXLouisiana-Pacific$64.57InvestorPlace - Stock Market News, Stock Advice &amp; Trading TipsUnited Microelectronics (UMC)AI. Circuit board. Technology background. Central Computer Processors CPU concept. Motherboard digital chip. Tech science background. Integrated communication processor. 3D illustration representing semiconductor stocksSource: ShutterstockFounded as Taiwan’s first semiconductor firm, United Microelectronics (NYSE:UMC) enjoys a rich history. Unfortunately, this geographic angle makes it a bit of a tricky narrative among the best bargain stocks to buy. With tensions rising between Taiwan and China – and because of U.S. support of the small breakaway island – drama is the last thing UMC needs.Therefore, it’s not a shocker that UMC dropped 37% of equity value in the trailing year. However, the near-term momentum for shares has been impressive. In the trailing five days, UMC gained 11% of market value. In the trailing six months, the stock boomed by nearly 14%. Yet despite this dynamic, UMC trades hands at 6.9 times trailing earnings. In contrast, the industry median is 16.6 times.Also, UMC is priced at 8.35 times forward earnings. Here, this metric ranks lower than 90% of the industry. In addition, the company features solid revenue growth and excellent profitability margins. Once the global economy normalizes, UMC could move significantly higher, making it one of the best bargain stocks to buy.Story continuesIntel (INTC)blue graphic of person's face made of binary code and microchip lines PGY stock.Source: shutterstock.com/PeshkovaOnce one of the standard bearers of the technology ecosystem, Intel (NASDAQ:INTC) lost some of its shine in recent years. From competitive pressures to some unforced errors, Intel admittedly looked sloppy. At the same time, many hope that the innovative spirit that guided INTC all these years still remains. For speculators, INTC could be one of the best bargain stocks to buy.Indeed, the tech giant made some big news last week, announcing the launch of the world’s fastest mobile processor. The disclosure occurred during the CES tech industry tradeshow. While the flagship Intel Core i9 may be overkill for most users, the processor targets two viable segments: hardcore gamers and professional users. With video games representing a burgeoning market, INTC appears worthy as one of the best bargain stocks to buy.Also, Intel’s objectively cheap. Currently, the market prices INTC at just over 9 times trailing earnings. In contrast, the sector median is 16.6 times.Kroger (KR)Kroger (KR) Supermarket. The Kroger Co. is One of the World's Largest Grocery Retailers.Source: Eric Glenn / Shutterstock.comFundamentally, the case for Kroger (NYSE:KR) as one of the best bargain stocks to buy really sells itself. Let’s look at it this way. No matter what happens in the economy, people must eat. Therefore, Kroger largely benefits from the trade-down effect, whereby consumers seek out cheaper alternatives until reaching a quality/price equilibrium.In Kroger’s case, people will give up eating out at fancy restaurants. Moreover, they’ll quit food-delivery services as well if finances force the trade down. Eventually, though, you’d figure that most people will trade down to Kroger for their culinary needs. Therefore, even with KR down about 4% in the trailing year, it’s worth picking up. Predictably, people will go through those doors.Financially as well, Kroger is one of the best bargain stocks to buy. At the moment, the market prices KR at 10.8 times forward earnings. For comparison, the industry’s forward price-earnings ratio stands at 16.7 times.Phillips 66 (PSX)In the field, the oil pump in the evening, the evening silhouette of the pumping unit, the silhouette of the oil pump. Oil stocks and energy stocksSource: zhengzaishuru / Shutterstock.comWhen you think about Phillips 66 (NYSE:PSX) as one of the best bargain stocks to buy, investors shouldn’t just focus on the company, which specializes in downstream (refining and marketing) energy services. Rather, they should look to Disney (NYSE:DIS) and specifically its reappointed CEO Bob Iger. Trust me, this will make sense.According to an email obtained by CNBC, Iger wants Disney’s hybrid employees to return to the office for four days a week. The change will officially take place on March 1. Fundamentally, this announcement and probably similar ones to come should bode well for the gig economy. After all, people like working from home. But more than likely, most will toe the line, especially under present economic conditions.You know what that means, don’t you? You got it, an increase in the vehicle miles traveled. I’d say that the spike will be significant. Of course, such a framework translates to more fuel consumption, bolstering PSX as one of the best bargain stocks to buy.BHP Group (BHP)Smartphone with BHP Group logo in front of BHP website. BHP stock.Source: T. Schneider / ShutterstockFor forward-looking investors, BHP Group (NYSE:BHP) makes for an enticing case for the best bargain stocks to buy. Fundamentally, the mining specialist focuses on the commodities of tomorrow. For instance, its copper projects should increase in demand for many years to come. As you probably know, copper is a crucial component of electric vehicles.Not surprisingly, BHP did very well in 2022, a sharp contrast to other public entities. In the trailing year, BHP gained over 16%. Better yet, shares have maintained their positive momentum in the near term. For instance, during the past five sessions, BHP returned over 7% of the value. And in the trailing month, it’s up nearly 6%.Per data from Gurufocus.com, the market prices BHP at 5.5 times trailing earnings. In contrast, the underlying industry median stands at 12 times. As well, the company enjoys a stable balance sheet and high business quality as reflected by its return on equity of 65%. This latter stat beats out 98% of the competition.Tyson Foods (TSN)A package of Tyson Foods (TSN) chicken breasts.Source: rblfmr / Shutterstock.comOne of the largest food processors, Tyson Foods (NYSE:TSN) fundamentally offers an indispensable service. Nevertheless, it’s fair to point out that TSN did not enjoy a strong showing last year. For instance, shares slipped 28% in the trailing 365 days. A tough environment due to food supply chains along with some unnecessary drama negatively affected sentiment.Still, people must eat. And when you have a critical service like Tyson Foods, much will be forgiven. There’s no other choice, really. On a lighter note, Tyson’s one of the best bargain stocks to buy based on traditional valuation metrics. According to Gurufocus.com, TSN trades at 7.35 times trailing earnings. In contrast, the industry median is 17.5 times.If that wasn’t convincing enough, the market prices TSN at 9.8 times forward earnings. For the industry, the median forward PE ratio stands at 16.1 times. Also, the company benefits from a stable balance sheet and a high ROE of 17.2%, reflecting a superior capacity to convert equity financing into profits.Louisiana-Pacific (LPX)A photo of a person in a neon green vest holding blueprints and standing behind a white table covered with supplies like pencils, a computer, a ruler and two wooden house shapes.Source: ARMMY PICCA/ShutterStock.comAn American building materials manufacturer, Louisiana-Pacific (NYSE:LPX) may be somewhat of a mixed bag. With global recession fears rising, the narrative for Louisiana-Pacific may encounter significant challenges. However, some room for optimism exists. Mainly, initiatives under the Biden administration to rebuild infrastructure may boost the company’s profile.Of course, it might take some convincing from the broader market. In the trailing year, LPX stock dropped over 17% in equity value. Still, the bulls may counter that near-term momentum favors LPX. For instance, during the past half-year period, shares gained 8%. This might reflect the early stages of a recovery effort.Even though LPX enjoys its core group of supporters, it remains one of the best bargain stocks to buy. Currently, shares trade at under 4-times trailing earnings. This compares favorably to the industry’s PE ratio of 13 times. Also, the company features a stable balance sheet (particularly a high cash-to-debt ratio) and outstanding profitability margins.On the date of publication, Josh Enomoto did not have (either directly or indirectly) any positions in the securities mentioned in this article. The opinions expressed in this article are those of the writer, subject to the InvestorPlace.com Publishing Guidelines.A former senior business analyst for Sony Electronics, Josh Enomoto has helped broker major contracts with Fortune Global 500 companies. Over the past several years, he has delivered unique, critical insights for the investment markets, as well as various other industries including legal, construction management, and healthcare.More From InvestorPlaceBuy This $5 Stock BEFORE This Apple Project Goes LiveThe Best $1 Investment You Can Make TodayEarly Bitcoin Millionaire Reveals His Next Big Crypto Trade “On Air”It doesn’t matter if you have $500 or $5 million. Do this now.The post The 7 Best Bargain Stocks to Buy in January 2023 appeared first on InvestorPlace.]"
29,607887bb-0f3a-32d9-8879-78f883c49691,AMGN,2023-01-15,"A New U.S. Law Aims to Reduce Drug Prices. But First, It Might Raise Them.",The Wall Street Journal,https://finance.yahoo.com/m/607887bb-0f3a-32d9-8879-78f883c49691/a-new-u.s.-law-aims-to-reduce.html,1673708580,STORY,['AMGN'],[]
30,f3e8e78a-9731-367f-9fd6-d0b5010572e6,NEM,2023-01-15,4 Gold Stocks to Buy as the Precious Metal Trends Higher,InvestorPlace,https://finance.yahoo.com/news/4-gold-stocks-buy-precious-113043772.html,1673523043,STORY,"['SI=F', 'GC=F', 'HG=F', 'GOLD', 'NEM', 'KGC', 'AU']","[I would look at some of the best gold stocks to buy if I had to make a call on some attractive investment themes for 2023.The U.S. dollar index peaked at 114.78 in September 2022. This was when the federal reserve was pursuing aggressive contractionary monetary policies. During this time, gold had also trended lower with high interest rates aimed at curbing inflation.However, the dollar index currently trades at around 103 and has been trending lower. In general, a weak dollar is positive for precious metals. I believe that the dollar will continue to weaken in 2023. The reason is that the world is staring at a potential recession. In such a scenario, aggressive contractionary monetary policy seems unlikely. On the contrary, policymakers globally might shift to expansionary policies.InvestorPlace - Stock Market News, Stock Advice &amp; Trading TipsSome of the best gold stocks have been depressed last year for reasons explained. With the potential reversal in monetary policy, it’s a good time to look at some gold stocks to buy. In addition to the potential for capital gains, these gold stocks also offer an attractive dividend yield.Let’s discuss four fundamentally strong gold stocks to buy for 2023 and beyond.NEMNewmont Corporation$52.46GOLDBarrick Gold$19.22KGCKinross Gold$4.56AUAngloGold Ashanti$22.01Newmont Corporation (NEM)Newmont logo on a mobile phone screenSource: Piotr Swat/ShutterstockNewmont Corporation (NYSE:NEM) is among the top gold stocks to buy.In the last 12 months, NEM stock has declined by 15%. This is understandable as the federal reserve pursued aggressive contractionary policies in 2022. The stock looks undervalued and is poised for a reversal rally.Newmont has 96 million ounces of gold reserves. Additionally, the company has 68 million ounces of copper and silver reserves. With a robust reserve base, the company expects to sustain steady production in the coming years.Newmont is also attractive considering the cash flow potential. Even with the depressed gold price, the company reported operating cash flow of $466 million for Q3 2022. If gold trades above $1,800 an ounce, the company is well-positioned to deliver annual operating cash flows in excess of $2 billion.Story continuesWith an investment-grade balance sheet, Newmont is also positioned to make sustained investments and pursue potential acquisitions. A dividend yield of 4.2% also makes NEM stock attractive.Barrick Gold (GOLD)How to Play Barrick Gold Stock Ahead of Today's EarningsSource: Piotr Swat / Shutterstock.comWith the recovery in the gold price, Barrick Gold (NYSE:GOLD) stock has trended higher by 17% in the last six months. However, the 2.1% dividend yield stock remains attractive at current levels for long-term exposure.Barrick Gold also has a strong asset base with 69 million ounces in proven and probable reserves. Last year, the company replaced its depletion of gold mineral reserves by 150%. Robust replacement on a sustained basis positions Barrick for steady cash flows in the coming decade.For the first nine months of 2022, Barrick Gold reported a healthy operating cash flow of $2.7 billion. Assuming a scenario where gold trades around $2,000 an ounce, Barrick is likely to deliver OCF in excess of $4 billion.Considering the cash flow potential, GOLD stock is an attractive dividend growth stock to consider. Barrick has an investment-grade balance sheet and ended Q3 2022 with cash and equivalents of $5.2 billion. This positions Barrick for aggressive exploration activity to further boost its proven reserves.Kinross Gold (KGC)Cellphone with business logo of Canadian mining company Kinross Gold Corp. on screen in front of webpage.Source: T. Schneider / Shutterstock.comAmong the relatively smaller names, Kinross Gold (NYSE:KGC) stock looks attractive. Kinross had a difficult last year with the company selling Russian assets at a steep discount. This translated into a revision of production guidance for 2023 and beyond.However, the worst seems to be over and KGC stock has already moved higher by 8% in the last month. I expect this uptrend to sustain with Kinross having guided for steady production for the next few years. The company has also guided for sustained free cash flows.It’s also worth noting that Kinross reported a liquidity buffer of $2 billion as of Q3 2022. Strong financial flexibility implies that dividends are safe. Kinross is already pursuing a $450 million share buyback program.I also believe that asset acquisition is likely considering a strong liquidity buffer and positive free cash flows. Any upward revision in the company’s production guidance can translate into a meaningful rally.AngloGold Ashanti (AU)Person holding cellphone with logo of South African mining company AngloGold Ashanti Limited on screen in front of website. AU stock.Source: T. Schneider / ShutterstockAngloGold Ashanti (NYSE:AU) stock has been the best-performing gold stock in the last six months. During this period, the stock has surged by almost 52%. Even after the big rally, AU stock looks undervalued at a forward price-earnings ratio of 15.6. As gold trends higher, I expect the positive momentum to sustain.One reason for the stock moving higher is the company’s focus on cost control. As an example, AngloGold reported an all-in-sustaining cost of $1,284 an ounce for Q3 2022 as compared to $1,362 an ounce in Q3 2021.With gold trading at $1,840 an ounce, AngloGold is positioned for healthy cash flows. For the last quarter, the company reported free cash flow of $169 million. With a higher realized price, it’s likely that the annualized FCF will be around $1 billion.AngloGold also has a quality balance sheet. As of Q3 2022, the company reported a gearing ratio of 0.41. With $2.5 billion in liquidity buffer, the company is well positioned to invest in exploration projects.On the date of publication, Faisal Humayun did not hold (either directly or indirectly) any positions in the securities mentioned in this article. The opinions expressed in this article are those of the writer, subject to the InvestorPlace.com Publishing Guidelines.Faisal Humayun is a senior research analyst with 12 years of industry experience in the field of credit research, equity research and financial modeling. Faisal has authored over 1,500 stock specific articles with focus on the technology, energy and commodities sector.More From InvestorPlaceBuy This $5 Stock BEFORE This Apple Project Goes LiveThe Best $1 Investment You Can Make TodayEarly Bitcoin Millionaire Reveals His Next Big Crypto Trade “On Air”It doesn’t matter if you have $500 or $5 million. Do this now.The post 4 Gold Stocks to Buy as the Precious Metal Trends Higher appeared first on InvestorPlace.]"
31,ab96d485-fe1c-3048-9b92-614959df1819,M,2023-01-15,China’s rapid reopening will stir the global economy,Financial Times,https://finance.yahoo.com/m/ab96d485-fe1c-3048-9b92-614959df1819/china%E2%80%99s-rapid-reopening-will.html,1673780442,STORY,['M'],[]
32,6774cc50-5e51-3768-b6a9-39283eda70ad,NEE,2023-01-15,Volatility Got You Down? This 1-of-a-Kind Investment Opportunity Could Stabilize Your Portfolio,Motley Fool,https://finance.yahoo.com/m/6774cc50-5e51-3768-b6a9-39283eda70ad/volatility-got-you-down%3F-this.html,1673788500,STORY,"['NEE-PR', '^GSPC']",[The company can help reduce your portfolio's volatility without diminishing your return potential.Continue reading]
33,18590540-29e5-31d3-98c1-54fb785c002c,NEE,2023-01-15,3 Dividend-Paying Energy Stocks to Buy for 2023,InvestorPlace,https://finance.yahoo.com/news/3-dividend-paying-energy-stocks-203911462.html,1673469551,STORY,"['CVX', 'FANG', 'NEE-PR']","[Last year was terrible for the stock market overall, but the energy sector actually performed quite well. Indeed, it was the only segment in the S&amp;P 500 that rose in 2022. While the S&amp;P 500 lost 19.44% of its value in 2022, energy stocks shot up a massive 59%. As a result, I think that these dividend-paying energy stocks to buy will be popular with investors again this year, which could be another difficult period Given the uncertain outlook in 2023, investors should look to buy defensive stocks, lesser-known names, and blue-chip stalwarts in the energy sector this year. These three stocks pay dividends, making them particularly attractive to investors looking for income. InvestorPlace - Stock Market News, Stock Advice &amp; Trading TipsNEENextEra$85FANGDiamondback Energy$142.60CVXChevron$175NextEra Energy (NEE)Nextra Energy (NEE) website on a mobile phone screenSource: madamF / Shutterstock.comNextEra Energy (NYSE:NEE) has a lot going for it that makes it a strong pick going into 2023. The company has two main businesses, both of which can grow significantly moving forward. NextEra Energy owns Florida Power &amp; Light which is the largest electric utility in the U.S., providing electricity to 5.8 million people in Florida. FP&amp;L is also the world’s largest generator of renewable energy and owns nuclear power plants in three states. Three quarters of NextEra Energy’s $6.719 billion of revenues in Q3 were generated by its utility business. And that means NEE stock has some defensive characteristics which will make it attractive in 2023. However, it should be noted that NE’s renewable energy segment has much higher margins and provides roughly 60% more profit than the utility unit despite generating only one-third as much revenue. The growth of renewable energy in the U.S. bodes well for the firm both in terms of top-line growth and bottom-line profitability. Finally, the stock has a dividend yield of 2.1%. Diamondback Energy (FANG)diamondback energy logo on its website to represent oil stocksSource: Pavel Kapysh / Shutterstock.comStory continuesDiamondback Energy (NASDAQ:FANG) is an oil company that had a solid but not exceptional 2022 as its share price increased from $123 to $136. Although FANG stock didn’t perform as strongly as a number of other names in the sector, there’s reason to believe that it’ll be a solid choice in 2023.Worth noting is that the majority of analysts give FANG stock a “buy” rating and that the average rating on it is “overweight.” And analysts’ average price target on the name is  $181. That’s encouraging since its shares currently trade for $142.60. Aside from that, Diamondback Energy is a particularly attractive investment because its expenses are lower than those of its competitors. Its low-cost operations will continue to attract investors to its shares in 2023 amid continued high inflation. The company generated $1.2 billion of cash flow in Q3, 75% of which was returned to investors in the form of stock repurchases. FANG also paid out $402 million of dividends. Those factors should make Diamondback Energy a clear winner in the energy sector this year. Chevron (CVX)CVX stockSource: tishomir / Shutterstock.comChevron (NYSE:CVX) had an excellent year in 2022, causing its stock to appreciate more than 43%. Chevron’s revenue jumped 65% year-over-year to $181.2 billion through the first nine months of 2022. Its net income nearly tripled last year to $29.11 billion. Chevron delivered great financial results in 2022. That might logically cause some investors to unload CVX stock in 2023. But Chevron will continue to be largely the same company in 2023 that it was in 2022. Analysts, on average,  expect CVX to appreciate in price modestly this year. And the company, which hasn’t cut its dividend since 1988, has a dividend yield of 3.25%. Chevron recently released its capital expenditure budget for 2023. That budget is 25% bigger than its 2022 capex. At the same time, the company intends to more than double its lower-carbon capital expenditures this year to $2 billion. It is embracing a lower-carbon future while continuing to expand its main business that produced a banner year in 2022. On the date of publication, Alex Sirois did not have (either directly or indirectly) any positions in the securities mentioned in this article. The opinions expressed in this article are those of the writer, subject to the InvestorPlace.com Publishing Guidelines.Alex Sirois is a freelance contributor to InvestorPlace whose personal stock investing style is focused on long-term, buy-and-hold, wealth-building stock picks.Having worked in several industries from e-commerce to translation to education and utilizing his MBA from George Washington University, he brings a diverse set of skills through which he filters his writing.More From InvestorPlaceBuy This $5 Stock BEFORE This Apple Project Goes LiveThe Best $1 Investment You Can Make TodayEarly Bitcoin Millionaire Reveals His Next Big Crypto Trade “On Air”It doesn’t matter if you have $500 or $5 million. Do this now.The post 3 Dividend-Paying Energy Stocks to Buy for 2023 appeared first on InvestorPlace.]"
