,Id,Company,Date,Title,Publisher,Link,ProviderPublishTime,Type,Related Company,Text
37,d986bd6e-540a-30e5-b58a-8d0710bac13f,NOC,2023-09-03,Goldman Sachs Defense Stocks: Top 10 Stock Picks,Insider Monkey,https://finance.yahoo.com/news/goldman-sachs-defense-stocks-top-035112162.html,1693713072,STORY,"['GS', 'GSBD', 'TXT', 'HWM', 'TDG', 'BA', 'NOC', 'LHX', 'LMT']","[In this article, we discuss the top 10 Goldman Sachs defense stocks. If you want to skip our detailed discussion on the defense sector, head directly to Goldman Sachs Defense Stocks: Top 5 Stock Picks. The worldwide aerospace and defense industry expanded from $795.92 billion in 2022 to $855.62 billion in 2023, representing a compound annual growth rate (CAGR) of 7.5%. The aerospace and defense market is projected to reach $1076.56 billion by 2027, indicating a CAGR of 5.9%. PwC's analysis indicated that in 2022, the aerospace and defense sector generated $741 billion in revenue, marking a modest 3% increase compared to the previous year. Simultaneously, the industry achieved $67 billion in operating profit, reflecting an 8% rise. However, the revenue growth was less than anticipated due to the industry's struggle to meet soaring market demand, hindered by production constraints stemming from supply chain and labor issues.Don't Miss: Goldman Sachs Growth Stocks: Top 12 StocksIn 2023, aerospace and defense organizations may encounter significant challenges primarily related to supply chain disruptions and talent shortages as well. Additionally, the aerospace and defense sector is sensitive to jet fuel prices, as they affect ticket prices and, subsequently, passenger travel demand. A sudden and sustained increase in jet fuel prices can disrupt traffic and introduce market volatility. To tackle these challenges, aircraft manufacturers are investing in the development of more fuel-efficient aircraft and engines to reduce operating costs. They are also exploring the creation of lower and zero-emission commercial aircraft for the future. According to Deloitte's outlook survey, 88% of senior executives surveyed expressed an optimistic outlook for the aerospace and defense industry in the coming year, ranging from somewhat positive to very positive. Several factors contribute to this optimism, including advancements in new technologies and sectors like advanced air mobility, evolving business models in areas such as space exploration, and the adoption of digital thread and smart factory practices. Aerospace and defense companies that prioritize innovation and are prepared to seize emerging opportunities are likely to outperform their peers in 2023, as per Deloitte. Story continuesAlso Read: Goldman Sachs AI Stocks: Top 10 Stock PicksDespite facing temporary operational challenges, FitchRatings maintains a positive outlook for the global Aerospace &amp; Defense sector in 2023. The industry is expected to maintain positive free cash flow generation and improved financial flexibility throughout the year, which should help mitigate short-term issues such as a decrease in aircraft deliveries. The robust demand for air travel and the aging aircraft fleets underline the necessity for new deliveries, exemplified by the combined backlog of Boeing and Airbus, which exceeds $700 billion or comprises more than 12,000 aircraft over multiple years. FitchRatings’ initial projection for 2023 commercial aircraft deliveries by Airbus and Boeing, which started the year at a 20% growth rate, has been adjusted downward to a low-teens growth rate. This revision is primarily driven by ongoing supply chain challenges, especially at Airbus. The new forecast anticipates more than 1,250 aircraft deliveries in 2023 compared to 1,140 in 2022, with Boeing contributing the majority of this growth.See Also: Goldman Sachs EV and Battery Stocks: Top 10 Stock PicksTo benefit from the growth potential in the defense industry, the Goldman Sachs portfolio holds stocks including Lockheed Martin Corporation (NYSE:LMT), RTX Corporation (NYSE:RTX), and The Boeing Company (NYSE:BA). Our Methodology We used Goldman Sachs’ Q2 2023 portfolio and selected the 10 biggest positions in defense firms during the quarter for this list. We have mentioned Goldman Sachs’ stake value and the hedge fund sentiment towards each stock as of the second quarter of 2023. The list is ranked in the ascending order of the firm’s stake value in each holding. Goldman Sachs Defense Stocks: Top 10 Stock PicksPhoto by Somchai Kongkamsri from PexelsGoldman Sachs Defense Stocks: Top Stock Picks10. Textron Inc. (NYSE:TXT)Goldman Sachs’ Stake Value: $116,607,175Number of Hedge Fund Holders: 28Textron Inc. (NYSE:TXT) conducts its operations globally across several sectors, including aircraft, defense, industrial, and finance. The company's activities are divided into six segments – Textron Aviation, Bell, Textron Systems, Industrial, Textron eAviation, and Finance. On August 7, Textron Inc. (NYSE:TXT) was granted a contract worth approximately $241.37 million by the U.S. Navy. This contract is for the procurement of materials and non-recurring activities related to five Ship to Shore Connector Landing Craft Air Cushion 100 Class. The project is scheduled to be finished by October 2025.Securities filings for the second quarter of 2023 reveal that Goldman Sachs held 1.72 million shares of Textron Inc. (NYSE:TXT) worth $116.60 million. According to Insider Monkey’s second quarter database, 28 hedge funds were bullish on Textron Inc. (NYSE:TXT), compared to 25 funds in the preceding quarter. Cliff Asness’ AQR Capital Management is the largest stakeholder of the company, with 1.78 million shares worth $120.6 million. In addition to Lockheed Martin Corporation (NYSE:LMT), RTX Corporation (NYSE:RTX), and The Boeing Company (NYSE:BA), Textron Inc. (NYSE:TXT) is one of the best Goldman Sachs defense stocks. 9. TransDigm Group Incorporated (NYSE:TDG)Goldman Sachs’ Stake Value: $141,507,189Number of Hedge Fund Holders: 67TransDigm Group Incorporated (NYSE:TDG) engages in the design, manufacturing, and distribution of aircraft parts worldwide. The company's operations are divided into three segments – Power &amp; Control, Airframe, and Non-aviation. TransDigm Group Incorporated (NYSE:TDG) caters to a wide range of customers, including suppliers of engine and power system components, airlines, third-party maintenance providers, military procurement agencies, and repair facilities. It is one of the top Goldman Sachs defense stocks. In Q2 2023, Goldman Sachs owned a $141.5 million position in TransDigm Group Incorporated (NYSE:TDG). On August 8, TransDigm Group Incorporated (NYSE:TDG) reported financial results for the quarter ended July 1, 2023. The company announced a non-GAAP EPS of $7.25 and a revenue of $1.74 billion, outperforming Wall Street estimates by $0.85 and $55.16 million. According to Insider Monkey’s second quarter database, 67 hedge funds were bullish on TransDigm Group Incorporated (NYSE:TDG), same as the prior quarter. Mark Massey’s AltaRock Partners is the leading stakeholder of the company, with 1.35 million shares worth $1.2 billion. Baron Small Cap Fund made the following comment about TransDigm Group Incorporated (NYSE:TDG) in its second quarter 2023 investor letter:“We have had some extraordinary winners over time. For instance, we bought DexCom, Inc. at a $950 million market cap in 2012, and it is now valued at $50 billion (the stock has appreciated 41% annually since the Fund’s initial purchase). TransDigm Group Incorporated (NYSE:TDG) has grown from $1.1 billion at purchase to $49 billion presently (and the stock has appreciated 29% annually since the Fund’s initial purchase 17 years ago). IDEXX Laboratories, Inc. has gone from $2 billion at purchase to $42 billion over almost 15 years and the stock has appreciated 26% annually during that time frame. The Trade Desk is now valued at $38 billion and was $433 million when we first purchased shares over 6 years ago. The stock has appreciated almost 60% annually since our initial purchase. Pretty amazing. All four stocks have been solid performers this year, contributing nicely to the Fund’s returns.Since we run a small-cap fund but want to hold on to these great investments as they continue to compound and perform, we reduce the positions sizes over the holding period so that the overall market capitalization of the Fund is palatable. For each of the four stocks mentioned above, we presently own 11% or less of our peak positions. We take the proceeds from the trimming of these positions to fund new small-cap investments, with the hopes of somehow replicating these results.”8. Howmet Aerospace Inc. (NYSE:HWM)Goldman Sachs’ Stake Value: $155,037,691Number of Hedge Fund Holders: 49Howmet Aerospace Inc. (NYSE:HWM) offers advanced engineered solutions for the aerospace and transportation sectors globally. The company operates through four segments – Engine Products, Fastening Systems, Engineered Structures, and Forged Wheels. The Engineered Structures segment specializes in providing products and services such as titanium ingots, aluminum and nickel forgings, machined components, and assemblies for aerospace and defense applications. Howmet Aerospace Inc. (NYSE:HWM) is one of the top Goldman Sachs defense stocks, with the firm holding a $155 million position in the company as of Q2 2023. On August 1, Howmet Aerospace Inc. (NYSE:HWM) reported a Q2 non-GAAP EPS of $0.44 and a revenue of $1.65 billion, outperforming Wall Street estimates by $0.01 and $40 million, respectively. The company ended the second quarter with a cash balance of $536 million.According to Insider Monkey’s second quarter database, 49 hedge funds were long Howmet Aerospace Inc. (NYSE:HWM), compared to 42 funds in the prior quarter. Paul Singer’s Elliott Management is the largest stakeholder of the company, with 17 million shares worth $847.2 million. Oakmark Equity and Income Fund made the following comment about Howmet Aerospace Inc. (NYSE:HWM) in its Q1 2023 investor letter:“During the quarter, we eliminated three positions: Howmet Aerospace Inc. (NYSE:HWM), Keurig Dr Pepper and LivaNova. Howmet performed well and reached our sell target. This is our second successful investment with CEO John Plant, whom we rank among the top CEOs.”7. L3Harris Technologies, Inc. (NYSE:LHX)Goldman Sachs’ Stake Value: $186,559,116Number of Hedge Fund Holders: 35L3Harris Technologies, Inc. (NYSE:LHX) is an aerospace and defense technology firm that delivers commercial solutions for governmental and commercial clients worldwide. On August 31, L3Harris Technologies, Inc. (NYSE:LHX) declared a $1.14 per share quarterly dividend, in line with previous. The dividend is distributable on September 19, to shareholders of record on September 5. L3Harris Technologies, Inc. (NYSE:LHX) is one of the top Goldman Sachs defense stocks. Goldman Sachs owned 952,950 shares of L3Harris Technologies, Inc. (NYSE:LHX) worth $186.5 million during the second quarter of 2023. According to Insider Monkey’s second quarter database, 35 hedge funds were bullish on L3Harris Technologies, Inc. (NYSE:LHX), compared to 46 funds in the preceding quarter. Dmitry Balyasny’s Balyasny Asset Management is the leading position holder in the company, with 1.27 million shares worth $250.5 million.  6. Northrop Grumman Corporation (NYSE:NOC)Goldman Sachs’ Stake Value: $273,998,676Number of Hedge Fund Holders: 40Northrop Grumman Corporation (NYSE:NOC) functions as a global aerospace and defense company. Its operations are divided into Aeronautics Systems, Defense Systems, Mission Systems, and Space Systems segments. At the conclusion of the second quarter of 2023, Goldman Sachs held 601,138 shares of Northrop Grumman Corporation (NYSE:NOC) worth approximately $274 million. On August 16, Northrop Grumman Corporation (NYSE:NOC) declared a quarterly dividend of $1.87 per share, in line with previous. The dividend is payable on September 13, to shareholders of record on August 28. According to Insider Monkey’s second quarter database, 40 hedge funds were bullish on Northrop Grumman Corporation (NYSE:NOC), compared to 45 funds in the prior quarter. Donald Yacktman’s Yacktman Asset Management is a prominent stakeholder of the company, with 409,839 shares worth $186.80 million.  Like Lockheed Martin Corporation (NYSE:LMT), RTX Corporation (NYSE:RTX), and The Boeing Company (NYSE:BA), Northrop Grumman Corporation (NYSE:NOC) is one of the top Goldman Sachs defense stocks. Harding Loevner Global Equity Strategy made the following comment about Northrop Grumman Corporation (NYSE:NOC) in its Q1 2023 investor letter:“Our other purchase was Northrop Grumman Corporation (NYSE:NOC), a US defense contractor whose stock price experienced a pullback. We like that Northrop has a larger presence than its rivals in the most favorable subcategories of the defense industry-namely, nuclear weapons, space systems, and what’s known as C4ISR (which stands for Command, Control, Communications, Computers. Intelligence, Surveillance, and Reconnaissance). C4ISR refers to digital systems that translate data picked up from different sensors-such as an incoming hypersonic missile or advancing troops-into a common format, and then escalate key information to the right people These differentiated technologies are especially relevant in a time of increased geopolitical tensions. Northrop also benefits from large barriers to entry in this stable industry, which should enable continued strong earnings and cash flow.” Click to continue reading and see Goldman Sachs Defense Stocks: Top 5 Stock Picks.  Suggested articles:15 Highest Paying Countries for Architects10 Best Uninterrupted Power Supplies in 202325 Richest to Poorest Countries in Europe by GDP Per Capita (PPP) Disclosure: None. Goldman Sachs Defense Stocks: Top 10 Stock Picks is originally published on Insider Monkey.]"
38,708bbda8-f433-37fb-8a49-edc0d5884a63,FOXA,2023-09-03,Judge Tosses Conviction of Former Fox Executive in FIFA Bribery Case,The Wall Street Journal,https://finance.yahoo.com/m/708bbda8-f433-37fb-8a49-edc0d5884a63/judge-tosses-conviction-of.html,1693677420,STORY,"['FOX', 'FOXA']",[Hernan Lopez had been found guilty of bribing soccer officials to secure broadcasting rights to World Cup-related matches.Continue reading]
39,7cccfc5c-9e4d-3325-8a08-ad0c6b642c15,PYPL,2023-09-03,"Positive week for PayPal Holdings, Inc. (NASDAQ:PYPL) institutional investors who lost 30% over the past year",Simply Wall St.,https://finance.yahoo.com/news/positive-week-paypal-holdings-inc-140020012.html,1693663220,STORY,['PYPL'],"[Key InsightsGiven the large stake in the stock by institutions, PayPal Holdings' stock price might be vulnerable to their trading decisionsA total of 25 investors have a majority stake in the company with 40% ownershipOwnership research along with  analyst forecasts data  help provide a good understanding of opportunities in a stockEvery investor in PayPal Holdings, Inc. (NASDAQ:PYPL) should be aware of the most powerful shareholder groups. And the group that holds the biggest piece of the pie are institutions with 72% ownership. That is, the group stands to benefit the most if the stock rises (or lose the most if there is a downturn).After a year of 30% losses, last week’s 3.9% gain would be welcomed by institutional investors as a likely sign that returns might start trending higher.Let's delve deeper into each type of owner of PayPal Holdings, beginning with the chart below. Check out our latest analysis for PayPal Holdings ownership-breakdownWhat Does The Institutional Ownership Tell Us About PayPal Holdings?Many institutions measure their performance against an index that approximates the local market. So they usually pay more attention to companies that are included in major indices.PayPal Holdings already has institutions on the share registry. Indeed, they own a respectable stake in the company. This can indicate that the company has a certain degree of credibility in the investment community. However, it is best to be wary of relying on the supposed validation that comes with institutional investors. They too, get it wrong sometimes. If multiple institutions change their view on a stock at the same time, you could see the share price drop fast. It's therefore worth looking at PayPal Holdings' earnings history below. Of course, the future is what really matters.earnings-and-revenue-growthInstitutional investors own over 50% of the company, so together than can probably strongly influence board decisions. We note that hedge funds don't have a meaningful investment in PayPal Holdings. Looking at our data, we can see that the largest shareholder is The Vanguard Group, Inc. with 8.4% of shares outstanding. In comparison, the second and third largest shareholders hold about 6.8% and 4.2% of the stock.Story continuesOur studies suggest that the top 25 shareholders collectively control less than half of the company's shares, meaning that the company's shares are widely disseminated and there is no dominant shareholder.While it makes sense to study institutional ownership data for a company, it also makes sense to study analyst sentiments to know which way the wind is blowing. There are a reasonable number of analysts covering the stock, so it might be useful to find out their aggregate view on the future.Insider Ownership Of PayPal HoldingsThe definition of an insider can differ slightly between different countries, but members of the board of directors always count. Company management run the business, but the CEO will answer to the board, even if he or she is a member of it.Most consider insider ownership a positive because it can indicate the board is well aligned with other shareholders. However, on some occasions too much power is concentrated within this group.Our information suggests that PayPal Holdings, Inc. insiders own under 1% of the company. Being so large, we would not expect insiders to own a large proportion of the stock. Collectively, they own US$105m of stock. In this sort of situation, it can be more interesting to  see if those insiders have been buying or selling. General Public OwnershipThe general public, who are usually individual investors, hold a 27% stake in PayPal Holdings. While this size of ownership may not be enough to sway a policy decision in their favour, they can still make a collective impact on company policies.Next Steps:While it is well worth considering the different groups that own a company, there are other factors that are even more important.I always like to check for a history of revenue growth. You can too, by accessing this free chart of historic revenue and earnings in this detailed graph.But ultimately  it is the future, not the past, that will determine how well the owners of this business will do. Therefore we think it advisable to take a look at this free report showing whether analysts are predicting a brighter future.NB: Figures in this article are calculated using data from the last twelve months, which refer to the 12-month period ending on the last date of the month the financial statement is dated. This may not be consistent with full year annual report figures.Have feedback on this article? Concerned about the content? Get in touch with us directly. Alternatively, email editorial-team (at) simplywallst.com.This article by Simply Wall St is general in nature. We provide commentary based on historical data and analyst forecasts only using an unbiased methodology and our articles are not intended to be financial advice. It does not constitute a recommendation to buy or sell any stock, and does not take account of your objectives, or your financial situation. We aim to bring you long-term focused analysis driven by fundamental data. Note that our analysis may not factor in the latest price-sensitive company announcements or qualitative material. Simply Wall St has no position in any stocks mentioned.]"
40,67bab166-6094-315b-8ae0-f6f177213f98,IBM,2023-09-03,Here's Why I'm Buying The Dip on This Beaten-Down AI Stock,Motley Fool,https://finance.yahoo.com/m/67bab166-6094-315b-8ae0-f6f177213f98/here%27s-why-i%27m-buying-the-dip.html,1693741860,STORY,"['ZI', 'IBM']","[ZoomInfo (NASDAQ: ZI) is a head-scratcher right now. At the same time, ZoomInfo's stock lost 70% of its value. The price drop only grows more confusing when you consider how closely ZoomInfo's business model relates to the ongoing market frenzy for artificial intelligence (AI) stocks.Continue reading]"
41,c2428f92-98b0-3e0f-acaf-512acbf181c8,GM,2023-09-03,"GM, Google collaborating on generative AI uses for automaker",Fox Business,https://finance.yahoo.com/news/gm-google-collaborating-generative-ai-160003046.html,1693670403,STORY,['GM'],[]
42,17e43ad0-b273-3110-834d-0791b656b89e,TGT,2023-09-03,5 Top Stocks for September,Motley Fool,https://finance.yahoo.com/m/17e43ad0-b273-3110-834d-0791b656b89e/5-top-stocks-for-september.html,1693734300,STORY,"['DHI', 'MELI', 'TGT', 'NEE', 'DIS', 'ENPH']",[These options are great for those looking for opportunities in the bargain bin or trying to ride the momentum of some hot stocks.Continue reading]
