,Id,Company,Date,Title,Publisher,Link,ProviderPublishTime,Type,Related Company,Text
0,16231021-a8e9-309e-a511-7cb183e8820d,SCHW,2023-04-10,The Charles Schwab Corporation's (NYSE:SCHW)) market cap declines to US$90b but insiders who sold US$140m stock were able to hedge their losses,Simply Wall St.,https://finance.yahoo.com/news/charles-schwab-corporations-nyse-schw-110029978.html,1681124429,STORY,['SCHW'],"[By selling US$140m worth of The Charles Schwab Corporation (NYSE:SCHW) stock at an average sell price of US$74.88 over the last year, insiders seemed to have made the most of their holdings. The company's market worth decreased by US$4.0b over the past week after the stock price dropped 4.3%, although insiders were able to minimize their lossesAlthough we don't think shareholders should simply follow insider transactions, logic dictates you should pay some attention to whether insiders are buying or selling shares. See our latest analysis for Charles Schwab Charles Schwab Insider Transactions Over The Last YearThe Founder &amp; Co-Chairman, Charles Schwab, made the biggest insider sale in the last 12 months. That single transaction was for US$25m worth of shares at a price of US$80.10 each. While insider selling is a negative, to us, it is more negative if the shares are sold at a lower price. The silver lining is that this sell-down took place above the latest price (US$49.35). So it is hard to draw any strong conclusion from it.Happily, we note that in the last year insiders paid US$17m for 275.84k shares. But they sold 1.87m shares for US$140m. Over the last year we saw more insider selling of Charles Schwab shares, than buying. The chart below shows insider transactions (by companies and individuals) over the last year. By clicking on the graph below, you can see the precise details of each insider transaction!insider-trading-volumeI will like Charles Schwab better if I see some big insider buys. While we wait, check out this free list of growing companies with considerable, recent, insider buying.Charles Schwab Insiders Are Selling The StockThere was substantially more insider selling, than buying, of Charles Schwab shares over the last three months. In that time, insiders dumped US$49m worth of shares. On the flip side, insiders spent US$7.9m on purchasing shares. Since the selling really does outweigh the buying, we'd say that these transactions may suggest that some insiders feel the company has been fully valued in recent months.Story continuesDoes Charles Schwab Boast High Insider Ownership?Looking at the total insider shareholdings in a company can help to inform your view of whether they are well aligned with common shareholders. We usually like to see fairly high levels of insider ownership. Charles Schwab insiders own about US$5.5b worth of shares (which is 6.2% of the company). I like to see this level of insider ownership, because it increases the chances that management are thinking about the best interests of shareholders.So What Do The Charles Schwab Insider Transactions Indicate?The stark truth for Charles Schwab is that there has been more insider selling than insider buying in the last three months. Despite some insider buying, the longer term picture doesn't make us feel much more positive. But since Charles Schwab is profitable and growing, we're not too worried by this. It is good to see high insider ownership, but the insider selling leaves us cautious. So these insider transactions can help us build a thesis about the stock, but it's also worthwhile knowing the risks facing this company. Every company has risks, and we've spotted 2 warning signs for Charles Schwab you should know about.But note: Charles Schwab may not be the best stock to buy. So take a peek at this free list of interesting companies with high ROE and low debt.For the purposes of this article, insiders are those individuals who report their transactions to the relevant regulatory body. We currently account for open market transactions and private dispositions, but not derivative transactions.Have feedback on this article? Concerned about the content? Get in touch with us directly. Alternatively, email editorial-team (at) simplywallst.com.This article by Simply Wall St is general in nature. We provide commentary based on historical data and analyst forecasts only using an unbiased methodology and our articles are not intended to be financial advice. It does not constitute a recommendation to buy or sell any stock, and does not take account of your objectives, or your financial situation. We aim to bring you long-term focused analysis driven by fundamental data. Note that our analysis may not factor in the latest price-sensitive company announcements or qualitative material. Simply Wall St has no position in any stocks mentioned.Join A Paid User Research SessionYou’ll receive a US$30 Amazon Gift card for 1 hour of your time while helping us build better investing tools for the individual investors like yourself. Sign up here]"
1,53e6e181-ed3b-31a6-a335-29354f1ec139,TXN,2023-04-10,Estimating The Fair Value Of Texas Instruments Incorporated (NASDAQ:TXN),Simply Wall St.,https://finance.yahoo.com/news/estimating-fair-value-texas-instruments-110012852.html,1681124412,STORY,['TXN'],"[Key InsightsUsing the 2 Stage Free Cash Flow to Equity, Texas Instruments fair value estimate is US$168Texas Instruments' US$178 share price indicates it is trading at similar levels as its fair value estimate Analyst price target for TXN is US$183, which is 9.0% above our fair value estimateIn this article we are going to estimate the intrinsic value of Texas Instruments Incorporated (NASDAQ:TXN) by taking the forecast future cash flows of the company and discounting them back to today's value. One way to achieve this is by employing the Discounted Cash Flow (DCF) model. Models like these may appear beyond the comprehension of a lay person, but they're fairly easy to follow.Remember though, that there are many ways to estimate a company's value, and a DCF is just one method. If you still have some burning questions about this type of valuation, take a look at the Simply Wall St analysis model. See our latest analysis for Texas Instruments The ModelWe are going to use a two-stage DCF model, which, as the name states, takes into account two stages of growth. The first stage is generally a higher growth period which levels off heading towards the terminal value, captured in the second 'steady growth' period. In the first stage we need to estimate the cash flows to the business over the next ten years. Where possible we use analyst estimates, but when these aren't available we extrapolate the previous free cash flow (FCF) from the last estimate or reported value. We assume companies with shrinking free cash flow will slow their rate of shrinkage, and that companies with growing free cash flow will see their growth rate slow, over this period. We do this to reflect that growth tends to slow more in the early years than it does in later years.A DCF is all about the idea that a dollar in the future is less valuable than a dollar today, so we discount the value of these future cash flows to their estimated value in today's dollars:Story continues10-year free cash flow (FCF) forecast2023202420252026202720282029203020312032 Levered FCF ($, Millions) US$4.31bUS$5.54bUS$6.69bUS$8.77bUS$11.0bUS$12.7bUS$14.1bUS$15.3bUS$16.3bUS$17.1bGrowth Rate Estimate SourceAnalyst x11Analyst x9Analyst x6Analyst x2Analyst x2Est @ 15.14%Est @ 11.22%Est @ 8.47%Est @ 6.55%Est @ 5.21% Present Value ($, Millions) Discounted @ 9.7% US$3.9kUS$4.6kUS$5.1kUS$6.0kUS$6.9kUS$7.2kUS$7.3kUS$7.3kUS$7.0kUS$6.8k(""Est"" = FCF growth rate estimated by Simply Wall St)Present Value of 10-year Cash Flow (PVCF) = US$62bAfter calculating the present value of future cash flows in the initial 10-year period, we need to calculate the Terminal Value, which accounts for all future cash flows beyond the first stage. The Gordon Growth formula is used to calculate Terminal Value at a future annual growth rate equal to the 5-year average of the 10-year government bond yield of 2.1%. We discount the terminal cash flows to today's value at a cost of equity of 9.7%.Terminal Value (TV)= FCF2032 × (1 + g) ÷ (r – g) = US$17b× (1 + 2.1%) ÷ (9.7%– 2.1%) = US$228bPresent Value of Terminal Value (PVTV)= TV / (1 + r)10= US$228b÷ ( 1 + 9.7%)10= US$90bThe total value is the sum of cash flows for the next ten years plus the discounted terminal value, which results in the Total Equity Value, which in this case is US$152b. The last step is to then divide the equity value by the number of shares outstanding. Compared to the current share price of US$178, the company appears around fair value at the time of writing. The assumptions in any calculation have a big impact on the valuation, so it is better to view this as a rough estimate, not precise down to the last cent.dcfThe AssumptionsNow the most important inputs to a discounted cash flow are the discount rate, and of course, the actual cash flows. You don't have to agree with these inputs, I recommend redoing the calculations yourself and playing with them. The DCF also does not consider the possible cyclicality of an industry, or a company's future capital requirements, so it does not give a full picture of a company's potential performance. Given that we are looking at Texas Instruments as potential shareholders, the cost of equity is used as the discount rate, rather than the cost of capital (or weighted average cost of capital, WACC) which accounts for debt. In this calculation we've used 9.7%, which is based on a levered beta of 1.292. Beta is a measure of a stock's volatility, compared to the market as a whole. We get our beta from the industry average beta of globally comparable companies, with an imposed limit between 0.8 and 2.0, which is a reasonable range for a stable business.SWOT Analysis for Texas InstrumentsStrengthDebt is not viewed as a risk.Dividends are covered by earnings and cash flows.WeaknessEarnings growth over the past year underperformed the Semiconductor industry.Dividend is low compared to the top 25% of dividend payers in the Semiconductor market.Expensive based on P/E ratio and estimated fair value.OpportunityAnnual earnings are forecast to grow for the next 3 years.ThreatAnnual earnings are forecast to grow slower than the American market.Next Steps:Although the valuation of a company is important, it shouldn't be the only metric you look at when researching a company. The DCF model is not a perfect stock valuation tool. Preferably you'd apply different cases and assumptions and see how they would impact the company's valuation. For instance, if the terminal value growth rate is adjusted slightly, it can dramatically alter the overall result. For Texas Instruments, we've put together three relevant elements you should look at:Risks: For example, we've discovered 2 warning signs for Texas Instruments (1 shouldn't be ignored!) that you should be aware of before investing here.Management:Have insiders been ramping up their shares to take advantage of the market's sentiment for TXN's future outlook? Check out our management and board analysis with insights on CEO compensation and governance factors.Other High Quality Alternatives: Do you like a good all-rounder? Explore our interactive list of high quality stocks to get an idea of what else is out there you may be missing!PS. The Simply Wall St app conducts a discounted cash flow valuation for every stock on the NASDAQGS every day. If you want to find the calculation for other stocks just search here.Have feedback on this article? Concerned about the content? Get in touch with us directly. Alternatively, email editorial-team (at) simplywallst.com.This article by Simply Wall St is general in nature. We provide commentary based on historical data and analyst forecasts only using an unbiased methodology and our articles are not intended to be financial advice. It does not constitute a recommendation to buy or sell any stock, and does not take account of your objectives, or your financial situation. We aim to bring you long-term focused analysis driven by fundamental data. Note that our analysis may not factor in the latest price-sensitive company announcements or qualitative material. Simply Wall St has no position in any stocks mentioned.Join A Paid User Research SessionYou’ll receive a US$30 Amazon Gift card for 1 hour of your time while helping us build better investing tools for the individual investors like yourself. Sign up here]"
2,e5a77005-310a-3132-8953-f6d70fab4384,AYI,2023-04-10,"Acuity Brands, Inc. (NYSE:AYI) Q2 2023 Earnings Call Transcript",Insider Monkey,https://finance.yahoo.com/news/acuity-brands-inc-nyse-ayi-144652007.html,1681051612,STORY,['AYI'],"[Acuity Brands, Inc. (NYSE:AYI) Q2 2023 Earnings Call Transcript April 4, 2023Operator: Good morning and welcome to the Acuity Brands Fiscal 2023 Second Quarter Earnings Call. Please be advised that today's conference is being recorded. I'd now like to hand the conference over to Charlotte McLaughlin, Vice President of Investor Relations. Charlotte, please go ahead.Charlotte McLaughlin: Thank you, Liz. Good morning and welcome to the Acuity Brands fiscal 2023 second quarter earnings call. As a reminder, some of our comments today may be forward-looking statements based on our management's beliefs and assumptions and information currently available to our management at this time. These beliefs are subject to known and unknown risks and uncertainties, many of which may be beyond our control, including those detailed in our periodic SEC filings. Please note that our company's actual results may differ materially from those anticipated and we undertake no obligation to update these results. Reconciliations of certain non-GAAP financial metrics with their corresponding GAAP measures are available in our 2023 second quarter earnings release which is available on our Investor Relations website at www.investors.acuitybrands.com.With me this morning is Neil Ashe, our Chairman, President and Chief Executive Officer, who will provide an update on our strategy and our fiscal second quarter highlights and Karen Holcom, our Senior Vice President and Chief Financial Officer, who will walk us through our fiscal second quarter financial performance. There will be an opportunity for Q&amp;A at the end of this call. We are webcasting today's conference call live. Thank you for your interest in Acuity Brands. I will now turn the call over to Neil Ashe.Neil Ashe: Thank you, Charlotte. Good morning and welcome to all of you joining us on this call. We delivered solid performance again in the second quarter of fiscal '23. We grew sales in both our lighting and spaces businesses, expanded adjusted operating profit and grew adjusted diluted earnings per share. We generated strong cash flow from operations and created permanent value for shareholders through share repurchases. Both our lighting and spaces businesses delivered solid revenue while improving adjusted operating profit. In the Acuity Brands, lighting and Lighting Controls business, our strategy of increasing product vitality and service levels continue to differentiate us in the market. A few weeks ago, we hosted our annual sales conference in Atlanta, NEXT 23.Story continuesIt was a great event, where we brought together our network of independent sales agents and shared our strategic vision for ABL and introduced new products. I'd like to take a minute to describe our independent sales network. Stated simply, we have the best agency network in the industry. To give you an idea of their scope, we have about 80 agents in North America and they have about 50 employees per agency. In other words, we have over 4,000 local sales and sales support people working for us every day throughout North America. While our agents are independent, they are exclusive to us for key controls and do not represent the other majors. They are generally the largest in their market and we are their most important partner. Our partnership works very well.With our product vitality and service efforts, we make products that deserve to be chosen and our independent sales agents ensure that they are chosen. Product vitality is driving success across our portfolio and during NEXT 23, we introduced several new products. I want to highlight a couple here. The first was the new nLight AIR System Input Device. This is an indoor controller that can be used in multiple spaces, including office, commercial and retail. The device converts analog outputs to wireless broadcast to control intelligent luminaires. This reduces the need for complex wiring solutions during installation and reduces the associated cost for the customer. The second was the nLight AIR rPOD Micro. This is a battery-powered wall switch that can be used as a traditional wall switch or as a remote, providing control from anywhere within a build space.buildings, real estate, workerPhoto by Tolu Olubode on UnsplashThis is a really exciting extension of the technology and an elegant response to our customers' need for flexibility. These and other products continue to gain market attention. This quarter, several of our architectural lighting brands, A-Light, Eureka and Luminis, won a total of eight Good Design Awards from the Chicago Athenaeum which recognizes products and industry leaders in design and manufacturing that have chartered new directions for innovation. Now moving to our Intelligent Spaces Group. The spaces team continued to perform well, delivering another quarter of solid sales and operating profit growth, driven by the continued success of Distech. Distech is winning because we have the best digital control solutions in the market. It's technology is open protocol which means you can connect our controller to most new or existing systems in a build space, giving our customers significant flexibility.We are also winning because Distech goes to market through independent system integrators. We are continually curating the highest quality network of SIs in each market in which we compete. Our focus is on expanding the addressable market for Distech which we have started to do in two ways. The first is geographic, as we mentioned last quarter. Today, we sell our controls primarily in the U.S., Canada and France and we are expanding our presence in the U.K. and in the future in Asia. As we enter new markets, we are identifying and recruiting the highest-quality SIs as our partners. Second, we believe that any control that is currently mechanical or analog will become digital over time. So we are increasing what we can control and build spaces; this will provide us a second vector for continued growth.Finally, I also joined our spaces team at the AHR Expo in Atlanta, where HVACR professionals gathered to share ideas and to showcase technology. It was great to hear firsthand from the SIs there, how differentiated our Distech and Atrius products are. Now looking to the rest of fiscal 2023. We've been intentional around our product vitality and service efforts and how we operate the business. We have demonstrated our ability to manage price and cost, both in our go-to-market efforts and in our operations. Today, we are in greater control of the things we can control than we have ever been. As you know, there are meaningful changes in the economic climate. During the quarter, we began to see a slowing in the order rate for our project business, while we continue to work through our extended backlog.We believe that the slower order rate is driven by the lead time compression that we discussed last quarter and now the changing C&amp;I lending environment. At the same time, our Contractor Select business continued to be strong. We will continue our focus on end markets and identifying new ways to grow. As we deal with these changing market conditions, our focus is on generating profits and turning those profits into cash. We are continuing to manage the price/cost relationship and we'll continue to generate strong cash flow. In closing, we entered the second half of fiscal '23 with our strategy unchanged. We are in control of what we can control and we are confident in our ability to adapt to the changing market conditions and requirements of our customers.Now I'll turn the call over to Karen, who will update you on our second quarter performance.Karen Holcom: Thank you, Neil. We delivered a solid performance in the second quarter of 2023. Sales in both businesses grew, delivering improved adjusted operating profit and margins and adjusted diluted EPS. We generated strong cash flow from operations and continued to allocate capital effectively. In the second quarter, we generated net sales of $944 million which is 4% higher than the prior year. This was largely due to price with both the ABL and ISG businesses contributing to the growth during the quarter. Operating profit in the second quarter was $112 million and adjusted operating profit increased $10 million to $132 million from the prior year. Adjusted operating profit margin improved 50 basis points over the prior year to 14%.The improvement in adjusted operating profit and adjusted operating profit margin was a result of the increase in gross profit performance as we successfully managed price and cost. Finally, we continued to grow adjusted diluted earnings per share. Our diluted earnings per share of $2.57 was an increase of $0.44 or 21% year-over-year while our adjusted diluted earnings per share of $3.06 increased $0.49 or 19% over the prior year. The growth in adjusted diluted earnings per share was primarily due to higher operating profit and lower shares outstanding due to the share repurchases. Moving to our segment performance review. ABL, net sales grew to $891 million, an increase of 3% compared with the prior year. This increase was primarily driven by higher year-over-year sales in our independent sales network, the direct sales network and the retail channel.As Neil mentioned, the order rate related to our project business slowed during the quarter, However, our Contractor Select business targeted at distributors and retail continued to grow. ABL's operating profit was $124 million, an increase of 6% versus the prior year with ABL adjusted operating profit at $133 million, an increase of 5% versus the prior year. The adjusted operating profit margin was 15% which was 30 basis points better than last year. The improvement was a result of our ability to manage price and cost. Now moving to ISG. The spaces segment continued to perform well with another good quarter of net sales growth and improved adjusted operating profit. Sales in the second quarter of 2023 were $58 million, an increase of $8 million or 16% versus the prior year, primarily as a result of the growth in Distech.During the quarter, both Distech and Atrius delivered growth across new and existing customers. Operating profit in the second quarter of 2023 increased to approximately $6 million this quarter, with ISG adjusted operating profit at $11 million. Now, I want to expand on our cash flow performance. We generated $306 million of cash flow from operating activities for the first 6 months of fiscal 2023, an increase of $179 million over the prior year's first half, driven largely by improvements in working capital. Last year, we invested in inventory in order to support our growth as well as insulate our production facilities from inconsistent supply availability with the intention of working down that inventory over several quarters which we have done.We are now down 16 inventory days from the peak in February of 2022 and we have brought inventory levels down by over $50 million sequentially from the first quarter of fiscal 2023. We also invested $36 million in capital expenditures and $124 million to repurchase approximately 700,000 shares during the first half of fiscal 2023. As we said before, our capital allocation priorities remain the same. We have invested for growth in our current businesses through R&amp;D and CapEx. We've expanded our platform through acquisitions as evidenced by the purchase of OPTOTRONIC in our lighting business. We've maintained our dividend and we've created a permanent shareholder value through over $1.1 billion of share repurchases since the fourth quarter of fiscal 2020 which was funded by our organic cash flow generation.Before I turn the call to the operator for questions, I want to summarize our performance. We continued to deliver solid performance in the second quarter of 2023. We grew sales in both our lighting and spaces businesses, we improved adjusted operating profit and margins and grew adjusted diluted earnings per share. We generated strong cash flow from operations and created a permanent value for shareholders through share repurchases. Our guidance provided for fiscal 2023 remains unchanged and we are continuing to focus on what we can control and position ourselves to quickly adapt to changing market conditions. Thank you for joining us today. I will now pass you over to the operator to take your questions.See also 15 Fastest Growing QSR Chains in India and 12 Best WallStreetBets Stocks To Buy Now.To continue reading the Q&amp;A session, please click here.]"
