,Id,Company,Date,Title,Publisher,Link,ProviderPublishTime,Type,Related Company,Text
65,00a18be5-6084-3731-8a2b-839804c57a7d,GS,2023-03-25,Are You Looking for a High-Growth Dividend Stock?,Zacks,https://finance.yahoo.com/news/looking-high-growth-dividend-stock-154503785.html,1679672703,STORY,"['GS', 'GSBD']","[Whether it's through stocks, bonds, ETFs, or other types of securities, all investors love seeing their portfolios score big returns. But for income investors, generating consistent cash flow from each of your liquid investments is your primary focus.Cash flow can come from bond interest, interest from other types of investments, and of course, dividends. A dividend is that coveted distribution of a company's earnings paid out to shareholders, and investors often view it by its dividend yield, a metric that measures the dividend as a percent of the current stock price. Many academic studies show that dividends make up large portions of long-term returns, and in many cases, dividend contributions surpass one-third of total returns.Goldman Sachs in FocusBased in New York, Goldman Sachs (GS) is in the Finance sector, and so far this year, shares have seen a price change of -8.31%. The investment bank is currently shelling out a dividend of $2.5 per share, with a dividend yield of 3.18%. This compares to the Financial - Investment Bank industry's yield of 0.5% and the S&amp;P 500's yield of 1.81%.In terms of dividend growth, the company's current annualized dividend of $10 is up 11.1% from last year. In the past five-year period, Goldman Sachs has increased its dividend 4 times on a year-over-year basis for an average annual increase of 29.39%. Looking ahead, future dividend growth will be dependent on earnings growth and payout ratio, which is the proportion of a company's annual earnings per share that it pays out as a dividend. Goldman's current payout ratio is 33%, meaning it paid out 33% of its trailing 12-month EPS as dividend.Looking at this fiscal year, GS expects solid earnings growth. The Zacks Consensus Estimate for 2023 is $33.14 per share, with earnings expected to increase 10.25% from the year ago period.Bottom LineInvestors like dividends for many reasons; they greatly improve stock investing profits, decrease overall portfolio risk, and carry tax advantages, among others. It's important to keep in mind that not all companies provide a quarterly payout.Story continuesBig, established firms that have more secure profits are often seen as the best dividend options, but it's fairly uncommon to see high-growth businesses or tech start-ups offer their stockholders a dividend. Income investors have to be mindful of the fact that high-yielding stocks tend to struggle during periods of rising interest rates. With that in mind, GS is a compelling investment opportunity. Not only is it a strong dividend play, but the stock currently sits at a Zacks Rank of 3 (Hold).Want the latest recommendations from Zacks Investment Research? Today, you can download 7 Best Stocks for the Next 30 Days. Click to get this free reportThe Goldman Sachs Group, Inc. (GS) : Free Stock Analysis ReportTo read this article on Zacks.com click here.Zacks Investment Research]"
66,911ec0df-295b-4f02-916c-b9b08b9a49a9,GS,2023-03-25,Goldman Sachs: Should it be punished for its role in the Silicon Valley Bank debacle?,Yahoo Finance,https://finance.yahoo.com/news/goldman-sachs-should-it-be-punished-for-its-role-in-the-silicon-valley-bank-debacle-140455869.html,1679666695,STORY,['GS'],"[We journalists usually write articles about how problems like how the collapse of Silicon Valley Bank (SVB) happened. But because so much has been written about SVB since it became the second-biggest bank failure in U.S. history two weeks ago, I’d like to depart from form.Instead of chewing over the SVB’s collapse, I’d like to make some suggestions that I think could help forestall future SVB-like problems by instilling in Wall Street the fear of making unseemly profits on the financial distress of others.As part of this, I’d like to suggest a non-traditional and constructive approach for our political leaders to take during public hearings next week examining the role that Goldman Sachs (GS) played in the collapse of SVB. There’s no date set for those hearings, but you can be sure that we’ll have them.Rather than use the upcoming U.S. Senate Banking Committee hearings to posture and make speeches, which are Congressional specialties, it would be great if the people running the show use them to extract the information from Goldman that will allow us to figure out how much money Goldman made by buying $24 billion of securities from SVB at a below-market price.And then to demand that Goldman turn over that profit to the federal government as compensation for the financial damage caused by SVB’s collapse and the subsequent aftereffects.You can be sure that if that happened, Wall Street firms would hesitate before taking massive advantage of Main Street firms that are in financial distress and in need of financing and good advice, as SVB was.Here’s the deal, based on my reading of documents, conversations with knowledgeable people who declined to talk on the record and more than 50 years of parsing numbers and explaining them in what I call “a language approaching English.”SVB, which had foolishly loaded its balance sheet with long-term federal government securities yielding less than 2% back when interest rates were mega-low, needed to convert those securities to cash to try to avoid a credit downgrade from Moody’s and to raise cash to pay off depositors who were starting to take their money out of the bank.Story continuesOn March 8, SVB ended up getting about $21.5 billion from Goldman for securities that were valued at about $24 billion on its books. The bank took a $2.5 billion loss on the sale. But it painted the most optimistic picture of the deal, stressing that its loss was $1.8 billion after taxes, a number that you see a lot, rather than $2.5 billion, a number that you rarely if ever see.The securities were selling for less than SVB paid for them because their average yield was fixed at a pathetic 1.79% and the yield on 10-year Treasury securities was about 3.8%. This meant that SVB’s 1.79% securities were valued in the financial markets at less than face value.Did Goldman Sachs dole out bad advice to Silicon Valley Bank? And if so, profit from it? A Goldman exec at the firm's investor day in NYC in February. REUTERS/Brendan McDermidHowever, because of bookkeeping rules, SVB was carrying its portfolio of so-called “available for sale” securities at cost, not at their market value. That’s why the $1.8 billion loss that SVB announced on the sale of the securities to Goldman came as a shock to SVB depositors and was a key element in starting a massive deposit outflow that caused the FDIC to take over the bank.That takeover, combined with the failure of Silvergate Bank and Signature Bank, both of which specialized in what I call “craptocurrency” (and most people call cryptocurrency), threatened to turn into a total financial panic. That prompted the federal government to say that all deposits in three banks were fully guaranteed, not just those up to the $250,000 limit.Goldman profited in two ways from its purchase of SVB’s securities.First, because it was one of the few buyers capable of cutting a check of $21.5 billion in an overnight transaction, it got to buy the $24 billion of securities for less than their market price because it was dealing with a desperate seller that was in a big hurry.It’s not clear how big that discount was. The number that emanates from Goldman is 0.26%—which works out to something in the $50 million to $60 million range. If the right questions get asked by lawmakers, we’ll be able to get the right number.Now, for the second source of profit. With interest rates falling as the result of the turmoil in financial markets, the market prices of the securities Goldman bought from SVB rose. Goldman’s intention was to sell most (if not all) of the SVB securities as quickly as possible, but we don’t know how many of those securities it sold or at what prices. Again, if the right questions are asked, we can find out Goldman’s profit on that part of the deal, too.Then there’s a whole other, complicated question of whether it was SVB’s managers or Goldman that screwed up the timing and that precipitated the announcement of the $1.8 billion loss before Goldman had lined up buyers for $2.25 billion of new SVB stock. That announcement touched off the bank run that led the FDIC and the state of California to close SVB.We need to know if SVB came to Goldman saying that it wanted to sell it the “assets for sale” and to also raise new capital to offset its losses, or whether Goldman suggested the securities sale and capital raising as a package deal.Customers line up outside of the Silicon Valley Bank headquarters, waiting to speak with representatives, in Santa Clara, California, U.S., March 13, 2023. REUTERS/Brittany Hosea-SmallWhy does this matter? Because if SVB had raised the $2.25 billion of capital that it was seeking before it did the asset sale and announced its $1.8 billion after-tax loss, depositors would have had nothing to be frightened about and we’d probably be talking about SVB in the current tense, not the past tense.But announcing the loss, combined with SVB CEO Greg Becker announcing that the bank was seeking to sell $2.25 billion of new stock and urging the bank’s depositors not to worry, made it impossible to raise the capital and doomed the bank.If the timing of the asset sale and the failed capital sale is SVB's fault, then we can’t blame Goldman for SVB’s collapse. However, if SVB came to Goldman for advice and Goldman advised it to sell assets and raise capital, then doing the asset sale and disclosing the loss before raising the capital is the fault of bad advice from Goldman.It would be great if lawmakers use the upcoming hearings to find out how much the government should seek to claw back from Goldman on the money it made on the assets it purchased from SVB. It would be even greater if in addition to that, we could find out whether to blame Goldman or SVB’s managers about the terrible timing of SVB announcing a big loss on the asset sale to Goldman before lining up investors to buy the $2.25 billion of new SVB stock the bank wanted to sell.Will either of these things happen? It seems unlikely—but we can always hope.Allan Sloan, who has written about business for more than 50 years, is a seven-time winner of the Gerald Loeb Award, business journalism’s highest honor. He’s won Loebs in four different categories over four different decades.Read the latest financial and business news from Yahoo FinanceDownload the Yahoo Finance app for Apple or AndroidFollow Yahoo Finance on Twitter, Facebook, Instagram, Flipboard, LinkedIn, and YouTube]"
67,36777512-4e22-3d9d-ba2c-a006b4f70ab9,GS,2023-03-25,7 Bank Stocks to Buy on the Dip,InvestorPlace,https://finance.yahoo.com/news/7-bank-stocks-buy-dip-201604508.html,1679429764,STORY,"['BAC', 'USB', 'CSGN.SW', 'WFC', 'JPM', 'GSBD', 'HSBC', 'PNC']","[Bank stocks continue to be volatile as professional traders and individual investors try to assess how bad the problems in the sector really are following the collapse of three lenders in the U.S. and the $3.2 billion takeover of Switzerland’s Credit Suisse (NYSE:CS) by rival UBS (NYSE:UBS). As the U.S. government steps in to guarantee the deposits at now defunct Silicon Valley Bank, and the largest banks in America inject $30 billion of deposits into troubled lender First Republic Bank (NYSE:FRC), investors have been understandably rattled and moved their money out of bank stocks. However, by most accounts, the selloff of bank stocks has been an overreaction. By nearly all accounts, this is not a repeat of the 2008-09 financial crisis. The good news for long-term investors is that many rock-solid bank stocks are now on sale as their share prices have been pushed lower in recent weeks. Here are seven bank stocks to buy on the dip.JPMJPMorgan$127.18GSGoldman Sachs$313.67HSBCHSBC$34.30WFCWells Fargo$37.20BACBank of America$27.64USBUS Bancorp$34.79PNCPNC Financial$124.40JPMorgan Chase (JPM)JPM stock: the JPMorgan logo on top of a buildingSource: ShutterstockLet’s begin with JPMorgan Chase (NYSE:JPM), which remains the largest U.S. bank by market capitalization. Few banks are as solid today as JPMorgan Chase. Many analysts refer to the lender as having a “fortress balance sheet.” And despite the turmoil of financial markets over the past year, JPMorgan Chase has found a way to continue reporting strong quarterly earnings. The bank’s profit for the fourth and final quarter of 2022 was $11 billion, or $3.57 per share, compared with $10.4 billion, or $3.33 per share, during the same period a year earlier.The revenue of JPMorgan’s investment-banking unit continued to decline in Q4 due to a lack of deals caused by the stock market’s struggles. The investment banking unit’s revenue declined 57% year-over-year last quarter.InvestorPlace - Stock Market News, Stock Advice &amp; Trading TipsStory continuesHowever, the lender’s trading revenue grew amid the market volatility as investors repositioned their portfolios to navigate the current high interest-rate environment. Moreover, the bank’s revenue from fixed income trading rose 12% YOY in Q2, .It should come as no surprise that JPMorgan CEO Jamie Dimon is reportedly advising First Republic Bank on its recovery plan given the clout that JPM and its management team have in the global banking sector.Goldman Sachs (GS)In this photo illustration the Goldman Sachs Group (GS) logo displayed on a smartphone screen and a stock market graph in the backgroundSource: rafapress / Shutterstock.comGoldman Sachs’ (NYSE:GS) consumer banking unit, called “Marcus,” got off to a promising start in 2016, but it was hit hard by the Covid-19 pandemic and never recovered. Goldman ultimately lost $3 billion on Marcus, which was rolled into a “platform solutions business” before being shut down and leaving the Wall Street titan with a rare black eye.However, there is every reason to believe that Goldman Sachs will bounce back and return to its winning ways, making it one of the best  bank stocks to buy on the dip. The company has taken decisive steps to right its ship, including cutting more than 3,000 jobs and slashing its annual bonus payments to bankers by 40%.The layoffs have been concentrated in Goldman’s investment banking division, whose corporate deal making has meaningfully slowed over the last year. The bank’s CEO, David Solomon, has said that he will refocus the investment bank on what it does best: making money for corporate clients.HSBC Holdings (HSBC)HSBC logo on corporate buildingSource: ShutterstockInvestors looking for a solid foreign bank outside the U.S. should consider HSBC Bank (NYSE:HSBC). The lender, which began life in Hong Kong and primarily served Asian markets is today based in London and is increasingly focusing on Europe while also trying to break into North America.In fact, HSBC is now the biggest bank in Europe with more than $10 trillion of assets under custody.  While HSBC recently announced that it was exiting Canada after a failed foray into that market, the sale of its Canadian unit will result in a special one-time dividend payment of 21 cents per share to its stockholders.HSBC announced the special dividend payment along with strong fourth-quarter results that showed a profit of $5.2 billion, which was 108% higher than the $2.5 billion of net income that  the bank had recorded a year earlier, and higher than the $4.97 billion that analysts who cover the lender had, on average, expected.Due to the strong Q4 print, HSBC announced a regular dividend payment to shareholders of 40 cents per share, which equates to a yield of 4.72% and is among the highest of any bank.Wells Fargo (WFC)Wells Fargo (WFC) bank sign in yellow and red with wagon logo. The sign is flanked by tall grassSource: Ken Wolter / Shutterstock.comU.S. lender Wells Fargo (NYSE:WFC) made headlines at the start of this year when it announced that it was exiting the multitrillion-dollar U.S. mortgage market. The announcement was a shock given that Wells Fargo was a leader in the U.S. home loan market, managing as much as $201.8 billion of such loans, according to data from Inside Mortgage Finance.The lender said it was getting out of the real estate game due to a combination of onerous regulations and rising interest rates that have dampened the market over the last year.Going forward, Wells Fargo plans to focus exclusively on providing home loans for its rich clients of its wealth-management unit.Additionally, the lender said it was generating more of its revenue from investment banking and credit cards rather than from mortgages and home equity lines of credit (HELOCs). While a surprise, Wells Fargo’s exit from the real estate market is not unprecedented. That’s because JPMorgan Chase got out of the mortgage market after the 2008 financial crisis.Wells Fargo announced its exit from the housing sector as it reported disappointing Q$ earnings in January.Bank of America (BAC)bank of america stockSource: PL Gould / Shutterstock.comAnother U.S. lender that is viewed as stable and strong today is Bank of America (NYSE:BAC). The second biggest bank in the U.S. after JPMorgan Chase has come along way since the dark days of the 2008 financial crisis. Between late 2007 and mid-2009, BAC stock declined more than 80%, and, at one point, was trading for just $6 a share and in danger of becoming a penny stock. Fortunately, Bank of America weathered the storm and even purchased financial firm Merrill Lynch coming out of the crisis and is today much healthier than in the past.Along with JPMorgan, Bank of America helped to organize the group of 11 banks that agreed to deposit $30 billion in troubled lender First Republic to help shore-up its finances and rally confidence in the banking sector. Bank of America is thriving under the leadership of CEO Brian Moynihan, who has the lender focused on consumer banking and loans. That strategy helped Bank of America post a Q4 2022 earnings beat despite a sharp downturn in investment banking revenues. BAC stock is down 15% on the year and a definite buy at current levels.US Bancorp (USB)US Bancorp (NYSE:USB) is not quite as well known as the four largest lenders in America. However, US Bancorp is the fifth biggest bank in the U.S. based in assets despite being primarily based in the Midwest. Maybe it’s because of its roots in the American heartland, but U.S. Bancorp has largely avoided scandal throughout its nearly 100 years of existence. And many analysts single the bank out for being one of the best managed financial institutions in the country.In particular, bullish analysts point out that US Bancorp has low-cost deposits that other banks can’t match, and more than enough funds on hand to cover potential loan losses. The bank also has limited exposure to troubled foreign lenders such as Credit Suisse.One of US Bancorp’s fans is none other than famed investor Warren Buffett. While he has sold most of his bank stocks in recent years, Buffett continues to own more than 8 million shares of USB stock, worth more than $300 million.PNC Financial Services (PNC)An image of a solar panel in the shape of a piggy bank on a rooftop; concept for solar stocksSource: Andreas Prott / ShutterstockAlso among the 10 biggest U.S. banks with more than $500 billion of assets is PNC Financial Services (NYSE:PNC). Like other lenders, PNC stock has been dragged lower by the current banking troubles and investors’ shaky sentiment. However, by all accounts, PNC Financial remains a sturdy bank that has none of the underlying problems that plagued a number of regional banks in recent weeks. In fact, there were rumors that PNC Financial was going to try to buy Silicon Valley Bank following its collapse. But the bank has ruled out that scenario.The decision to steer clear of Silicon Valley Bank could be a smart one given the financial mess at that institution. PNC’s revenue grew 4% in the final quarter of last year versus the same period a year earlier to $5.76 billion.During Q4, the company also $1.2 billion to shareholders through its generous dividend that pays $1.50 per share each quarter for a yield of 4.55%. Like its peers, PNC stock has been dragged lower due to the current turmoil of the financial sector.As the first quarter nears its end, PNC Financial’s stock is down 21%. Investors should view the decline as a buying opportunity.On the date of publication, Joel Baglole held a long position in BAC. The opinions expressed in this article are those of the writer, subject to the InvestorPlace.com Publishing Guidelines. Joel Baglole has been a business journalist for 20 years. He spent five years as a staff reporter at The Wall Street Journal, and has also written for The Washington Post and Toronto Star newspapers, as well as financial websites such as The Motley Fool and Investopedia.More From InvestorPlaceBuy This $5 Stock BEFORE This Apple Project Goes LiveThe Best $1 Investment You Can Make TodayIt doesn’t matter if you have $500 or $5 million. Do this now.Massive Bear Market “Divergence Event” Ahead… And The #1 Way to Play ItThe post 7 Bank Stocks to Buy on the Dip appeared first on InvestorPlace.]"
68,4c9efe10-f251-38cd-9c9c-25cbe87a3cae,NTRS,2023-03-25,Northern Trust Corporation to Webcast First Quarter 2023 Earnings Conference Call,Business Wire,https://finance.yahoo.com/news/northern-trust-corporation-webcast-first-193500386.html,1679686500,STORY,"['NTRS', 'NTRSO']","[CHICAGO, March 24, 2023--(BUSINESS WIRE)--Northern Trust Corporation announced today that it will webcast its first quarter 2023 earnings conference call live on Tuesday, April 25, 2023. The webcast, the earnings press release, and related presentation materials will be accessible on Northern Trust’s website.The call will be conducted at 8:00 a.m. (CT), following the release that morning of Northern Trust’s first quarter 2023 earnings press release. A replay of the webcast will be available for approximately four weeks after the date of the call.About Northern TrustNorthern Trust Corporation (Nasdaq: NTRS) is a leading provider of wealth management, asset servicing, asset management and banking to corporations, institutions, affluent families and individuals. Founded in Chicago in 1889, Northern Trust has a global presence with offices in 25 U.S. states and Washington, D.C., and across 23 locations in Canada, Europe, the Middle East and the Asia-Pacific region. As of December 31, 2022, Northern Trust had assets under custody/administration of US$13.6 trillion, and assets under management of US$1.2 trillion. For more than 130 years, Northern Trust has earned distinction as an industry leader for exceptional service, financial expertise, integrity and innovation. Please visit our website or follow us on Twitter.Northern Trust Corporation, Head Office: 50 South La Salle Street, Chicago, Illinois 60603 U.S.A., incorporated with limited liability in the U.S. Please read our global and regulatory information.View source version on businesswire.com: https://www.businesswire.com/news/home/20230324005378/en/ContactsInvestor Contact: Jennifer Childe(312) 444-3290Jennifer.Childe@ntrs.comMedia Contact:Doug Holt(312) 557-1571Doug.Holt@ntrs.com]"
