,Id,Company,Date,Title,Publisher,Link,ProviderPublishTime,Type,Related Company,Text
0,a5aaf485-e8f8-390a-b17f-32a72fe72111,NUE,2023-05-21,Could The Market Be Wrong About Nucor Corporation (NYSE:NUE) Given Its Attractive Financial Prospects?,Simply Wall St.,https://finance.yahoo.com/news/could-market-wrong-nucor-corporation-133718278.html,1684589838,STORY,['NUE'],"[It is hard to get excited after looking at Nucor's (NYSE:NUE) recent performance, when its stock has declined 17% over the past three months. However, a closer look at its sound financials might cause you to think again. Given that fundamentals usually drive long-term market outcomes, the company is worth looking at. In this article, we decided to focus on Nucor's  ROE.Return on equity or ROE is an important factor to be considered by a shareholder because it tells them how effectively their capital is being reinvested. Put another way, it reveals the company's success at turning shareholder investments into profits. View our latest analysis for Nucor How Is ROE Calculated?Return on equity can be calculated by using the formula:Return on Equity = Net Profit (from continuing operations) ÷ Shareholders' EquitySo, based on the above formula, the ROE for Nucor is:36% = US$7.1b ÷ US$20b (Based on the trailing twelve months to April 2023).The 'return' is the amount earned after tax over the last twelve months. One way to conceptualize this is that for each $1 of shareholders' capital it has, the company made $0.36 in profit.Why Is ROE Important For Earnings Growth?We have already established that ROE serves as an efficient profit-generating gauge for a company's future earnings. Depending on how much of these profits the company reinvests or ""retains"", and how effectively it does so, we are then able to assess a company’s earnings growth potential. Assuming everything else remains unchanged, the higher the ROE and profit retention, the higher the growth rate of a company compared to companies that don't necessarily bear these characteristics.A Side By Side comparison of Nucor's Earnings Growth And 36% ROEFirst thing first, we like that Nucor has an impressive ROE. Second, a comparison with the average ROE reported by the industry of 14% also doesn't go unnoticed by us. As a result, Nucor's exceptional 41% net income growth seen over the past five years, doesn't come as a surprise.Story continuesNext, on comparing with the industry net income growth, we found that Nucor's growth is quite high when compared to the industry average growth of 31% in the same period, which is great to see.past-earnings-growthEarnings growth is an important metric to consider when valuing a stock. What investors need to determine next is if the expected earnings growth, or the lack of it, is already built into the share price. Doing so will help them establish if the stock's future looks promising or ominous. If you're wondering about Nucor's's valuation, check out this gauge of its price-to-earnings ratio, as compared to its industry.Is Nucor Efficiently Re-investing Its Profits?Nucor has a really low three-year median payout ratio of 9.8%, meaning that it has the remaining 90% left over to reinvest into its business. So it seems like the management is reinvesting profits heavily to grow its business and this reflects in its earnings growth number.Besides, Nucor has been paying dividends for at least ten years or more. This shows that the company is committed to sharing profits with its shareholders. Our latest analyst data shows that the future payout ratio of the company is expected to rise to 18% over the next three years. Therefore, the expected rise in the payout ratio explains why the company's ROE is expected to decline to 12% over the same period.SummaryOverall, we are quite pleased with Nucor's performance. In particular, it's great to see that the company is investing heavily into its business and along with a high rate of return, that has resulted in a sizeable growth in its earnings. Having said that, on studying current analyst estimates, we were concerned to see that while the company has grown its earnings in the past, analysts expect its earnings to shrink in the future. To know more about the latest analysts predictions for the company, check out this visualization of analyst forecasts for the company.Have feedback on this article? Concerned about the content? Get in touch with us directly. Alternatively, email editorial-team (at) simplywallst.com.This article by Simply Wall St is general in nature. We provide commentary based on historical data and analyst forecasts only using an unbiased methodology and our articles are not intended to be financial advice. It does not constitute a recommendation to buy or sell any stock, and does not take account of your objectives, or your financial situation. We aim to bring you long-term focused analysis driven by fundamental data. Note that our analysis may not factor in the latest price-sensitive company announcements or qualitative material. Simply Wall St has no position in any stocks mentioned.Join A Paid User Research SessionYou’ll receive a US$30 Amazon Gift card for 1 hour of your time while helping us build better investing tools for the individual investors like yourself. Sign up here]"
1,2508229c-eb80-34a8-94a5-cb8a97dbc2de,WMT,2023-05-21,Amazon falls behind Walmart in battle for India’s online shoppers,Financial Times,https://finance.yahoo.com/m/2508229c-eb80-34a8-94a5-cb8a97dbc2de/amazon-falls-behind-walmart.html,1684620044,STORY,['WMT'],[]
2,52688817-326b-3f6c-acc9-5f67001054a6,WMT,2023-05-21,"Here's Why Walmart, Target, and Kroger Should Drop Self-Checkout",TheStreet.com,https://finance.yahoo.com/m/52688817-326b-3f6c-acc9-5f67001054a6/here%27s-why-walmart%2C-target%2C.html,1684587600,STORY,"['WMT', 'TGT', 'KR']","[It's easy to see why retailers want self-checkout, but there is one major reason why they should consider getting rid of it.Continue reading]"
3,0e4b7ac9-e3aa-3df4-9b2a-39a4a371de5b,WMT,2023-05-21,Walmart (NYSE:WMT) Is Increasing Its Dividend To $0.57,Simply Wall St.,https://finance.yahoo.com/news/walmart-nyse-wmt-increasing-dividend-122704143.html,1684585624,STORY,['WMT'],"[Walmart Inc. (NYSE:WMT) will increase its dividend from last year's comparable payment on the 5th of September to $0.57. This takes the annual payment to 1.5% of the current stock price, which is about average for the industry. View our latest analysis for Walmart Walmart's Dividend Is Well Covered By EarningsWhile it is always good to see a solid dividend yield, we should also consider whether the payment is feasible. The last dividend was quite easily covered by Walmart's earnings. This indicates that quite a large proportion of earnings is being invested back into the business.The next year is set to see EPS grow by 79.7%. Assuming the dividend continues along recent trends, we think the payout ratio could be 31% by next year, which is in a pretty sustainable range.historic-dividendWalmart Has A Solid Track RecordThe company has been paying a dividend for a long time, and it has been quite stable which gives us confidence in the future dividend potential. The dividend has gone from an annual total of $1.88 in 2013 to the most recent total annual payment of $2.28. This means that it has been growing its distributions at 1.9% per annum over that time. Although we can't deny that the dividend has been remarkably stable in the past, the growth has been pretty muted.Walmart Could Grow Its DividendSome investors will be chomping at the bit to buy some of the company's stock based on its dividend history. We are encouraged to see that Walmart has grown earnings per share at 6.8% per year over the past five years. The company is paying a reasonable amount of earnings to shareholders, and is growing earnings at a decent rate so we think it could be a decent dividend stock.Walmart Looks Like A Great Dividend StockIn summary, it is always positive to see the dividend being increased, and we are particularly pleased with its overall sustainability. Earnings are easily covering distributions, and the company is generating plenty of cash. All in all, this checks a lot of the boxes we look for when choosing an income stock.Story continuesMarket movements attest to how highly valued a consistent dividend policy is compared to one which is more unpredictable. Meanwhile, despite the importance of dividend payments, they are not the only factors our readers should know when assessing a company. As an example, we've identified 3 warning signs for Walmart that you should be aware of before investing. If you are a dividend investor, you might also want to look at our curated list of high yield dividend stocks.Have feedback on this article? Concerned about the content? Get in touch with us directly. Alternatively, email editorial-team (at) simplywallst.com.This article by Simply Wall St is general in nature. We provide commentary based on historical data and analyst forecasts only using an unbiased methodology and our articles are not intended to be financial advice. It does not constitute a recommendation to buy or sell any stock, and does not take account of your objectives, or your financial situation. We aim to bring you long-term focused analysis driven by fundamental data. Note that our analysis may not factor in the latest price-sensitive company announcements or qualitative material. Simply Wall St has no position in any stocks mentioned.Join A Paid User Research SessionYou’ll receive a US$30 Amazon Gift card for 1 hour of your time while helping us build better investing tools for the individual investors like yourself. Sign up here]"
4,25eebd03-920c-3f74-b185-65fa5bdfcefe,JWN,2023-05-21,"Nordstrom, Inc. (NYSE:JWN) Pays A US$0.19 Dividend In Just Four Days",Simply Wall St.,https://finance.yahoo.com/news/nordstrom-inc-nyse-jwn-pays-121610462.html,1684671370,STORY,['JWN'],"[Nordstrom, Inc. (NYSE:JWN) is about to trade ex-dividend in the next four days. The ex-dividend date occurs one day before the record date which is the day on which shareholders need to be on the company's books in order to receive a dividend. The ex-dividend date is important as the process of settlement involves two full business days. So if you miss that date, you would not show up on the company's books on the record date. This means that investors who purchase Nordstrom's shares on or after the 26th of May will not receive the dividend, which will be paid on the 14th of June.The company's next dividend payment will be US$0.19 per share, and in the last 12 months, the company paid a total of US$0.76 per share. Last year's total dividend payments show that Nordstrom has a trailing yield of 4.9% on the current share price of $15.44. Dividends are a major contributor to investment returns for long term holders, but only if the dividend continues to be paid. So we need to check whether the dividend payments are covered, and if earnings are growing. See our latest analysis for Nordstrom Dividends are usually paid out of company profits, so if a company pays out more than it earned then its dividend is usually at greater risk of being cut. Fortunately Nordstrom's payout ratio is modest, at just 50% of profit. Yet cash flows are even more important than profits for assessing a dividend, so we need to see if the company generated enough cash to pay its distribution. It distributed 25% of its free cash flow as dividends, a comfortable payout level for most companies.It's positive to see that Nordstrom's dividend is covered by both profits and cash flow, since this is generally a sign that the dividend is sustainable, and a lower payout ratio usually suggests a greater margin of safety before the dividend gets cut.Click here to see the company's payout ratio, plus analyst estimates of its future dividends.Story continueshistoric-dividendHave Earnings And Dividends Been Growing?Companies with falling earnings are riskier for dividend shareholders. If business enters a downturn and the dividend is cut, the company could see its value fall precipitously. Nordstrom's earnings per share have fallen at approximately 10% a year over the previous five years. Such a sharp decline casts doubt on the future sustainability of the dividend.Another key way to measure a company's dividend prospects is by measuring its historical rate of dividend growth. Nordstrom has seen its dividend decline 3.5% per annum on average over the past 10 years, which is not great to see. While it's not great that earnings and dividends per share have fallen in recent years, we're encouraged by the fact that management has trimmed the dividend rather than risk over-committing the company in a risky attempt to maintain yields to shareholders.The Bottom LineHas Nordstrom got what it takes to maintain its dividend payments? Earnings per share are down meaningfully, although at least the company is paying out a low and conservative percentage of both its earnings and cash flow. It's definitely not great to see earnings falling, but at least there may be some buffer before the dividend needs to be cut. In summary, while it has some positive characteristics, we're not inclined to race out and buy Nordstrom today.With that in mind, a critical part of thorough stock research is being aware of any risks that stock currently faces. For example, we've found 2 warning signs for Nordstrom that we recommend you consider before investing in the business.A common investing mistake is buying the first interesting stock you see. Here you can find a full list of high-yield dividend stocks.Have feedback on this article? Concerned about the content? Get in touch with us directly. Alternatively, email editorial-team (at) simplywallst.com.This article by Simply Wall St is general in nature. We provide commentary based on historical data and analyst forecasts only using an unbiased methodology and our articles are not intended to be financial advice. It does not constitute a recommendation to buy or sell any stock, and does not take account of your objectives, or your financial situation. We aim to bring you long-term focused analysis driven by fundamental data. Note that our analysis may not factor in the latest price-sensitive company announcements or qualitative material. Simply Wall St has no position in any stocks mentioned.Join A Paid User Research SessionYou’ll receive a US$30 Amazon Gift card for 1 hour of your time while helping us build better investing tools for the individual investors like yourself. Sign up here]"
5,91346d11-4441-39cc-bc94-721f8adb8a97,O,2023-05-21,Artificial Intelligence Is Wading Into the Deep to Unlock More Oil,Motley Fool,https://finance.yahoo.com/m/91346d11-4441-39cc-bc94-721f8adb8a97/artificial-intelligence-is.html,1684667880,STORY,"['SHEL.L', 'CL=F', 'EOG']",[The use cases for Artificial Intelligence (AI) are growing exponentially as companies discover more ways to leverage the technology. Deepwater oil and gas production and exploration is one of the latest frontiers for AI. Leading global energy giant Shell (NYSE: SHEL) recently unveiled a technology collaboration with AI software solutions provider SparkCognition to enhance its ability to find and produce oil from deepwater sources.Continue reading]
6,f5cdd67a-21fb-3d0d-a01c-f9f8e9d44524,O,2023-05-21,2 Big Reasons (Other Than Oil) to Follow Warren Buffett and Buy Occidental Petroleum,Motley Fool,https://finance.yahoo.com/m/f5cdd67a-21fb-3d0d-a01c-f9f8e9d44524/2-big-reasons-%28other-than.html,1684588500,STORY,"['OXY', 'BRK-A', 'CL=F']","[Warren Buffett's Berkshire Hathaway (NYSE: BRK.A)(NYSE: BRK.B) has been buying shares of Occidental Petroleum (NYSE: OXY) hand over fist. Berkshire Hathaway now owns nearly 24% of the oil company's outstanding shares. While Buffett recently dismissed the idea of acquiring Occidental, his company has the approval to boost that position up to 50%.Continue reading]"
7,0dc7bda8-f52d-37f5-96f0-0141e23db267,O,2023-05-21,Hedge Funds’ Ultra-Bearish Oil Bets Signal US Recession Angst,Bloomberg,https://finance.yahoo.com/news/hedge-funds-ultra-bearish-oil-130000479.html,1684587600,STORY,['O'],[]
8,6edd6433-baad-347a-bbb2-e1aacc6c687f,MS,2023-05-21,Morgan Stanley CEO succession underscores Wall Street's diversity gap,Reuters,https://finance.yahoo.com/news/morgan-stanley-ceo-succession-underscores-110311179.html,1684666991,STORY,"['MS', 'BAC']","[By Ross Kerber and Simon Jessop(Reuters) - The absence of women from the slate of potential Morgan Stanley CEO successors underscores the importance of cultivating and keeping diverse talent, corporate governance experts say.Morgan Stanley co-presidents Ted Pick and Andy Saperstein, and head of investment management Dan Simkowitz, are the front-runners to succeed James Gorman, who said on Friday he plans to step down as chief executive within a year.The most recent U.S. workforce diversity data comprehensively reported by the Wall Street banks shows women were less represented in leadership positions at Morgan Stanley than at other top U.S. banks as of 2021.Morgan Stanley said 25% of those holding ""executive/senior officials/manager"" roles in the U.S. were women, versus 29% for JPMorgan Chase &amp; Co, 36% for Bank of America Corp and 38% for Citigroup Inc. Among major peers, only Morgan Stanley's arch rival Goldman Sachs Group Inc had less female representation, at 23%.Moreover, 80% of Morgan Stanley's top leaders in the U.S. were white, more than the others, that reported such representation at between 67% and 78%.A Morgan Stanley representative declined to comment.Mary Beth Gallagher, director of engagement for Domini Impact Investments LLC, which invests with environmental, social and governance (ESG) considerations, said firms need to have a pipeline of diverse talent if they want to find diverse leaders, which would involve recruiting and career-building efforts.""The logic is to ensure you have the right people with the skills sets and decision-making authority. You need to have cultivated those leaders,"" said Gallagher.To be sure, Morgan Stanley has several women in top roles, including Chief Financial Officer Sharon Yeshaya. She is one of three women on its 14-member operating committee. There are four women on its 14-member board of directors and four directors who identify themselves as ethnically diverse.Story continuesAcross the financial industry, women held just 21% of services board seats, 19% of C-suite roles, and 5% of CEO jobs in 2021, according to a Deloitte study published last year.Wall Street has struggled to shake off its image as an ""old boys' club"". In recent years, however, banks have made strides on diversity as they seek to appeal to millennial workers, and under pressure from social movements like #MeToo and Black Lives Matter.A major milestone came in 2021, when Citigroup named Jane Fraser, formerly its president, as its CEO.Doug Chia, president of consulting firm Soundboard Governance, called the lack of diverse senior leaders at Morgan Stanley and other firms ""a classic pipeline problem"" because it limits the pool of candidates that companies could promote to higher jobs.""If there's a dearth of candidates, then you have got to try harder"" to attract them, he said.(Reporting by Ross Kerber in Iowa City and by Simon Jessop in London; Editing by Greg Roumeliotis and Rosalba O'Brien)]"
9,b8e8d503-643d-361d-a0f6-d92efb300414,OMC,2023-05-21,Here's What To Make Of Omnicom Group's (NYSE:OMC) Decelerating Rates Of Return,Simply Wall St.,https://finance.yahoo.com/news/heres-omnicom-groups-nyse-omc-130359692.html,1684587839,STORY,['OMC'],"[If we want to find a potential multi-bagger, often there are underlying trends that can provide clues. Firstly, we'd want to identify a growing return on capital employed (ROCE) and then alongside that, an ever-increasing base of capital employed. Ultimately, this demonstrates that it's a business that is reinvesting profits at increasing rates of return. However, after briefly looking over the numbers, we don't think Omnicom Group (NYSE:OMC) has the makings of a multi-bagger going forward, but let's have a look at why that may be.Understanding Return On Capital Employed (ROCE)For those that aren't sure what ROCE is, it measures the amount of pre-tax profits a company can generate from the capital employed in its business. The formula for this calculation on Omnicom Group is:Return on Capital Employed = Earnings Before Interest and Tax (EBIT) ÷ (Total Assets - Current Liabilities)0.17 = US$2.0b ÷ (US$25b - US$13b) (Based on the trailing twelve months to March 2023).So, Omnicom Group has an ROCE of 17%.  In absolute terms, that's a satisfactory return, but compared to the Media industry average of 9.4% it's much better. See our latest analysis for Omnicom Group roceAbove you can see how the current ROCE for Omnicom Group compares to its prior returns on capital, but there's only so much you can tell from the past. If you're interested, you can view the analysts predictions in our free report on analyst forecasts for the company.What Does the ROCE Trend For Omnicom Group Tell Us?Things have been pretty stable at Omnicom Group, with its capital employed and returns on that capital staying somewhat the same for the last five years. It's not uncommon to see this when looking at a mature and stable business that isn't re-investing its earnings because it has likely passed that phase of the business cycle. With that in mind, unless investment picks up again in the future, we wouldn't expect Omnicom Group to be a multi-bagger going forward. This probably explains why Omnicom Group is paying out 39% of its income to shareholders in the form of dividends. Unless businesses have highly compelling growth opportunities, they'll typically return some money to shareholders.Story continuesOn a side note, Omnicom Group's current liabilities are still rather high at 53% of total assets. This effectively means that suppliers (or short-term creditors) are funding a large portion of the business, so just be aware that this can introduce some elements of risk. Ideally we'd like to see this reduce as that would mean fewer obligations bearing risks.The Key TakeawayIn a nutshell, Omnicom Group has been trudging along with the same returns from the same amount of capital over the last five years. Since the stock has gained an impressive 56% over the last five years, investors must think there's better things to come. But if the trajectory of these underlying trends continue, we think the likelihood of it being a multi-bagger from here isn't high.Since virtually every company faces some risks, it's worth knowing what they are, and we've spotted   2 warning signs for Omnicom Group   (of which 1 can't be ignored!) that you should know about.If you want to search for solid companies with great earnings, check out this free list of companies with good balance sheets and impressive returns on equity.Have feedback on this article? Concerned about the content? Get in touch with us directly. Alternatively, email editorial-team (at) simplywallst.com.This article by Simply Wall St is general in nature. We provide commentary based on historical data and analyst forecasts only using an unbiased methodology and our articles are not intended to be financial advice. It does not constitute a recommendation to buy or sell any stock, and does not take account of your objectives, or your financial situation. We aim to bring you long-term focused analysis driven by fundamental data. Note that our analysis may not factor in the latest price-sensitive company announcements or qualitative material. Simply Wall St has no position in any stocks mentioned.Join A Paid User Research SessionYou’ll receive a US$30 Amazon Gift card for 1 hour of your time while helping us build better investing tools for the individual investors like yourself. Sign up here]"
