,Id,Company,Date,Title,Publisher,Link,ProviderPublishTime,Type,Related Company,Text
0,9bd34615-1f64-30aa-b2e4-abd55e9e5916,VRSK,2023-08-28,Planitar Inc. and Verisk Join Forces to Revolutionize Insurance Adjusters' Workflow with iGUIDE Instant Sketch,Business Wire,https://finance.yahoo.com/news/planitar-inc-verisk-join-forces-100000439.html,1693216800,STORY,['VRSK'],"[WATERLOO, Ontario &amp; JERSEY CITY, N.J., August 28, 2023--(BUSINESS WIRE)--Planitar Inc., the creators of iGUIDE, and Verisk (Nasdaq: VRSK) announced today a strategic integration aimed at accelerating the insurance industry's claims process.This press release features multimedia. View the full release here: https://www.businesswire.com/news/home/20230828858271/en/Planitar Inc. and Verisk join forces to revolutionize insurance adjusters' workflow with iGUIDE Instant Sketch. (Photo: Business Wire)Leveraging the market-leading technology of both providers, the collaboration introduces a groundbreaking solution, iGUIDE Instant Sketch.* This integration of iGUIDE and Verisk’s Xactimate platform is designed to enable insurance adjusters to process claims with unprecedented accuracy, speed and increased efficiency.Planitar is a proptech company providing a secure solution for comprehensive pre- and post-loss property documentation. Verisk is a leading global data analytics and technology provider to the insurance industry.iGUIDE Instant Sketch is designed to significantly improve the accuracy and speed of creating a comprehensive property loss documentation package. The product fully automates the floor plan sketch creation, an essential first step in the claims and restoration process. By combining optical imaging, laser (Lidar) measurements and deep learning AI technology, the iGUIDE Instant Sketch product provides the insurance industry with an essential tool to document an interior loss more quickly, consistently and comprehensively.Planitar’s iGUIDE technology can automatically create room(s) or entire floor plan drawings and translate those directly to a Sketch™ within the Xactimate software platform in minutes.Saving Time with AccuracyThis solution can help eliminate hours spent manually measuring, photographing and annotating property damage, helping to streamline the initial claim estimating process. AI-generated floorplans improve the accuracy and consistency of claim sketches used to create replacement material estimates.Story continuesAs an added benefit, insurance and restoration professionals can use iGUIDE Real-Time Tagging, and the iGUIDE 3D virtual walk-through to organize and augment the evidence report package they give to carriers.""We are excited to announce our collaboration with Verisk to introduce iGUIDE Instant Sketch to the insurance industry. Together, we're taking a significant step towards transforming the insurance claims process. By combining our comprehensive property documentation solution with Verisk's data analytics expertise, we’re offering insurance adjusters a seamless and high-speed workflow that reduces time spent on data collection and sketching by 90 percent or more,"" explains Alexander Likholyot, the CEO of Planitar Inc.An insurance adjuster can now estimate or share a claim in Xactimate with an automated Sketch™ workflow before they even leave the property.""Our collaboration with Planitar brings an unparalleled opportunity for insurance adjusters to leverage technology from our ecosystem partners together with the power of the Xactimate claims processing platform. Together, we’re working to simplify the claims Sketch™ process, improve the quality of loss documentation and enhance adjusters’ productivity,"" explained Aaron Brunko, president, Property Estimating Solutions, Verisk. ""We are proud to be at the forefront of this transformation and of our commitment to an open ecosystem designed to drive efficiency and deliver solutions that make a real difference for our customers.""Lubricating the moving parts of a claims process while benefiting both adjusters and policyholders alike, iGUIDE Instant Sketch (BETA) is available to insurance and claims professionals. Interested parties can visit goiguide.com/insurance-restoration to learn more.*Please note that iGUIDE Instant Sketch is currently in BETA. The machine-generated sketch quality relies on the input data the camera operator provides. Although iGUIDE and Verisk aim for typical file delivery in Xactimate within minutes, this timeframe may vary depending on load factors, such as after a catastrophic loss event.About PlanitarFounded in 2013 in Kitchener, Ontario, Canada, Planitar Inc. is the maker of iGUIDE, a proprietary camera and software platform for capturing and delivering immersive 3D virtual tours and extensive property data. iGUIDE is the most efficient system to map interior spaces and features accurate floor plans, measurements and reliable property square footage. By integrating floor plans and visual data, iGUIDE provides an intuitive and practical way to navigate and explore built environments digitally. For more, visit goiguide.com.About VeriskVerisk (Nasdaq: VRSK) is a leading strategic data analytics and technology partner to the global insurance industry. It empowers clients to strengthen operating efficiency, improve underwriting and claims outcomes, combat fraud and make informed decisions about global risks, including climate change, extreme events, ESG and political issues. Through advanced data analytics, software, scientific research and deep industry knowledge, Verisk helps build global resilience for individuals, communities and businesses. With teams across more than 20 countries, Verisk consistently earns certification by Great Place to Work and fosters an inclusive culture where all team members feel they belong. For more, visit Verisk.com and the Verisk Newsroom.View source version on businesswire.com: https://www.businesswire.com/news/home/20230828858271/en/ContactsPlanitar Inc. Media Contact Skylar Lawrence-LeBel647-455-0585skylar@planitar.comVerisk Media Contact Michelle Pantina551-500-7327michelle.pantina@verisk.com]"
1,e45cf210-269a-31fc-bf72-74dc1a4c690c,VRSK,2023-08-28,Verisk Enters Egypt Health Insurance Market Through AXA Deal,GlobeNewswire,https://finance.yahoo.com/news/verisk-enters-egypt-health-insurance-081100808.html,1693210260,STORY,['VRSK'],"[Verisk Analytics, Inc.AXA selects Verisk’s Health Risk Rating Tool and Ratings Engine to assess substandard risks posed by pre-existing medical conditionsCAIRO, Egypt, Aug. 28, 2023 (GLOBE NEWSWIRE) -- AXA Life &amp; Health Reinsurance Solutions has selected Verisk’s Health Risk Rating Tool and Ratings Engine to help its insurance partners in Egypt automate health insurance underwriting based on the declared pre-existing medical conditions of their customers. This deal marks the first time Verisk, a global data analytics and technology provider for insurers, provides a product or service to Egypt’s insurance market.Verisk’s Health Risk Rating Tool, which will be marketed as AXA’s Intelligent Medical Acceptance Tool (IMPACT), enables insurers to grow by helping them make more informed underwriting decisions at point of sale. The solution analyses an applicant’s responses to a dynamic question set, assesses the applicant’s pre-existing medical conditions, and generates risk scores that insurers can use to better understand the cost of maintaining a condition and any potential complications.Verisk’s Health Risk Ratings Engine is an additional module of the solution that streamlines the process by allowing insurers to configure their own rules based on the risk scores and generate real-time automated underwriting decisions.“The new Ratings Engine feature of the Health Risk Rating Tool has vastly improved IMPACT’s accessibility and efficiency in providing bespoke health insurance products to a wider demographic of customers,” said Laurent Pochat-Cottilloux, CEO of AXA Life &amp; Health Reinsurance Solutions. “Customers with pre-existing medical conditions should now have a much better experience finding cover that suits them.”This deal builds on an existing business relationship between Verisk and AXA Life &amp; Health Reinsurance, with AXA using Verisk’s Health Risk Rating Tool in China, Vietnam and the Philippines.“Our entry into Egypt’s health market is not only a significant achievement in expanding our global presence in EMEA but it is also a positive step forward in our ongoing relationship with AXA,” said Rachel Edwards, Managing Director of Verisk Life, Health &amp; Travel. “The addition of the Ratings Engine to our product suite has expanded the value Verisk can add to our customers’ underwriting process and has greatly assisted AXA’s launch in Egypt.”Story continuesThe Health Risk Rating Tool is available as a standalone portal or as an integrated API. For more information, e-mail riskrating@verisk.com.Verisk's Life, Health &amp; Travel business has worked with insurers to automate the assessment of pre-existing conditions with the Risk Rating Tool since 2000. The integration of Verisk's software into the workflows of insurers, brokers, distributors, banks and price comparison websites has established the Risk Rating Tool as a leading solution in the marketplace.About Verisk Verisk (Nasdaq: VRSK) is a leading strategic data analytics and technology partner to the global insurance industry. It empowers clients to strengthen operating efficiency, improve underwriting and claims outcomes, combat fraud and make informed decisions about global risks, including climate change, extreme events, ESG and political issues. Through advanced data analytics, software, scientific research and deep industry knowledge, Verisk helps build global resilience for individuals, communities and businesses. With teams across more than 20 countries, Verisk consistently earns certification by Great Place to Work and fosters an inclusive culture where all team members feel they belong. For more, visit Verisk.com and the Verisk Newsroom.CONTACT: Media Contact Mary Keller Verisk (339) 832-7048 mary.keller@verisk.com]"
2,323818e9-0037-3cba-8c06-451accf5b93c,SCHW,2023-08-28,Is Schwab Fundamental U.S. Large Company Index ETF (FNDX) a Strong ETF Right Now?,Zacks,https://finance.yahoo.com/news/schwab-fundamental-u-large-company-102007704.html,1693218007,STORY,['SCHW'],"[The Schwab Fundamental U.S. Large Company Index ETF (FNDX) made its debut on 08/13/2013, and is a smart beta exchange traded fund that provides broad exposure to the Style Box - Large Cap Value category of the market.What Are Smart Beta ETFs?The ETF industry has long been dominated by products based on market cap weighted indexes, a strategy created to reflect the market or a particular market segment.Because market cap weighted indexes provide a low-cost, convenient, and transparent way of replicating market returns, they work well for investors who believe in market efficiency.But, there are some investors who would rather invest in smart beta funds; these funds track non-cap weighted strategies, and are a strong option for those who prefer choosing great stocks in order to beat the market.This kind of index follows this same mindset, as it attempts to pick stocks that have better chances of risk-return performance; non-cap weighted strategies base selection on certain fundamental characteristics, or a mix of such characteristics.Methodologies like equal-weighting, one of the simplest options out there, fundamental weighting, and volatility/momentum based weighting are all choices offered to investors in this space, but not all of them can deliver superior returns.Fund Sponsor &amp; IndexThe fund is sponsored by Charles Schwab. It has amassed assets over $11.61 billion, making it one of the larger ETFs in the Style Box - Large Cap Value. This particular fund, before fees and expenses, seeks to match the performance of the Russell RAFI US Large Co. Index.The Russell RAFI US Large Company Index measures the performance of the large company size segment by fundamental overall company scores.Cost &amp; Other ExpensesFor ETF investors, expense ratios are an important factor when considering a fund's return; in the long-term, cheaper funds actually have the ability to outperform their more expensive cousins if all other things remain the same.Story continuesAnnual operating expenses for this ETF are 0.25%, making it on par with most peer products in the space.It has a 12-month trailing dividend yield of 1.95%.Sector Exposure and Top HoldingsEven though ETFs offer diversified exposure which minimizes single stock risk, it is still important to look into a fund's holdings before investing. Luckily, most ETFs are very transparent products that disclose their holdings on a daily basis.This ETF has heaviest allocation in the Information Technology sector - about 18.40% of the portfolio. Financials and Healthcare round out the top three.Taking into account individual holdings, Apple Inc (AAPL) accounts for about 4.77% of the fund's total assets, followed by Microsoft Corp (MSFT) and Berkshire Hathaway Inc Class B (BRKB).FNDX's top 10 holdings account for about 20.85% of its total assets under management.Performance and RiskThe ETF has added roughly 8.15% so far this year and it's up approximately 4.35% in the last one year (as of 08/28/2023). In the past 52-week period, it has traded between $47.76 and $59.78.The fund has a beta of 1.01 and standard deviation of 17.15% for the trailing three-year period, which makes FNDX a medium risk choice in this particular space. With about 733 holdings, it effectively diversifies company-specific risk.AlternativesSchwab Fundamental U.S. Large Company Index ETF is a reasonable option for investors seeking to outperform the Style Box - Large Cap Value segment of the market. However, there are other ETFs in the space which investors could consider.IShares Russell 1000 Value ETF (IWD) tracks Russell 1000 Value Index and the Vanguard Value ETF (VTV) tracks CRSP U.S. Large Cap Value Index. IShares Russell 1000 Value ETF has $49.88 billion in assets, Vanguard Value ETF has $100.20 billion. IWD has an expense ratio of 0.19% and VTV charges 0.04%.Investors looking for cheaper and lower-risk options should consider traditional market cap weighted ETFs that aim to match the returns of the Style Box - Large Cap Value.Bottom LineTo learn more about this product and other ETFs, screen for products that match your investment objectives and read articles on latest developments in the ETF investing universe, please visit Zacks ETF Center.Want the latest recommendations from Zacks Investment Research? Today, you can download 7 Best Stocks for the Next 30 Days. Click to get this free reportSchwab Fundamental U.S. Large Company Index ETF (FNDX): ETF Research ReportsApple Inc. (AAPL) : Free Stock Analysis ReportMicrosoft Corporation (MSFT) : Free Stock Analysis ReportVanguard Value ETF (VTV): ETF Research ReportsiShares Russell 1000 Value ETF (IWD): ETF Research ReportsTo read this article on Zacks.com click here.Zacks Investment Research]"
3,163b82a3-1a36-3cca-a7b9-f99c179da833,SCHW,2023-08-28,Is Schwab Fundamental International Small Company Index ETF (FNDC) a Strong ETF Right Now?,Zacks,https://finance.yahoo.com/news/schwab-fundamental-international-small-company-102006172.html,1693218006,STORY,['SCHW'],"[Designed to provide broad exposure to the World ETFs category of the market, the Schwab Fundamental International Small Company Index ETF (FNDC) is a smart beta exchange traded fund launched on 08/13/2013.What Are Smart Beta ETFs?The ETF industry has traditionally been dominated by products based on market capitalization weighted indexes that are designed to represent the market or a particular segment of the market.Market cap weighted indexes offer a low-cost, convenient, and transparent way of replicating market returns, and are a good option for investors who believe in market efficiency.There are some investors, though, who think it's possible to beat the market with great stock selection; this group likely invests in another class of funds known as smart beta, which track non-cap weighted strategies.By attempting to pick stocks that have a better chance of risk-return performance, non-cap weighted indexes are based on certain fundamental characteristics, or a combination of such.The smart beta space gives investors many different choices, from equal-weighting, one of the simplest strategies, to more complicated ones like fundamental and volatility/momentum based weighting. However, not all of these methodologies have been able to deliver remarkable returns.Fund Sponsor &amp; IndexFNDC is managed by Charles Schwab, and this fund has amassed over $2.93 billion, which makes it one of the larger ETFs in the World ETFs. This particular fund, before fees and expenses, seeks to match the performance of the Russell RAFI Developed ex-U.S. Small Co. Index (Net).The Russell RAFI Developed ex US Small Company Index (Net) measures the performance of the small company size segment by fundamental overall company scores, which are created using as the universe the developed ex U.S. companies in the FTSE Global Total Cap Index.Cost &amp; Other ExpensesInvestors should also pay attention to an ETF's expense ratio. Lower cost products will produce better results than those with a higher cost, assuming all other metrics remain the same.Story continuesAnnual operating expenses for FNDC are 0.39%, which makes it on par with most peer products in the space.FNDC's 12-month trailing dividend yield is 2.21%.Sector Exposure and Top HoldingsIt is important to delve into an ETF's holdings before investing despite the many upsides to these kinds of funds like diversified exposure, which minimizes single stock risk. And, most ETFs are very transparent products that disclose their holdings on a daily basis.When you look at individual holdings, Meritz Financial Group Inc accounts for about 0.27% of the fund's total assets, followed by Disco Corp and H2o Retailing Corp.Performance and RiskThe ETF has added about 5.88% and was up about 6.25% so far this year and in the past one year (as of 08/28/2023), respectively. FNDC has traded between $26.94 and $34.74 during this last 52-week period.The ETF has a beta of 0.93 and standard deviation of 17.06% for the trailing three-year period, making it a low risk choice in the space. With about 1779 holdings, it effectively diversifies company-specific risk.AlternativesSchwab Fundamental International Small Company Index ETF is a reasonable option for investors seeking to outperform the World ETFs segment of the market. However, there are other ETFs in the space which investors could consider.Vanguard Total International Stock ETF (VXUS) tracks FTSE Global All Cap ex US Index and the Vanguard FTSE Developed Markets ETF (VEA) tracks FTSE Developed All Cap ex US Index. Vanguard Total International Stock ETF has $56.59 billion in assets, Vanguard FTSE Developed Markets ETF has $111.17 billion. VXUS has an expense ratio of 0.07% and VEA charges 0.05%.Investors looking for cheaper and lower-risk options should consider traditional market cap weighted ETFs that aim to match the returns of the World ETFs.Bottom LineTo learn more about this product and other ETFs, screen for products that match your investment objectives and read articles on latest developments in the ETF investing universe, please visit Zacks ETF Center.Want the latest recommendations from Zacks Investment Research? Today, you can download 7 Best Stocks for the Next 30 Days. Click to get this free reportSchwab Fundamental International Small Company Index ETF (FNDC): ETF Research ReportsVanguard FTSE Developed Markets ETF (VEA): ETF Research ReportsVanguard Total International Stock ETF (VXUS): ETF Research ReportsTo read this article on Zacks.com click here.Zacks Investment Research]"
4,9b6bc934-286c-3a05-b459-d1c3769695c1,SCHW,2023-08-28,4 Steps to Take if You're Near Retirement and Facing a Bear Market,Motley Fool,https://finance.yahoo.com/m/9b6bc934-286c-3a05-b459-d1c3769695c1/4-steps-to-take-if-you%27re.html,1693155629,STORY,['SCHW'],"[Facing a bear market as you near retirement may feel daunting, but there are steps you can take to prepare. Take a look at four of them.Continue reading]"
