,Id,Company,Date,Title,Publisher,Link,ProviderPublishTime,Type,Related Company,Text
24,7273e7d3-a654-3a62-a0df-6a9bcda40abf,PM,2023-06-19,Philip Morris International Insiders Sold US$16m Of Shares Suggesting Hesitancy \,Simply Wall St.,https://finance.yahoo.com/news/philip-morris-international-insiders-sold-130028274.html,1687093228,STORY,['PM'],"[Over the past year, many Philip Morris International Inc. (NYSE:PM) insiders sold a significant stake in the company which may have piqued investors' interest. Knowing whether insiders are buying is usually more helpful when evaluating insider transactions, as insider selling can have various explanations. However, if numerous insiders are selling, shareholders should investigate more.While insider transactions are not the most important thing when it comes to long-term investing, logic dictates you should pay some attention to whether insiders are buying or selling shares. See our latest analysis for Philip Morris International The Last 12 Months Of Insider Transactions At Philip Morris InternationalThe Executive Chairman of the Board, Andre Calantzopoulos, made the biggest insider sale in the last 12 months. That single transaction was for US$8.0m worth of shares at a price of US$100 each. So we know that an insider sold shares at around the present share price of US$94.89. While we don't usually like to see insider selling, it's more concerning if the sales take place at a lower price. We note that this sale took place at around the current price, so it isn't a major concern, though it's hardly a good sign.Philip Morris International insiders didn't buy any shares over the last year. You can see the insider transactions (by companies and individuals) over the last year depicted in the chart below. If you want to know exactly who sold, for how much, and when, simply click on the graph below!insider-trading-volumeIf you like to buy stocks that insiders are buying, rather than selling, then you might just love this free list of companies. (Hint: insiders have been buying them).Insider Ownership Of Philip Morris InternationalLooking at the total insider shareholdings in a company can help to inform your view of whether they are well aligned with common shareholders. I reckon it's a good sign if insiders own a significant number of shares in the company. Philip Morris International insiders own 0.2% of the company, currently worth about US$230m based on the recent share price. This kind of significant ownership by insiders does generally increase the chance that the company is run in the interest of all shareholders.Story continuesWhat Might The Insider Transactions At Philip Morris International Tell Us?It doesn't really mean much that no insider has traded Philip Morris International shares in the last quarter. It's great to see high levels of insider ownership, but looking back over the last year, we don't gain confidence from the Philip Morris International insiders selling. While we like knowing what's going on with the insider's ownership and transactions, we make sure to also consider what risks are facing a stock before making any investment decision. You'd be interested to know, that we found 2 warning signs for Philip Morris International and we suggest you have a look.But note: Philip Morris International may not be the best stock to buy. So take a peek at this free list of interesting companies with high ROE and low debt.For the purposes of this article, insiders are those individuals who report their transactions to the relevant regulatory body. We currently account for open market transactions and private dispositions, but not derivative transactions.Have feedback on this article? Concerned about the content? Get in touch with us directly. Alternatively, email editorial-team (at) simplywallst.com.This article by Simply Wall St is general in nature. We provide commentary based on historical data and analyst forecasts only using an unbiased methodology and our articles are not intended to be financial advice. It does not constitute a recommendation to buy or sell any stock, and does not take account of your objectives, or your financial situation. We aim to bring you long-term focused analysis driven by fundamental data. Note that our analysis may not factor in the latest price-sensitive company announcements or qualitative material. Simply Wall St has no position in any stocks mentioned.Join A Paid User Research SessionYou’ll receive a US$30 Amazon Gift card for 1 hour of your time while helping us build better investing tools for the individual investors like yourself. Sign up here]"
25,ee48032d-47aa-3f57-a0a3-78dfd0175816,GS,2023-06-19,Oil Steadies as Focus Returns to China Stimulus on US Holiday,Bloomberg,https://finance.yahoo.com/news/oil-edges-lower-last-week-224842151.html,1687167435,STORY,['GS'],[]
26,2d4a8769-25a2-3c1e-8f92-b3ae6c82a0a5,APTV,2023-06-19,7 EV Sleeper Stocks to Buy Before Investors Wake Up,InvestorPlace,https://finance.yahoo.com/news/7-ev-sleeper-stocks-buy-172656666.html,1686590816,STORY,"['FSR', 'MGA', 'BLNK', 'APTV', 'TM', 'TSLA']","[When you mention EV stocks, I bet most people immediately think of Tesla (NASDAQ:TSLA), Elon Musk, American legacy manufacturers releasing electric versions of popular models, and perhaps a few Chinese makers like Nio (NYSE:NIO). I’d also bet that most of the money to be made in those stocks has already been made. What I’m getting at here is the idea that in order to find higher returns in EV stocks, investors need to think differently. That means it’s necessary to identify undervalued sleeper stocks that aren’t necessarily unknown, but that also aren’t yet in high demand. EVs have already reached a critical mass: They aren’t a fad, they are here to stay. That means investing in up-and-coming EV stocks can and will yield strong returns. InvestorPlace - Stock Market News, Stock Advice &amp; Trading TipsPolestar (PSNY)Close up Polestar logo with electric car in store. Polestar (PSNY) is a Swedish automotive brand owned by Volvo Cars and GeelySource: Robert Way / Shutterstock.comPolestar (NASDAQ:PSNY) is currently going through growing pains that present an opportunity to investors in PSNY stock. The company delivered a record 51,491 vehicles in 2022. That had many investors riding high last year and brought share prices higher with it. But in 2023, Polestar is facing inevitable growing pains that have taken some of the shine off its shares. A big part of the problem is that the production starts of Polestar’s 3 SUV has been delayed. The result is that Polestar now anticipates delivering between 60,000-70,000 vehicles in 2023. That would still represent 36% growth at the upper end. It’s just that the Polestar 3 will now begin production in early 2024. The Polestar 4 remains on schedule for a Q4 production start in China and early 2024 elsewhere. The company, like so many others, is focused on efficiency this year. It has instated a hiring freeze and other cost-cutting measures. That’s all good and well, but investors should also note that the company already posted a very minimal loss in Q1. It’s pretty well run as it is. Fisker (FSR)The Fisker logo hangs on display at the November 2011 International Auto Show.Source: Eric Broder Van Dyke / Shutterstock.comStory continuesFisker (NYSE:FSR) has just entered the sales stage. The company delivered its first vehicle on May 25. That means investors will have a much better idea of its top-line performance in a few months. Right now, we only know that Fisker is spending a lot of money to get operations going while receiving a few hundred thousand per quarter in revenues. Q2 will basically be two-thirds of a normal quarter for the company in terms of sales. Yet investors only know that Fisker expects to produce between 1,400-1,700 vehicles in Q2. We have no idea how many deliveries it expects. That is an important factor in forecasting sales. Anyway, Fisker has entered the production stages. Up to 36,000 Ocean SUVs will be produced in 2023. The company now has to focus on balancing deliveries and liquidity concerns. Fortunately, the company has $652 million in cash and equivalents and expects $610 million in total expenses at most this year. Magna International (MGA)A Magna International (MGA) sign is on the front of a Magna building in Ontario, Canada.Source: JHVEPhoto / Shutterstock.comInvestors should really consider Magna International (NYSE:MGA) stock because it is already in the middle of a great experiment that can propel it much higher. The problem — if it can be called that — is that investors have shiny object syndrome. What I mean is that Magna International has fallen out of the limelight. The company successfully began production of the Ocean SUV for Fisker on time on Nov. 17 of last year. This is essentially a test trial for Magna International. The company generally acts as a third-party manufacturer for lower volume, niche models. It has now effectively become a contract manufacturer in the EV space. What that means is that Magna International may already be set up to be the go-to solution for outsourced EV manufacturing. If the Fisker Ocean proves to be a quality vehicle then MGA stock will suddenly have a lot more upside. The positive news is that based on the target price, MGA stock already has approximately 20% upside. That also doesn’t take into account the dividend yielding 3.5% currently. Toyota (TM)Toyota (TM) logo on the building of a dealership during daylightSource: josefkubes / Shutterstock.comWhen it comes to legacy manufacturers and EVs, Toyota (NYSE:TM) stock hardly gets the recognition it deserves. Ford (NYSE:F) and General Motors (NYSE:GM) tend to get much more press. That’s arguably a function of Toyota’s laggard status. It had remained stalwart in a hybrid-first strategy under the leadership of Akio Toyoda. But Toyoda, the grandson of the founder, stepped down in January. New CEO Koji Sato intends to release 10 new battery electric vehicles by 2026. That brings Toyota into the all-electric fold and makes it competitive with other EV giants. Tesla sold 1.3 million EVs in 2022. Toyota expects to sell 1.5 million by 2026. Current expectations are that GM and Ford will be producing similar volumes by that time, perhaps more. But who would you trust to build the higher-quality vehicle? I know I’d bet on Toyota 10 times out of 10 to do so. And that’s going to matter over the long run just as it has with those brands’ respective fossil fuel vehicles. FREYR Battery (FREY)Person holding smartphone with logo of Norwegian battery company Freyr AS (FREY) on screen in front of website. Focus on phone display. Unmodified photo.Source: T. Schneider / Shutterstock.comFREYR Battery (NYSE:FREY) stock could hold the answer to the question of how environmentally friendly EV batteries really are. FREYR Battery markets itself as “clean battery solutions.” And some of its operations are located in Norway, which is one of the greenest countries in the world. The company is producing current-generation lithium-ion batteries fueled by hydroelectric and wind energy. All of those factors combine to potentially make FREYR Battery a real green solution. It provides a strong counter to arguments related to CO2 emissions and EV batteries. FREYR Battery is building parallel operations that include a U.S. manufacturing base, Giga America, and a Norway manufacturing base, Giga Arctic. The solution allows the company to judge the efficacy of both in parallel and adjust accordingly. Right now, Giga America is receiving greater attention due to the Inflation Reduction Act’s EV provisions. In time, FREY stock should grow as it represents a partnership between a leading green nation and U.S. aspirations to build partnerships in EVs with politically stable nations. Aptiv (APTV)An Aptiv (APTV) office building in Poland.Source: shutterstock.comAptiv (NYSE:APTV) supplies automotive technology and was formerly known as Delphi Systems under General Motors. The company has deep experience in the integration of software and automotive systems. It is particularly focused on autonomous driving safety, making it especially relevant as EVs gain wider acceptance. That wider acceptance will partially hinge on the development of autonomous driving in EVs. Aptiv has a real opportunity to establish itself as an authority in that realm. Back in 2019, Aptiv formed a joint venture with Hyundai focused on Level 4 and Level 5 self-driving technology. Share prices have gone up and down since then, but the positive news is that there’s plenty of upside now.Aptiv’s sales and net income both continue to grow. Those high-level figures provide a reasonable snapshot of overall health. So, Aptiv continues to do well and grow despite overarching concerns about the economy. The greater the level of autonomous driving adoption, the better for Aptiv. Blink Charging (BLNK)a blink charging station, BLNK stockSource: David Tonelson/Shutterstock.comBlink Charging (NASDAQ:BLNK) is an EV stock that gets overshadowed by bigger-name competitors in the space. But for aggressive investors seeking high growth, Blink Charging offers more. Let’s put some numbers to that growth just to give you an idea of how fast Blink Charging is growing. Total revenues increased by 121% year-over-year, reaching $21.67 million in Q1. Service revenues more than tripled during that period. And network fees jumped by 911%. However, net losses also nearly doubled, up 97% to $29.8 million. There’s clearly risk inherent in investing in Blink Charging stock. One obvious risk is interest rate risk as it pertains to growth shares like BLNK stock. They fall when rates rise and do well when rates stabilize or fall. Rate hikes are coming nearer to an end, so that works in Blink Charging’s favor. If more investors become aware of the growth metrics underpinning the company, those two factors could conspire to send BLNK shares higher very quickly. On the date of publication, Alex Sirois did not have (either directly or indirectly) any positions in the securities mentioned in this article. The opinions expressed in this article are those of the writer, subject to the InvestorPlace.com Publishing Guidelines.Alex Sirois is a freelance contributor to InvestorPlace whose personal stock investing style is focused on long-term, buy-and-hold, wealth-building stock picks. Having worked in several industries from e-commerce to translation to education and utilizing his MBA from George Washington University, he brings a diverse set of skills through which he filters his writing.More From InvestorPlaceBuy This $5 Stock BEFORE This Apple Project Goes LiveDid Elon Musk Just Trigger a New Netscape Moment?The $1 Investment You MUST Take Advantage of Right NowThe Rich Use This Income Secret (NOT Dividends) Far More Than Regular InvestorsThe post 7 EV Sleeper Stocks to Buy Before Investors Wake Up appeared first on InvestorPlace.]"
27,f1e559a4-a6f7-3bf1-8ef2-3e40155d6224,NFLX,2023-06-19,Streaming Customers Get Choosy About When to Pay for Ads,The Wall Street Journal,https://finance.yahoo.com/m/f1e559a4-a6f7-3bf1-8ef2-3e40155d6224/streaming-customers-get.html,1687167000,STORY,['NFLX'],[]
28,c66a1ef2-4614-36e9-a043-0a2396afda20,NFLX,2023-06-19,The Next Bull Market Might Already Be Here: 2 Sensational Stocks to Buy Now,Motley Fool,https://finance.yahoo.com/m/c66a1ef2-4614-36e9-a043-0a2396afda20/the-next-bull-market-might.html,1687091922,STORY,"['NFLX', 'SPOT']","[Wall Street is in the midst of a debate: Did a new bull market just begin, or is there more work to be done? The benchmark S&amp;P 500 index has been in a technical bear market since June 2022, when it closed 20% below its all-time high.Continue reading]"
