,Id,Company,Date,Title,Publisher,Link,ProviderPublishTime,Type,Related Company,Text
56,99e3bf8e-3970-330d-af16-6d862d512edc,PWR,2023-09-24,The 3 Most Undervalued Industrial Stocks to Buy in September 2023,InvestorPlace,https://finance.yahoo.com/news/3-most-undervalued-industrial-stocks-111837217.html,1695035917,STORY,"['PWR', 'DE']","[According to Morningstar, industrial stocks are affiliated with companies that manufacture machinery, handheld tools, industrial products, aerospace, defense and transportation. The best industrial stocks to buy are those that are heavily exposed to the energy revolution, U.S. economic growth, government infrastructure spending and the onshoring trend. The latter term refers to American companies’ recent tendency to relocate their factories to America. And with many farmers prospering tremendously amid very high food prices, buying the shares of farm equipment makers also makes a great deal of sense. The following greatly undervalued industrial stocks have a great deal of exposure to one or more of those trends.Quanta Services (PWR)Environmental protection, renewable, sustainable energy sources. Plant growing in the bulb concept. renewable energy stocks to buySource: Proxima Studio / Shutterstock.comQuanta (NYSE:PWR) builds infrastructure, electrical power stations, facilities for renewable energy and natural gas transmission.Consequently, the company is very well-positioned to benefit from the shift to electrified transportation. Quanta will therefore see an increased need in their services in the forms of energy transmission and additional power grids. Additionally, Quanta will be helped by the tremendous amount of money that will be spent on renewable energy facilities.InvestorPlace - Stock Market News, Stock Advice &amp; Trading TipsQuanta has taken on two huge renewable energy products in SunZia Transmission and SunZia Wind. The company was selected to transmit wind power generated in New Mexico to power-hungry states in the Western U.S. Cumulatively, the two initiatives ” represent the largest clean energy infrastructure project in United States history,” Quanta reported.Quanta will doubtlessly generate a great deal of revenue and profits from these projects and will probably be chosen to carry out many more like them.Despite these powerful, positive catalysts, PWR stock only has a forward price-earnings ratio of 23.25 which is about average for the S&amp;P 500. As a result, it’s definitely one of the most undervalued industrial stocks.Story continuesManitowoc (MTW)Source: ShutterstockConstruction equipment provider, Manitowoc (NYSE:MTW), is well-positioned to benefit from strong U.S. economic growth.Barron’s noticed that, in previous weeks, industrial stocks had retreated. The hypothesis was that, if the Fed stopped raising its rates, the industrial sector and the American economy could continue their expansion.Barron’s also noted that undervalued industrial stocks can get a lift from the current, high level of infrastructure spending by the U.S. government. The American economy does indeed look set to continue growing, as retail sales expanded significantly again last month. The Atlanta Fed predicts that the U.S. economy will grow by a very impressive 5.8% this quarter. Meanwhile, most market observers now believe that the Fed is done or almost finished raising rates.Barron’s named Caterpillar (NYSE:CAT) as one of the stocks that can benefit from these trends. Mantiwoc also sells construction equipment and equipment used to expand infrastructure. The company is also well-positioned to benefit from the current high oil prices due to its marketing oil exploration equipment. MTW has a very low forward price-earnings ratio of 9.8.Deere (DE)Several John Deere vehicles are parked outside of a building.Source: Jim Lambert / Shutterstock.comDeere (NYSE:DE) markets farming equipment. As a result, the company is benefiting from high food prices which is incentivizing farmers to harvest more crops.Last quarter, Deere’s revenue jumped 12% versus the same period a year earlier. Its net income also soared an incredible 58% year-over-year to $2.98 billion.“Reflected by our strong third-quarter results, Deere continues to benefit from favorable market conditions and an operating environment showing further improvement,” said CEO John C. May in a statement. DE stock has a very low forward price-earnings ratio of 12.4.On the date of publication, Larry Ramer did not hold (either directly or indirectly) any positions in the securities mentioned in this article. The opinions expressed in this article are those of the writer, subject to the InvestorPlace.com Publishing Guidelines.Larry Ramer has conducted research and written articles on U.S. stocks for 15 years. He has been employed by The Fly and Israel’s largest business newspaper, Globes. Larry began writing columns for InvestorPlace in 2015. Among his highly successful, contrarian picks have been PLUG, XOM and solar stocks. You can reach him on Stocktwits at @larryramer.More From InvestorPlaceMusk’s “Project Omega” May Be Set to Mint New Millionaires. Here’s How to Get In.ChatGPT IPO Could Shock the World, Make This Move Before the AnnouncementIt doesn’t matter if you have $500 or $5 million. Do this now.The post The 3 Most Undervalued Industrial Stocks to Buy in September 2023 appeared first on InvestorPlace.]"
57,c26672b6-9e03-32f2-bfce-3e89416989e8,NKE,2023-09-24,"Disney Stock Could Climb 50%, J.P. Morgan Says",Barrons.com,https://finance.yahoo.com/m/c26672b6-9e03-32f2-bfce-3e89416989e8/disney-stock-could-climb-50%25%2C.html,1695422100,STORY,"['DIS', 'CSCO', 'WMT', 'NKE', 'IBM']","[Walt Disney hosted a parks-focused analyst meeting at Walt Disney World, where speakers included CEO Bob Iger, Disney Parks, Experiences and Products Chairman Josh D’Amaro, and ESPN Chairman Jimmy Pitaro, as well as a number of other executives. On the stock, we have found investors mostly on the sidelines this year as the company works to define its strategic future, but like shares at this level and expect in the next six to 12 months that major questions around Hulu, an ESPN investment, and a linear sale (or not) will be answered, which should give investors more confidence in long-term value creation at the company.Continue reading]"
58,ea848b51-d14d-3fc9-9c2f-f2d9665adce0,WFC,2023-09-24,10 Best Investments During High Interest Rates,Insider Monkey,https://finance.yahoo.com/news/10-best-investments-during-high-215854848.html,1695506334,STORY,"['USB', 'PM', 'WFC', 'PEP', 'CL', 'PG', 'BRK-B', 'V']","[In this article, we discuss 10 best investments during high interest rates. If you want to skip our detailed discussion on the stock market outlook and industries benefiting the most due to high interest rates, head directly to 5 Best Investments During High Interest Rates.According to J.P. Morgan's analysis last year, as mentioned by Forbes, starting from February 2009, there was a strong correlation between the movements of the S&amp;P 500 and the 10-year Treasury bond yield until the 10-year yield reached 3.5%, at which point they began to diverge. In simpler terms, increasing interest rates can benefit the overall stock market up to a certain threshold. Rising interest rates have several implications for financial markets. They tend to put pressure on stock valuations, impacting corporate profits and growth prospects, especially for growth stocks. Dividend-paying stocks may need to increase yields to compete with potentially higher bond coupon rates. However, financials, particularly banks and lending institutions, historically perform well in rising rate environments as they can earn more on loans.""As the Federal Reserve increases interest rates, we can anticipate a deceleration in economic growth,"" Eric Freedman, Chief Investment Officer, U.S. Bank Wealth and Institutional Asset Management, commented in July 2023. Indeed, the Gross Domestic Product (GDP) expanded at a notably slower rate in 2022, registering a 2.1% growth compared to the 5.9% seen in 2021. In the first quarter of 2023, the economy seemed to stabilize, achieving a 2.0% annualized growth rate. Hiked interest rates have also altered the landscape for equity investors, leading to potential impacts on future earnings growth for U.S. companies. Economic weakness, resulting in slower GDP growth, can affect corporate earnings and stock prices. Additionally, the attractiveness of bonds and other fixed income investments increases with higher interest rates, potentially reducing demand for stocks. Stocks with premium price-to-earnings (P/E) multiples, particularly those with future earnings expectations that may not materialize, face risks in this changing environment. Higher debt costs due to elevated interest rates could also impact corporate profits and stock prices. While the Federal Reserve has signaled more rate hikes to come, the outlook for equities remains uncertain, with factors like corporate performance and inflation influencing market dynamics and potential volatility ahead.Story continuesIt's not only financial companies that can thrive in a favorable rising interest rate environment. Consumer discretionary stocks can also experience a boost, as improved employment and a healthier housing market tend to encourage consumers to indulge in non-essential purchases beyond basic staples like food, beverages, and hygiene products. According to CNBC, in July 2022, the United States' inflation rate, assessed through the Consumer Price Index, stood at 8.5%. Although the impact of inflation varied across different goods and services, categories like food and energy witnessed the most significant price increases. Some noteworthy companies to watch during interest rate hikes include Bank of America Corporation (NYSE:BAC), in the banking and finance sector, as well as consumer goods retailers such as Walmart Inc. (NYSE:WMT).Investors should consider strategies for navigating this environment, such as strategic bond investments to manage rate exposure, actively managed strategies to mitigate concentration risk, and diversification across sectors, regions, and market capitalization to maintain a balanced portfolio. Investors looking to expand their portfolio through low-risk investment opportunities during a period with hiked interest rates can look at Visa Inc. (NYSE:V), JPMorgan Chase &amp; Co. (NYSE:JPM), and Berkshire Hathaway Inc. (NYSE:BRK.A).Our Methodology We selected stocks from industries that historically perform well during high interest rate environments, such as consumer staples, banking, retail, and insurance. We aimed to select stocks that had the highest hedge fund sentiment in the aforementioned sectors. We assessed the hedge fund sentiment from Insider Monkey’s database of 910 elite hedge funds tracked as of the end of the second quarter of 2023. The list is arranged in ascending order of the number of hedge fund investors in each firm.10 Best Investments During High Interest RatesPhoto by Mirza Babic on UnsplashBest Investments During High Interest Rates10. Philip Morris International Inc. (NYSE:PM)Number of Hedge Fund Holders: 54Philip Morris International Inc. (NYSE:PM) functions as a tobacco enterprise working to create a smoke-free future. On September 13, Philip Morris International Inc. (NYSE:PM) declared a $1.30 per share quarterly dividend, a 2.4% increase from its prior dividend of $1.27. The dividend is distributable on October 12, to shareholders of record on September 27. According to Insider Monkey’s second quarter database, 54 hedge funds were bullish on Philip Morris International Inc. (NYSE:PM), compared to 55 funds in the last quarter. Terry Smith’s Fundsmith LLP is one of the major stakeholders of the company, with 15.8 million shares worth $1.54 billion.In addition to Visa Inc. (NYSE:V), JPMorgan Chase &amp; Co. (NYSE:JPM), and  Berkshire Hathaway Inc. (NYSE:BRK.A), Philip Morris International Inc. (NYSE:PM) is one of the best investments during high interest rates.Ariel International Fund made the following comment about Philip Morris International Inc. (NYSE:PM) in its Q1 2023 investor letter:“Finally, tobacco maker, Philip Morris International Inc. (NYSE:PM) declined in the period on concerns related to supply-chain disruptions resulting from the war in Ukraine, which we view as temporary. We believe the favorable economics and margin expansion associated with market share gains from the IQOS brand and Reduced Risk Products should yield value creation opportunities in the years ahead. Furthermore, at current trading levels, we think the company’s operating leverage, pricing power, and free cash flow profile offer a margin of safety.”9. Colgate-Palmolive Company (NYSE:CL)Number of Hedge Fund Holders: 58Colgate-Palmolive Company (NYSE:CL) produces and markets consumer goods on a global scale. The corporation is divided into two divisions – Oral, Personal, Home Care, and Pet Nutrition. On July 28, Colgate-Palmolive Company (NYSE:CL) reported a Q2 non-GAAP EPS of $0.77, beating Wall Street estimates by $0.02. The revenue of $4.82 billion increased 7.6% year-over-year, surpassing market consensus by $120 million. Colgate-Palmolive Company (NYSE:CL), as part of the consumer goods industry, benefits from several factors that make it less susceptible to the impacts of high-interest rates, such as strong brand loyalty and product differentiation to shield it from price sensitivity, as well as its global presence. According to Insider Monkey’s second quarter database, 58 hedge funds were bullish on Colgate-Palmolive Company (NYSE:CL), as compared to 55 in the previous quarter. Jean-Marie Eveillard’s First Eagle Investment Management is the leading stakeholder of the company, with an estimated 11 million shares worth $854.5 million.Third Point Management made the following comment about Colgate-Palmolive Company (NYSE:CL) in its Q1 2023 investor letter:“Existing positions in LVMH, Disney and Microsoft gained while FIS, Bath &amp; Body Works, and Colgate-Palmolive Company (NYSE:CL) posted losses after their management teams lowered 2023 guidance despite reporting solid quarterly results. FIS and Colgate have both since “beat and raised” this guidance, indicating that many management teams are adopting very conservative tones in this uncertain macro environment.”8. PepsiCo, Inc. (NASDAQ:PEP)Number of Hedge Fund Holders: 68PepsiCo, Inc. (NASDAQ:PEP) is a global company known for producing, marketing, and distributing a wide range of beverages and convenient foods. On July 20, PepsiCo, Inc. (NASDAQ:PEP) declared a quarterly dividend of $1.265 per share, in line with previous. The dividend will be distributed on September 29, to shareholders of record on September 1. PepsiCo, Inc. (NASDAQ:PEP) is less affected by high interest rates due to its diversification across multiple sectors and regions, a strong financial position with ample cash reserves, pricing power, efficient capital management, hedging strategies, and a portfolio of strong brands.According to Insider Monkey’s second quarter database, 68 hedge funds were bullish on PepsiCo, Inc. (NASDAQ:PEP), two down from the last quarter. Ric Dillon’s Diamond Hill Capital is a prominent stakeholder of the company, with 2.70 million shares worth nearly $501 million.Madison Sustainable Equity Fund made the following comment about PepsiCo, Inc. (NASDAQ:PEP) in its Q1 2023 investor letter:“PepsiCo, Inc. (NASDAQ:PEP) announced that it will commit $3.3 million in funds toward water replenishment projects across North America. These projects aim to reduce absolute water use and replenish back into the local watershed more than 100% of the water used at company-owned and third-party sites in high water-risk areas.”7. The Procter &amp; Gamble Company (NYSE:PG)Number of Hedge Fund Holders: 74The Procter &amp; Gamble Company (NYSE:PG) offers branded consumer packaged goods worldwide. Its operations are divided into five segments – Beauty, Grooming, Health Care, Fabric &amp; Home Care, and Baby, Feminine &amp; Family Care. On July 28, The Procter &amp; Gamble Company (NYSE:PG) reported fourth quarter results for fiscal 2023. The non-GAAP EPS of $1.37 exceeded Wall Street estimates by $0.05. The revenue of $20.6 billion increased 5.5% year-over-year, surpassing market consensus by $610 million.According to Insider Monkey’s second quarter database, 74 hedge funds were bullish on The Procter &amp; Gamble Company (NYSE:PG), one down from the last quarter. Ray Dalio’s Bridgewater Associates is a significant position holder in the company, with a stake worth $700.5 million. 6. Wells Fargo &amp; Company (NYSE:WFC)Number of Hedge Fund Holders: 75Wells Fargo &amp; Company (NYSE:WFC), a diversified financial services corporation, offers a range of banking, investment, mortgage, and consumer and commercial financial products and services both in the United States and globally. The company is organized into four segments – Consumer Banking and Lending, Commercial Banking, Corporate and Investment Banking, and Wealth and Investment Management. On July 14, Wells Fargo &amp; Company (NYSE:WFC) reported a Q2 GAAP EPS of $1.25, beating Wall Street estimates by $0.09. The revenue of $20.53 billion increased 20.6% year-on-year, surpassing market estimates by $410 million. Wells Fargo's loan portfolio diversification, pricing flexibility, investment management, loyal customer base, and regulatory risk measures enable it to navigate changing interest rate environments well. According to Insider Monkey’s second quarter database, 75 hedge funds were bullish on Wells Fargo &amp; Company (NYSE:WFC), as compared to 78 in the last quarter. Harris Associates is the top stakeholder of the firm, with over 24 million shares valued at approximately $1.02 billion.Like Visa Inc. (NYSE:V), JPMorgan Chase &amp; Co. (NYSE:JPM), and  Berkshire Hathaway Inc. (NYSE:BRK.A), Wells Fargo &amp; Company (NYSE:WFC) is one of the best investments for high interest rate periods. Rowan Street Capital made the following comment about The Procter &amp; Gamble Company (NYSE:PG) in its Q4 2022 investor letter:“Let’s look at The Procter &amp; Gamble Company (NYSE:PG). Dividend yield is 2.4%. Earnings are forecasted to grow at 5.9%, and its current earnings multiple is at 25x. Now, lets say over the next 3-5 years the market loses interest in the “safe”, mature companies that grow at anemic rates and gets an appetite for growth again. It’s very unlikely that Mr. Market will be paying 25x for 5.9% earnings growth. Let's assume that multiple declines to the market average of 18x — that would be ~6.9% drag per year on the total expected return over next 3-5 years. If we get 2.4% (dividend) + 5.9% (earnings growth) – 6.9% (decrease in earnings multiple) = 1.4% (annual return we can expect on average from this stock).”Click to continue reading and see 5 Best Investments During High Interest Rates.  Suggested articles:30 Low Cost Business Ideas With High Profit12 Best Streaming and TV Stocks To Buy Now12 Best Growth ETFs to Buy Disclosure: None. 10 Best Investments During High Interest Rates is originally published on Insider Monkey.]"
59,31748a6b-6d97-3af5-9449-6f5b6d34e4cd,WFC,2023-09-24,Housing Market 2023: 8 Cities That Will Give You $10K Toward Your Down Payment,GOBankingRates,https://finance.yahoo.com/news/housing-market-2023-8-cities-180017909.html,1695492017,STORY,"['WFC', 'ZG']","[wdstock / Getty ImagesWells Fargo Home Lending is offering $10,000 Homebuyer Access grants that will be applied toward the down payment for eligible homebuyers who currently live in or are purchasing homes in eight metropolitan areas.This offering under the company's Special Purpose Credit Program (SPCP) adds another key component to Wells Fargo's efforts to help drive economic growth, sustainable homeownership, and neighborhood stability in minority communities, Wells Fargo said in an August press release.Read: 5 Reasons the Housing Market is ReversingFind Out: 3 Things You Must Do When Your Savings Reach $50,000Asked how Wells Fargo picked these specific areas, a spokesperson said they were selected because they offered strong opportunities to increase homeownership among minority families, based on historical home purchase activity, and because they are locations where Wells Fargo has overlapping strategies that can help support the program's success.""Wells Fargo has local home mortgage consultants in the selected markets, for example, and our Dream. Plan. Home. closing cost credit is also available in these geographies,"" the spokesperson said.Here are the eight areas in which the grants are available initially to homebuyers.jimkruger / Getty ImagesMinneapolis-St. Paul Metro AreaAverage home prices: The average Minneapolis-St. Paul-Bloomington area home value is $373,640, down 1.3% over the past year and goes to pending in around 13 days, according to Zillow.Taxes: The minimum combined 2023 sales tax rate for Bloomington is 7.53%. For St. Paul, it's 7.88% and for Minneapolis, it's 8.03%.I'm a Real Estate Agent: Buy Real Estate in These 10 Cities To Be Rich in 10 YearsBuying a House? Here's How To Get a 4% Mortgage RateSeanPavonePhoto / Getty Images/iStockphotoPhiladelphia Metro AreaAverage home prices: The average Philadelphia-Camden-Wilmington home value is $346,473, up 4.3% over the past year, and goes to pending in around eight days, according to Zillow.Tax rate: The sales tax rate for Philadelphia-Camden-Wilmington metro area is 6.1%, according to Best Places.Story continuesI'm a Real Estate Agent: Don't Buy Real Estate in These 5 States If You Want To Be Rich in 10 YearsSean Pavone / Shutterstock.comDallas-Fort Worth Metro AreaAverage home prices: The average Dallas-Fort Worth-Arlington home value is $373,556, down 3% over the past year, and goes to pending in around 12 days.Tax rate: All three cities' sales tax rate stands at  8.25%.Tinnaporn Sathapornnanont / Shutterstock.comWashington, D.C., Metro AreaAverage home prices: The average Washington-Arlington-Alexandria home value is $541,810, down 0.1% over the past year, and goes to pending in six days, according to Zillow.Tax rate: The tax rate for all three cities is 5.9%, according to Best Places.Majestic_Aerials / Getty ImagesBaltimore Metro AreaAverage homes prices: The average Baltimore-Columbia-Towson home value is $372,577, up 3.6% over the past year, and goes to pending in around six days.Tax rate:  The sales tax rate for the Baltimore-Columbia-Towson area is 6%, according to Best Places.Nate Hovee / Getty Images/iStockphotoAtlanta Metro AreaAverage home prices: In July 2023, Sandy Springs home prices were up 4.5% compared to last year, selling for a median price of $605,000, according to Redfin. The average Alpharetta home value is $656,261, up 2.6% over the past year, and goes to pending in around 10 days, according to Zillow.Meanwhile, the average Atlanta home value is $376,972, down 1.2% over the past year, and goes to pending in around 21 days.Tax rate: Both Sandy Springs and Alpharetta's sales tax rate stand at 7.75%, while Atlanta's is higher, at 8.9%.Eric Krouse / Shutterstock.comCharlotte, N.C., Metro AreaAverage home prices: The average Charlotte-Concord-Gastonia home value is $369,442, down 0.3% over the past year, and goes to pending in around eight days, according to Zillow.Tax rate: Sales tax rate for the Charlotte-Concord-Gastonia area is 7.1%, according to Best Places.Doug Kerr / Flickr.comNew York Metro Area/Newark-Jersey City, New JerseyAverage home prices: The average New York-Newark-Jersey City home value is $618,653, up 2.7% over the past year, and goes to pending in around 24 days, according to Zillow.Tax rate: Jersey City and Newark's sales tax rate stands at 6.63%. Meanwhile, it's much higher in New York City- with a 8.87% tax rate.More From GOBankingRatesHow To Get Free Money: 13 Proven WaysSuccessful Retirees Master These 7 Money Moves To Keep Their Retirement Funds Secure3 Things You Must Do When Your Savings Reach $50,000How to Save $200,000 Cash By Improving Your Credit ScoreThis article originally appeared on GOBankingRates.com: Housing Market 2023: 8 Cities That Will Give You $10K Toward Your Down Payment]"
60,8eda1378-3d22-3525-9987-929675514be0,PYPL,2023-09-24,3 Unrivaled Stocks That Can Generate Life-Changing Money by 2040,Motley Fool,https://finance.yahoo.com/m/8eda1378-3d22-3525-9987-929675514be0/3-unrivaled-stocks-that-can.html,1695546360,STORY,"['PYPL', 'LOVE', '^GSPC', 'ETSY']","[Since this decade began, the major stock indexes have all endured two bear markets. With all three major stock indexes well below their all-time highs set between November 2021 and January 2022, bargains can still be found. Patient investors wanting to lean on time as an ally can buy the following three unrivaled stocks now, with the goal of generating life-changing money by 2040.Continue reading]"
