,Id,Company,Date,Title,Publisher,Link,ProviderPublishTime,Type,Related Company,Text
33,e6fc2ccc-eab3-36b1-aced-b6e5f3cf90be,IBM,2023-05-21,Top 20 Most Popular Consumer Electronics Brands,Insider Monkey,https://finance.yahoo.com/news/top-20-most-popular-consumer-122351505.html,1684585431,STORY,"['GOOGL', 'NVDA', 'INTC', 'MSFT', 'IBM', 'HPQ', 'PHG', 'DELL']","[In this article, we will take a look at the top 20 most popular consumer electronics brands. If you want to see more brands in this selection, go to the Top 5 Most Popular Consumer Electronics Brands.According to Zion Industry Research, the size of the consumer electronics industry is set to increase from $1.10 trillion in 2021 to $1.70 trillion by 2028, reflecting a compound annual growth rate of 7.6%. China stands out as one of the largest manufacturers of consumer electronic goods. Consequently, the COVID-19 pandemic had a significant adverse impact on the industry, considering China's position as the epi-centre of the virus. Regulations regarding social distancing and the closure of businesses led to a global reduction in the sales of electronics. For example, Sony's Electronic Products and Solutions segment experienced a decline in revenue, with sales dropping from 977.4 billion yen ($7.09 billion) in the first half of 2019 to 836.5 billion yen ($6.07 billion) in the first half of 2020 due to retail stores closing down. In addition to Sony Group Corporation (NYSE:SONY), companies such as Apple, Inc. (NASDAQ:AAPL), Samsung Electronics Co., Ltd. (005930.KS), and LG also temporarily halted production in various countries to adhere to government regulations. However, one positive trend that emerged during the pandemic was the increased adoption of remote work, which led to a surge in demand for consumer electronics, particularly computing devices.In addition to the work-from-home trend, the preference for having connected homes is supporting the expansion of the consumer electronics industry. The convenience of enhanced features, such as voice assistance, Bluetooth, and Wi-Fi connectivity, has led to a growing adoption of appliances equipped with these tools. According to a Value of Video Report 2020 issued by Grabyo, 58% of streaming customers surveyed reported frequent video consumption on a Smart TV. Furthermore, AI technologies and voice assistants like Siri, Alexa, Google Assistant, and Cortana are becoming increasingly prevalent. The market growth of consumer electronics has been further boosted by the increased demand for Asian electronic products in Western countries. According to data from The Japan Electronics and Information Technology Industries Association, the production value of computers and information terminals in Japan rose by 1251.3 billion yen ($9.07 billion) in 2019 from 1041.1 billion yen ($7.55 billion) in 2017. Additionally, the rising disposable income among the population in South-East Asian nations has led to increased consumption of home appliances. This trend is expected to drive the regional market growth in the next decade.Story continuesThe key players in the consumer electronics industry, such as Apple, Inc. (NASDAQ:AAPL), Samsung Electronics Co., Ltd. (005930.KS), and Sony Group Corporation (NYSE:SONY) are investing heavily in research and development to introduce innovative products to cater to evolving consumer preferences and technological advancements. Meanwhile, government authorities are also actively taking initiatives to support the growth of electronics within their countries. For instance, the Government of India introduced the National Electronics Policy in 2018. The policy intends to provide a framework to achieve a turnover of $400 billion through consumer electronics manufacturing by the middle of this decade. Achieving such a significant number would surely require greater adoption of modern technologies like 5G, artificial intelligence (AI), IoT, and machine learning. Most Popular Consumer Electronics BrandsCopyright: kobby_dagan / 123RF Stock PhotoOur MethodologyWe used a consensus opinion-based rankings approach to shortlist the top 20 most popular consumer electronics brands. We used seven metrics, namely market share, brand recognition, consumer reviews and ratings, website rankings, product range, sales figures, and online presence, to evaluate the popularity of each brand. We referred to over 12 reputable sources, such as Value Today, Reddit threads, and GlobalData, to collate information regarding these metrics. The brands have been ranked in ascending order of their scores, with the maximum attainable score being 70. The methodology employed attempts to provide a holistic view of brand popularity, considering both quantitative and qualitative aspects.Top 20 Most Popular Consumer Electronics Brands20. GreeTotal Score: 24TTM Revenue: $28.03 billionGree is a Zhuhai, China-based leading multinational business famous for its reliable consumer electronic products. With a focus on user-centric design, Gree offers a variety of smart and user-friendly devices. From smart home appliances to state-of-the-art air conditioning systems, Gree's expertise lies in delivering efficient and technologically advanced solutions to enhance consumer lifestyles.19. NVIDIA Corporation (NASDAQ:NVDA)Total Score: 25TTM Revenue: $26.97 billionNVIDIA Corporation (NASDAQ:NVDA) is a notable player in the consumer electronics industry and excels in providing graphics processing units (GPUs) and artificial intelligence (AI) solutions. Renowned for their technological prowess, NVIDIA Corporation's (NASDAQ:NVDA) consumer electronics power high-performance gaming, virtual reality experiences, autonomous vehicles, and data centre solutions.Here's what RiverPark Advisors said about NVIDIA Corporation (NASDAQ:NVDA) in its Q1 2023 investor letter:“NVIDIA Corporation (NASDAQ:NVDA): NVDA shares were our next top contributor on better-than-expected 4Q results and 1Q guidance. The stock also benefitted from the positive momentum around Artificial Intelligence and the Nvidia chips that drive it. While revenue was down -21% year over year, a rebound in the company’s gaming business helped drive revenue above Wall Street’s expectations.NVDA is the leading designer of graphics processing units (GPU’s) required for powerful computer processing. Over the past 20 years, the company has evolved through innovation and adaptation from a predominantly gaming-focused chip vendor to one of the largest semiconductor/software vendors in the world. Over the past decade, the company has grown revenue at a compound annual rate of over 20% while expanding operating margins and, through its asset light business model, producing ever increasing amounts of free cash flow. After working through its near-term slowdown, we expect future growth to remain robust as NVDA chips and software are critical to many of the core technologies being adopted globally, including cloud computing, virtual reality, and artificial intelligence.”18. Alphabet Inc. (NASDAQ:GOOGL)Total Score: 26TTM Revenue: $284.61 billion Alphabet Inc. (NASDAQ:GOOGL) offers a variety of advanced consumer electronics through Google and other subsidiaries. From smartphones like the Pixel series to smart home devices such as Google Nest and Chromecast, Alphabet Inc. (NASDAQ:GOOGL) combines intuitive software with advanced hardware to provide an integrated user experience. On May 11, analysts at Morgan Stanley assigned an Overweight rating to Alphabet Inc. (NASDAQ:GOOGL) stock with a price target of $140.Diamond Hill Capital shared its stance on Alphabet Inc. (NASDAQ:GOOGL) in its Q1 2023 investor letter. Here's what the firm said:“We did have several strong performing stocks this quarter. Our top contributors to return included NVR, Amazon, Alphabet Inc. (NASDAQ:GOOG), Microsoft and Booking Holdings, all of which posted double-digit gains. Shares of media and technology giant Alphabet outperformed as the company announced expense discipline while continuing to invest in its core products of Google Search, YouTube and Google Cloud.”17. International Business Machines Corporation (NYSE:IBM)Total Score: 27TTM Revenue: $60.59 billion International Business Machines Corporation (NYSE:IBM) is a well-known player in the consumer electronics industry and offers advanced technology solutions. On April 16, International Business Machines Corporation (NYSE:IBM) made an announcement regarding its acquisition of Polar Security, an innovative company specializing in the monitoring and security of cloud and software-as-a-service application data.International Business Machines Corporation (NYSE:IBM) was discussed in the Q4 2022 investor letter of Diamond Hill Capital. Here's what the firm said:“New positions initiated in Q4 included shorts International Business Machines Corporation (NYSE:IBM), Acushnet Holdings (GOLF) and elf Beauty (ELF). Since diversified information technology company IBM’s 2019 acquisition of Red Hat, the company has aggressively pursued a hybrid cloud strategy. Though IBM and its new management team have made solid progress on this pivot, we believe the company still meaningfully lags the cloud hyperscalers and other cloud-native companies. Management has also laid out aggressive long-term targets for revenue growth and free cash flow, both of which we believe the company will struggle to achieve as it faces intense competition in its hybrid cloud business and structural headwinds in the company’s legacy businesses.”16. Fujitsu Limited (6702.T)Total Score: 28TTM Revenue: $27.27 billion (¥3.71 trillion) Fujitsu Limited (6702.T) is a Minato City, Tokyo-based conglomerate that provides a comprehensive selection of innovative products ranging from laptops and tablets to air conditioners and home appliances. In 2021, Fujitsu Limited (6702.T) held the position of the largest IT services provider in Japan and ranked as the sixth-largest globally based on annual revenue.15. Canon Inc. (7751.T)Total Score: 29TTM Revenue: $30.3 billion (¥4.12 trillion)Canon Inc. (7751.T) is an Ota, Tokyo-based company that offers imaging and optical products. The company's product portfolio includes high-performance cameras, camcorders, printers, and scanners. Canon Inc.'s (7751.T) assurance of innovation and remarkable image quality has made them a reliable brand among professional photographers, videographers, and consumers seeking top-notch imaging solutions.14. Intel Corporation (NASDAQ:INTC)Total Score: 30TTM Revenue: $56.42 billionIntel Corporation (NASDAQ:INTC) is amongst the global leaders in the consumer electronics industry. The company offers a diverse array of products, ranging from powerful processors and chipsets for PCs and laptops to solid-state drives and networking solutions. Intel Corporation (NASDAQ:INTC) stock offers an annual forward dividend yield of 1.68% as of May 19.Here's what ClearBridge Investments said about Intel Corporation (NASDAQ:INTC) in its Q3 2022 investor letter:“Also on the detractor side, Intel Corporation (NASDAQ:INTC) delivered a disappointing revenue miss and lowered full-year revenue and earnings guidance as COVID-19-driven demand for PCs abated (where Intel enjoys half its sales) and a delay in its flagship Sapphire Rapids CPU hurt its data center business. Despite these issues, we still believe Intel is an economically sensitive turnaround story with substantial upside.”13. Nintendo Co., Ltd. (7974.T)Total Score: 31TTM Revenue: $12.62 billion Nintendo Co., Ltd. (7974.T) is a pioneer in the gaming industry. With iconic consoles like the Nintendo Switch and handheld gadgets like the Nintendo 3DS, the company has been known for delivering innovative gaming experiences. Nintendo Co., Ltd.'s (7974.T) focus on creativity, family-friendly content, and unique gameplay has garnered a dedicated fan base worldwide, making the company a dominant force in the gaming market.12. Toshiba Corporation (6502.T)Total Score: 32TTM Revenue: $28.27 billion Toshiba Corporation (6502.T) provides an extensive range of products, including laptops, storage solutions, domestic appliances, and visual display systems. In March, Toshiba Corporation (6502.T) accepted a buyout offer worth $14.8 billion from Japan Industrial Partners (JIP). The news was received positively by various stakeholders.11. Huawei TechnologiesTotal Score: 33TTM Revenue: $93.5 billion Huawei Technologies is a Shenzhen, China-based leading consumer electronics corporation. The company's product portfolio spans from smartphones and tablets to wearables and electrical appliances. With its commitment to delivering advanced features, sophisticated design, and robust performance, Huawei Technologies has successfully built a loyal customer base.10. Xiaomi Corporation (1810.HK)Total Score: 34TTM Revenue: $35.72 billion (HK$280.04 billion) Xiaomi Corporation (1810.HK) is a Beijing, China-based consumer electronics company that is known for combining advanced technology with affordable pricing. The corporation is known for its user-centric approach and high-value offerings. Xiaomi Corporation (1810.HK) has gained significant popularity globally, positioning itself as a key player in the consumer electronics market through its diverse portfolio.9. Dell Technologies Inc. (NYSE:DELL)Total Score: 35TTM Revenue: $102.3 billion Dell Technologies Inc. (NYSE:DELL) is a Round Rock, Texas-based electronics corporation. On May 15, Erik Woodring at Morgan Stanley raised the price target on Dell Technologies Inc. (NYSE:DELL) from $45 to $55 and maintained an Outperform rating on the stock. The company is expected to receive a boost in performance following the rebound in the PC market.8. Microsoft Corporation (NASDAQ:MSFT)Total Score: 38TTM Revenue: $207.59 billionMicrosoft Corporation (NASDAQ:MSFT) is known for producing advanced consumer electronics. From the iconic Surface lineup of tablets and laptops to the Xbox gaming consoles and accessories, Microsoft Corporation (NASDAQ:MSFT) excels in producing premium gadgets and software solutions.Diamond Hill Capital shared its outlook on Microsoft Corporation (NASDAQ:MSFT) in its Q1 2023 investor letter. Here's what the firm said:“We did have several strong performing stocks this quarter. Our top contributors to return included NVR, Amazon, Alphabet, Microsoft Corporation (NASDAQ:MSFT) and Booking Holdings, all of which posted double-digit gains.Shares of software and IT services provider Microsoft rallied as investors became less cautious about the potential for growth deceleration in Azure, its public cloud business, and more focused on opportunities in search after the company announced an investment in and long-term partnership with OpenAI, the company that developed ChatGPT. Microsoft’s net cash balance sheet also seemed to gain appreciation from investors who became more cautious about the economic cycle.”7. Koninklijke Philips N.V. (NYSE:PHG)Total Score: 39TTM Revenue: $18.08 billionKoninklijke Philips N.V. (NYSE:PHG), commonly known as Philips, is a multinational conglomerate that operates in various industries, including consumer electronics. Philips offers a wide variety of consumer electronics, including televisions, audio systems, lighting solutions, personal care tools, and household appliances.Koninklijke Philips N.V. (NYSE:PHG) was mentioned in the Q4 2022 investor letter of Artisan Partners. Here’s what the firm said:“Shares of Koninklijke Philips N.V. (NYSE:PHG), a health care technology company, were hurt by fears regarding the recall of its first-generation CPAP machine and the potential for legal recourse and market share losses arising in its sleep division. Adding to the company’s woes are supply chain disruptions and a worsening macro environment that will weigh on deliveries and customer installations. The stock is down more than 70%, losing more than €30 billion in market value from its April 2021 highs. The stock reaction seems excessive given the likely range of outcomes we see, so we’ve been adding to our position. The sleep division is a small part of the overall business—which we do not believe is going to zero. The company has a large installed base of medical diagnostic equipment (e.g., MRI/PET/CT/ultrasound scanners) that offers a high recurring stream of software-like maintenance revenues. This is a sticky business as medical providers are reluctant to switch over to competitors. We appreciate that until there is greater clarity on the full impact of the recall and how long it may take to resolve, the stock will remain under pressure, but we believe today’s asking price offers the potential for highly attractive multi-year returns.”6. HP Inc. (NYSE:HPQ)Total Score: 40TTM Revenue: $59.78 billionHP Inc. (NYSE:HPQ), or the Hewlett-Packard Company, is a Palo Alto, California-based consumer electronics giant known for its laptops, desktop computers, printers, scanners, and accessories. In January, HP Inc. (NYSE:HPQ) showcased its latest lineup of laptops and monitors at the 2023 Consumer Electronics Show (CES), aiming to enhance hybrid experiences in today's digital landscape. HP Inc. (NYSE:HPQ) has established itself as a solid brand among consumers and professionals seeking top-quality computing and imaging equipment.In addition to HP Inc. (NYSE:HPQ), companies such as Apple, Inc. (NASDAQ:AAPL), Samsung Electronics Co., Ltd. (005930.KS), and Sony Group Corporation (NYSE:SONY) are also some of the most popular consumer electronics brands.Click to continue reading and see the Top 5 Most Popular Consumer Electronics Brands. Suggested Articles:Billionaire John Paulson's 2023 Portfolio: Top 15 Stock Picks10 Most Expensive Fast Food Restaurants Right Now25 Most Technologically Advanced Cities in the WorldDisclosure: None. Top 20 Most Popular Consumer Electronics Brands is originally published on Insider Monkey.]"
34,1936ed1b-bf19-39f0-b405-cbcec6581e2b,GM,2023-05-21,3 Top Buffett Stocks to Buy and Hold for the Long Haul,Motley Fool,https://finance.yahoo.com/m/1936ed1b-bf19-39f0-b405-cbcec6581e2b/3-top-buffett-stocks-to-buy.html,1684660500,STORY,"['BRK-A', 'AAPL', 'GM']","[Warren Buffett's stock portfolio is one of the most scrutinized in the world. Each quarter there are several news stories about what the Oracle of Omaha purchased for his company Berkshire Hathaway (NYSE: BRK.A) (NYSE: BRK.B). Interest in this portfolio shouldn't be a surprise, considering Buffett's track record of success.Continue reading]"
35,b5eb43ca-cc96-3c93-b13d-46fbaae9af91,TGT,2023-05-21,Target's (NYSE:TGT) earnings growth rate lags the 19% CAGR delivered to shareholders,Simply Wall St.,https://finance.yahoo.com/news/targets-nyse-tgt-earnings-growth-120038214.html,1684670438,STORY,['TGT'],"[While Target Corporation (NYSE:TGT) shareholders are probably generally happy, the stock hasn't had particularly good run recently, with the share price falling 12% in the last quarter. But that doesn't change the fact that shareholders have received really good returns over the last five years. In fact, the share price is 114% higher today. Generally speaking the long term returns will give you a better idea of business quality than short periods can. Only time will tell if there is still too much optimism currently reflected in the share price.While this past week has detracted from the company's five-year return, let's look at the recent trends of the underlying business and see if the gains have been in alignment. View our latest analysis for Target In his essay The Superinvestors of Graham-and-Doddsville Warren Buffett described how share prices do not always rationally reflect the value of a business. By comparing earnings per share (EPS) and share price changes over time, we can get a feel for how investor attitudes to a company have morphed over time.During five years of share price growth, Target achieved compound earnings per share (EPS) growth of 1.6% per year. This EPS growth is slower than the share price growth of 16% per year, over the same period. This suggests that market participants hold the company in higher regard, these days. That's not necessarily surprising considering the five-year track record of earnings growth.The image below shows how EPS has tracked over time (if you click on the image you can see greater detail).earnings-per-share-growthThis free interactive report on Target's earnings, revenue and cash flow is a great place to start, if you want to investigate the stock further.What About Dividends?As well as measuring the share price return, investors should also consider the total shareholder return (TSR). Whereas the share price return only reflects the change in the share price, the TSR includes the value of dividends (assuming they were reinvested) and the benefit of any discounted capital raising or spin-off. It's fair to say that the TSR gives a more complete picture for stocks that pay a dividend. In the case of Target, it has a TSR of 140% for the last 5 years. That exceeds its share price return that we previously mentioned. This is largely a result of its dividend payments!Story continuesA Different PerspectiveTarget shareholders are up 0.5% for the year (even including dividends). But that was short of the market average. It's probably a good sign that the company has an even better long term track record, having provided shareholders with an annual TSR of 19% over five years. It may well be that this is a business worth popping on the watching, given the continuing positive reception, over time, from the market. I find it very interesting to look at share price over the long term as a proxy for business performance. But to truly gain insight, we need to consider other information, too. Case in point: We've spotted   4 warning signs for Target  you should be aware of.Of course, you might find a fantastic investment by looking elsewhere. So take a peek at this free list of companies we expect will grow earnings.Please note, the market returns quoted in this article reflect the market weighted average returns of stocks that currently trade on American exchanges.Have feedback on this article? Concerned about the content? Get in touch with us directly. Alternatively, email editorial-team (at) simplywallst.com.This article by Simply Wall St is general in nature. We provide commentary based on historical data and analyst forecasts only using an unbiased methodology and our articles are not intended to be financial advice. It does not constitute a recommendation to buy or sell any stock, and does not take account of your objectives, or your financial situation. We aim to bring you long-term focused analysis driven by fundamental data. Note that our analysis may not factor in the latest price-sensitive company announcements or qualitative material. Simply Wall St has no position in any stocks mentioned.Join A Paid User Research SessionYou’ll receive a US$30 Amazon Gift card for 1 hour of your time while helping us build better investing tools for the individual investors like yourself. Sign up here]"
